
################################################################################

 PACKMOL - Packing optimization for the automated generation of
 starting configurations for molecular dynamics simulations.
 
                                                             Version 21.1.2 

################################################################################

  Packmol must be run with: packmol < inputfile.inp 

  Userguide at: http://m3g.iqm.unicamp.br/packmol 

  Reading input file... (Control-C aborts)
  Types of coordinate files specified: xyz
  Periodic boundary condition activated: 
    Minimum coordinates:     0.00    0.00    0.00
    Maximum coordinates:    10.89   10.89   10.89
  Seed for random number generator:      1234567
  Output file: solvated_150/11-butyl-3-methylimidazol-3-ium_1hydroxide_oxidane.xyz
  Reading coordinate file: ../structures/1-butyl-3-methylimidazol-3-ium.xyz
  Reading coordinate file: ../structures/hydroxide.xyz
  Reading coordinate file: ../structures/oxidane.xyz
  Number of independent structures:            3
  The structures are: 
  Structure            1 :Properties=species:S:1:pos:R:3 iupac_name=1-butyl-3-methylimidazol-3-ium pbc="F F F"(          25  atoms)
  Structure            2 :Properties=species:S:1:pos:R:3 iupac_name=hydroxide pbc="F F F"(           2  atoms)
  Structure            3 :Properties=species:S:1:pos:R:3 iupac_name=oxidane pbc="F F F"(           3  atoms)
  Maximum number of GENCAN loops for all molecule packing:          600
  Distance tolerance:    2.0000000000000000     
  Number of molecules of type            1 :            1
  Number of molecules of type            2 :            1
  Number of molecules of type            3 :           41
  Total number of restrictions:            3
  Total number of atoms:          150
  Total number of molecules:           43
  Number of fixed molecules:            0
  Number of free molecules:           43
  Number of variables:          258
  Total number of fixed atoms:            0
  PBC on: Constraint automatically added to non-fixed atoms:
  -> inside box     0.00    0.00    0.00   10.89   10.89   10.89
  Updated total number of restrictions:            4
  Maximum internal distance of type            1 :    8.3884801424334299     
  Maximum internal distance of type            2 :   0.96977183398983080     
  Maximum internal distance of type            3 :    1.5269386005992513     
  All atoms must be within these coordinates: 
   x: [   -993.60000000000002      ,    1006.4000000000000       ] 
   y: [   -996.04644136936986      ,    1003.9535586306301       ] 
   z: [   -997.77153894802382      ,    1002.2284610519762       ] 
  If the system is larger than this, increase the sidemax parameter. 

################################################################################

  Building initial approximation ... 

################################################################################

  Adjusting initial point to fit the constraints 

--------------------------------------------------------------------------------

--------------------------------------------------------------------------------

  Molecules of type:            1

  Packing:|0                                                        100%|
          |************************

  Restraint-only function value:    8.6190876004759442E-003
  Maximum violation of the restraints:    8.6190876004759442E-003

--------------------------------------------------------------------------------

  Molecules of type:            2

  Packing:|0                                                        100%|
          |*********

  Restraint-only function value:    2.5983499799700171E-018
  Maximum violation of the restraints:    2.5983499799700171E-018

--------------------------------------------------------------------------------

  Molecules of type:            3

  Packing:|0                                                        100%|
          |***************

  Restraint-only function value:    2.7204953018670407E-004
  Maximum violation of the restraints:    1.5629748615281089E-004

--------------------------------------------------------------------------------

  Rescaling maximum and minimum coordinates... 
  Mininum and maximum coordinates after constraint fitting: 
   x: [   -6.8499806512446011E-004 ,    10.959452941933057       ] 
   y: [   -8.8401777740272532E-003 ,    10.898074720654137       ] 
   z: [   -2.6218871648752843E-003 ,    10.896054503740146       ] 
  Computing size of patches... 
  Number of cells in each direction and cell sides: 
   x:            4  cells of size    2.7234514565572954     
   y:            4  cells of size    2.7234514565572954     
   z:            4  cells of size    2.7234514565572954     
  Cell-system length:   10.89381  10.89381  10.89381
  Reseting center of mass... 

--------------------------------------------------------------------------------

  Setting initial trial coordinates ... 

--------------------------------------------------------------------------------

--------------------------------------------------------------------------------

  Molecules of type:            1
  Adjusting random positions to fit the constraints. 
  Packing:|0                                                        100%|
          |***
  Restraint-only function value:    0.0000000000000000     
  Maximum violation of the restraints:    0.0000000000000000     

--------------------------------------------------------------------------------

  Molecules of type:            2
  Adjusting random positions to fit the constraints. 
  Packing:|0                                                        100%|
          |***
  Restraint-only function value:    0.0000000000000000     
  Maximum violation of the restraints:    0.0000000000000000     

--------------------------------------------------------------------------------

  Molecules of type:            3
  Adjusting random positions to fit the constraints. 
  Packing:|0                                                        100%|
          |***
  Restraint-only function value:    1.0916733583269779E-002
  Maximum violation of the restraints:    4.6669822082541276E-003

################################################################################

  Objective function at initial point:    936.32526247504472     

################################################################################

  Packing molecules of type:            1

################################################################################


  Initial approximation is a solution. Nothing to do. 

  Current point written to file: solvated_150/11-butyl-3-methylimidazol-3-ium_1hydroxide_oxidane.xyz
--------------------------------------------------------------------------------
  Packing solved for molecules of type           1
  Objective function value:    0.0000000000000000     
  Maximum violation of target distance:    0.0000000000000000     
  Max. constraint violation:    0.0000000000000000     
--------------------------------------------------------------------------------

################################################################################

  Packing molecules of type:            2

################################################################################


  Initial approximation is a solution. Nothing to do. 

  Current point written to file: solvated_150/11-butyl-3-methylimidazol-3-ium_1hydroxide_oxidane.xyz
--------------------------------------------------------------------------------
  Packing solved for molecules of type           2
  Objective function value:    0.0000000000000000     
  Maximum violation of target distance:    0.0000000000000000     
  Max. constraint violation:    0.0000000000000000     
--------------------------------------------------------------------------------

################################################################################

  Packing molecules of type:            3

################################################################################


--------------------------------------------------------------------------------

  Starting GENCAN loop:            0
  Scaling radii by:    1.1000000000000001     

  Packing:|0                                                        100%|
          |************************************

  Function value from last GENCAN loop: f = .15585E-02
  Best function value before: f = .64554E+03
  Improvement from best function value:    99.99 %
  Improvement from last loop:    99.99 %
  Maximum violation of target distance:     0.000000
  Maximum violation of the constraints: .99498E-03
  Current structure written to file: solvated_150/11-butyl-3-methylimidazol-3-ium_1hydroxide_oxidane.xyz
--------------------------------------------------------------------------------
  Packing solved for molecules of type           3
  Objective function value:    1.5585367105028485E-003
  Maximum violation of target distance:    0.0000000000000000     
  Max. constraint violation:    9.9497850159418208E-004
--------------------------------------------------------------------------------

################################################################################

  Packing all molecules together 

################################################################################


--------------------------------------------------------------------------------

  Starting GENCAN loop:            0
  Scaling radii by:    1.1000000000000001     

  Packing:|0                                                        100%|
          |***************************************************

  Function value from last GENCAN loop: f = .97424E-02
  Best function value before: f = .31907E+03
  Improvement from best function value:    99.99 %
  Improvement from last loop:    99.99 %
  Maximum violation of target distance:     0.000000
  Maximum violation of the constraints: .33921E-02

################################################################################

                                 Success! 
              Final objective function value: .97424E-02
              Maximum violation of target distance:   0.000000
              Maximum violation of the constraints: .33921E-02

--------------------------------------------------------------------------------

              Please cite this work if Packmol was useful: 

           L. Martinez, R. Andrade, E. G. Birgin, J. M. Martinez, 
         PACKMOL: A package for building initial configurations for
                   molecular dynamics simulations. 
        Journal of Computational Chemistry, 30(13) pp. 2157-2164, 2009.
                  https://doi.org/10.1002/jcc.21224

################################################################################

  Solution written to file: solvated_150/11-butyl-3-methylimidazol-3-ium_1hydroxide_oxidane.xyz

--------------------------------------------------------------------------------

   Running time:    4.19869982E-02  seconds. 

--------------------------------------------------------------------------------


