
################################################################################

 PACKMOL - Packing optimization for the automated generation of
 starting configurations for molecular dynamics simulations.
 
                                                             Version 21.1.2 

################################################################################

  Packmol must be run with: packmol < inputfile.inp 

  Userguide at: http://m3g.iqm.unicamp.br/packmol 

  Reading input file... (Control-C aborts)
  Types of coordinate files specified: xyz
  Periodic boundary condition activated: 
    Minimum coordinates:     0.00    0.00    0.00
    Maximum coordinates:    11.10   11.10   11.10
  Seed for random number generator:      1234567
  Output file: solvated_150/11-butyl-3-methylimidazol-3-ium_1I_azane.xyz
  Reading coordinate file: ../structures/1-butyl-3-methylimidazol-3-ium.xyz
  Reading coordinate file: ../structures/I.xyz
  Reading coordinate file: ../structures/azane.xyz
  Number of independent structures:            3
  The structures are: 
  Structure            1 :Properties=species:S:1:pos:R:3 iupac_name=1-butyl-3-methylimidazol-3-ium pbc="F F F"(          25  atoms)
  Structure            2 :Properties=species:S:1:pos:R:3 iupac_name=I pbc="F F F"(           1  atoms)
  Structure            3 :Properties=species:S:1:pos:R:3 iupac_name=azane pbc="F F F"(           4  atoms)
  Maximum number of GENCAN loops for all molecule packing:          600
  Distance tolerance:    2.0000000000000000     
  Number of molecules of type            1 :            1
  Number of molecules of type            2 :            1
  Number of molecules of type            3 :           31
  Total number of restrictions:            3
  Total number of atoms:          150
  Total number of molecules:           33
  Number of fixed molecules:            0
  Number of free molecules:           33
  Number of variables:          198
  Total number of fixed atoms:            0
  PBC on: Constraint automatically added to non-fixed atoms:
  -> inside box     0.00    0.00    0.00   11.10   11.10   11.10
  Updated total number of restrictions:            4
  Maximum internal distance of type            1 :    8.3884801424334299     
  Maximum internal distance of type            2 :    0.0000000000000000     
  Maximum internal distance of type            3 :    1.6276392505712067     
  All atoms must be within these coordinates: 
   x: [   -993.60000000000002      ,    1006.4000000000000       ] 
   y: [   -996.04644136936986      ,    1003.9535586306301       ] 
   z: [   -997.77153894802382      ,    1002.2284610519762       ] 
  If the system is larger than this, increase the sidemax parameter. 

################################################################################

  Building initial approximation ... 

################################################################################

  Adjusting initial point to fit the constraints 

--------------------------------------------------------------------------------

--------------------------------------------------------------------------------

  Molecules of type:            1

  Packing:|0                                                        100%|
          |***************

  Restraint-only function value:    0.0000000000000000     
  Maximum violation of the restraints:    0.0000000000000000     

--------------------------------------------------------------------------------

  Molecules of type:            2

  Packing:|0                                                        100%|
          |******

  Restraint-only function value:    5.8757232851473325E-018
  Maximum violation of the restraints:    5.8757232851473325E-018

--------------------------------------------------------------------------------

  Molecules of type:            3

  Packing:|0                                                        100%|
          |*********************

  Restraint-only function value:    3.1349759819170727E-003
  Maximum violation of the restraints:    2.6785325433159916E-003

--------------------------------------------------------------------------------

  Rescaling maximum and minimum coordinates... 
  Mininum and maximum coordinates after constraint fitting: 
   x: [   -1.2382169707337213E-002 ,    11.102832629182021       ] 
   y: [   -1.6059060797081758E-004 ,    11.139354205239085       ] 
   z: [   -1.7140191488351775E-009 ,    11.110535132775645       ] 
  Computing size of patches... 
  Number of cells in each direction and cell sides: 
   x:            4  cells of size    2.7756895545353362     
   y:            4  cells of size    2.7756895545353362     
   z:            4  cells of size    2.7756895545353362     
  Cell-system length:   11.10276  11.10276  11.10276
  Reseting center of mass... 

--------------------------------------------------------------------------------

  Setting initial trial coordinates ... 

--------------------------------------------------------------------------------

--------------------------------------------------------------------------------

  Molecules of type:            1
  Adjusting random positions to fit the constraints. 
  Packing:|0                                                        100%|
          |***
  Restraint-only function value:    0.0000000000000000     
  Maximum violation of the restraints:    0.0000000000000000     

--------------------------------------------------------------------------------

  Molecules of type:            2
  Adjusting random positions to fit the constraints. 
  Restraint-only function value:    5.8757232851473325E-018
  Maximum violation of the restraints:    5.8757232851473325E-018

--------------------------------------------------------------------------------

  Molecules of type:            3
  Adjusting random positions to fit the constraints. 
  Packing:|0                                                        100%|
          |***
  Restraint-only function value:    4.5239801430648505E-007
  Maximum violation of the restraints:    4.5239801430648505E-007

################################################################################

  Objective function at initial point:    990.35418988566562     

################################################################################

  Packing molecules of type:            1

################################################################################


  Initial approximation is a solution. Nothing to do. 

  Current point written to file: solvated_150/11-butyl-3-methylimidazol-3-ium_1I_azane.xyz
--------------------------------------------------------------------------------
  Packing solved for molecules of type           1
  Objective function value:    0.0000000000000000     
  Maximum violation of target distance:    0.0000000000000000     
  Max. constraint violation:    0.0000000000000000     
--------------------------------------------------------------------------------

################################################################################

  Packing molecules of type:            2

################################################################################


  Initial approximation is a solution. Nothing to do. 

  Current point written to file: solvated_150/11-butyl-3-methylimidazol-3-ium_1I_azane.xyz
--------------------------------------------------------------------------------
  Packing solved for molecules of type           2
  Objective function value:    5.8757232851473325E-018
  Maximum violation of target distance:    0.0000000000000000     
  Max. constraint violation:    5.8757232851473325E-018
--------------------------------------------------------------------------------

################################################################################

  Packing molecules of type:            3

################################################################################


--------------------------------------------------------------------------------

  Starting GENCAN loop:            0
  Scaling radii by:    1.1000000000000001     

  Packing:|0                                                        100%|
          |******************************

  Function value from last GENCAN loop: f = .13926E-01
  Best function value before: f = .70670E+03
  Improvement from best function value:    99.99 %
  Improvement from last loop:    99.99 %
  Maximum violation of target distance:     0.000000
  Maximum violation of the constraints: .69789E-02
  Current structure written to file: solvated_150/11-butyl-3-methylimidazol-3-ium_1I_azane.xyz
--------------------------------------------------------------------------------
  Packing solved for molecules of type           3
  Objective function value:    1.3925980266042587E-002
  Maximum violation of target distance:    0.0000000000000000     
  Max. constraint violation:    6.9788697982912764E-003
--------------------------------------------------------------------------------

################################################################################

  Packing all molecules together 

################################################################################


--------------------------------------------------------------------------------

  Starting GENCAN loop:            0
  Scaling radii by:    1.1000000000000001     

  Packing:|0                                                        100%|
          |*************************************************************|

  Function value from last GENCAN loop: f = .33513E-01
  Best function value before: f = .29984E+03
  Improvement from best function value:    99.99 %
  Improvement from last loop:    99.99 %
  Maximum violation of target distance:     0.000000
  Maximum violation of the constraints: .22402E-01

--------------------------------------------------------------------------------


--------------------------------------------------------------------------------

  Starting GENCAN loop:            1
  Scaling radii by:    1.1000000000000001     

  Packing:|0                                                        100%|
          |*********************

  Function value from last GENCAN loop: f = .16833E-01
  Best function value before: f = .33513E-01
  Improvement from best function value:    49.77 %
  Improvement from last loop:    49.77 %
  Maximum violation of target distance:     0.000000
  Maximum violation of the constraints: .89091E-02

################################################################################

                                 Success! 
              Final objective function value: .16833E-01
              Maximum violation of target distance:   0.000000
              Maximum violation of the constraints: .89091E-02

--------------------------------------------------------------------------------

              Please cite this work if Packmol was useful: 

           L. Martinez, R. Andrade, E. G. Birgin, J. M. Martinez, 
         PACKMOL: A package for building initial configurations for
                   molecular dynamics simulations. 
        Journal of Computational Chemistry, 30(13) pp. 2157-2164, 2009.
                  https://doi.org/10.1002/jcc.21224

################################################################################

  Solution written to file: solvated_150/11-butyl-3-methylimidazol-3-ium_1I_azane.xyz

--------------------------------------------------------------------------------

   Running time:    6.16519935E-02  seconds. 

--------------------------------------------------------------------------------


