
################################################################################

 PACKMOL - Packing optimization for the automated generation of
 starting configurations for molecular dynamics simulations.
 
                                                             Version 21.1.2 

################################################################################

  Packmol must be run with: packmol < inputfile.inp 

  Userguide at: http://m3g.iqm.unicamp.br/packmol 

  Reading input file... (Control-C aborts)
  Types of coordinate files specified: xyz
  Periodic boundary condition activated: 
    Minimum coordinates:     0.00    0.00    0.00
    Maximum coordinates:    11.24   11.24   11.24
  Seed for random number generator:      1234567
  Output file: solvated_150/11-butyl-3-methylimidazol-3-ium_1methanesulfonate_methanol.xyz
  Reading coordinate file: ../structures/1-butyl-3-methylimidazol-3-ium.xyz
  Reading coordinate file: ../structures/methanesulfonate.xyz
  Reading coordinate file: ../structures/methanol.xyz
  Number of independent structures:            3
  The structures are: 
  Structure            1 :Properties=species:S:1:pos:R:3 iupac_name=1-butyl-3-methylimidazol-3-ium pbc="F F F"(          25  atoms)
  Structure            2 :Properties=species:S:1:pos:R:3 iupac_name=methanesulfonate pbc="F F F"(           8  atoms)
  Structure            3 :Properties=species:S:1:pos:R:3 iupac_name=methanol pbc="F F F"(           6  atoms)
  Maximum number of GENCAN loops for all molecule packing:          600
  Distance tolerance:    2.0000000000000000     
  Number of molecules of type            1 :            1
  Number of molecules of type            2 :            1
  Number of molecules of type            3 :           19
  Total number of restrictions:            3
  Total number of atoms:          147
  Total number of molecules:           21
  Number of fixed molecules:            0
  Number of free molecules:           21
  Number of variables:          126
  Total number of fixed atoms:            0
  PBC on: Constraint automatically added to non-fixed atoms:
  -> inside box     0.00    0.00    0.00   11.24   11.24   11.24
  Updated total number of restrictions:            4
  Maximum internal distance of type            1 :    8.3884801424334299     
  Maximum internal distance of type            2 :    3.4723013766088910     
  Maximum internal distance of type            3 :    2.8429210119171442     
  All atoms must be within these coordinates: 
   x: [   -993.60000000000002      ,    1006.4000000000000       ] 
   y: [   -996.04644136936986      ,    1003.9535586306301       ] 
   z: [   -997.77153894802382      ,    1002.2284610519762       ] 
  If the system is larger than this, increase the sidemax parameter. 

################################################################################

  Building initial approximation ... 

################################################################################

  Adjusting initial point to fit the constraints 

--------------------------------------------------------------------------------

--------------------------------------------------------------------------------

  Molecules of type:            1

  Packing:|0                                                        100%|
          |***************

  Restraint-only function value:    0.0000000000000000     
  Maximum violation of the restraints:    0.0000000000000000     

--------------------------------------------------------------------------------

  Molecules of type:            2

  Packing:|0                                                        100%|
          |************

  Restraint-only function value:    0.0000000000000000     
  Maximum violation of the restraints:    0.0000000000000000     

--------------------------------------------------------------------------------

  Molecules of type:            3

  Packing:|0                                                        100%|
          |*********************

  Restraint-only function value:    2.7183902084291973E-005
  Maximum violation of the restraints:    2.7165601647668333E-005

--------------------------------------------------------------------------------

  Rescaling maximum and minimum coordinates... 
  Mininum and maximum coordinates after constraint fitting: 
   x: [    6.8717876495659718E-004 ,    11.244938921706714       ] 
   y: [    3.8450970507453389E-003 ,    11.240856711025138       ] 
   z: [    3.7068045236433772E-005 ,    11.241347857505833       ] 
  Computing size of patches... 
  Number of cells in each direction and cell sides: 
   x:            5  cells of size    2.2482506873104482     
   y:            5  cells of size    2.2482506873104482     
   z:            5  cells of size    2.2482506873104482     
  Cell-system length:   11.24125  11.24125  11.24125
  Reseting center of mass... 

--------------------------------------------------------------------------------

  Setting initial trial coordinates ... 

--------------------------------------------------------------------------------

--------------------------------------------------------------------------------

  Molecules of type:            1
  Adjusting random positions to fit the constraints. 
  Packing:|0                                                        100%|
          |***
  Restraint-only function value:    0.0000000000000000     
  Maximum violation of the restraints:    0.0000000000000000     

--------------------------------------------------------------------------------

  Molecules of type:            2
  Adjusting random positions to fit the constraints. 
  Packing:|0                                                        100%|
          |***
  Restraint-only function value:    0.0000000000000000     
  Maximum violation of the restraints:    0.0000000000000000     

--------------------------------------------------------------------------------

  Molecules of type:            3
  Adjusting random positions to fit the constraints. 
  Packing:|0                                                        100%|
          |***
  Restraint-only function value:    0.0000000000000000     
  Maximum violation of the restraints:    0.0000000000000000     

################################################################################

  Objective function at initial point:    1244.4897114583157     

################################################################################

  Packing molecules of type:            1

################################################################################


  Initial approximation is a solution. Nothing to do. 

  Current point written to file: solvated_150/11-butyl-3-methylimidazol-3-ium_1methanesulfonate_methanol.xyz
--------------------------------------------------------------------------------
  Packing solved for molecules of type           1
  Objective function value:    0.0000000000000000     
  Maximum violation of target distance:    0.0000000000000000     
  Max. constraint violation:    0.0000000000000000     
--------------------------------------------------------------------------------

################################################################################

  Packing molecules of type:            2

################################################################################


  Initial approximation is a solution. Nothing to do. 

  Current point written to file: solvated_150/11-butyl-3-methylimidazol-3-ium_1methanesulfonate_methanol.xyz
--------------------------------------------------------------------------------
  Packing solved for molecules of type           2
  Objective function value:    0.0000000000000000     
  Maximum violation of target distance:    0.0000000000000000     
  Max. constraint violation:    0.0000000000000000     
--------------------------------------------------------------------------------

################################################################################

  Packing molecules of type:            3

################################################################################


--------------------------------------------------------------------------------

  Starting GENCAN loop:            0
  Scaling radii by:    1.1000000000000001     

  Packing:|0                                                        100%|
          |*********************

  Function value from last GENCAN loop: f = .10737E-02
  Best function value before: f = .47345E+03
  Improvement from best function value:    99.99 %
  Improvement from last loop:    99.99 %
  Maximum violation of target distance:     0.000000
  Maximum violation of the constraints: .10737E-02
  Current structure written to file: solvated_150/11-butyl-3-methylimidazol-3-ium_1methanesulfonate_methanol.xyz
--------------------------------------------------------------------------------
  Packing solved for molecules of type           3
  Objective function value:    1.0736665278519514E-003
  Maximum violation of target distance:    0.0000000000000000     
  Max. constraint violation:    1.0736665278519514E-003
--------------------------------------------------------------------------------

################################################################################

  Packing all molecules together 

################################################################################


--------------------------------------------------------------------------------

  Starting GENCAN loop:            0
  Scaling radii by:    1.1000000000000001     

  Packing:|0                                                        100%|
          |*************************************************************|


  Function value from last GENCAN loop: f = .24525E-02
  Best function value before: f = .50125E+03
  Improvement from best function value:    99.99 %
  Improvement from last loop:    99.99 %
  Maximum violation of target distance:     0.000000
  Maximum violation of the constraints: .21767E-02

################################################################################

                                 Success! 
              Final objective function value: .24525E-02
              Maximum violation of target distance:   0.000000
              Maximum violation of the constraints: .21767E-02

--------------------------------------------------------------------------------

              Please cite this work if Packmol was useful: 

           L. Martinez, R. Andrade, E. G. Birgin, J. M. Martinez, 
         PACKMOL: A package for building initial configurations for
                   molecular dynamics simulations. 
        Journal of Computational Chemistry, 30(13) pp. 2157-2164, 2009.
                  https://doi.org/10.1002/jcc.21224

################################################################################

  Solution written to file: solvated_150/11-butyl-3-methylimidazol-3-ium_1methanesulfonate_methanol.xyz

--------------------------------------------------------------------------------

   Running time:    3.08969989E-02  seconds. 

--------------------------------------------------------------------------------


