
################################################################################

 PACKMOL - Packing optimization for the automated generation of
 starting configurations for molecular dynamics simulations.
 
                                                             Version 21.1.2 

################################################################################

  Packmol must be run with: packmol < inputfile.inp 

  Userguide at: http://m3g.iqm.unicamp.br/packmol 

  Reading input file... (Control-C aborts)
  Types of coordinate files specified: xyz
  Periodic boundary condition activated: 
    Minimum coordinates:     0.00    0.00    0.00
    Maximum coordinates:    11.82   11.82   11.82
  Seed for random number generator:      1234567
  Output file: solvated_150/11-butyl-3-methylimidazol-3-ium_1F_methylsulfinylmethane.xyz
  Reading coordinate file: ../structures/1-butyl-3-methylimidazol-3-ium.xyz
  Reading coordinate file: ../structures/F.xyz
  Reading coordinate file: ../structures/methylsulfinylmethane.xyz
  Number of independent structures:            3
  The structures are: 
  Structure            1 :Properties=species:S:1:pos:R:3 iupac_name=1-butyl-3-methylimidazol-3-ium pbc="F F F"(          25  atoms)
  Structure            2 :Properties=species:S:1:pos:R:3 iupac_name=F pbc="F F F"(           1  atoms)
  Structure            3 :Properties=species:S:1:pos:R:3 iupac_name=methylsulfinylmethane pbc="F F F"(          10  atoms)
  Maximum number of GENCAN loops for all molecule packing:          600
  Distance tolerance:    2.0000000000000000     
  Number of molecules of type            1 :            1
  Number of molecules of type            2 :            1
  Number of molecules of type            3 :           12
  Total number of restrictions:            3
  Total number of atoms:          146
  Total number of molecules:           14
  Number of fixed molecules:            0
  Number of free molecules:           14
  Number of variables:           84
  Total number of fixed atoms:            0
  PBC on: Constraint automatically added to non-fixed atoms:
  -> inside box     0.00    0.00    0.00   11.82   11.82   11.82
  Updated total number of restrictions:            4
  Maximum internal distance of type            1 :    8.3884801424334299     
  Maximum internal distance of type            2 :    0.0000000000000000     
  Maximum internal distance of type            3 :    4.5884748326649891     
  All atoms must be within these coordinates: 
   x: [   -993.60000000000002      ,    1006.4000000000000       ] 
   y: [   -996.04644136936986      ,    1003.9535586306301       ] 
   z: [   -997.77153894802382      ,    1002.2284610519762       ] 
  If the system is larger than this, increase the sidemax parameter. 

################################################################################

  Building initial approximation ... 

################################################################################

  Adjusting initial point to fit the constraints 

--------------------------------------------------------------------------------

--------------------------------------------------------------------------------

  Molecules of type:            1

  Packing:|0                                                        100%|
          |*********************

  Restraint-only function value:    0.0000000000000000     
  Maximum violation of the restraints:    0.0000000000000000     

--------------------------------------------------------------------------------

  Molecules of type:            2

  Packing:|0                                                        100%|
          |******

  Restraint-only function value:    3.2103173864553144E-017
  Maximum violation of the restraints:    3.2103173864553144E-017

--------------------------------------------------------------------------------

  Molecules of type:            3

  Packing:|0                                                        100%|
          |************************

  Restraint-only function value:    8.9031553825298093E-003
  Maximum violation of the restraints:    4.8797175849344268E-003

--------------------------------------------------------------------------------

  Rescaling maximum and minimum coordinates... 
  Mininum and maximum coordinates after constraint fitting: 
   x: [   -8.0263778323795239E-004 ,    11.868981563233344       ] 
   y: [   -3.1019530828274085E-002 ,    11.851972782633624       ] 
   z: [    6.9698309346222231E-009 ,    11.810383758131156       ] 
  Computing size of patches... 
  Number of cells in each direction and cell sides: 
   x:            5  cells of size    2.3639173272889162     
   y:            5  cells of size    2.3639173272889162     
   z:            5  cells of size    2.3639173272889162     
  Cell-system length:   11.81959  11.81959  11.81959
  Reseting center of mass... 

--------------------------------------------------------------------------------

  Setting initial trial coordinates ... 

--------------------------------------------------------------------------------

--------------------------------------------------------------------------------

  Molecules of type:            1
  Adjusting random positions to fit the constraints. 
  Packing:|0                                                        100%|
          |*********
  Restraint-only function value:    1.9227852173420230E-004
  Maximum violation of the restraints:    1.9227852173420230E-004

--------------------------------------------------------------------------------

  Molecules of type:            2
  Adjusting random positions to fit the constraints. 
  Restraint-only function value:    3.2103173864553144E-017
  Maximum violation of the restraints:    3.2103173864553144E-017

--------------------------------------------------------------------------------

  Molecules of type:            3
  Adjusting random positions to fit the constraints. 
  Packing:|0                                                        100%|
          |***
  Restraint-only function value:    0.0000000000000000     
  Maximum violation of the restraints:    0.0000000000000000     

################################################################################

  Objective function at initial point:    785.25041375315561     

################################################################################

  Packing molecules of type:            1

################################################################################


  Initial approximation is a solution. Nothing to do. 

  Current point written to file: solvated_150/11-butyl-3-methylimidazol-3-ium_1F_methylsulfinylmethane.xyz
--------------------------------------------------------------------------------
  Packing solved for molecules of type           1
  Objective function value:    1.9227852173420230E-004
  Maximum violation of target distance:    0.0000000000000000     
  Max. constraint violation:    1.9227852173420230E-004
--------------------------------------------------------------------------------

################################################################################

  Packing molecules of type:            2

################################################################################


  Initial approximation is a solution. Nothing to do. 

  Current point written to file: solvated_150/11-butyl-3-methylimidazol-3-ium_1F_methylsulfinylmethane.xyz
--------------------------------------------------------------------------------
  Packing solved for molecules of type           2
  Objective function value:    3.2103173864553144E-017
  Maximum violation of target distance:    0.0000000000000000     
  Max. constraint violation:    3.2103173864553144E-017
--------------------------------------------------------------------------------

################################################################################

  Packing molecules of type:            3

################################################################################


--------------------------------------------------------------------------------

  Starting GENCAN loop:            0
  Scaling radii by:    1.1000000000000001     

  Packing:|0                                                        100%|
          |******************************************************

  Function value from last GENCAN loop: f = .17605E-01
  Best function value before: f = .74623E+03
  Improvement from best function value:    99.99 %
  Improvement from last loop:    99.99 %
  Maximum violation of target distance:     0.000000
  Maximum violation of the constraints: .97926E-02
  Current structure written to file: solvated_150/11-butyl-3-methylimidazol-3-ium_1F_methylsulfinylmethane.xyz
--------------------------------------------------------------------------------
  Packing solved for molecules of type           3
  Objective function value:    1.7604717866907253E-002
  Maximum violation of target distance:    0.0000000000000000     
  Max. constraint violation:    9.7926191628080559E-003
--------------------------------------------------------------------------------

################################################################################

  Packing all molecules together 

################################################################################


--------------------------------------------------------------------------------

  Starting GENCAN loop:            0
  Scaling radii by:    1.1000000000000001     

  Packing:|0                                                        100%|
          |*************************************************************|


  Function value from last GENCAN loop: f = .14243E-01
  Best function value before: f = .61273E+02
  Improvement from best function value:    99.98 %
  Improvement from last loop:    99.98 %
  Maximum violation of target distance:     0.000000
  Maximum violation of the constraints: .73852E-02

################################################################################

                                 Success! 
              Final objective function value: .14243E-01
              Maximum violation of target distance:   0.000000
              Maximum violation of the constraints: .73852E-02

--------------------------------------------------------------------------------

              Please cite this work if Packmol was useful: 

           L. Martinez, R. Andrade, E. G. Birgin, J. M. Martinez, 
         PACKMOL: A package for building initial configurations for
                   molecular dynamics simulations. 
        Journal of Computational Chemistry, 30(13) pp. 2157-2164, 2009.
                  https://doi.org/10.1002/jcc.21224

################################################################################

  Solution written to file: solvated_150/11-butyl-3-methylimidazol-3-ium_1F_methylsulfinylmethane.xyz

--------------------------------------------------------------------------------

   Running time:    4.09240015E-02  seconds. 

--------------------------------------------------------------------------------


