
################################################################################

 PACKMOL - Packing optimization for the automated generation of
 starting configurations for molecular dynamics simulations.
 
                                                             Version 21.1.2 

################################################################################

  Packmol must be run with: packmol < inputfile.inp 

  Userguide at: http://m3g.iqm.unicamp.br/packmol 

  Reading input file... (Control-C aborts)
  Types of coordinate files specified: xyz
  Periodic boundary condition activated: 
    Minimum coordinates:     0.00    0.00    0.00
    Maximum coordinates:    11.10   11.10   11.10
  Seed for random number generator:      1234567
  Output file: solvated_150/11-ethyl-3-methylimidazol-3-ium_1tetrafluoroborate_azane.xyz
  Reading coordinate file: ../structures/1-ethyl-3-methylimidazol-3-ium.xyz
  Reading coordinate file: ../structures/tetrafluoroborate.xyz
  Reading coordinate file: ../structures/azane.xyz
  Number of independent structures:            3
  The structures are: 
  Structure            1 :Properties=species:S:1:pos:R:3 iupac_name=1-ethyl-3-methylimidazol-3-ium pbc="F F F"(          19  atoms)
  Structure            2 :Properties=species:S:1:pos:R:3 iupac_name=tetrafluoroborate pbc="F F F"(           5  atoms)
  Structure            3 :Properties=species:S:1:pos:R:3 iupac_name=azane pbc="F F F"(           4  atoms)
  Maximum number of GENCAN loops for all molecule packing:          600
  Distance tolerance:    2.0000000000000000     
  Number of molecules of type            1 :            1
  Number of molecules of type            2 :            1
  Number of molecules of type            3 :           31
  Total number of restrictions:            3
  Total number of atoms:          148
  Total number of molecules:           33
  Number of fixed molecules:            0
  Number of free molecules:           33
  Number of variables:          198
  Total number of fixed atoms:            0
  PBC on: Constraint automatically added to non-fixed atoms:
  -> inside box     0.00    0.00    0.00   11.10   11.10   11.10
  Updated total number of restrictions:            4
  Maximum internal distance of type            1 :    7.3997103713591379     
  Maximum internal distance of type            2 :    2.3741501496324950     
  Maximum internal distance of type            3 :    1.6276392505712067     
  All atoms must be within these coordinates: 
   x: [   -993.60000000000002      ,    1006.4000000000000       ] 
   y: [   -997.01970716783342      ,    1002.9802928321666       ] 
   z: [   -998.21431392687418      ,    1001.7856860731258       ] 
  If the system is larger than this, increase the sidemax parameter. 

################################################################################

  Building initial approximation ... 

################################################################################

  Adjusting initial point to fit the constraints 

--------------------------------------------------------------------------------

--------------------------------------------------------------------------------

  Molecules of type:            1

  Packing:|0                                                        100%|
          |*********************

  Restraint-only function value:    7.4262781159176745E-003
  Maximum violation of the restraints:    7.4262781159176745E-003

--------------------------------------------------------------------------------

  Molecules of type:            2

  Packing:|0                                                        100%|
          |************

  Restraint-only function value:    0.0000000000000000     
  Maximum violation of the restraints:    0.0000000000000000     

--------------------------------------------------------------------------------

  Molecules of type:            3

  Packing:|0                                                        100%|
          |*********************

  Restraint-only function value:    3.1351590608112300E-003
  Maximum violation of the restraints:    2.6786358149409870E-003

--------------------------------------------------------------------------------

  Rescaling maximum and minimum coordinates... 
  Mininum and maximum coordinates after constraint fitting: 
   x: [   -1.2383516632237570E-002 ,    11.102832633270037       ] 
   y: [   -1.6058311848949995E-004 ,    11.163693750123587       ] 
   z: [    3.5011569800479119E-005 ,    11.110535420359925       ] 
  Computing size of patches... 
  Number of cells in each direction and cell sides: 
   x:            4  cells of size    2.7756895545353362     
   y:            4  cells of size    2.7756895545353362     
   z:            4  cells of size    2.7756895545353362     
  Cell-system length:   11.10276  11.10276  11.10276
  Reseting center of mass... 

--------------------------------------------------------------------------------

  Setting initial trial coordinates ... 

--------------------------------------------------------------------------------

--------------------------------------------------------------------------------

  Molecules of type:            1
  Adjusting random positions to fit the constraints. 
  Packing:|0                                                        100%|
          |******
  Restraint-only function value:    0.0000000000000000     
  Maximum violation of the restraints:    0.0000000000000000     

--------------------------------------------------------------------------------

  Molecules of type:            2
  Adjusting random positions to fit the constraints. 
  Restraint-only function value:    0.0000000000000000     
  Maximum violation of the restraints:    0.0000000000000000     

--------------------------------------------------------------------------------

  Molecules of type:            3
  Adjusting random positions to fit the constraints. 
  Packing:|0                                                        100%|
          |***
  Restraint-only function value:    4.5214438583430484E-007
  Maximum violation of the restraints:    4.5214438583430484E-007

################################################################################

  Objective function at initial point:    1130.8971399203247     

################################################################################

  Packing molecules of type:            1

################################################################################


  Initial approximation is a solution. Nothing to do. 

  Current point written to file: solvated_150/11-ethyl-3-methylimidazol-3-ium_1tetrafluoroborate_azane.xyz
--------------------------------------------------------------------------------
  Packing solved for molecules of type           1
  Objective function value:    0.0000000000000000     
  Maximum violation of target distance:    0.0000000000000000     
  Max. constraint violation:    0.0000000000000000     
--------------------------------------------------------------------------------

################################################################################

  Packing molecules of type:            2

################################################################################


  Initial approximation is a solution. Nothing to do. 

  Current point written to file: solvated_150/11-ethyl-3-methylimidazol-3-ium_1tetrafluoroborate_azane.xyz
--------------------------------------------------------------------------------
  Packing solved for molecules of type           2
  Objective function value:    0.0000000000000000     
  Maximum violation of target distance:    0.0000000000000000     
  Max. constraint violation:    0.0000000000000000     
--------------------------------------------------------------------------------

################################################################################

  Packing molecules of type:            3

################################################################################


--------------------------------------------------------------------------------

  Starting GENCAN loop:            0
  Scaling radii by:    1.1000000000000001     

  Packing:|0                                                        100%|
          |******************************

  Function value from last GENCAN loop: f = .13922E-01
  Best function value before: f = .70670E+03
  Improvement from best function value:    99.99 %
  Improvement from last loop:    99.99 %
  Maximum violation of target distance:     0.000000
  Maximum violation of the constraints: .69770E-02
  Current structure written to file: solvated_150/11-ethyl-3-methylimidazol-3-ium_1tetrafluoroborate_azane.xyz
--------------------------------------------------------------------------------
  Packing solved for molecules of type           3
  Objective function value:    1.3921507529148839E-002
  Maximum violation of target distance:    0.0000000000000000     
  Max. constraint violation:    6.9770028046828771E-003
--------------------------------------------------------------------------------

################################################################################

  Packing all molecules together 

################################################################################


--------------------------------------------------------------------------------

  Starting GENCAN loop:            0
  Scaling radii by:    1.1000000000000001     

  Packing:|0                                                        100%|
          |************************************************

  Function value from last GENCAN loop: f = .20932E-01
  Best function value before: f = .38403E+03
  Improvement from best function value:    99.99 %
  Improvement from last loop:    99.99 %
  Maximum violation of target distance:     0.000000
  Maximum violation of the constraints: .98977E-02

################################################################################

                                 Success! 
              Final objective function value: .20932E-01
              Maximum violation of target distance:   0.000000
              Maximum violation of the constraints: .98977E-02

--------------------------------------------------------------------------------

              Please cite this work if Packmol was useful: 

           L. Martinez, R. Andrade, E. G. Birgin, J. M. Martinez, 
         PACKMOL: A package for building initial configurations for
                   molecular dynamics simulations. 
        Journal of Computational Chemistry, 30(13) pp. 2157-2164, 2009.
                  https://doi.org/10.1002/jcc.21224

################################################################################

  Solution written to file: solvated_150/11-ethyl-3-methylimidazol-3-ium_1tetrafluoroborate_azane.xyz

--------------------------------------------------------------------------------

   Running time:    4.31719944E-02  seconds. 

--------------------------------------------------------------------------------


