
################################################################################

 PACKMOL - Packing optimization for the automated generation of
 starting configurations for molecular dynamics simulations.
 
                                                             Version 21.1.2 

################################################################################

  Packmol must be run with: packmol < inputfile.inp 

  Userguide at: http://m3g.iqm.unicamp.br/packmol 

  Reading input file... (Control-C aborts)
  Types of coordinate files specified: xyz
  Periodic boundary condition activated: 
    Minimum coordinates:     0.00    0.00    0.00
    Maximum coordinates:    15.88   15.88   15.88
  Seed for random number generator:      1234567
  Output file: solvated_150/11-ethyl-3-methylimidazol-3-ium_1benzoate_tetrachloromethane.xyz
  Reading coordinate file: ../structures/1-ethyl-3-methylimidazol-3-ium.xyz
  Reading coordinate file: ../structures/benzoate.xyz
  Reading coordinate file: ../structures/tetrachloromethane.xyz
  Number of independent structures:            3
  The structures are: 
  Structure            1 :Properties=species:S:1:pos:R:3 iupac_name=1-ethyl-3-methylimidazol-3-ium pbc="F F F"(          19  atoms)
  Structure            2 :Properties=species:S:1:pos:R:3 iupac_name=benzoate pbc="F F F"(          14  atoms)
  Structure            3 :Properties=species:S:1:pos:R:3 iupac_name=tetrachloromethane pbc="F F F"(           5  atoms)
  Maximum number of GENCAN loops for all molecule packing:          600
  Distance tolerance:    2.0000000000000000     
  Number of molecules of type            1 :            1
  Number of molecules of type            2 :            1
  Number of molecules of type            3 :           23
  Total number of restrictions:            3
  Total number of atoms:          148
  Total number of molecules:           25
  Number of fixed molecules:            0
  Number of free molecules:           25
  Number of variables:          150
  Total number of fixed atoms:            0
  PBC on: Constraint automatically added to non-fixed atoms:
  -> inside box     0.00    0.00    0.00   15.88   15.88   15.88
  Updated total number of restrictions:            4
  Maximum internal distance of type            1 :    7.3997103713591379     
  Maximum internal distance of type            2 :    6.0733410755530590     
  Maximum internal distance of type            3 :    2.9101379795466742     
  All atoms must be within these coordinates: 
   x: [   -987.20000000000005      ,    1012.8000000000000       ] 
   y: [   -994.03941433566683      ,    1005.9605856643332       ] 
   z: [   -996.44583594196718      ,    1003.5541640580328       ] 
  If the system is larger than this, increase the sidemax parameter. 

################################################################################

  Building initial approximation ... 

################################################################################

  Adjusting initial point to fit the constraints 

--------------------------------------------------------------------------------

--------------------------------------------------------------------------------

  Molecules of type:            1

  Packing:|0                                                        100%|
          |*********************

  Restraint-only function value:    4.1251959508303379E-005
  Maximum violation of the restraints:    4.1251959508303379E-005

--------------------------------------------------------------------------------

  Molecules of type:            2

  Packing:|0                                                        100%|
          |******************

  Restraint-only function value:    4.3549683922478009E-003
  Maximum violation of the restraints:    4.3423777218337895E-003

--------------------------------------------------------------------------------

  Molecules of type:            3

  Packing:|0                                                        100%|
          |******************

  Restraint-only function value:    5.6467394957400458E-003
  Maximum violation of the restraints:    4.2669287190269974E-003

--------------------------------------------------------------------------------

  Rescaling maximum and minimum coordinates... 
  Mininum and maximum coordinates after constraint fitting: 
   x: [   -1.9586857645009267E-002 ,    15.928385878931280       ] 
   y: [   -4.6189439913399022E-002 ,    15.884298911938963       ] 
   z: [   -4.5415833972472300E-003 ,    15.858513223369208       ] 
  Computing size of patches... 
  Number of cells in each direction and cell sides: 
   x:            7  cells of size    2.2688271230400638     
   y:            7  cells of size    2.2688271230400638     
   z:            7  cells of size    2.2688271230400638     
  Cell-system length:   15.88179  15.88179  15.88179
  Reseting center of mass... 

--------------------------------------------------------------------------------

  Setting initial trial coordinates ... 

--------------------------------------------------------------------------------

--------------------------------------------------------------------------------

  Molecules of type:            1
  Adjusting random positions to fit the constraints. 
  Packing:|0                                                        100%|
          |*********
  Restraint-only function value:    0.0000000000000000     
  Maximum violation of the restraints:    0.0000000000000000     

--------------------------------------------------------------------------------

  Molecules of type:            2
  Adjusting random positions to fit the constraints. 
  Packing:|0                                                        100%|
          |******
  Restraint-only function value:    0.0000000000000000     
  Maximum violation of the restraints:    0.0000000000000000     

--------------------------------------------------------------------------------

  Molecules of type:            3
  Adjusting random positions to fit the constraints. 
  Packing:|0                                                        100%|
          |***
  Restraint-only function value:    5.2379615467140964E-005
  Maximum violation of the restraints:    5.2379615467140964E-005

################################################################################

  Objective function at initial point:    205.11048573319758     

################################################################################

  Packing molecules of type:            1

################################################################################


  Initial approximation is a solution. Nothing to do. 

  Current point written to file: solvated_150/11-ethyl-3-methylimidazol-3-ium_1benzoate_tetrachloromethane.xyz
--------------------------------------------------------------------------------
  Packing solved for molecules of type           1
  Objective function value:    0.0000000000000000     
  Maximum violation of target distance:    0.0000000000000000     
  Max. constraint violation:    0.0000000000000000     
--------------------------------------------------------------------------------

################################################################################

  Packing molecules of type:            2

################################################################################


  Initial approximation is a solution. Nothing to do. 

  Current point written to file: solvated_150/11-ethyl-3-methylimidazol-3-ium_1benzoate_tetrachloromethane.xyz
--------------------------------------------------------------------------------
  Packing solved for molecules of type           2
  Objective function value:    0.0000000000000000     
  Maximum violation of target distance:    0.0000000000000000     
  Max. constraint violation:    0.0000000000000000     
--------------------------------------------------------------------------------

################################################################################

  Packing molecules of type:            3

################################################################################


--------------------------------------------------------------------------------

  Starting GENCAN loop:            0
  Scaling radii by:    1.1000000000000001     

  Packing:|0                                                        100%|
          |******************

  Function value from last GENCAN loop: f = .15167E-02
  Best function value before: f = .15405E+03
  Improvement from best function value:    99.99 %
  Improvement from last loop:    99.99 %
  Maximum violation of target distance:     0.000000
  Maximum violation of the constraints: .15167E-02
  Current structure written to file: solvated_150/11-ethyl-3-methylimidazol-3-ium_1benzoate_tetrachloromethane.xyz
--------------------------------------------------------------------------------
  Packing solved for molecules of type           3
  Objective function value:    1.5167057728321613E-003
  Maximum violation of target distance:    0.0000000000000000     
  Max. constraint violation:    1.5167057728321613E-003
--------------------------------------------------------------------------------

################################################################################

  Packing all molecules together 

################################################################################


--------------------------------------------------------------------------------

  Starting GENCAN loop:            0
  Scaling radii by:    1.1000000000000001     

  Packing:|0                                                        100%|
          |***************************

  Function value from last GENCAN loop: f = .12443E-02
  Best function value before: f = .95500E+02
  Improvement from best function value:    99.99 %
  Improvement from last loop:    99.99 %
  Maximum violation of target distance:     0.000000
  Maximum violation of the constraints: .11599E-02

################################################################################

                                 Success! 
              Final objective function value: .12443E-02
              Maximum violation of target distance:   0.000000
              Maximum violation of the constraints: .11599E-02

--------------------------------------------------------------------------------

              Please cite this work if Packmol was useful: 

           L. Martinez, R. Andrade, E. G. Birgin, J. M. Martinez, 
         PACKMOL: A package for building initial configurations for
                   molecular dynamics simulations. 
        Journal of Computational Chemistry, 30(13) pp. 2157-2164, 2009.
                  https://doi.org/10.1002/jcc.21224

################################################################################

  Solution written to file: solvated_150/11-ethyl-3-methylimidazol-3-ium_1benzoate_tetrachloromethane.xyz

--------------------------------------------------------------------------------

   Running time:    1.04069971E-02  seconds. 

--------------------------------------------------------------------------------


