
################################################################################

 PACKMOL - Packing optimization for the automated generation of
 starting configurations for molecular dynamics simulations.
 
                                                             Version 21.1.2 

################################################################################

  Packmol must be run with: packmol < inputfile.inp 

  Userguide at: http://m3g.iqm.unicamp.br/packmol 

  Reading input file... (Control-C aborts)
  Types of coordinate files specified: xyz
  Periodic boundary condition activated: 
    Minimum coordinates:     0.00    0.00    0.00
    Maximum coordinates:    16.29   16.29   16.29
  Seed for random number generator:      1234567
  Output file: solvated_150/11-ethyl-3-methylimidazol-3-ium_1cyanide_tetrachloromethane.xyz
  Reading coordinate file: ../structures/1-ethyl-3-methylimidazol-3-ium.xyz
  Reading coordinate file: ../structures/cyanide.xyz
  Reading coordinate file: ../structures/tetrachloromethane.xyz
  Number of independent structures:            3
  The structures are: 
  Structure            1 :Properties=species:S:1:pos:R:3 iupac_name=1-ethyl-3-methylimidazol-3-ium pbc="F F F"(          19  atoms)
  Structure            2 :Properties=species:S:1:pos:R:3 iupac_name=cyanide pbc="F F F"(           2  atoms)
  Structure            3 :Properties=species:S:1:pos:R:3 iupac_name=tetrachloromethane pbc="F F F"(           5  atoms)
  Maximum number of GENCAN loops for all molecule packing:          600
  Distance tolerance:    2.0000000000000000     
  Number of molecules of type            1 :            1
  Number of molecules of type            2 :            1
  Number of molecules of type            3 :           25
  Total number of restrictions:            3
  Total number of atoms:          146
  Total number of molecules:           27
  Number of fixed molecules:            0
  Number of free molecules:           27
  Number of variables:          162
  Total number of fixed atoms:            0
  PBC on: Constraint automatically added to non-fixed atoms:
  -> inside box     0.00    0.00    0.00   16.29   16.29   16.29
  Updated total number of restrictions:            4
  Maximum internal distance of type            1 :    7.3997103713591379     
  Maximum internal distance of type            2 :    1.1133999999999999     
  Maximum internal distance of type            3 :    2.9101379795466742     
  All atoms must be within these coordinates: 
   x: [   -987.20000000000005      ,    1012.8000000000000       ] 
   y: [   -994.03941433566683      ,    1005.9605856643332       ] 
   z: [   -996.44583594196718      ,    1003.5541640580328       ] 
  If the system is larger than this, increase the sidemax parameter. 

################################################################################

  Building initial approximation ... 

################################################################################

  Adjusting initial point to fit the constraints 

--------------------------------------------------------------------------------

--------------------------------------------------------------------------------

  Molecules of type:            1

  Packing:|0                                                        100%|
          |*********************

  Restraint-only function value:    7.4283554812952452E-003
  Maximum violation of the restraints:    7.4283554812952452E-003

--------------------------------------------------------------------------------

  Molecules of type:            2

  Packing:|0                                                        100%|
          |*********

  Restraint-only function value:    1.9594263747904987E-020
  Maximum violation of the restraints:    1.9594263747904987E-020

--------------------------------------------------------------------------------

  Molecules of type:            3

  Packing:|0                                                        100%|
          |************************

  Restraint-only function value:    2.1419200791161028E-003
  Maximum violation of the restraints:    2.1419200791161028E-003

--------------------------------------------------------------------------------

  Rescaling maximum and minimum coordinates... 
  Mininum and maximum coordinates after constraint fitting: 
   x: [    2.1941669272777896E-006 ,    16.294487191527498       ] 
   y: [   -3.2725525810260885E-002 ,    16.355431245964219       ] 
   z: [   -9.8980462081930558E-011 ,    16.287144196758177       ] 
  Computing size of patches... 
  Number of cells in each direction and cell sides: 
   x:            7  cells of size    2.3277838845397203     
   y:            7  cells of size    2.3277838845397203     
   z:            7  cells of size    2.3277838845397203     
  Cell-system length:   16.29449  16.29449  16.29449
  Reseting center of mass... 

--------------------------------------------------------------------------------

  Setting initial trial coordinates ... 

--------------------------------------------------------------------------------

--------------------------------------------------------------------------------

  Molecules of type:            1
  Adjusting random positions to fit the constraints. 
  Packing:|0                                                        100%|
          |******
  Restraint-only function value:    0.0000000000000000     
  Maximum violation of the restraints:    0.0000000000000000     

--------------------------------------------------------------------------------

  Molecules of type:            2
  Adjusting random positions to fit the constraints. 
  Restraint-only function value:    9.1251011162355735E-004
  Maximum violation of the restraints:    9.1251011162355735E-004

--------------------------------------------------------------------------------

  Molecules of type:            3
  Adjusting random positions to fit the constraints. 
  Packing:|0                                                        100%|
          |***
  Restraint-only function value:    0.0000000000000000     
  Maximum violation of the restraints:    0.0000000000000000     

################################################################################

  Objective function at initial point:    188.80521339327933     

################################################################################

  Packing molecules of type:            1

################################################################################


  Initial approximation is a solution. Nothing to do. 

  Current point written to file: solvated_150/11-ethyl-3-methylimidazol-3-ium_1cyanide_tetrachloromethane.xyz
--------------------------------------------------------------------------------
  Packing solved for molecules of type           1
  Objective function value:    0.0000000000000000     
  Maximum violation of target distance:    0.0000000000000000     
  Max. constraint violation:    0.0000000000000000     
--------------------------------------------------------------------------------

################################################################################

  Packing molecules of type:            2

################################################################################


  Initial approximation is a solution. Nothing to do. 

  Current point written to file: solvated_150/11-ethyl-3-methylimidazol-3-ium_1cyanide_tetrachloromethane.xyz
--------------------------------------------------------------------------------
  Packing solved for molecules of type           2
  Objective function value:    9.1251011162355735E-004
  Maximum violation of target distance:    0.0000000000000000     
  Max. constraint violation:    9.1251011162355735E-004
--------------------------------------------------------------------------------

################################################################################

  Packing molecules of type:            3

################################################################################


--------------------------------------------------------------------------------

  Starting GENCAN loop:            0
  Scaling radii by:    1.1000000000000001     

  Packing:|0                                                        100%|
          |*********************************

  Function value from last GENCAN loop: f = .12454E-01
  Best function value before: f = .18371E+03
  Improvement from best function value:    99.99 %
  Improvement from last loop:    99.99 %
  Maximum violation of target distance:     0.000000
  Maximum violation of the constraints: .87400E-02
  Current structure written to file: solvated_150/11-ethyl-3-methylimidazol-3-ium_1cyanide_tetrachloromethane.xyz
--------------------------------------------------------------------------------
  Packing solved for molecules of type           3
  Objective function value:    1.2453564488528600E-002
  Maximum violation of target distance:    0.0000000000000000     
  Max. constraint violation:    8.7399639558049160E-003
--------------------------------------------------------------------------------

################################################################################

  Packing all molecules together 

################################################################################


--------------------------------------------------------------------------------

  Starting GENCAN loop:            0
  Scaling radii by:    1.1000000000000001     

  Packing:|0                                                        100%|
          |************

  Function value from last GENCAN loop: f = .75362E-02
  Best function value before: f = .44477E+01
  Improvement from best function value:    99.83 %
  Improvement from last loop:    99.83 %
  Maximum violation of target distance:     0.000000
  Maximum violation of the constraints: .56471E-02

################################################################################

                                 Success! 
              Final objective function value: .75362E-02
              Maximum violation of target distance:   0.000000
              Maximum violation of the constraints: .56471E-02

--------------------------------------------------------------------------------

              Please cite this work if Packmol was useful: 

           L. Martinez, R. Andrade, E. G. Birgin, J. M. Martinez, 
         PACKMOL: A package for building initial configurations for
                   molecular dynamics simulations. 
        Journal of Computational Chemistry, 30(13) pp. 2157-2164, 2009.
                  https://doi.org/10.1002/jcc.21224

################################################################################

  Solution written to file: solvated_150/11-ethyl-3-methylimidazol-3-ium_1cyanide_tetrachloromethane.xyz

--------------------------------------------------------------------------------

   Running time:    1.03240013E-02  seconds. 

--------------------------------------------------------------------------------


