
################################################################################

 PACKMOL - Packing optimization for the automated generation of
 starting configurations for molecular dynamics simulations.
 
                                                             Version 21.1.2 

################################################################################

  Packmol must be run with: packmol < inputfile.inp 

  Userguide at: http://m3g.iqm.unicamp.br/packmol 

  Reading input file... (Control-C aborts)
  Types of coordinate files specified: xyz
  Periodic boundary condition activated: 
    Minimum coordinates:     0.00    0.00    0.00
    Maximum coordinates:    10.72   10.72   10.72
  Seed for random number generator:      1234567
  Output file: solvated_150/11-ethyl-3-methylimidazol-3-ium_1benzoate_oxidane.xyz
  Reading coordinate file: ../structures/1-ethyl-3-methylimidazol-3-ium.xyz
  Reading coordinate file: ../structures/benzoate.xyz
  Reading coordinate file: ../structures/oxidane.xyz
  Number of independent structures:            3
  The structures are: 
  Structure            1 :Properties=species:S:1:pos:R:3 iupac_name=1-ethyl-3-methylimidazol-3-ium pbc="F F F"(          19  atoms)
  Structure            2 :Properties=species:S:1:pos:R:3 iupac_name=benzoate pbc="F F F"(          14  atoms)
  Structure            3 :Properties=species:S:1:pos:R:3 iupac_name=oxidane pbc="F F F"(           3  atoms)
  Maximum number of GENCAN loops for all molecule packing:          600
  Distance tolerance:    2.0000000000000000     
  Number of molecules of type            1 :            1
  Number of molecules of type            2 :            1
  Number of molecules of type            3 :           39
  Total number of restrictions:            3
  Total number of atoms:          150
  Total number of molecules:           41
  Number of fixed molecules:            0
  Number of free molecules:           41
  Number of variables:          246
  Total number of fixed atoms:            0
  PBC on: Constraint automatically added to non-fixed atoms:
  -> inside box     0.00    0.00    0.00   10.72   10.72   10.72
  Updated total number of restrictions:            4
  Maximum internal distance of type            1 :    7.3997103713591379     
  Maximum internal distance of type            2 :    6.0733410755530590     
  Maximum internal distance of type            3 :    1.5269386005992513     
  All atoms must be within these coordinates: 
   x: [   -993.60000000000002      ,    1006.4000000000000       ] 
   y: [   -997.01970716783342      ,    1002.9802928321666       ] 
   z: [   -998.21431392687418      ,    1001.7856860731258       ] 
  If the system is larger than this, increase the sidemax parameter. 

################################################################################

  Building initial approximation ... 

################################################################################

  Adjusting initial point to fit the constraints 

--------------------------------------------------------------------------------

--------------------------------------------------------------------------------

  Molecules of type:            1

  Packing:|0                                                        100%|
          |*********************

  Restraint-only function value:    0.0000000000000000     
  Maximum violation of the restraints:    0.0000000000000000     

--------------------------------------------------------------------------------

  Molecules of type:            2

  Packing:|0                                                        100%|
          |******************

  Restraint-only function value:    4.3462109035916985E-003
  Maximum violation of the restraints:    4.3335406992599723E-003

--------------------------------------------------------------------------------

  Molecules of type:            3

  Packing:|0                                                        100%|
          |***************

  Restraint-only function value:    6.3946960759871758E-004
  Maximum violation of the restraints:    2.5972075572278715E-004

--------------------------------------------------------------------------------

  Rescaling maximum and minimum coordinates... 
  Mininum and maximum coordinates after constraint fitting: 
   x: [   -4.6439404483971156E-004 ,    10.768769811436600       ] 
   y: [   -1.1395629770284466E-002 ,    10.727069967704377       ] 
   z: [   -7.8550847921297420E-003 ,    10.725524010455835       ] 
  Computing size of patches... 
  Number of cells in each direction and cell sides: 
   x:            4  cells of size    2.6805553077259194     
   y:            4  cells of size    2.6805553077259194     
   z:            4  cells of size    2.6805553077259194     
  Cell-system length:   10.72222  10.72222  10.72222
  Reseting center of mass... 

--------------------------------------------------------------------------------

  Setting initial trial coordinates ... 

--------------------------------------------------------------------------------

--------------------------------------------------------------------------------

  Molecules of type:            1
  Adjusting random positions to fit the constraints. 
  Packing:|0                                                        100%|
          |*********
  Restraint-only function value:    6.0692396930316257E-003
  Maximum violation of the restraints:    5.9061554662277064E-003

--------------------------------------------------------------------------------

  Molecules of type:            2
  Adjusting random positions to fit the constraints. 
  Packing:|0                                                        100%|
          |***
  Restraint-only function value:    0.0000000000000000     
  Maximum violation of the restraints:    0.0000000000000000     

--------------------------------------------------------------------------------

  Molecules of type:            3
  Adjusting random positions to fit the constraints. 
  Packing:|0                                                        100%|
          |***
  Restraint-only function value:    0.0000000000000000     
  Maximum violation of the restraints:    0.0000000000000000     

################################################################################

  Objective function at initial point:    1229.7777446548830     

################################################################################

  Packing molecules of type:            1

################################################################################


  Initial approximation is a solution. Nothing to do. 

  Current point written to file: solvated_150/11-ethyl-3-methylimidazol-3-ium_1benzoate_oxidane.xyz
--------------------------------------------------------------------------------
  Packing solved for molecules of type           1
  Objective function value:    6.0692396930316257E-003
  Maximum violation of target distance:    0.0000000000000000     
  Max. constraint violation:    5.9061554662277064E-003
--------------------------------------------------------------------------------

################################################################################

  Packing molecules of type:            2

################################################################################


  Initial approximation is a solution. Nothing to do. 

  Current point written to file: solvated_150/11-ethyl-3-methylimidazol-3-ium_1benzoate_oxidane.xyz
--------------------------------------------------------------------------------
  Packing solved for molecules of type           2
  Objective function value:    0.0000000000000000     
  Maximum violation of target distance:    0.0000000000000000     
  Max. constraint violation:    0.0000000000000000     
--------------------------------------------------------------------------------

################################################################################

  Packing molecules of type:            3

################################################################################


--------------------------------------------------------------------------------

  Starting GENCAN loop:            0
  Scaling radii by:    1.1000000000000001     

  Packing:|0                                                        100%|
          |***************************************

  Function value from last GENCAN loop: f = .11917E-01
  Best function value before: f = .69270E+03
  Improvement from best function value:    99.99 %
  Improvement from last loop:    99.99 %
  Maximum violation of target distance:     0.000000
  Maximum violation of the constraints: .87152E-02
  Current structure written to file: solvated_150/11-ethyl-3-methylimidazol-3-ium_1benzoate_oxidane.xyz
--------------------------------------------------------------------------------
  Packing solved for molecules of type           3
  Objective function value:    1.1916536216032681E-002
  Maximum violation of target distance:    0.0000000000000000     
  Max. constraint violation:    8.7152498640072837E-003
--------------------------------------------------------------------------------

################################################################################

  Packing all molecules together 

################################################################################


--------------------------------------------------------------------------------

  Starting GENCAN loop:            0
  Scaling radii by:    1.1000000000000001     

  Packing:|0                                                        100%|
          |*************************************************************|

  Function value from last GENCAN loop: f = .50378E-01
  Best function value before: f = .52402E+03
  Improvement from best function value:    99.99 %
  Improvement from last loop:    99.99 %
  Maximum violation of target distance:     0.000000
  Maximum violation of the constraints: .42578E-01

--------------------------------------------------------------------------------


--------------------------------------------------------------------------------

  Starting GENCAN loop:            1
  Scaling radii by:    1.1000000000000001     

  Packing:|0                                                        100%|
          |************

  Function value from last GENCAN loop: f = .53247E-02
  Best function value before: f = .50378E-01
  Improvement from best function value:    89.43 %
  Improvement from last loop:    89.43 %
  Maximum violation of target distance:     0.000000
  Maximum violation of the constraints: .29624E-02

################################################################################

                                 Success! 
              Final objective function value: .53247E-02
              Maximum violation of target distance:   0.000000
              Maximum violation of the constraints: .29624E-02

--------------------------------------------------------------------------------

              Please cite this work if Packmol was useful: 

           L. Martinez, R. Andrade, E. G. Birgin, J. M. Martinez, 
         PACKMOL: A package for building initial configurations for
                   molecular dynamics simulations. 
        Journal of Computational Chemistry, 30(13) pp. 2157-2164, 2009.
                  https://doi.org/10.1002/jcc.21224

################################################################################

  Solution written to file: solvated_150/11-ethyl-3-methylimidazol-3-ium_1benzoate_oxidane.xyz

--------------------------------------------------------------------------------

   Running time:    6.61149994E-02  seconds. 

--------------------------------------------------------------------------------


