
################################################################################

 PACKMOL - Packing optimization for the automated generation of
 starting configurations for molecular dynamics simulations.
 
                                                             Version 21.1.2 

################################################################################

  Packmol must be run with: packmol < inputfile.inp 

  Userguide at: http://m3g.iqm.unicamp.br/packmol 

  Reading input file... (Control-C aborts)
  Types of coordinate files specified: xyz
  Periodic boundary condition activated: 
    Minimum coordinates:     0.00    0.00    0.00
    Maximum coordinates:    15.67   15.67   15.67
  Seed for random number generator:      1234567
  Output file: solvated_150/11-hexyl-3-methylimidazol-3-ium_1acetate_tetrachloromethane.xyz
  Reading coordinate file: ../structures/1-hexyl-3-methylimidazol-3-ium.xyz
  Reading coordinate file: ../structures/acetate.xyz
  Reading coordinate file: ../structures/tetrachloromethane.xyz
  Number of independent structures:            3
  The structures are: 
  Structure            1 :Properties=species:S:1:pos:R:3 iupac_name=1-hexyl-3-methylimidazol-3-ium pbc="F F F"(          31  atoms)
  Structure            2 :Properties=species:S:1:pos:R:3 iupac_name=acetate pbc="F F F"(           7  atoms)
  Structure            3 :Properties=species:S:1:pos:R:3 iupac_name=tetrachloromethane pbc="F F F"(           5  atoms)
  Maximum number of GENCAN loops for all molecule packing:          600
  Distance tolerance:    2.0000000000000000     
  Number of molecules of type            1 :            1
  Number of molecules of type            2 :            1
  Number of molecules of type            3 :           22
  Total number of restrictions:            3
  Total number of atoms:          148
  Total number of molecules:           24
  Number of fixed molecules:            0
  Number of free molecules:           24
  Number of variables:          144
  Total number of fixed atoms:            0
  PBC on: Constraint automatically added to non-fixed atoms:
  -> inside box     0.00    0.00    0.00   15.67   15.67   15.67
  Updated total number of restrictions:            4
  Maximum internal distance of type            1 :    10.040047375884239     
  Maximum internal distance of type            2 :    3.2679070993527342     
  Maximum internal distance of type            3 :    2.9101379795466742     
  All atoms must be within these coordinates: 
   x: [   -987.20000000000005      ,    1012.8000000000000       ] 
   y: [   -993.51955879809634      ,    1006.4804412019037       ] 
   z: [   -996.48691677502416      ,    1003.5130832249758       ] 
  If the system is larger than this, increase the sidemax parameter. 

################################################################################

  Building initial approximation ... 

################################################################################

  Adjusting initial point to fit the constraints 

--------------------------------------------------------------------------------

--------------------------------------------------------------------------------

  Molecules of type:            1

  Packing:|0                                                        100%|
          |***************************

  Restraint-only function value:    0.0000000000000000     
  Maximum violation of the restraints:    0.0000000000000000     

--------------------------------------------------------------------------------

  Molecules of type:            2

  Packing:|0                                                        100%|
          |***************

  Restraint-only function value:    3.9002012987071504E-003
  Maximum violation of the restraints:    3.5929163933594225E-003

--------------------------------------------------------------------------------

  Molecules of type:            3

  Packing:|0                                                        100%|
          |*********************

  Restraint-only function value:    8.8733156361256726E-003
  Maximum violation of the restraints:    8.8167376404135692E-003

--------------------------------------------------------------------------------

  Rescaling maximum and minimum coordinates... 
  Mininum and maximum coordinates after constraint fitting: 
   x: [   -3.0358565754420405E-002 ,    15.709529412913282       ] 
   y: [   -5.9048508072103878E-002 ,    15.656436787658164       ] 
   z: [   -1.2395259282236249E-002 ,    15.646115171880020       ] 
  Computing size of patches... 
  Number of cells in each direction and cell sides: 
   x:            7  cells of size    2.2381635381639473     
   y:            7  cells of size    2.2381635381639473     
   z:            7  cells of size    2.2381635381639473     
  Cell-system length:   15.66714  15.66714  15.66714
  Reseting center of mass... 

--------------------------------------------------------------------------------

  Setting initial trial coordinates ... 

--------------------------------------------------------------------------------

--------------------------------------------------------------------------------

  Molecules of type:            1
  Adjusting random positions to fit the constraints. 
  Packing:|0                                                        100%|
          |*********
  Restraint-only function value:    1.3720793755256715E-003
  Maximum violation of the restraints:    1.2886362904552281E-003

--------------------------------------------------------------------------------

  Molecules of type:            2
  Adjusting random positions to fit the constraints. 
  Packing:|0                                                        100%|
          |***
  Restraint-only function value:    0.0000000000000000     
  Maximum violation of the restraints:    0.0000000000000000     

--------------------------------------------------------------------------------

  Molecules of type:            3
  Adjusting random positions to fit the constraints. 
  Packing:|0                                                        100%|
          |***
  Restraint-only function value:    0.0000000000000000     
  Maximum violation of the restraints:    0.0000000000000000     

################################################################################

  Objective function at initial point:    305.28278162479660     

################################################################################

  Packing molecules of type:            1

################################################################################


  Initial approximation is a solution. Nothing to do. 

  Current point written to file: solvated_150/11-hexyl-3-methylimidazol-3-ium_1acetate_tetrachloromethane.xyz
--------------------------------------------------------------------------------
  Packing solved for molecules of type           1
  Objective function value:    1.3720793755256715E-003
  Maximum violation of target distance:    0.0000000000000000     
  Max. constraint violation:    1.2886362904552281E-003
--------------------------------------------------------------------------------

################################################################################

  Packing molecules of type:            2

################################################################################


  Initial approximation is a solution. Nothing to do. 

  Current point written to file: solvated_150/11-hexyl-3-methylimidazol-3-ium_1acetate_tetrachloromethane.xyz
--------------------------------------------------------------------------------
  Packing solved for molecules of type           2
  Objective function value:    0.0000000000000000     
  Maximum violation of target distance:    0.0000000000000000     
  Max. constraint violation:    0.0000000000000000     
--------------------------------------------------------------------------------

################################################################################

  Packing molecules of type:            3

################################################################################


--------------------------------------------------------------------------------

  Starting GENCAN loop:            0
  Scaling radii by:    1.1000000000000001     

  Packing:|0                                                        100%|
          |************************

  Function value from last GENCAN loop: f = .97341E-02
  Best function value before: f = .15451E+03
  Improvement from best function value:    99.99 %
  Improvement from last loop:    99.99 %
  Maximum violation of target distance:     0.000000
  Maximum violation of the constraints: .78848E-02
  Current structure written to file: solvated_150/11-hexyl-3-methylimidazol-3-ium_1acetate_tetrachloromethane.xyz
--------------------------------------------------------------------------------
  Packing solved for molecules of type           3
  Objective function value:    9.7341115557971081E-003
  Maximum violation of target distance:    0.0000000000000000     
  Max. constraint violation:    7.8848411680067353E-003
--------------------------------------------------------------------------------

################################################################################

  Packing all molecules together 

################################################################################


--------------------------------------------------------------------------------

  Starting GENCAN loop:            0
  Scaling radii by:    1.1000000000000001     

  Packing:|0                                                        100%|
          |******************************************

  Function value from last GENCAN loop: f = .13619E-01
  Best function value before: f = .15149E+03
  Improvement from best function value:    99.99 %
  Improvement from last loop:    99.99 %
  Maximum violation of target distance:     0.000000
  Maximum violation of the constraints: .58694E-02

################################################################################

                                 Success! 
              Final objective function value: .13619E-01
              Maximum violation of target distance:   0.000000
              Maximum violation of the constraints: .58694E-02

--------------------------------------------------------------------------------

              Please cite this work if Packmol was useful: 

           L. Martinez, R. Andrade, E. G. Birgin, J. M. Martinez, 
         PACKMOL: A package for building initial configurations for
                   molecular dynamics simulations. 
        Journal of Computational Chemistry, 30(13) pp. 2157-2164, 2009.
                  https://doi.org/10.1002/jcc.21224

################################################################################

  Solution written to file: solvated_150/11-hexyl-3-methylimidazol-3-ium_1acetate_tetrachloromethane.xyz

--------------------------------------------------------------------------------

   Running time:    1.64530016E-02  seconds. 

--------------------------------------------------------------------------------


