
################################################################################

 PACKMOL - Packing optimization for the automated generation of
 starting configurations for molecular dynamics simulations.
 
                                                             Version 21.1.2 

################################################################################

  Packmol must be run with: packmol < inputfile.inp 

  Userguide at: http://m3g.iqm.unicamp.br/packmol 

  Reading input file... (Control-C aborts)
  Types of coordinate files specified: xyz
  Periodic boundary condition activated: 
    Minimum coordinates:     0.00    0.00    0.00
    Maximum coordinates:    10.76   10.76   10.76
  Seed for random number generator:      1234567
  Output file: solvated_150/11-hexyl-3-methylimidazol-3-ium_1perchlorate_azane.xyz
  Reading coordinate file: ../structures/1-hexyl-3-methylimidazol-3-ium.xyz
  Reading coordinate file: ../structures/perchlorate.xyz
  Reading coordinate file: ../structures/azane.xyz
  Number of independent structures:            3
  The structures are: 
  Structure            1 :Properties=species:S:1:pos:R:3 iupac_name=1-hexyl-3-methylimidazol-3-ium pbc="F F F"(          31  atoms)
  Structure            2 :Properties=species:S:1:pos:R:3 iupac_name=perchlorate pbc="F F F"(           5  atoms)
  Structure            3 :Properties=species:S:1:pos:R:3 iupac_name=azane pbc="F F F"(           4  atoms)
  Maximum number of GENCAN loops for all molecule packing:          600
  Distance tolerance:    2.0000000000000000     
  Number of molecules of type            1 :            1
  Number of molecules of type            2 :            1
  Number of molecules of type            3 :           28
  Total number of restrictions:            3
  Total number of atoms:          148
  Total number of molecules:           30
  Number of fixed molecules:            0
  Number of free molecules:           30
  Number of variables:          180
  Total number of fixed atoms:            0
  PBC on: Constraint automatically added to non-fixed atoms:
  -> inside box     0.00    0.00    0.00   10.76   10.76   10.76
  Updated total number of restrictions:            4
  Maximum internal distance of type            1 :    10.040047375884239     
  Maximum internal distance of type            2 :    2.4217290788608046     
  Maximum internal distance of type            3 :    1.6276392505712067     
  All atoms must be within these coordinates: 
   x: [   -993.79260191601668      ,    1006.2073980839833       ] 
   y: [   -993.43103704781436      ,    1006.5689629521856       ] 
   z: [   -997.60045864680899      ,    1002.3995413531910       ] 
  If the system is larger than this, increase the sidemax parameter. 

################################################################################

  Building initial approximation ... 

################################################################################

  Adjusting initial point to fit the constraints 

--------------------------------------------------------------------------------

--------------------------------------------------------------------------------

  Molecules of type:            1

  Packing:|0                                                        100%|
          |************************

  Restraint-only function value:    3.1066595646602295E-003
  Maximum violation of the restraints:    3.1066595646602295E-003

--------------------------------------------------------------------------------

  Molecules of type:            2

  Packing:|0                                                        100%|
          |************

  Restraint-only function value:    8.9516442145959017E-003
  Maximum violation of the restraints:    8.9516442145959017E-003

--------------------------------------------------------------------------------

  Molecules of type:            3

  Packing:|0                                                        100%|
          |*********************

  Restraint-only function value:    4.3808904924095285E-008
  Maximum violation of the restraints:    4.3808904924095285E-008

--------------------------------------------------------------------------------

  Rescaling maximum and minimum coordinates... 
  Mininum and maximum coordinates after constraint fitting: 
   x: [    9.9961522730700257E-004 ,    10.794979569988422       ] 
   y: [   -1.4800152858010501E-004 ,    10.822468850265089       ] 
   z: [    2.1346541942158893E-004 ,    10.755542094885882       ] 
  Computing size of patches... 
  Number of cells in each direction and cell sides: 
   x:            4  cells of size    2.6888918162568833     
   y:            4  cells of size    2.6888918162568833     
   z:            4  cells of size    2.6888918162568833     
  Cell-system length:   10.75557  10.75557  10.75557
  Reseting center of mass... 

--------------------------------------------------------------------------------

  Setting initial trial coordinates ... 

--------------------------------------------------------------------------------

--------------------------------------------------------------------------------

  Molecules of type:            1
  Adjusting random positions to fit the constraints. 
  Packing:|0                                                        100%|
          |******
  Restraint-only function value:    0.0000000000000000     
  Maximum violation of the restraints:    0.0000000000000000     

--------------------------------------------------------------------------------

  Molecules of type:            2
  Adjusting random positions to fit the constraints. 
  Packing:|0                                                        100%|
          |***
  Restraint-only function value:    1.5224902812003419E-003
  Maximum violation of the restraints:    1.5224902812003419E-003

--------------------------------------------------------------------------------

  Molecules of type:            3
  Adjusting random positions to fit the constraints. 
  Packing:|0                                                        100%|
          |***
  Restraint-only function value:    0.0000000000000000     
  Maximum violation of the restraints:    0.0000000000000000     

################################################################################

  Objective function at initial point:    743.41442193577996     

################################################################################

  Packing molecules of type:            1

################################################################################


  Initial approximation is a solution. Nothing to do. 

  Current point written to file: solvated_150/11-hexyl-3-methylimidazol-3-ium_1perchlorate_azane.xyz
--------------------------------------------------------------------------------
  Packing solved for molecules of type           1
  Objective function value:    0.0000000000000000     
  Maximum violation of target distance:    0.0000000000000000     
  Max. constraint violation:    0.0000000000000000     
--------------------------------------------------------------------------------

################################################################################

  Packing molecules of type:            2

################################################################################


  Initial approximation is a solution. Nothing to do. 

  Current point written to file: solvated_150/11-hexyl-3-methylimidazol-3-ium_1perchlorate_azane.xyz
--------------------------------------------------------------------------------
  Packing solved for molecules of type           2
  Objective function value:    1.5224902812003419E-003
  Maximum violation of target distance:    0.0000000000000000     
  Max. constraint violation:    1.5224902812003419E-003
--------------------------------------------------------------------------------

################################################################################

  Packing molecules of type:            3

################################################################################


--------------------------------------------------------------------------------

  Starting GENCAN loop:            0
  Scaling radii by:    1.1000000000000001     

  Packing:|0                                                        100%|
          |******************************

  Function value from last GENCAN loop: f = .33362E-02
  Best function value before: f = .44377E+03
  Improvement from best function value:    99.99 %
  Improvement from last loop:    99.99 %
  Maximum violation of target distance:     0.000000
  Maximum violation of the constraints: .21631E-02
  Current structure written to file: solvated_150/11-hexyl-3-methylimidazol-3-ium_1perchlorate_azane.xyz
--------------------------------------------------------------------------------
  Packing solved for molecules of type           3
  Objective function value:    3.3362307923151561E-003
  Maximum violation of target distance:    0.0000000000000000     
  Max. constraint violation:    2.1631431658830367E-003
--------------------------------------------------------------------------------

################################################################################

  Packing all molecules together 

################################################################################


--------------------------------------------------------------------------------

  Starting GENCAN loop:            0
  Scaling radii by:    1.1000000000000001     

  Packing:|0                                                        100%|
          |*************************************************************|

  Function value from last GENCAN loop: f = .26594E+01
  Best function value before: f = .37978E+03
  Improvement from best function value:    99.30 %
  Improvement from last loop:    99.30 %
  Maximum violation of target distance:     0.000000
  Maximum violation of the constraints: .14155E+01

--------------------------------------------------------------------------------


--------------------------------------------------------------------------------

  Starting GENCAN loop:            1
  Scaling radii by:    1.1000000000000001     

  Packing:|0                                                        100%|
          |***************************************************

  Function value from last GENCAN loop: f = .17859E-01
  Best function value before: f = .26594E+01
  Improvement from best function value:    99.33 %
  Improvement from last loop:    99.33 %
  Maximum violation of target distance:     0.000000
  Maximum violation of the constraints: .76981E-02

################################################################################

                                 Success! 
              Final objective function value: .17859E-01
              Maximum violation of target distance:   0.000000
              Maximum violation of the constraints: .76981E-02

--------------------------------------------------------------------------------

              Please cite this work if Packmol was useful: 

           L. Martinez, R. Andrade, E. G. Birgin, J. M. Martinez, 
         PACKMOL: A package for building initial configurations for
                   molecular dynamics simulations. 
        Journal of Computational Chemistry, 30(13) pp. 2157-2164, 2009.
                  https://doi.org/10.1002/jcc.21224

################################################################################

  Solution written to file: solvated_150/11-hexyl-3-methylimidazol-3-ium_1perchlorate_azane.xyz

--------------------------------------------------------------------------------

   Running time:    8.61979872E-02  seconds. 

--------------------------------------------------------------------------------


