
################################################################################

 PACKMOL - Packing optimization for the automated generation of
 starting configurations for molecular dynamics simulations.
 
                                                             Version 21.1.2 

################################################################################

  Packmol must be run with: packmol < inputfile.inp 

  Userguide at: http://m3g.iqm.unicamp.br/packmol 

  Reading input file... (Control-C aborts)
  Types of coordinate files specified: xyz
  Periodic boundary condition activated: 
    Minimum coordinates:     0.00    0.00    0.00
    Maximum coordinates:    12.41   12.41   12.41
  Seed for random number generator:      1234567
  Output file: solvated_150/1Ac_3dihydrogen-phosphate_acetic-acid.xyz
  Reading coordinate file: ../structures/Ac.xyz
  Reading coordinate file: ../structures/dihydrogen-phosphate.xyz
  Reading coordinate file: ../structures/acetic-acid.xyz
  Number of independent structures:            3
  The structures are: 
  Structure            1 :Properties=species:S:1:pos:R:3 iupac_name=Ac pbc="F F F"(           1  atoms)
  Structure            2 :Properties=species:S:1:pos:R:3 iupac_name=dihydrogen-phosphate pbc="F F F"(           7  atoms)
  Structure            3 :Properties=species:S:1:pos:R:3 iupac_name=acetic-acid pbc="F F F"(           8  atoms)
  Maximum number of GENCAN loops for all molecule packing:          600
  Distance tolerance:    2.0000000000000000     
  Number of molecules of type            1 :            1
  Number of molecules of type            2 :            3
  Number of molecules of type            3 :           16
  Total number of restrictions:            3
  Total number of atoms:          150
  Total number of molecules:           20
  Number of fixed molecules:            0
  Number of free molecules:           20
  Number of variables:          120
  Total number of fixed atoms:            0
  PBC on: Constraint automatically added to non-fixed atoms:
  -> inside box     0.00    0.00    0.00   12.41   12.41   12.41
  Updated total number of restrictions:            4
  Maximum internal distance of type            1 :    0.0000000000000000     
  Maximum internal distance of type            2 :    3.4498690960672698     
  Maximum internal distance of type            3 :    4.0492717592179464     
  All atoms must be within these coordinates: 
   x: [   -1000.0000000000000      ,    1000.0000000000000       ] 
   y: [   -1000.0000000000000      ,    1000.0000000000000       ] 
   z: [   -1000.0000000000000      ,    1000.0000000000000       ] 
  If the system is larger than this, increase the sidemax parameter. 

################################################################################

  Building initial approximation ... 

################################################################################

  Adjusting initial point to fit the constraints 

--------------------------------------------------------------------------------

--------------------------------------------------------------------------------

  Molecules of type:            1

  Packing:|0                                                        100%|
          |******

  Restraint-only function value:    1.9475371294701006E-014
  Maximum violation of the restraints:    1.9475371294701006E-014

--------------------------------------------------------------------------------

  Molecules of type:            2

  Packing:|0                                                        100%|
          |***************

  Restraint-only function value:    1.4651409658994114E-003
  Maximum violation of the restraints:    8.5312222695296521E-004

--------------------------------------------------------------------------------

  Molecules of type:            3

  Packing:|0                                                        100%|
          |*********************

  Restraint-only function value:    2.0048686856135921E-005
  Maximum violation of the restraints:    9.2902380371667624E-006

--------------------------------------------------------------------------------

  Rescaling maximum and minimum coordinates... 
  Mininum and maximum coordinates after constraint fitting: 
   x: [   -1.5615679793167740E-002 ,    12.405857569892573       ] 
   y: [    7.6909066536531075E-004 ,    12.426380730373051       ] 
   z: [   -2.1552538176705270E-003 ,    12.407376081682187       ] 
  Computing size of patches... 
  Number of cells in each direction and cell sides: 
   x:            5  cells of size    2.4811454748774486     
   y:            5  cells of size    2.4811454748774486     
   z:            5  cells of size    2.4811454748774486     
  Cell-system length:   12.40573  12.40573  12.40573
  Reseting center of mass... 

--------------------------------------------------------------------------------

  Setting initial trial coordinates ... 

--------------------------------------------------------------------------------

--------------------------------------------------------------------------------

  Molecules of type:            1
  Adjusting random positions to fit the constraints. 
  Restraint-only function value:    1.9475371294701006E-014
  Maximum violation of the restraints:    1.9475371294701006E-014

--------------------------------------------------------------------------------

  Molecules of type:            2
  Adjusting random positions to fit the constraints. 
  Packing:|0                                                        100%|
          |***
  Restraint-only function value:    0.0000000000000000     
  Maximum violation of the restraints:    0.0000000000000000     

--------------------------------------------------------------------------------

  Molecules of type:            3
  Adjusting random positions to fit the constraints. 
  Packing:|0                                                        100%|
          |***
  Restraint-only function value:    0.0000000000000000     
  Maximum violation of the restraints:    0.0000000000000000     

################################################################################

  Objective function at initial point:    883.30688737755600     

################################################################################

  Packing molecules of type:            1

################################################################################


  Initial approximation is a solution. Nothing to do. 

  Current point written to file: solvated_150/1Ac_3dihydrogen-phosphate_acetic-acid.xyz
--------------------------------------------------------------------------------
  Packing solved for molecules of type           1
  Objective function value:    1.9475371294701006E-014
  Maximum violation of target distance:    0.0000000000000000     
  Max. constraint violation:    1.9475371294701006E-014
--------------------------------------------------------------------------------

################################################################################

  Packing molecules of type:            2

################################################################################


--------------------------------------------------------------------------------

  Starting GENCAN loop:            0
  Scaling radii by:    1.1000000000000001     

  Packing:|0                                                        100%|
          |************

  Function value from last GENCAN loop: f = .39964E-04
  Best function value before: f = .53600E+02
  Improvement from best function value:    99.99 %
  Improvement from last loop:    99.99 %
  Maximum violation of target distance:     0.000000
  Maximum violation of the constraints: .39857E-04
  Current structure written to file: solvated_150/1Ac_3dihydrogen-phosphate_acetic-acid.xyz
--------------------------------------------------------------------------------
  Packing solved for molecules of type           2
  Objective function value:    3.9964381802649418E-005
  Maximum violation of target distance:    0.0000000000000000     
  Max. constraint violation:    3.9857258335000813E-005
--------------------------------------------------------------------------------

################################################################################

  Packing molecules of type:            3

################################################################################


--------------------------------------------------------------------------------

  Starting GENCAN loop:            0
  Scaling radii by:    1.1000000000000001     

  Packing:|0                                                        100%|
          |***************************************

  Function value from last GENCAN loop: f = .39042E-02
  Best function value before: f = .67626E+03
  Improvement from best function value:    99.99 %
  Improvement from last loop:    99.99 %
  Maximum violation of target distance:     0.000000
  Maximum violation of the constraints: .33271E-02
  Current structure written to file: solvated_150/1Ac_3dihydrogen-phosphate_acetic-acid.xyz
--------------------------------------------------------------------------------
  Packing solved for molecules of type           3
  Objective function value:    3.9042162464811157E-003
  Maximum violation of target distance:    0.0000000000000000     
  Max. constraint violation:    3.3271260532841788E-003
--------------------------------------------------------------------------------

################################################################################

  Packing all molecules together 

################################################################################


--------------------------------------------------------------------------------

  Starting GENCAN loop:            0
  Scaling radii by:    1.1000000000000001     

  Packing:|0                                                        100%|
          |******************************

  Function value from last GENCAN loop: f = .82918E-02
  Best function value before: f = .13177E+03
  Improvement from best function value:    99.99 %
  Improvement from last loop:    99.99 %
  Maximum violation of target distance:     0.000000
  Maximum violation of the constraints: .42278E-02

################################################################################

                                 Success! 
              Final objective function value: .82918E-02
              Maximum violation of target distance:   0.000000
              Maximum violation of the constraints: .42278E-02

--------------------------------------------------------------------------------

              Please cite this work if Packmol was useful: 

           L. Martinez, R. Andrade, E. G. Birgin, J. M. Martinez, 
         PACKMOL: A package for building initial configurations for
                   molecular dynamics simulations. 
        Journal of Computational Chemistry, 30(13) pp. 2157-2164, 2009.
                  https://doi.org/10.1002/jcc.21224

################################################################################

  Solution written to file: solvated_150/1Ac_3dihydrogen-phosphate_acetic-acid.xyz

--------------------------------------------------------------------------------

   Running time:    2.14999951E-02  seconds. 

--------------------------------------------------------------------------------


