
################################################################################

 PACKMOL - Packing optimization for the automated generation of
 starting configurations for molecular dynamics simulations.
 
                                                             Version 21.1.2 

################################################################################

  Packmol must be run with: packmol < inputfile.inp 

  Userguide at: http://m3g.iqm.unicamp.br/packmol 

  Reading input file... (Control-C aborts)
  Types of coordinate files specified: xyz
  Periodic boundary condition activated: 
    Minimum coordinates:     0.00    0.00    0.00
    Maximum coordinates:    12.44   12.44   12.44
  Seed for random number generator:      1234567
  Output file: solvated_150/1azanium_1perchlorate_benzene.xyz
  Reading coordinate file: ../structures/azanium.xyz
  Reading coordinate file: ../structures/perchlorate.xyz
  Reading coordinate file: ../structures/benzene.xyz
  Number of independent structures:            3
  The structures are: 
  Structure            1 :Properties=species:S:1:pos:R:3 iupac_name=ammonium pbc="F F F"(           5  atoms)
  Structure            2 :Properties=species:S:1:pos:R:3 iupac_name=perchlorate pbc="F F F"(           5  atoms)
  Structure            3 :Properties=species:S:1:pos:R:3 iupac_name=benzene pbc="F F F"(          12  atoms)
  Maximum number of GENCAN loops for all molecule packing:          600
  Distance tolerance:    2.0000000000000000     
  Number of molecules of type            1 :            1
  Number of molecules of type            2 :            1
  Number of molecules of type            3 :           11
  Total number of restrictions:            3
  Total number of atoms:          142
  Total number of molecules:           13
  Number of fixed molecules:            0
  Number of free molecules:           13
  Number of variables:           78
  Total number of fixed atoms:            0
  PBC on: Constraint automatically added to non-fixed atoms:
  -> inside box     0.00    0.00    0.00   12.44   12.44   12.44
  Updated total number of restrictions:            4
  Maximum internal distance of type            1 :    1.6868875125804925     
  Maximum internal distance of type            2 :    2.4217290788608046     
  Maximum internal distance of type            3 :    4.9619487079170828     
  All atoms must be within these coordinates: 
   x: [   -998.39999999999998      ,    1001.6000000000000       ] 
   y: [   -998.70640540811314      ,    1001.2935945918869       ] 
   z: [   -998.68884568164333      ,    1001.3111543183567       ] 
  If the system is larger than this, increase the sidemax parameter. 

################################################################################

  Building initial approximation ... 

################################################################################

  Adjusting initial point to fit the constraints 

--------------------------------------------------------------------------------

--------------------------------------------------------------------------------

  Molecules of type:            1

  Packing:|0                                                        100%|
          |***************

  Restraint-only function value:    0.0000000000000000     
  Maximum violation of the restraints:    0.0000000000000000     

--------------------------------------------------------------------------------

  Molecules of type:            2

  Packing:|0                                                        100%|
          |************

  Restraint-only function value:    0.0000000000000000     
  Maximum violation of the restraints:    0.0000000000000000     

--------------------------------------------------------------------------------

  Molecules of type:            3

  Packing:|0                                                        100%|
          |************************

  Restraint-only function value:    4.3100422029623377E-006
  Maximum violation of the restraints:    4.3100422029623377E-006

--------------------------------------------------------------------------------

  Rescaling maximum and minimum coordinates... 
  Mininum and maximum coordinates after constraint fitting: 
   x: [    5.6477363800762521E-003 ,    12.424481531879508       ] 
   y: [    3.6852550865118343E-004 ,    12.422577370476693       ] 
   z: [   -1.4679990127657338E-003 ,    12.402163081040710       ] 
  Computing size of patches... 
  Number of cells in each direction and cell sides: 
   x:            5  cells of size    2.4883143122553752     
   y:            5  cells of size    2.4883143122553752     
   z:            5  cells of size    2.4883143122553752     
  Cell-system length:   12.44157  12.44157  12.44157
  Reseting center of mass... 

--------------------------------------------------------------------------------

  Setting initial trial coordinates ... 

--------------------------------------------------------------------------------

--------------------------------------------------------------------------------

  Molecules of type:            1
  Adjusting random positions to fit the constraints. 
  Packing:|0                                                        100%|
          |***
  Restraint-only function value:    0.0000000000000000     
  Maximum violation of the restraints:    0.0000000000000000     

--------------------------------------------------------------------------------

  Molecules of type:            2
  Adjusting random positions to fit the constraints. 
  Packing:|0                                                        100%|
          |***
  Restraint-only function value:    1.4765672719606696E-005
  Maximum violation of the restraints:    1.4765672719606696E-005

--------------------------------------------------------------------------------

  Molecules of type:            3
  Adjusting random positions to fit the constraints. 
  Packing:|0                                                        100%|
          |******
  Restraint-only function value:    0.0000000000000000     
  Maximum violation of the restraints:    0.0000000000000000     

################################################################################

  Objective function at initial point:    710.04935100438843     

################################################################################

  Packing molecules of type:            1

################################################################################


  Initial approximation is a solution. Nothing to do. 

  Current point written to file: solvated_150/1azanium_1perchlorate_benzene.xyz
--------------------------------------------------------------------------------
  Packing solved for molecules of type           1
  Objective function value:    0.0000000000000000     
  Maximum violation of target distance:    0.0000000000000000     
  Max. constraint violation:    0.0000000000000000     
--------------------------------------------------------------------------------

################################################################################

  Packing molecules of type:            2

################################################################################


  Initial approximation is a solution. Nothing to do. 

  Current point written to file: solvated_150/1azanium_1perchlorate_benzene.xyz
--------------------------------------------------------------------------------
  Packing solved for molecules of type           2
  Objective function value:    1.4765672719606696E-005
  Maximum violation of target distance:    0.0000000000000000     
  Max. constraint violation:    1.4765672719606696E-005
--------------------------------------------------------------------------------

################################################################################

  Packing molecules of type:            3

################################################################################


--------------------------------------------------------------------------------

  Starting GENCAN loop:            0
  Scaling radii by:    1.1000000000000001     

  Packing:|0                                                        100%|
          |*********************************************

  Function value from last GENCAN loop: f = .62002E-03
  Best function value before: f = .62828E+03
  Improvement from best function value:    99.99 %
  Improvement from last loop:    99.99 %
  Maximum violation of target distance:     0.000000
  Maximum violation of the constraints: .41925E-03
  Current structure written to file: solvated_150/1azanium_1perchlorate_benzene.xyz
--------------------------------------------------------------------------------
  Packing solved for molecules of type           3
  Objective function value:    6.2002432096475591E-004
  Maximum violation of target distance:    0.0000000000000000     
  Max. constraint violation:    4.1924569608576466E-004
--------------------------------------------------------------------------------

################################################################################

  Packing all molecules together 

################################################################################


--------------------------------------------------------------------------------

  Starting GENCAN loop:            0
  Scaling radii by:    1.1000000000000001     

  Packing:|0                                                        100%|
          |***************************************************

  Function value from last GENCAN loop: f = .00000E+00
  Best function value before: f = .15604E+03
  Improvement from best function value:    99.99 %
  Improvement from last loop:    99.99 %
  Maximum violation of target distance:     0.000000
  Maximum violation of the constraints: .00000E+00

################################################################################

                                 Success! 
              Final objective function value: .00000E+00
              Maximum violation of target distance:   0.000000
              Maximum violation of the constraints: .00000E+00

--------------------------------------------------------------------------------

              Please cite this work if Packmol was useful: 

           L. Martinez, R. Andrade, E. G. Birgin, J. M. Martinez, 
         PACKMOL: A package for building initial configurations for
                   molecular dynamics simulations. 
        Journal of Computational Chemistry, 30(13) pp. 2157-2164, 2009.
                  https://doi.org/10.1002/jcc.21224

################################################################################

  Solution written to file: solvated_150/1azanium_1perchlorate_benzene.xyz

--------------------------------------------------------------------------------

   Running time:    2.78380029E-02  seconds. 

--------------------------------------------------------------------------------


