
################################################################################

 PACKMOL - Packing optimization for the automated generation of
 starting configurations for molecular dynamics simulations.
 
                                                             Version 21.1.2 

################################################################################

  Packmol must be run with: packmol < inputfile.inp 

  Userguide at: http://m3g.iqm.unicamp.br/packmol 

  Reading input file... (Control-C aborts)
  Types of coordinate files specified: xyz
  Periodic boundary condition activated: 
    Minimum coordinates:     0.00    0.00    0.00
    Maximum coordinates:    11.84   11.84   11.84
  Seed for random number generator:      1234567
  Output file: solvated_150/1azanium_1perchlorate_N,N-dimethylformamide.xyz
  Reading coordinate file: ../structures/azanium.xyz
  Reading coordinate file: ../structures/perchlorate.xyz
  Reading coordinate file: ../structures/N,N-dimethylformamide.xyz
  Number of independent structures:            3
  The structures are: 
  Structure            1 :Properties=species:S:1:pos:R:3 iupac_name=ammonium pbc="F F F"(           5  atoms)
  Structure            2 :Properties=species:S:1:pos:R:3 iupac_name=perchlorate pbc="F F F"(           5  atoms)
  Structure            3 :Properties=species:S:1:pos:R:3 iupac_name=N,N-dimethylformamide pbc="F F F"(          12  atoms)
  Maximum number of GENCAN loops for all molecule packing:          600
  Distance tolerance:    2.0000000000000000     
  Number of molecules of type            1 :            1
  Number of molecules of type            2 :            1
  Number of molecules of type            3 :           11
  Total number of restrictions:            3
  Total number of atoms:          142
  Total number of molecules:           13
  Number of fixed molecules:            0
  Number of free molecules:           13
  Number of variables:           78
  Total number of fixed atoms:            0
  PBC on: Constraint automatically added to non-fixed atoms:
  -> inside box     0.00    0.00    0.00   11.84   11.84   11.84
  Updated total number of restrictions:            4
  Maximum internal distance of type            1 :    1.6868875125804925     
  Maximum internal distance of type            2 :    2.4217290788608046     
  Maximum internal distance of type            3 :    4.2658499117995232     
  All atoms must be within these coordinates: 
   x: [   -998.39999999999998      ,    1001.6000000000000       ] 
   y: [   -998.70640540811314      ,    1001.2935945918869       ] 
   z: [   -998.68884568164333      ,    1001.3111543183567       ] 
  If the system is larger than this, increase the sidemax parameter. 

################################################################################

  Building initial approximation ... 

################################################################################

  Adjusting initial point to fit the constraints 

--------------------------------------------------------------------------------

--------------------------------------------------------------------------------

  Molecules of type:            1

  Packing:|0                                                        100%|
          |*********

  Restraint-only function value:    6.8836374251856724E-004
  Maximum violation of the restraints:    6.8836374251856724E-004

--------------------------------------------------------------------------------

  Molecules of type:            2

  Packing:|0                                                        100%|
          |************

  Restraint-only function value:    0.0000000000000000     
  Maximum violation of the restraints:    0.0000000000000000     

--------------------------------------------------------------------------------

  Molecules of type:            3

  Packing:|0                                                        100%|
          |************************

  Restraint-only function value:    0.0000000000000000     
  Maximum violation of the restraints:    0.0000000000000000     

--------------------------------------------------------------------------------

  Rescaling maximum and minimum coordinates... 
  Mininum and maximum coordinates after constraint fitting: 
   x: [    6.4040163781390854E-003 ,    11.838901019644704       ] 
   y: [   0.14239136697828297      ,    11.861383782461047       ] 
   z: [    4.2735696937202145E-004 ,    11.835557685607906       ] 
  Computing size of patches... 
  Number of cells in each direction and cell sides: 
   x:            5  cells of size    2.3685663286394716     
   y:            5  cells of size    2.3685663286394716     
   z:            5  cells of size    2.3685663286394716     
  Cell-system length:   11.84283  11.84283  11.84283
  Reseting center of mass... 

--------------------------------------------------------------------------------

  Setting initial trial coordinates ... 

--------------------------------------------------------------------------------

--------------------------------------------------------------------------------

  Molecules of type:            1
  Adjusting random positions to fit the constraints. 
  Packing:|0                                                        100%|
          |***
  Restraint-only function value:    0.0000000000000000     
  Maximum violation of the restraints:    0.0000000000000000     

--------------------------------------------------------------------------------

  Molecules of type:            2
  Adjusting random positions to fit the constraints. 
  Packing:|0                                                        100%|
          |******
  Restraint-only function value:    2.1176613438726464E-004
  Maximum violation of the restraints:    2.1176613438726464E-004

--------------------------------------------------------------------------------

  Molecules of type:            3
  Adjusting random positions to fit the constraints. 
  Packing:|0                                                        100%|
          |***
  Restraint-only function value:    0.0000000000000000     
  Maximum violation of the restraints:    0.0000000000000000     

################################################################################

  Objective function at initial point:    891.22349962739327     

################################################################################

  Packing molecules of type:            1

################################################################################


  Initial approximation is a solution. Nothing to do. 

  Current point written to file: solvated_150/1azanium_1perchlorate_N,N-dimethylformamide.xyz
--------------------------------------------------------------------------------
  Packing solved for molecules of type           1
  Objective function value:    0.0000000000000000     
  Maximum violation of target distance:    0.0000000000000000     
  Max. constraint violation:    0.0000000000000000     
--------------------------------------------------------------------------------

################################################################################

  Packing molecules of type:            2

################################################################################


  Initial approximation is a solution. Nothing to do. 

  Current point written to file: solvated_150/1azanium_1perchlorate_N,N-dimethylformamide.xyz
--------------------------------------------------------------------------------
  Packing solved for molecules of type           2
  Objective function value:    2.1176613438726464E-004
  Maximum violation of target distance:    0.0000000000000000     
  Max. constraint violation:    2.1176613438726464E-004
--------------------------------------------------------------------------------

################################################################################

  Packing molecules of type:            3

################################################################################


--------------------------------------------------------------------------------

  Starting GENCAN loop:            0
  Scaling radii by:    1.1000000000000001     

  Packing:|0                                                        100%|
          |*********************************************************

  Function value from last GENCAN loop: f = .20222E-02
  Best function value before: f = .88426E+03
  Improvement from best function value:    99.99 %
  Improvement from last loop:    99.99 %
  Maximum violation of target distance:     0.000000
  Maximum violation of the constraints: .20222E-02
  Current structure written to file: solvated_150/1azanium_1perchlorate_N,N-dimethylformamide.xyz
--------------------------------------------------------------------------------
  Packing solved for molecules of type           3
  Objective function value:    2.0221544102001035E-003
  Maximum violation of target distance:    0.0000000000000000     
  Max. constraint violation:    2.0221544102001035E-003
--------------------------------------------------------------------------------

################################################################################

  Packing all molecules together 

################################################################################


--------------------------------------------------------------------------------

  Starting GENCAN loop:            0
  Scaling radii by:    1.1000000000000001     

  Packing:|0                                                        100%|
          |***************************************************

  Function value from last GENCAN loop: f = .25580E-02
  Best function value before: f = .38931E+02
  Improvement from best function value:    99.99 %
  Improvement from last loop:    99.99 %
  Maximum violation of target distance:     0.000000
  Maximum violation of the constraints: .21033E-02

################################################################################

                                 Success! 
              Final objective function value: .25580E-02
              Maximum violation of target distance:   0.000000
              Maximum violation of the constraints: .21033E-02

--------------------------------------------------------------------------------

              Please cite this work if Packmol was useful: 

           L. Martinez, R. Andrade, E. G. Birgin, J. M. Martinez, 
         PACKMOL: A package for building initial configurations for
                   molecular dynamics simulations. 
        Journal of Computational Chemistry, 30(13) pp. 2157-2164, 2009.
                  https://doi.org/10.1002/jcc.21224

################################################################################

  Solution written to file: solvated_150/1azanium_1perchlorate_N,N-dimethylformamide.xyz

--------------------------------------------------------------------------------

   Running time:    4.03650030E-02  seconds. 

--------------------------------------------------------------------------------


