
################################################################################

 PACKMOL - Packing optimization for the automated generation of
 starting configurations for molecular dynamics simulations.
 
                                                             Version 21.1.2 

################################################################################

  Packmol must be run with: packmol < inputfile.inp 

  Userguide at: http://m3g.iqm.unicamp.br/packmol 

  Reading input file... (Control-C aborts)
  Types of coordinate files specified: xyz
  Periodic boundary condition activated: 
    Minimum coordinates:     0.00    0.00    0.00
    Maximum coordinates:    15.88   15.88   15.88
  Seed for random number generator:      1234567
  Output file: solvated_150/1Be_2iodate_chloroform.xyz
  Reading coordinate file: ../structures/Be.xyz
  Reading coordinate file: ../structures/iodate.xyz
  Reading coordinate file: ../structures/chloroform.xyz
  Number of independent structures:            3
  The structures are: 
  Structure            1 :Properties=species:S:1:pos:R:3 iupac_name=Be pbc="F F F"(           1  atoms)
  Structure            2 :Properties=species:S:1:pos:R:3 iupac_name=iodate pbc="F F F"(           5  atoms)
  Structure            3 :Properties=species:S:1:pos:R:3 iupac_name=chloroform pbc="F F F"(           5  atoms)
  Maximum number of GENCAN loops for all molecule packing:          600
  Distance tolerance:    2.0000000000000000     
  Number of molecules of type            1 :            1
  Number of molecules of type            2 :            2
  Number of molecules of type            3 :           27
  Total number of restrictions:            3
  Total number of atoms:          146
  Total number of molecules:           30
  Number of fixed molecules:            0
  Number of free molecules:           30
  Number of variables:          180
  Total number of fixed atoms:            0
  PBC on: Constraint automatically added to non-fixed atoms:
  -> inside box     0.00    0.00    0.00   15.88   15.88   15.88
  Updated total number of restrictions:            4
  Maximum internal distance of type            1 :    0.0000000000000000     
  Maximum internal distance of type            2 :    3.2333368451029041     
  Maximum internal distance of type            3 :    2.9128739262110201     
  All atoms must be within these coordinates: 
   x: [   -1000.0000000000000      ,    1000.0000000000000       ] 
   y: [   -1000.0000000000000      ,    1000.0000000000000       ] 
   z: [   -1000.0000000000000      ,    1000.0000000000000       ] 
  If the system is larger than this, increase the sidemax parameter. 

################################################################################

  Building initial approximation ... 

################################################################################

  Adjusting initial point to fit the constraints 

--------------------------------------------------------------------------------

--------------------------------------------------------------------------------

  Molecules of type:            1

  Packing:|0                                                        100%|
          |******

  Restraint-only function value:    1.6537865783607222E-014
  Maximum violation of the restraints:    1.6537865783607222E-014

--------------------------------------------------------------------------------

  Molecules of type:            2

  Packing:|0                                                        100%|
          |******************

  Restraint-only function value:    6.5872240297724107E-007
  Maximum violation of the restraints:    6.5872240297724107E-007

--------------------------------------------------------------------------------

  Molecules of type:            3

  Packing:|0                                                        100%|
          |***************************

  Restraint-only function value:    8.4125287807549198E-003
  Maximum violation of the restraints:    8.3777627846274433E-003

--------------------------------------------------------------------------------

  Rescaling maximum and minimum coordinates... 
  Mininum and maximum coordinates after constraint fitting: 
   x: [    1.0426180428409300E-002 ,    15.948191690065821       ] 
   y: [   -1.7705800930404741E-003 ,    15.887663637429203       ] 
   z: [    1.9810379114915122E-008 ,    15.884068245148063       ] 
  Computing size of patches... 
  Number of cells in each direction and cell sides: 
   x:            7  cells of size    2.2690706207364970     
   y:            7  cells of size    2.2690706207364970     
   z:            7  cells of size    2.2690706207364970     
  Cell-system length:   15.88349  15.88349  15.88349
  Reseting center of mass... 

--------------------------------------------------------------------------------

  Setting initial trial coordinates ... 

--------------------------------------------------------------------------------

--------------------------------------------------------------------------------

  Molecules of type:            1
  Adjusting random positions to fit the constraints. 
  Restraint-only function value:    1.6537865783607222E-014
  Maximum violation of the restraints:    1.6537865783607222E-014

--------------------------------------------------------------------------------

  Molecules of type:            2
  Adjusting random positions to fit the constraints. 
  Restraint-only function value:    0.0000000000000000     
  Maximum violation of the restraints:    0.0000000000000000     

--------------------------------------------------------------------------------

  Molecules of type:            3
  Adjusting random positions to fit the constraints. 
  Packing:|0                                                        100%|
          |***
  Restraint-only function value:    0.0000000000000000     
  Maximum violation of the restraints:    0.0000000000000000     

################################################################################

  Objective function at initial point:    202.78405014015465     

################################################################################

  Packing molecules of type:            1

################################################################################


  Initial approximation is a solution. Nothing to do. 

  Current point written to file: solvated_150/1Be_2iodate_chloroform.xyz
--------------------------------------------------------------------------------
  Packing solved for molecules of type           1
  Objective function value:    1.6537865783607222E-014
  Maximum violation of target distance:    0.0000000000000000     
  Max. constraint violation:    1.6537865783607222E-014
--------------------------------------------------------------------------------

################################################################################

  Packing molecules of type:            2

################################################################################


--------------------------------------------------------------------------------

  Starting GENCAN loop:            0
  Scaling radii by:    1.1000000000000001     

  Packing:|0                                                        100%|
          |***

  Function value from last GENCAN loop: f = .12900E-02
  Best function value before: f = .91823E+01
  Improvement from best function value:    99.99 %
  Improvement from last loop:    99.99 %
  Maximum violation of target distance:     0.000000
  Maximum violation of the constraints: .12900E-02
  Current structure written to file: solvated_150/1Be_2iodate_chloroform.xyz
--------------------------------------------------------------------------------
  Packing solved for molecules of type           2
  Objective function value:    1.2899938578250906E-003
  Maximum violation of target distance:    0.0000000000000000     
  Max. constraint violation:    1.2899938578250906E-003
--------------------------------------------------------------------------------

################################################################################

  Packing molecules of type:            3

################################################################################


--------------------------------------------------------------------------------

  Starting GENCAN loop:            0
  Scaling radii by:    1.1000000000000001     

  Packing:|0                                                        100%|
          |***************************

  Function value from last GENCAN loop: f = .37836E-02
  Best function value before: f = .19360E+03
  Improvement from best function value:    99.99 %
  Improvement from last loop:    99.99 %
  Maximum violation of target distance:     0.000000
  Maximum violation of the constraints: .37836E-02
  Current structure written to file: solvated_150/1Be_2iodate_chloroform.xyz
--------------------------------------------------------------------------------
  Packing solved for molecules of type           3
  Objective function value:    3.7835687020591974E-003
  Maximum violation of target distance:    0.0000000000000000     
  Max. constraint violation:    3.7835687020591974E-003
--------------------------------------------------------------------------------

################################################################################

  Packing all molecules together 

################################################################################


--------------------------------------------------------------------------------

  Starting GENCAN loop:            0
  Scaling radii by:    1.1000000000000001     

  Packing:|0                                                        100%|
          |************

  Function value from last GENCAN loop: f = .00000E+00
  Best function value before: f = .14407E+02
  Improvement from best function value:    99.99 %
  Improvement from last loop:    99.99 %
  Maximum violation of target distance:     0.000000
  Maximum violation of the constraints: .00000E+00

################################################################################

                                 Success! 
              Final objective function value: .00000E+00
              Maximum violation of target distance:   0.000000
              Maximum violation of the constraints: .00000E+00

--------------------------------------------------------------------------------

              Please cite this work if Packmol was useful: 

           L. Martinez, R. Andrade, E. G. Birgin, J. M. Martinez, 
         PACKMOL: A package for building initial configurations for
                   molecular dynamics simulations. 
        Journal of Computational Chemistry, 30(13) pp. 2157-2164, 2009.
                  https://doi.org/10.1002/jcc.21224

################################################################################

  Solution written to file: solvated_150/1Be_2iodate_chloroform.xyz

--------------------------------------------------------------------------------

   Running time:    9.83799994E-03  seconds. 

--------------------------------------------------------------------------------


