
################################################################################

 PACKMOL - Packing optimization for the automated generation of
 starting configurations for molecular dynamics simulations.
 
                                                             Version 21.1.2 

################################################################################

  Packmol must be run with: packmol < inputfile.inp 

  Userguide at: http://m3g.iqm.unicamp.br/packmol 

  Reading input file... (Control-C aborts)
  Types of coordinate files specified: xyz
  Periodic boundary condition activated: 
    Minimum coordinates:     0.00    0.00    0.00
    Maximum coordinates:    11.84   11.84   11.84
  Seed for random number generator:      1234567
  Output file: solvated_150/1Be_2benzoate_1,3-dioxolan-2-one.xyz
  Reading coordinate file: ../structures/Be.xyz
  Reading coordinate file: ../structures/benzoate.xyz
  Reading coordinate file: ../structures/1,3-dioxolan-2-one.xyz
  Number of independent structures:            3
  The structures are: 
  Structure            1 :Properties=species:S:1:pos:R:3 iupac_name=Be pbc="F F F"(           1  atoms)
  Structure            2 :Properties=species:S:1:pos:R:3 iupac_name=benzoate pbc="F F F"(          14  atoms)
  Structure            3 :Properties=species:S:1:pos:R:3 iupac_name=1,3-dioxolan-2-one pbc="F F F"(          10  atoms)
  Maximum number of GENCAN loops for all molecule packing:          600
  Distance tolerance:    2.0000000000000000     
  Number of molecules of type            1 :            1
  Number of molecules of type            2 :            2
  Number of molecules of type            3 :           12
  Total number of restrictions:            3
  Total number of atoms:          149
  Total number of molecules:           15
  Number of fixed molecules:            0
  Number of free molecules:           15
  Number of variables:           90
  Total number of fixed atoms:            0
  PBC on: Constraint automatically added to non-fixed atoms:
  -> inside box     0.00    0.00    0.00   11.84   11.84   11.84
  Updated total number of restrictions:            4
  Maximum internal distance of type            1 :    0.0000000000000000     
  Maximum internal distance of type            2 :    6.0733410755530590     
  Maximum internal distance of type            3 :    4.2728366537933553     
  All atoms must be within these coordinates: 
   x: [   -1000.0000000000000      ,    1000.0000000000000       ] 
   y: [   -1000.0000000000000      ,    1000.0000000000000       ] 
   z: [   -1000.0000000000000      ,    1000.0000000000000       ] 
  If the system is larger than this, increase the sidemax parameter. 

################################################################################

  Building initial approximation ... 

################################################################################

  Adjusting initial point to fit the constraints 

--------------------------------------------------------------------------------

--------------------------------------------------------------------------------

  Molecules of type:            1

  Packing:|0                                                        100%|
          |******

  Restraint-only function value:    1.7685842729141518E-014
  Maximum violation of the restraints:    1.7685842729141518E-014

--------------------------------------------------------------------------------

  Molecules of type:            2

  Packing:|0                                                        100%|
          |************************

  Restraint-only function value:    3.0516808025126281E-005
  Maximum violation of the restraints:    2.9786253131855919E-005

--------------------------------------------------------------------------------

  Molecules of type:            3

  Packing:|0                                                        100%|
          |************************

  Restraint-only function value:    2.0797456459431271E-003
  Maximum violation of the restraints:    1.4249253187824690E-003

--------------------------------------------------------------------------------

  Rescaling maximum and minimum coordinates... 
  Mininum and maximum coordinates after constraint fitting: 
   x: [    1.1512359604440598E-003 ,    11.848872079992219       ] 
   y: [   -9.1979895792468694E-005 ,    11.844310301257591       ] 
   z: [   -2.9831843891729210E-004 ,    11.867143136043646       ] 
  Computing size of patches... 
  Number of cells in each direction and cell sides: 
   x:            5  cells of size    2.3680902279752840     
   y:            5  cells of size    2.3680902279752840     
   z:            5  cells of size    2.3680902279752840     
  Cell-system length:   11.84045  11.84045  11.84045
  Reseting center of mass... 

--------------------------------------------------------------------------------

  Setting initial trial coordinates ... 

--------------------------------------------------------------------------------

--------------------------------------------------------------------------------

  Molecules of type:            1
  Adjusting random positions to fit the constraints. 
  Restraint-only function value:    1.7685842729141518E-014
  Maximum violation of the restraints:    1.7685842729141518E-014

--------------------------------------------------------------------------------

  Molecules of type:            2
  Adjusting random positions to fit the constraints. 
  Packing:|0                                                        100%|
          |******
  Restraint-only function value:    0.0000000000000000     
  Maximum violation of the restraints:    0.0000000000000000     

--------------------------------------------------------------------------------

  Molecules of type:            3
  Adjusting random positions to fit the constraints. 
  Packing:|0                                                        100%|
          |***
  Restraint-only function value:    0.0000000000000000     
  Maximum violation of the restraints:    0.0000000000000000     

################################################################################

  Objective function at initial point:    826.37877200416403     

################################################################################

  Packing molecules of type:            1

################################################################################


  Initial approximation is a solution. Nothing to do. 

  Current point written to file: solvated_150/1Be_2benzoate_1,3-dioxolan-2-one.xyz
--------------------------------------------------------------------------------
  Packing solved for molecules of type           1
  Objective function value:    1.7685842729141518E-014
  Maximum violation of target distance:    0.0000000000000000     
  Max. constraint violation:    1.7685842729141518E-014
--------------------------------------------------------------------------------

################################################################################

  Packing molecules of type:            2

################################################################################


  Initial approximation is a solution. Nothing to do. 

  Current point written to file: solvated_150/1Be_2benzoate_1,3-dioxolan-2-one.xyz
--------------------------------------------------------------------------------
  Packing solved for molecules of type           2
  Objective function value:   0.90775638637665168     
  Maximum violation of target distance:    0.0000000000000000     
  Max. constraint violation:    0.0000000000000000     
--------------------------------------------------------------------------------

################################################################################

  Packing molecules of type:            3

################################################################################


--------------------------------------------------------------------------------

  Starting GENCAN loop:            0
  Scaling radii by:    1.1000000000000001     

  Packing:|0                                                        100%|
          |************************************************

  Function value from last GENCAN loop: f = .15052E-02
  Best function value before: f = .54961E+03
  Improvement from best function value:    99.99 %
  Improvement from last loop:    99.99 %
  Maximum violation of target distance:     0.000000
  Maximum violation of the constraints: .71609E-03
  Current structure written to file: solvated_150/1Be_2benzoate_1,3-dioxolan-2-one.xyz
--------------------------------------------------------------------------------
  Packing solved for molecules of type           3
  Objective function value:    1.5052180383448711E-003
  Maximum violation of target distance:    0.0000000000000000     
  Max. constraint violation:    7.1609177386824463E-004
--------------------------------------------------------------------------------

################################################################################

  Packing all molecules together 

################################################################################


--------------------------------------------------------------------------------

  Starting GENCAN loop:            0
  Scaling radii by:    1.1000000000000001     

  Packing:|0                                                        100%|
          |*************************************************************|

  Function value from last GENCAN loop: f = .40850E-01
  Best function value before: f = .27181E+03
  Improvement from best function value:    99.98 %
  Improvement from last loop:    99.98 %
  Maximum violation of target distance:     0.000000
  Maximum violation of the constraints: .29870E-01

--------------------------------------------------------------------------------


--------------------------------------------------------------------------------

  Starting GENCAN loop:            1
  Scaling radii by:    1.1000000000000001     

  Packing:|0                                                        100%|
          |******

  Function value from last GENCAN loop: f = .12772E-01
  Best function value before: f = .40850E-01
  Improvement from best function value:    68.74 %
  Improvement from last loop:    68.74 %
  Maximum violation of target distance:     0.000000
  Maximum violation of the constraints: .58573E-02

################################################################################

                                 Success! 
              Final objective function value: .12772E-01
              Maximum violation of target distance:   0.000000
              Maximum violation of the constraints: .58573E-02

--------------------------------------------------------------------------------

              Please cite this work if Packmol was useful: 

           L. Martinez, R. Andrade, E. G. Birgin, J. M. Martinez, 
         PACKMOL: A package for building initial configurations for
                   molecular dynamics simulations. 
        Journal of Computational Chemistry, 30(13) pp. 2157-2164, 2009.
                  https://doi.org/10.1002/jcc.21224

################################################################################

  Solution written to file: solvated_150/1Be_2benzoate_1,3-dioxolan-2-one.xyz

--------------------------------------------------------------------------------

   Running time:    3.83900031E-02  seconds. 

--------------------------------------------------------------------------------


