
################################################################################

 PACKMOL - Packing optimization for the automated generation of
 starting configurations for molecular dynamics simulations.
 
                                                             Version 21.1.2 

################################################################################

  Packmol must be run with: packmol < inputfile.inp 

  Userguide at: http://m3g.iqm.unicamp.br/packmol 

  Reading input file... (Control-C aborts)
  Types of coordinate files specified: xyz
  Periodic boundary condition activated: 
    Minimum coordinates:     0.00    0.00    0.00
    Maximum coordinates:    12.44   12.44   12.44
  Seed for random number generator:      1234567
  Output file: solvated_150/1diaminomethylideneazanium_1iodate_benzene.xyz
  Reading coordinate file: ../structures/diaminomethylideneazanium.xyz
  Reading coordinate file: ../structures/iodate.xyz
  Reading coordinate file: ../structures/benzene.xyz
  Number of independent structures:            3
  The structures are: 
  Structure            1 :Properties=species:S:1:pos:R:3 iupac_name=diaminomethylideneazanium pbc="F F F"(          10  atoms)
  Structure            2 :Properties=species:S:1:pos:R:3 iupac_name=iodate pbc="F F F"(           5  atoms)
  Structure            3 :Properties=species:S:1:pos:R:3 iupac_name=benzene pbc="F F F"(          12  atoms)
  Maximum number of GENCAN loops for all molecule packing:          600
  Distance tolerance:    2.0000000000000000     
  Number of molecules of type            1 :            1
  Number of molecules of type            2 :            1
  Number of molecules of type            3 :           11
  Total number of restrictions:            3
  Total number of atoms:          147
  Total number of molecules:           13
  Number of fixed molecules:            0
  Number of free molecules:           13
  Number of variables:           78
  Total number of fixed atoms:            0
  PBC on: Constraint automatically added to non-fixed atoms:
  -> inside box     0.00    0.00    0.00   12.44   12.44   12.44
  Updated total number of restrictions:            4
  Maximum internal distance of type            1 :    4.1851607316804458     
  Maximum internal distance of type            2 :    3.2333368451029041     
  Maximum internal distance of type            3 :    4.9619487079170828     
  All atoms must be within these coordinates: 
   x: [   -996.79999999999995      ,    1003.2000000000000       ] 
   y: [   -996.91106050338635      ,    1003.0889394966136       ] 
   z: [   -999.99985780463692      ,    1000.0001421953631       ] 
  If the system is larger than this, increase the sidemax parameter. 

################################################################################

  Building initial approximation ... 

################################################################################

  Adjusting initial point to fit the constraints 

--------------------------------------------------------------------------------

--------------------------------------------------------------------------------

  Molecules of type:            1

  Packing:|0                                                        100%|
          |***************

  Restraint-only function value:    4.7648857933914697E-003
  Maximum violation of the restraints:    4.7648857933914697E-003

--------------------------------------------------------------------------------

  Molecules of type:            2

  Packing:|0                                                        100%|
          |******************

  Restraint-only function value:    2.0930236739091176E-003
  Maximum violation of the restraints:    2.0930236739091176E-003

--------------------------------------------------------------------------------

  Molecules of type:            3

  Packing:|0                                                        100%|
          |************************

  Restraint-only function value:    1.3063945714785243E-005
  Maximum violation of the restraints:    1.3063945714785243E-005

--------------------------------------------------------------------------------

  Rescaling maximum and minimum coordinates... 
  Mininum and maximum coordinates after constraint fitting: 
   x: [    1.8617052789423553E-003 ,    12.426053373748601       ] 
   y: [    6.5646714580533368E-003 ,    12.490381835776164       ] 
   z: [   -2.5557724580628498E-003 ,    12.388082622734455       ] 
  Computing size of patches... 
  Number of cells in each direction and cell sides: 
   x:            5  cells of size    2.4883143122553752     
   y:            5  cells of size    2.4883143122553752     
   z:            5  cells of size    2.4883143122553752     
  Cell-system length:   12.44157  12.44157  12.44157
  Reseting center of mass... 

--------------------------------------------------------------------------------

  Setting initial trial coordinates ... 

--------------------------------------------------------------------------------

--------------------------------------------------------------------------------

  Molecules of type:            1
  Adjusting random positions to fit the constraints. 
  Packing:|0                                                        100%|
          |******
  Restraint-only function value:    6.5083055128316546E-003
  Maximum violation of the restraints:    6.5083055128316546E-003

--------------------------------------------------------------------------------

  Molecules of type:            2
  Adjusting random positions to fit the constraints. 
  Packing:|0                                                        100%|
          |***
  Restraint-only function value:    0.0000000000000000     
  Maximum violation of the restraints:    0.0000000000000000     

--------------------------------------------------------------------------------

  Molecules of type:            3
  Adjusting random positions to fit the constraints. 
  Packing:|0                                                        100%|
          |******
  Restraint-only function value:    0.0000000000000000     
  Maximum violation of the restraints:    0.0000000000000000     

################################################################################

  Objective function at initial point:    732.96728726732829     

################################################################################

  Packing molecules of type:            1

################################################################################


  Initial approximation is a solution. Nothing to do. 

  Current point written to file: solvated_150/1diaminomethylideneazanium_1iodate_benzene.xyz
--------------------------------------------------------------------------------
  Packing solved for molecules of type           1
  Objective function value:    6.5083055128316546E-003
  Maximum violation of target distance:    0.0000000000000000     
  Max. constraint violation:    6.5083055128316546E-003
--------------------------------------------------------------------------------

################################################################################

  Packing molecules of type:            2

################################################################################


  Initial approximation is a solution. Nothing to do. 

  Current point written to file: solvated_150/1diaminomethylideneazanium_1iodate_benzene.xyz
--------------------------------------------------------------------------------
  Packing solved for molecules of type           2
  Objective function value:    0.0000000000000000     
  Maximum violation of target distance:    0.0000000000000000     
  Max. constraint violation:    0.0000000000000000     
--------------------------------------------------------------------------------

################################################################################

  Packing molecules of type:            3

################################################################################


--------------------------------------------------------------------------------

  Starting GENCAN loop:            0
  Scaling radii by:    1.1000000000000001     

  Packing:|0                                                        100%|
          |***************************************************

  Function value from last GENCAN loop: f = .57358E-02
  Best function value before: f = .63874E+03
  Improvement from best function value:    99.99 %
  Improvement from last loop:    99.99 %
  Maximum violation of target distance:     0.000000
  Maximum violation of the constraints: .57358E-02
  Current structure written to file: solvated_150/1diaminomethylideneazanium_1iodate_benzene.xyz
--------------------------------------------------------------------------------
  Packing solved for molecules of type           3
  Objective function value:    5.7358208176114161E-003
  Maximum violation of target distance:    0.0000000000000000     
  Max. constraint violation:    5.7358208176114161E-003
--------------------------------------------------------------------------------

################################################################################

  Packing all molecules together 

################################################################################


--------------------------------------------------------------------------------

  Starting GENCAN loop:            0
  Scaling radii by:    1.1000000000000001     

  Packing:|0                                                        100%|
          |*************************************************************|

  Function value from last GENCAN loop: f = .20426E-01
  Best function value before: f = .20529E+03
  Improvement from best function value:    99.99 %
  Improvement from last loop:    99.99 %
  Maximum violation of target distance:     0.000000
  Maximum violation of the constraints: .10498E-01

--------------------------------------------------------------------------------


--------------------------------------------------------------------------------

  Starting GENCAN loop:            1
  Scaling radii by:    1.1000000000000001     

  Packing:|0                                                        100%|
          |*********

  Function value from last GENCAN loop: f = .13324E-01
  Best function value before: f = .20426E-01
  Improvement from best function value:    34.77 %
  Improvement from last loop:    34.77 %
  Maximum violation of target distance:     0.000000
  Maximum violation of the constraints: .67627E-02

################################################################################

                                 Success! 
              Final objective function value: .13324E-01
              Maximum violation of target distance:   0.000000
              Maximum violation of the constraints: .67627E-02

--------------------------------------------------------------------------------

              Please cite this work if Packmol was useful: 

           L. Martinez, R. Andrade, E. G. Birgin, J. M. Martinez, 
         PACKMOL: A package for building initial configurations for
                   molecular dynamics simulations. 
        Journal of Computational Chemistry, 30(13) pp. 2157-2164, 2009.
                  https://doi.org/10.1002/jcc.21224

################################################################################

  Solution written to file: solvated_150/1diaminomethylideneazanium_1iodate_benzene.xyz

--------------------------------------------------------------------------------

   Running time:    3.56460065E-02  seconds. 

--------------------------------------------------------------------------------


