
################################################################################

 PACKMOL - Packing optimization for the automated generation of
 starting configurations for molecular dynamics simulations.
 
                                                             Version 21.1.2 

################################################################################

  Packmol must be run with: packmol < inputfile.inp 

  Userguide at: http://m3g.iqm.unicamp.br/packmol 

  Reading input file... (Control-C aborts)
  Types of coordinate files specified: xyz
  Periodic boundary condition activated: 
    Minimum coordinates:     0.00    0.00    0.00
    Maximum coordinates:    11.75   11.75   11.75
  Seed for random number generator:      1234567
  Output file: solvated_150/1diaminomethylideneazanium_1nitrate_methanol.xyz
  Reading coordinate file: ../structures/diaminomethylideneazanium.xyz
  Reading coordinate file: ../structures/nitrate.xyz
  Reading coordinate file: ../structures/methanol.xyz
  Number of independent structures:            3
  The structures are: 
  Structure            1 :Properties=species:S:1:pos:R:3 iupac_name=diaminomethylideneazanium pbc="F F F"(          10  atoms)
  Structure            2 :Properties=species:S:1:pos:R:3 iupac_name=nitrate pbc="F F F"(           4  atoms)
  Structure            3 :Properties=species:S:1:pos:R:3 iupac_name=methanol pbc="F F F"(           6  atoms)
  Maximum number of GENCAN loops for all molecule packing:          600
  Distance tolerance:    2.0000000000000000     
  Number of molecules of type            1 :            1
  Number of molecules of type            2 :            1
  Number of molecules of type            3 :           22
  Total number of restrictions:            3
  Total number of atoms:          146
  Total number of molecules:           24
  Number of fixed molecules:            0
  Number of free molecules:           24
  Number of variables:          144
  Total number of fixed atoms:            0
  PBC on: Constraint automatically added to non-fixed atoms:
  -> inside box     0.00    0.00    0.00   11.75   11.75   11.75
  Updated total number of restrictions:            4
  Maximum internal distance of type            1 :    4.1851607316804458     
  Maximum internal distance of type            2 :    2.1514812107011299     
  Maximum internal distance of type            3 :    2.8429210119171442     
  All atoms must be within these coordinates: 
   x: [   -996.79999999999995      ,    1003.2000000000000       ] 
   y: [   -996.91106050338635      ,    1003.0889394966136       ] 
   z: [   -999.99985780463692      ,    1000.0001421953631       ] 
  If the system is larger than this, increase the sidemax parameter. 

################################################################################

  Building initial approximation ... 

################################################################################

  Adjusting initial point to fit the constraints 

--------------------------------------------------------------------------------

--------------------------------------------------------------------------------

  Molecules of type:            1

  Packing:|0                                                        100%|
          |*********

  Restraint-only function value:    0.0000000000000000     
  Maximum violation of the restraints:    0.0000000000000000     

--------------------------------------------------------------------------------

  Molecules of type:            2

  Packing:|0                                                        100%|
          |************

  Restraint-only function value:    3.1925844998056943E-003
  Maximum violation of the restraints:    3.1925844998056943E-003

--------------------------------------------------------------------------------

  Molecules of type:            3

  Packing:|0                                                        100%|
          |*********************

  Restraint-only function value:    7.6317539759441309E-003
  Maximum violation of the restraints:    4.7468225110383943E-003

--------------------------------------------------------------------------------

  Rescaling maximum and minimum coordinates... 
  Mininum and maximum coordinates after constraint fitting: 
   x: [    1.2672374073507015E-002 ,    11.782870224566487       ] 
   y: [    6.6991634298235389E-003 ,    11.761744060031024       ] 
   z: [   -4.7445593573621998E-002 ,    11.749630640387535       ] 
  Computing size of patches... 
  Number of cells in each direction and cell sides: 
   x:            5  cells of size    2.3505818793251985     
   y:            5  cells of size    2.3505818793251985     
   z:            5  cells of size    2.3505818793251985     
  Cell-system length:   11.75291  11.75291  11.75291
  Reseting center of mass... 

--------------------------------------------------------------------------------

  Setting initial trial coordinates ... 

--------------------------------------------------------------------------------

--------------------------------------------------------------------------------

  Molecules of type:            1
  Adjusting random positions to fit the constraints. 
  Restraint-only function value:    0.0000000000000000     
  Maximum violation of the restraints:    0.0000000000000000     

--------------------------------------------------------------------------------

  Molecules of type:            2
  Adjusting random positions to fit the constraints. 
  Packing:|0                                                        100%|
          |***
  Restraint-only function value:    0.0000000000000000     
  Maximum violation of the restraints:    0.0000000000000000     

--------------------------------------------------------------------------------

  Molecules of type:            3
  Adjusting random positions to fit the constraints. 
  Packing:|0                                                        100%|
          |***
  Restraint-only function value:    0.0000000000000000     
  Maximum violation of the restraints:    0.0000000000000000     

################################################################################

  Objective function at initial point:    828.52216286606665     

################################################################################

  Packing molecules of type:            1

################################################################################


  Initial approximation is a solution. Nothing to do. 

  Current point written to file: solvated_150/1diaminomethylideneazanium_1nitrate_methanol.xyz
--------------------------------------------------------------------------------
  Packing solved for molecules of type           1
  Objective function value:    0.0000000000000000     
  Maximum violation of target distance:    0.0000000000000000     
  Max. constraint violation:    0.0000000000000000     
--------------------------------------------------------------------------------

################################################################################

  Packing molecules of type:            2

################################################################################


  Initial approximation is a solution. Nothing to do. 

  Current point written to file: solvated_150/1diaminomethylideneazanium_1nitrate_methanol.xyz
--------------------------------------------------------------------------------
  Packing solved for molecules of type           2
  Objective function value:    0.0000000000000000     
  Maximum violation of target distance:    0.0000000000000000     
  Max. constraint violation:    0.0000000000000000     
--------------------------------------------------------------------------------

################################################################################

  Packing molecules of type:            3

################################################################################


--------------------------------------------------------------------------------

  Starting GENCAN loop:            0
  Scaling radii by:    1.1000000000000001     

  Packing:|0                                                        100%|
          |******************************************

  Function value from last GENCAN loop: f = .20378E-01
  Best function value before: f = .64200E+03
  Improvement from best function value:    99.99 %
  Improvement from last loop:    99.99 %
  Maximum violation of target distance:     0.000000
  Maximum violation of the constraints: .67700E-02
  Current structure written to file: solvated_150/1diaminomethylideneazanium_1nitrate_methanol.xyz
--------------------------------------------------------------------------------
  Packing solved for molecules of type           3
  Objective function value:    2.0377860933787188E-002
  Maximum violation of target distance:    0.0000000000000000     
  Max. constraint violation:    6.7699924381659730E-003
--------------------------------------------------------------------------------

################################################################################

  Packing all molecules together 

################################################################################


--------------------------------------------------------------------------------

  Starting GENCAN loop:            0
  Scaling radii by:    1.1000000000000001     

  Packing:|0                                                        100%|
          |***************************************************

  Function value from last GENCAN loop: f = .13423E-01
  Best function value before: f = .26933E+03
  Improvement from best function value:    99.99 %
  Improvement from last loop:    99.99 %
  Maximum violation of target distance:     0.000000
  Maximum violation of the constraints: .74505E-02

################################################################################

                                 Success! 
              Final objective function value: .13423E-01
              Maximum violation of target distance:   0.000000
              Maximum violation of the constraints: .74505E-02

--------------------------------------------------------------------------------

              Please cite this work if Packmol was useful: 

           L. Martinez, R. Andrade, E. G. Birgin, J. M. Martinez, 
         PACKMOL: A package for building initial configurations for
                   molecular dynamics simulations. 
        Journal of Computational Chemistry, 30(13) pp. 2157-2164, 2009.
                  https://doi.org/10.1002/jcc.21224

################################################################################

  Solution written to file: solvated_150/1diaminomethylideneazanium_1nitrate_methanol.xyz

--------------------------------------------------------------------------------

   Running time:    3.06870043E-02  seconds. 

--------------------------------------------------------------------------------


