
################################################################################

 PACKMOL - Packing optimization for the automated generation of
 starting configurations for molecular dynamics simulations.
 
                                                             Version 21.1.2 

################################################################################

  Packmol must be run with: packmol < inputfile.inp 

  Userguide at: http://m3g.iqm.unicamp.br/packmol 

  Reading input file... (Control-C aborts)
  Types of coordinate files specified: xyz
  Periodic boundary condition activated: 
    Minimum coordinates:     0.00    0.00    0.00
    Maximum coordinates:    12.38   12.38   12.38
  Seed for random number generator:      1234567
  Output file: solvated_150/1Dy_3nitrate_oxolane.xyz
  Reading coordinate file: ../structures/Dy.xyz
  Reading coordinate file: ../structures/nitrate.xyz
  Reading coordinate file: ../structures/oxolane.xyz
  Number of independent structures:            3
  The structures are: 
  Structure            1 :Properties=species:S:1:pos:R:3 iupac_name=Dy pbc="F F F"(           1  atoms)
  Structure            2 :Properties=species:S:1:pos:R:3 iupac_name=nitrate pbc="F F F"(           4  atoms)
  Structure            3 :Properties=species:S:1:pos:R:3 iupac_name=oxolane pbc="F F F"(          13  atoms)
  Maximum number of GENCAN loops for all molecule packing:          600
  Distance tolerance:    2.0000000000000000     
  Number of molecules of type            1 :            1
  Number of molecules of type            2 :            3
  Number of molecules of type            3 :           10
  Total number of restrictions:            3
  Total number of atoms:          143
  Total number of molecules:           14
  Number of fixed molecules:            0
  Number of free molecules:           14
  Number of variables:           84
  Total number of fixed atoms:            0
  PBC on: Constraint automatically added to non-fixed atoms:
  -> inside box     0.00    0.00    0.00   12.38   12.38   12.38
  Updated total number of restrictions:            4
  Maximum internal distance of type            1 :    0.0000000000000000     
  Maximum internal distance of type            2 :    2.1514812107011299     
  Maximum internal distance of type            3 :    4.1645648236040227     
  All atoms must be within these coordinates: 
   x: [   -1000.0000000000000      ,    1000.0000000000000       ] 
   y: [   -1000.0000000000000      ,    1000.0000000000000       ] 
   z: [   -1000.0000000000000      ,    1000.0000000000000       ] 
  If the system is larger than this, increase the sidemax parameter. 

################################################################################

  Building initial approximation ... 

################################################################################

  Adjusting initial point to fit the constraints 

--------------------------------------------------------------------------------

--------------------------------------------------------------------------------

  Molecules of type:            1

  Packing:|0                                                        100%|
          |******

  Restraint-only function value:    1.8368368085168495E-014
  Maximum violation of the restraints:    1.8368368085168495E-014

--------------------------------------------------------------------------------

  Molecules of type:            2

  Packing:|0                                                        100%|
          |************

  Restraint-only function value:    8.0233102915918762E-003
  Maximum violation of the restraints:    8.0233102915918762E-003

--------------------------------------------------------------------------------

  Molecules of type:            3

  Packing:|0                                                        100%|
          |************************

  Restraint-only function value:    1.6642864420858686E-003
  Maximum violation of the restraints:    1.6642864420858686E-003

--------------------------------------------------------------------------------

  Rescaling maximum and minimum coordinates... 
  Mininum and maximum coordinates after constraint fitting: 
   x: [    5.5222681880821439E-003 ,    12.409745312925400       ] 
   y: [    1.9909353103803779E-002 ,    12.380898513802364       ] 
   z: [   -6.3337628198377766E-002 ,    12.353395759335141       ] 
  Computing size of patches... 
  Number of cells in each direction and cell sides: 
   x:            5  cells of size    2.4761796840360750     
   y:            5  cells of size    2.4761796840360750     
   z:            5  cells of size    2.4761796840360750     
  Cell-system length:   12.38090  12.38090  12.38090
  Reseting center of mass... 

--------------------------------------------------------------------------------

  Setting initial trial coordinates ... 

--------------------------------------------------------------------------------

--------------------------------------------------------------------------------

  Molecules of type:            1
  Adjusting random positions to fit the constraints. 
  Restraint-only function value:    1.8368368085168495E-014
  Maximum violation of the restraints:    1.8368368085168495E-014

--------------------------------------------------------------------------------

  Molecules of type:            2
  Adjusting random positions to fit the constraints. 
  Packing:|0                                                        100%|
          |***
  Restraint-only function value:    0.0000000000000000     
  Maximum violation of the restraints:    0.0000000000000000     

--------------------------------------------------------------------------------

  Molecules of type:            3
  Adjusting random positions to fit the constraints. 
  Restraint-only function value:    0.0000000000000000     
  Maximum violation of the restraints:    0.0000000000000000     

################################################################################

  Objective function at initial point:    622.38002614288769     

################################################################################

  Packing molecules of type:            1

################################################################################


  Initial approximation is a solution. Nothing to do. 

  Current point written to file: solvated_150/1Dy_3nitrate_oxolane.xyz
--------------------------------------------------------------------------------
  Packing solved for molecules of type           1
  Objective function value:    1.8368368085168495E-014
  Maximum violation of target distance:    0.0000000000000000     
  Max. constraint violation:    1.8368368085168495E-014
--------------------------------------------------------------------------------

################################################################################

  Packing molecules of type:            2

################################################################################


--------------------------------------------------------------------------------

  Starting GENCAN loop:            0
  Scaling radii by:    1.1000000000000001     

  Packing:|0                                                        100%|
          |******

  Function value from last GENCAN loop: f = .39947E-04
  Best function value before: f = .11574E+02
  Improvement from best function value:    99.99 %
  Improvement from last loop:    99.99 %
  Maximum violation of target distance:     0.000000
  Maximum violation of the constraints: .39947E-04
  Current structure written to file: solvated_150/1Dy_3nitrate_oxolane.xyz
--------------------------------------------------------------------------------
  Packing solved for molecules of type           2
  Objective function value:    3.9946785739518134E-005
  Maximum violation of target distance:    0.0000000000000000     
  Max. constraint violation:    3.9946785739518134E-005
--------------------------------------------------------------------------------

################################################################################

  Packing molecules of type:            3

################################################################################


--------------------------------------------------------------------------------

  Starting GENCAN loop:            0
  Scaling radii by:    1.1000000000000001     

  Packing:|0                                                        100%|
          |*********************

  Function value from last GENCAN loop: f = .66636E-02
  Best function value before: f = .53962E+03
  Improvement from best function value:    99.99 %
  Improvement from last loop:    99.99 %
  Maximum violation of target distance:     0.000000
  Maximum violation of the constraints: .66605E-02
  Current structure written to file: solvated_150/1Dy_3nitrate_oxolane.xyz
--------------------------------------------------------------------------------
  Packing solved for molecules of type           3
  Objective function value:    6.6636178452415705E-003
  Maximum violation of target distance:    0.0000000000000000     
  Max. constraint violation:    6.6605050849186604E-003
--------------------------------------------------------------------------------

################################################################################

  Packing all molecules together 

################################################################################


--------------------------------------------------------------------------------

  Starting GENCAN loop:            0
  Scaling radii by:    1.1000000000000001     

  Packing:|0                                                        100%|
          |***************************************

  Function value from last GENCAN loop: f = .86979E-02
  Best function value before: f = .10901E+03
  Improvement from best function value:    99.99 %
  Improvement from last loop:    99.99 %
  Maximum violation of target distance:     0.000000
  Maximum violation of the constraints: .86979E-02

################################################################################

                                 Success! 
              Final objective function value: .86979E-02
              Maximum violation of target distance:   0.000000
              Maximum violation of the constraints: .86979E-02

--------------------------------------------------------------------------------

              Please cite this work if Packmol was useful: 

           L. Martinez, R. Andrade, E. G. Birgin, J. M. Martinez, 
         PACKMOL: A package for building initial configurations for
                   molecular dynamics simulations. 
        Journal of Computational Chemistry, 30(13) pp. 2157-2164, 2009.
                  https://doi.org/10.1002/jcc.21224

################################################################################

  Solution written to file: solvated_150/1Dy_3nitrate_oxolane.xyz

--------------------------------------------------------------------------------

   Running time:    1.83200017E-02  seconds. 

--------------------------------------------------------------------------------


