
################################################################################

 PACKMOL - Packing optimization for the automated generation of
 starting configurations for molecular dynamics simulations.
 
                                                             Version 21.1.2 

################################################################################

  Packmol must be run with: packmol < inputfile.inp 

  Userguide at: http://m3g.iqm.unicamp.br/packmol 

  Reading input file... (Control-C aborts)
  Types of coordinate files specified: xyz
  Periodic boundary condition activated: 
    Minimum coordinates:     0.00    0.00    0.00
    Maximum coordinates:    12.10   12.10   12.10
  Seed for random number generator:      1234567
  Output file: solvated_150/1Es_3acetate_1,3-dioxolan-2-one.xyz
  Reading coordinate file: ../structures/Es.xyz
  Reading coordinate file: ../structures/acetate.xyz
  Reading coordinate file: ../structures/1,3-dioxolan-2-one.xyz
  Number of independent structures:            3
  The structures are: 
  Structure            1 :Properties=species:S:1:pos:R:3 iupac_name=Es pbc="F F F"(           1  atoms)
  Structure            2 :Properties=species:S:1:pos:R:3 iupac_name=acetate pbc="F F F"(           7  atoms)
  Structure            3 :Properties=species:S:1:pos:R:3 iupac_name=1,3-dioxolan-2-one pbc="F F F"(          10  atoms)
  Maximum number of GENCAN loops for all molecule packing:          600
  Distance tolerance:    2.0000000000000000     
  Number of molecules of type            1 :            1
  Number of molecules of type            2 :            3
  Number of molecules of type            3 :           12
  Total number of restrictions:            3
  Total number of atoms:          142
  Total number of molecules:           16
  Number of fixed molecules:            0
  Number of free molecules:           16
  Number of variables:           96
  Total number of fixed atoms:            0
  PBC on: Constraint automatically added to non-fixed atoms:
  -> inside box     0.00    0.00    0.00   12.10   12.10   12.10
  Updated total number of restrictions:            4
  Maximum internal distance of type            1 :    0.0000000000000000     
  Maximum internal distance of type            2 :    3.2679070993527342     
  Maximum internal distance of type            3 :    4.2728366537933553     
  All atoms must be within these coordinates: 
   x: [   -1000.0000000000000      ,    1000.0000000000000       ] 
   y: [   -1000.0000000000000      ,    1000.0000000000000       ] 
   z: [   -1000.0000000000000      ,    1000.0000000000000       ] 
  If the system is larger than this, increase the sidemax parameter. 

################################################################################

  Building initial approximation ... 

################################################################################

  Adjusting initial point to fit the constraints 

--------------------------------------------------------------------------------

--------------------------------------------------------------------------------

  Molecules of type:            1

  Packing:|0                                                        100%|
          |******

  Restraint-only function value:    8.4864423570434834E-014
  Maximum violation of the restraints:    8.4864423570434834E-014

--------------------------------------------------------------------------------

  Molecules of type:            2

  Packing:|0                                                        100%|
          |***************

  Restraint-only function value:    4.4894827527493125E-005
  Maximum violation of the restraints:    4.4894827527493125E-005

--------------------------------------------------------------------------------

  Molecules of type:            3

  Packing:|0                                                        100%|
          |******************

  Restraint-only function value:    0.0000000000000000     
  Maximum violation of the restraints:    0.0000000000000000     

--------------------------------------------------------------------------------

  Rescaling maximum and minimum coordinates... 
  Mininum and maximum coordinates after constraint fitting: 
   x: [    1.1790861788542901E-003 ,    12.097932706418149       ] 
   y: [    8.7030112768506258E-004 ,    12.097932616882233       ] 
   z: [   -4.7378701716854340E-003 ,    12.093764327820931       ] 
  Computing size of patches... 
  Number of cells in each direction and cell sides: 
   x:            5  cells of size    2.4195865046086125     
   y:            5  cells of size    2.4195865046086125     
   z:            5  cells of size    2.4195865046086125     
  Cell-system length:   12.09793  12.09793  12.09793
  Reseting center of mass... 

--------------------------------------------------------------------------------

  Setting initial trial coordinates ... 

--------------------------------------------------------------------------------

--------------------------------------------------------------------------------

  Molecules of type:            1
  Adjusting random positions to fit the constraints. 
  Restraint-only function value:    8.4864423570434834E-014
  Maximum violation of the restraints:    8.4864423570434834E-014

--------------------------------------------------------------------------------

  Molecules of type:            2
  Adjusting random positions to fit the constraints. 
  Packing:|0                                                        100%|
          |***
  Restraint-only function value:    0.0000000000000000     
  Maximum violation of the restraints:    0.0000000000000000     

--------------------------------------------------------------------------------

  Molecules of type:            3
  Adjusting random positions to fit the constraints. 
  Packing:|0                                                        100%|
          |***
  Restraint-only function value:    0.0000000000000000     
  Maximum violation of the restraints:    0.0000000000000000     

################################################################################

  Objective function at initial point:    982.54873426359313     

################################################################################

  Packing molecules of type:            1

################################################################################


  Initial approximation is a solution. Nothing to do. 

  Current point written to file: solvated_150/1Es_3acetate_1,3-dioxolan-2-one.xyz
--------------------------------------------------------------------------------
  Packing solved for molecules of type           1
  Objective function value:    8.4864423570434834E-014
  Maximum violation of target distance:    0.0000000000000000     
  Max. constraint violation:    8.4864423570434834E-014
--------------------------------------------------------------------------------

################################################################################

  Packing molecules of type:            2

################################################################################


--------------------------------------------------------------------------------

  Starting GENCAN loop:            0
  Scaling radii by:    1.1000000000000001     

  Packing:|0                                                        100%|
          |***

  Function value from last GENCAN loop: f = .00000E+00
  Best function value before: f = .82382E+01
  Improvement from best function value:    99.99 %
  Improvement from last loop:    99.99 %
  Maximum violation of target distance:     0.000000
  Maximum violation of the constraints: .00000E+00
  Current structure written to file: solvated_150/1Es_3acetate_1,3-dioxolan-2-one.xyz
--------------------------------------------------------------------------------
  Packing solved for molecules of type           2
  Objective function value:    0.0000000000000000     
  Maximum violation of target distance:    0.0000000000000000     
  Max. constraint violation:    0.0000000000000000     
--------------------------------------------------------------------------------

################################################################################

  Packing molecules of type:            3

################################################################################


--------------------------------------------------------------------------------

  Starting GENCAN loop:            0
  Scaling radii by:    1.1000000000000001     

  Packing:|0                                                        100%|
          |******************************

  Function value from last GENCAN loop: f = .48723E-02
  Best function value before: f = .90913E+03
  Improvement from best function value:    99.99 %
  Improvement from last loop:    99.99 %
  Maximum violation of target distance:     0.000000
  Maximum violation of the constraints: .45158E-02
  Current structure written to file: solvated_150/1Es_3acetate_1,3-dioxolan-2-one.xyz
--------------------------------------------------------------------------------
  Packing solved for molecules of type           3
  Objective function value:    4.8722720763287111E-003
  Maximum violation of target distance:    0.0000000000000000     
  Max. constraint violation:    4.5157832071708098E-003
--------------------------------------------------------------------------------

################################################################################

  Packing all molecules together 

################################################################################


--------------------------------------------------------------------------------

  Starting GENCAN loop:            0
  Scaling radii by:    1.1000000000000001     

  Packing:|0                                                        100%|
          |******************************

  Function value from last GENCAN loop: f = .96705E-02
  Best function value before: f = .76722E+02
  Improvement from best function value:    99.99 %
  Improvement from last loop:    99.99 %
  Maximum violation of target distance:     0.000000
  Maximum violation of the constraints: .55886E-02

################################################################################

                                 Success! 
              Final objective function value: .96705E-02
              Maximum violation of target distance:   0.000000
              Maximum violation of the constraints: .55886E-02

--------------------------------------------------------------------------------

              Please cite this work if Packmol was useful: 

           L. Martinez, R. Andrade, E. G. Birgin, J. M. Martinez, 
         PACKMOL: A package for building initial configurations for
                   molecular dynamics simulations. 
        Journal of Computational Chemistry, 30(13) pp. 2157-2164, 2009.
                  https://doi.org/10.1002/jcc.21224

################################################################################

  Solution written to file: solvated_150/1Es_3acetate_1,3-dioxolan-2-one.xyz

--------------------------------------------------------------------------------

   Running time:    1.67710036E-02  seconds. 

--------------------------------------------------------------------------------


