
################################################################################

 PACKMOL - Packing optimization for the automated generation of
 starting configurations for molecular dynamics simulations.
 
                                                             Version 21.1.2 

################################################################################

  Packmol must be run with: packmol < inputfile.inp 

  Userguide at: http://m3g.iqm.unicamp.br/packmol 

  Reading input file... (Control-C aborts)
  Types of coordinate files specified: xyz
  Periodic boundary condition activated: 
    Minimum coordinates:     0.00    0.00    0.00
    Maximum coordinates:    12.34   12.34   12.34
  Seed for random number generator:      1234567
  Output file: solvated_150/1La_3chlorate_1,3-dioxolan-2-one.xyz
  Reading coordinate file: ../structures/La.xyz
  Reading coordinate file: ../structures/chlorate.xyz
  Reading coordinate file: ../structures/1,3-dioxolan-2-one.xyz
  Number of independent structures:            3
  The structures are: 
  Structure            1 :Properties=species:S:1:pos:R:3 iupac_name=La pbc="F F F"(           1  atoms)
  Structure            2 :Properties=species:S:1:pos:R:3 iupac_name=chlorate pbc="F F F"(           4  atoms)
  Structure            3 :Properties=species:S:1:pos:R:3 iupac_name=1,3-dioxolan-2-one pbc="F F F"(          10  atoms)
  Maximum number of GENCAN loops for all molecule packing:          600
  Distance tolerance:    2.0000000000000000     
  Number of molecules of type            1 :            1
  Number of molecules of type            2 :            3
  Number of molecules of type            3 :           13
  Total number of restrictions:            3
  Total number of atoms:          143
  Total number of molecules:           17
  Number of fixed molecules:            0
  Number of free molecules:           17
  Number of variables:          102
  Total number of fixed atoms:            0
  PBC on: Constraint automatically added to non-fixed atoms:
  -> inside box     0.00    0.00    0.00   12.34   12.34   12.34
  Updated total number of restrictions:            4
  Maximum internal distance of type            1 :    0.0000000000000000     
  Maximum internal distance of type            2 :    2.7625205161410111     
  Maximum internal distance of type            3 :    4.2728366537933553     
  All atoms must be within these coordinates: 
   x: [   -1000.0000000000000      ,    1000.0000000000000       ] 
   y: [   -1000.0000000000000      ,    1000.0000000000000       ] 
   z: [   -1000.0000000000000      ,    1000.0000000000000       ] 
  If the system is larger than this, increase the sidemax parameter. 

################################################################################

  Building initial approximation ... 

################################################################################

  Adjusting initial point to fit the constraints 

--------------------------------------------------------------------------------

--------------------------------------------------------------------------------

  Molecules of type:            1

  Packing:|0                                                        100%|
          |******

  Restraint-only function value:    2.6993414618831944E-014
  Maximum violation of the restraints:    2.6993414618831944E-014

--------------------------------------------------------------------------------

  Molecules of type:            2

  Packing:|0                                                        100%|
          |***************

  Restraint-only function value:    8.1523375151853724E-007
  Maximum violation of the restraints:    8.1523375151853724E-007

--------------------------------------------------------------------------------

  Molecules of type:            3

  Packing:|0                                                        100%|
          |*********************

  Restraint-only function value:    2.8916444825053338E-004
  Maximum violation of the restraints:    1.3771130012346072E-004

--------------------------------------------------------------------------------

  Rescaling maximum and minimum coordinates... 
  Mininum and maximum coordinates after constraint fitting: 
   x: [   -2.1046005484696567E-003 ,    12.344897063008943       ] 
   y: [   0.15038500524832671      ,    12.353194931801234       ] 
   z: [   -5.4595795013709630E-003 ,    12.342260836791692       ] 
  Computing size of patches... 
  Number of cells in each direction and cell sides: 
   x:            5  cells of size    2.4689794002665266     
   y:            5  cells of size    2.4689794002665266     
   z:            5  cells of size    2.4689794002665266     
  Cell-system length:   12.34490  12.34490  12.34490
  Reseting center of mass... 

--------------------------------------------------------------------------------

  Setting initial trial coordinates ... 

--------------------------------------------------------------------------------

--------------------------------------------------------------------------------

  Molecules of type:            1
  Adjusting random positions to fit the constraints. 
  Restraint-only function value:    2.6993414618831944E-014
  Maximum violation of the restraints:    2.6993414618831944E-014

--------------------------------------------------------------------------------

  Molecules of type:            2
  Adjusting random positions to fit the constraints. 
  Packing:|0                                                        100%|
          |******
  Restraint-only function value:    0.0000000000000000     
  Maximum violation of the restraints:    0.0000000000000000     

--------------------------------------------------------------------------------

  Molecules of type:            3
  Adjusting random positions to fit the constraints. 
  Packing:|0                                                        100%|
          |***
  Restraint-only function value:    0.0000000000000000     
  Maximum violation of the restraints:    0.0000000000000000     

################################################################################

  Objective function at initial point:    625.75199113970621     

################################################################################

  Packing molecules of type:            1

################################################################################


  Initial approximation is a solution. Nothing to do. 

  Current point written to file: solvated_150/1La_3chlorate_1,3-dioxolan-2-one.xyz
--------------------------------------------------------------------------------
  Packing solved for molecules of type           1
  Objective function value:    2.6993414618831944E-014
  Maximum violation of target distance:    0.0000000000000000     
  Max. constraint violation:    2.6993414618831944E-014
--------------------------------------------------------------------------------

################################################################################

  Packing molecules of type:            2

################################################################################


  Initial approximation is a solution. Nothing to do. 

  Current point written to file: solvated_150/1La_3chlorate_1,3-dioxolan-2-one.xyz
--------------------------------------------------------------------------------
  Packing solved for molecules of type           2
  Objective function value:    8.8472157708007079E-002
  Maximum violation of target distance:    0.0000000000000000     
  Max. constraint violation:    0.0000000000000000     
--------------------------------------------------------------------------------

################################################################################

  Packing molecules of type:            3

################################################################################


--------------------------------------------------------------------------------

  Starting GENCAN loop:            0
  Scaling radii by:    1.1000000000000001     

  Packing:|0                                                        100%|
          |***************************************************

  Function value from last GENCAN loop: f = .84365E-02
  Best function value before: f = .61360E+03
  Improvement from best function value:    99.99 %
  Improvement from last loop:    99.99 %
  Maximum violation of target distance:     0.000000
  Maximum violation of the constraints: .81461E-02
  Current structure written to file: solvated_150/1La_3chlorate_1,3-dioxolan-2-one.xyz
--------------------------------------------------------------------------------
  Packing solved for molecules of type           3
  Objective function value:    8.4364725098777689E-003
  Maximum violation of target distance:    0.0000000000000000     
  Max. constraint violation:    8.1460593467511319E-003
--------------------------------------------------------------------------------

################################################################################

  Packing all molecules together 

################################################################################


--------------------------------------------------------------------------------

  Starting GENCAN loop:            0
  Scaling radii by:    1.1000000000000001     

  Packing:|0                                                        100%|
          |************************************

  Function value from last GENCAN loop: f = .10779E-01
  Best function value before: f = .61846E+02
  Improvement from best function value:    99.98 %
  Improvement from last loop:    99.98 %
  Maximum violation of target distance:     0.000000
  Maximum violation of the constraints: .67604E-02

################################################################################

                                 Success! 
              Final objective function value: .10779E-01
              Maximum violation of target distance:   0.000000
              Maximum violation of the constraints: .67604E-02

--------------------------------------------------------------------------------

              Please cite this work if Packmol was useful: 

           L. Martinez, R. Andrade, E. G. Birgin, J. M. Martinez, 
         PACKMOL: A package for building initial configurations for
                   molecular dynamics simulations. 
        Journal of Computational Chemistry, 30(13) pp. 2157-2164, 2009.
                  https://doi.org/10.1002/jcc.21224

################################################################################

  Solution written to file: solvated_150/1La_3chlorate_1,3-dioxolan-2-one.xyz

--------------------------------------------------------------------------------

   Running time:    2.61159949E-02  seconds. 

--------------------------------------------------------------------------------


