
################################################################################

 PACKMOL - Packing optimization for the automated generation of
 starting configurations for molecular dynamics simulations.
 
                                                             Version 21.1.2 

################################################################################

  Packmol must be run with: packmol < inputfile.inp 

  Userguide at: http://m3g.iqm.unicamp.br/packmol 

  Reading input file... (Control-C aborts)
  Types of coordinate files specified: xyz
  Periodic boundary condition activated: 
    Minimum coordinates:     0.00    0.00    0.00
    Maximum coordinates:    16.69   16.69   16.69
  Seed for random number generator:      1234567
  Output file: solvated_150/1Lu_3dihydrogen-phosphate_tetrachloromethane.xyz
  Reading coordinate file: ../structures/Lu.xyz
  Reading coordinate file: ../structures/dihydrogen-phosphate.xyz
  Reading coordinate file: ../structures/tetrachloromethane.xyz
  Number of independent structures:            3
  The structures are: 
  Structure            1 :Properties=species:S:1:pos:R:3 iupac_name=Lu pbc="F F F"(           1  atoms)
  Structure            2 :Properties=species:S:1:pos:R:3 iupac_name=dihydrogen-phosphate pbc="F F F"(           7  atoms)
  Structure            3 :Properties=species:S:1:pos:R:3 iupac_name=tetrachloromethane pbc="F F F"(           5  atoms)
  Maximum number of GENCAN loops for all molecule packing:          600
  Distance tolerance:    2.0000000000000000     
  Number of molecules of type            1 :            1
  Number of molecules of type            2 :            3
  Number of molecules of type            3 :           25
  Total number of restrictions:            3
  Total number of atoms:          147
  Total number of molecules:           29
  Number of fixed molecules:            0
  Number of free molecules:           29
  Number of variables:          174
  Total number of fixed atoms:            0
  PBC on: Constraint automatically added to non-fixed atoms:
  -> inside box     0.00    0.00    0.00   16.69   16.69   16.69
  Updated total number of restrictions:            4
  Maximum internal distance of type            1 :    0.0000000000000000     
  Maximum internal distance of type            2 :    3.4498690960672698     
  Maximum internal distance of type            3 :    2.9101379795466742     
  All atoms must be within these coordinates: 
   x: [   -1000.0000000000000      ,    1000.0000000000000       ] 
   y: [   -1000.0000000000000      ,    1000.0000000000000       ] 
   z: [   -1000.0000000000000      ,    1000.0000000000000       ] 
  If the system is larger than this, increase the sidemax parameter. 

################################################################################

  Building initial approximation ... 

################################################################################

  Adjusting initial point to fit the constraints 

--------------------------------------------------------------------------------

--------------------------------------------------------------------------------

  Molecules of type:            1

  Packing:|0                                                        100%|
          |******

  Restraint-only function value:    1.6935203345586395E-014
  Maximum violation of the restraints:    1.6935203345586395E-014

--------------------------------------------------------------------------------

  Molecules of type:            2

  Packing:|0                                                        100%|
          |************

  Restraint-only function value:    7.1565215449476511E-003
  Maximum violation of the restraints:    7.1182487908384717E-003

--------------------------------------------------------------------------------

  Molecules of type:            3

  Packing:|0                                                        100%|
          |*********************

  Restraint-only function value:    0.0000000000000000     
  Maximum violation of the restraints:    0.0000000000000000     

--------------------------------------------------------------------------------

  Rescaling maximum and minimum coordinates... 
  Mininum and maximum coordinates after constraint fitting: 
   x: [    3.3331155645814965E-002 ,    16.687275714182832       ] 
   y: [    3.0556760131921182E-003 ,    16.745152923268869       ] 
   z: [   -4.3745144935855287E-003 ,    16.701744790082916       ] 
  Computing size of patches... 
  Number of cells in each direction and cell sides: 
   x:            7  cells of size    2.3838965316772476     
   y:            7  cells of size    2.3838965316772476     
   z:            7  cells of size    2.3838965316772476     
  Cell-system length:   16.68728  16.68728  16.68728
  Reseting center of mass... 

--------------------------------------------------------------------------------

  Setting initial trial coordinates ... 

--------------------------------------------------------------------------------

--------------------------------------------------------------------------------

  Molecules of type:            1
  Adjusting random positions to fit the constraints. 
  Restraint-only function value:    1.6935203345586395E-014
  Maximum violation of the restraints:    1.6935203345586395E-014

--------------------------------------------------------------------------------

  Molecules of type:            2
  Adjusting random positions to fit the constraints. 
  Restraint-only function value:    6.6838868978352488E-003
  Maximum violation of the restraints:    4.4700328413842276E-003

--------------------------------------------------------------------------------

  Molecules of type:            3
  Adjusting random positions to fit the constraints. 
  Packing:|0                                                        100%|
          |***
  Restraint-only function value:    3.3725638202476846E-007
  Maximum violation of the restraints:    3.3725638202476846E-007

################################################################################

  Objective function at initial point:    286.54007169192755     

################################################################################

  Packing molecules of type:            1

################################################################################


  Initial approximation is a solution. Nothing to do. 

  Current point written to file: solvated_150/1Lu_3dihydrogen-phosphate_tetrachloromethane.xyz
--------------------------------------------------------------------------------
  Packing solved for molecules of type           1
  Objective function value:    1.6935203345586395E-014
  Maximum violation of target distance:    0.0000000000000000     
  Max. constraint violation:    1.6935203345586395E-014
--------------------------------------------------------------------------------

################################################################################

  Packing molecules of type:            2

################################################################################


--------------------------------------------------------------------------------

  Starting GENCAN loop:            0
  Scaling radii by:    1.1000000000000001     

  Packing:|0                                                        100%|
          |***************

  Function value from last GENCAN loop: f = .39348E-02
  Best function value before: f = .69618E+02
  Improvement from best function value:    99.99 %
  Improvement from last loop:    99.99 %
  Maximum violation of target distance:     0.000000
  Maximum violation of the constraints: .39348E-02
  Current structure written to file: solvated_150/1Lu_3dihydrogen-phosphate_tetrachloromethane.xyz
--------------------------------------------------------------------------------
  Packing solved for molecules of type           2
  Objective function value:    3.9348014995868189E-003
  Maximum violation of target distance:    0.0000000000000000     
  Max. constraint violation:    3.9348014995868189E-003
--------------------------------------------------------------------------------

################################################################################

  Packing molecules of type:            3

################################################################################


--------------------------------------------------------------------------------

  Starting GENCAN loop:            0
  Scaling radii by:    1.1000000000000001     

  Packing:|0                                                        100%|
          |************************

  Function value from last GENCAN loop: f = .14934E-01
  Best function value before: f = .18850E+03
  Improvement from best function value:    99.99 %
  Improvement from last loop:    99.99 %
  Maximum violation of target distance:     0.000000
  Maximum violation of the constraints: .91281E-02
  Current structure written to file: solvated_150/1Lu_3dihydrogen-phosphate_tetrachloromethane.xyz
--------------------------------------------------------------------------------
  Packing solved for molecules of type           3
  Objective function value:    1.4934420144490557E-002
  Maximum violation of target distance:    0.0000000000000000     
  Max. constraint violation:    9.1281214298339370E-003
--------------------------------------------------------------------------------

################################################################################

  Packing all molecules together 

################################################################################


--------------------------------------------------------------------------------

  Starting GENCAN loop:            0
  Scaling radii by:    1.1000000000000001     

  Packing:|0                                                        100%|
          |******************************

  Function value from last GENCAN loop: f = .72850E-02
  Best function value before: f = .76544E+02
  Improvement from best function value:    99.99 %
  Improvement from last loop:    99.99 %
  Maximum violation of target distance:     0.000000
  Maximum violation of the constraints: .72835E-02

################################################################################

                                 Success! 
              Final objective function value: .72850E-02
              Maximum violation of target distance:   0.000000
              Maximum violation of the constraints: .72835E-02

--------------------------------------------------------------------------------

              Please cite this work if Packmol was useful: 

           L. Martinez, R. Andrade, E. G. Birgin, J. M. Martinez, 
         PACKMOL: A package for building initial configurations for
                   molecular dynamics simulations. 
        Journal of Computational Chemistry, 30(13) pp. 2157-2164, 2009.
                  https://doi.org/10.1002/jcc.21224

################################################################################

  Solution written to file: solvated_150/1Lu_3dihydrogen-phosphate_tetrachloromethane.xyz

--------------------------------------------------------------------------------

   Running time:    1.27549991E-02  seconds. 

--------------------------------------------------------------------------------


