
################################################################################

 PACKMOL - Packing optimization for the automated generation of
 starting configurations for molecular dynamics simulations.
 
                                                             Version 21.1.2 

################################################################################

  Packmol must be run with: packmol < inputfile.inp 

  Userguide at: http://m3g.iqm.unicamp.br/packmol 

  Reading input file... (Control-C aborts)
  Types of coordinate files specified: xyz
  Periodic boundary condition activated: 
    Minimum coordinates:     0.00    0.00    0.00
    Maximum coordinates:    11.46   11.46   11.46
  Seed for random number generator:      1234567
  Output file: solvated_150/1oxidanium_1F_oxidane.xyz
  Reading coordinate file: ../structures/oxidanium.xyz
  Reading coordinate file: ../structures/F.xyz
  Reading coordinate file: ../structures/oxidane.xyz
  Number of independent structures:            3
  The structures are: 
  Structure            1 :Properties=species:S:1:pos:R:3 iupac_name=oxidanium pbc="F F F"(           4  atoms)
  Structure            2 :Properties=species:S:1:pos:R:3 iupac_name=F pbc="F F F"(           1  atoms)
  Structure            3 :Properties=species:S:1:pos:R:3 iupac_name=oxidane pbc="F F F"(           3  atoms)
  Maximum number of GENCAN loops for all molecule packing:          600
  Distance tolerance:    2.0000000000000000     
  Number of molecules of type            1 :            1
  Number of molecules of type            2 :            1
  Number of molecules of type            3 :           48
  Total number of restrictions:            3
  Total number of atoms:          149
  Total number of molecules:           50
  Number of fixed molecules:            0
  Number of free molecules:           50
  Number of variables:          300
  Total number of fixed atoms:            0
  PBC on: Constraint automatically added to non-fixed atoms:
  -> inside box     0.00    0.00    0.00   11.46   11.46   11.46
  Updated total number of restrictions:            4
  Maximum internal distance of type            1 :    1.6376059019190179     
  Maximum internal distance of type            2 :    0.0000000000000000     
  Maximum internal distance of type            3 :    1.5269386005992513     
  All atoms must be within these coordinates: 
   x: [   -999.36173535791761      ,    1000.6382646420824       ] 
   y: [   -999.20000000000005      ,    1000.8000000000000       ] 
   z: [   -999.38416485900223      ,    1000.6158351409978       ] 
  If the system is larger than this, increase the sidemax parameter. 

################################################################################

  Building initial approximation ... 

################################################################################

  Adjusting initial point to fit the constraints 

--------------------------------------------------------------------------------

--------------------------------------------------------------------------------

  Molecules of type:            1

  Packing:|0                                                        100%|
          |***************

  Restraint-only function value:    1.2898796526347709E-004
  Maximum violation of the restraints:    1.2898796526347709E-004

--------------------------------------------------------------------------------

  Molecules of type:            2

  Packing:|0                                                        100%|
          |******

  Restraint-only function value:    2.6808605182476534E-017
  Maximum violation of the restraints:    2.6808605182476534E-017

--------------------------------------------------------------------------------

  Molecules of type:            3

  Packing:|0                                                        100%|
          |*********************

  Restraint-only function value:    2.3615625325486139E-006
  Maximum violation of the restraints:    1.7718597903901937E-006

--------------------------------------------------------------------------------

  Rescaling maximum and minimum coordinates... 
  Mininum and maximum coordinates after constraint fitting: 
   x: [   -2.6981536594621476E-004 ,    11.456426202556749       ] 
   y: [   -9.3281597030220092E-005 ,    11.455930953053604       ] 
   z: [   -8.0308145683821233E-003 ,    11.455391169402375       ] 
  Computing size of patches... 
  Number of cells in each direction and cell sides: 
   x:            5  cells of size    2.2910969928133351     
   y:            5  cells of size    2.2910969928133351     
   z:            5  cells of size    2.2910969928133351     
  Cell-system length:   11.45548  11.45548  11.45548
  Reseting center of mass... 

--------------------------------------------------------------------------------

  Setting initial trial coordinates ... 

--------------------------------------------------------------------------------

--------------------------------------------------------------------------------

  Molecules of type:            1
  Adjusting random positions to fit the constraints. 
  Packing:|0                                                        100%|
          |******
  Restraint-only function value:    0.0000000000000000     
  Maximum violation of the restraints:    0.0000000000000000     

--------------------------------------------------------------------------------

  Molecules of type:            2
  Adjusting random positions to fit the constraints. 
  Restraint-only function value:    2.6808605182476534E-017
  Maximum violation of the restraints:    2.6808605182476534E-017

--------------------------------------------------------------------------------

  Molecules of type:            3
  Adjusting random positions to fit the constraints. 
  Packing:|0                                                        100%|
          |******
  Restraint-only function value:    0.0000000000000000     
  Maximum violation of the restraints:    0.0000000000000000     

################################################################################

  Objective function at initial point:    908.25197257666980     

################################################################################

  Packing molecules of type:            1

################################################################################


  Initial approximation is a solution. Nothing to do. 

  Current point written to file: solvated_150/1oxidanium_1F_oxidane.xyz
--------------------------------------------------------------------------------
  Packing solved for molecules of type           1
  Objective function value:    0.0000000000000000     
  Maximum violation of target distance:    0.0000000000000000     
  Max. constraint violation:    0.0000000000000000     
--------------------------------------------------------------------------------

################################################################################

  Packing molecules of type:            2

################################################################################


  Initial approximation is a solution. Nothing to do. 

  Current point written to file: solvated_150/1oxidanium_1F_oxidane.xyz
--------------------------------------------------------------------------------
  Packing solved for molecules of type           2
  Objective function value:    2.6808605182476534E-017
  Maximum violation of target distance:    0.0000000000000000     
  Max. constraint violation:    2.6808605182476534E-017
--------------------------------------------------------------------------------

################################################################################

  Packing molecules of type:            3

################################################################################


--------------------------------------------------------------------------------

  Starting GENCAN loop:            0
  Scaling radii by:    1.1000000000000001     

  Packing:|0                                                        100%|
          |*********************************

  Function value from last GENCAN loop: f = .15641E-02
  Best function value before: f = .88108E+03
  Improvement from best function value:    99.99 %
  Improvement from last loop:    99.99 %
  Maximum violation of target distance:     0.000000
  Maximum violation of the constraints: .98912E-03
  Current structure written to file: solvated_150/1oxidanium_1F_oxidane.xyz
--------------------------------------------------------------------------------
  Packing solved for molecules of type           3
  Objective function value:    1.5640517775234244E-003
  Maximum violation of target distance:    0.0000000000000000     
  Max. constraint violation:    9.8912131119278934E-004
--------------------------------------------------------------------------------

################################################################################

  Packing all molecules together 

################################################################################


--------------------------------------------------------------------------------

  Starting GENCAN loop:            0
  Scaling radii by:    1.1000000000000001     

  Packing:|0                                                        100%|
          |*********************

  Function value from last GENCAN loop: f = .11033E-03
  Best function value before: f = .49826E+02
  Improvement from best function value:    99.99 %
  Improvement from last loop:    99.99 %
  Maximum violation of target distance:     0.000000
  Maximum violation of the constraints: .91799E-04

################################################################################

                                 Success! 
              Final objective function value: .11033E-03
              Maximum violation of target distance:   0.000000
              Maximum violation of the constraints: .91799E-04

--------------------------------------------------------------------------------

              Please cite this work if Packmol was useful: 

           L. Martinez, R. Andrade, E. G. Birgin, J. M. Martinez, 
         PACKMOL: A package for building initial configurations for
                   molecular dynamics simulations. 
        Journal of Computational Chemistry, 30(13) pp. 2157-2164, 2009.
                  https://doi.org/10.1002/jcc.21224

################################################################################

  Solution written to file: solvated_150/1oxidanium_1F_oxidane.xyz

--------------------------------------------------------------------------------

   Running time:    2.19540074E-02  seconds. 

--------------------------------------------------------------------------------


