
################################################################################

 PACKMOL - Packing optimization for the automated generation of
 starting configurations for molecular dynamics simulations.
 
                                                             Version 21.1.2 

################################################################################

  Packmol must be run with: packmol < inputfile.inp 

  Userguide at: http://m3g.iqm.unicamp.br/packmol 

  Reading input file... (Control-C aborts)
  Types of coordinate files specified: xyz
  Periodic boundary condition activated: 
    Minimum coordinates:     0.00    0.00    0.00
    Maximum coordinates:    15.88   15.88   15.88
  Seed for random number generator:      1234567
  Output file: solvated_150/1oxidanium_1chlorite_chloroform.xyz
  Reading coordinate file: ../structures/oxidanium.xyz
  Reading coordinate file: ../structures/chlorite.xyz
  Reading coordinate file: ../structures/chloroform.xyz
  Number of independent structures:            3
  The structures are: 
  Structure            1 :Properties=species:S:1:pos:R:3 iupac_name=oxidanium pbc="F F F"(           4  atoms)
  Structure            2 :Properties=species:S:1:pos:R:3 iupac_name=chlorite pbc="F F F"(           3  atoms)
  Structure            3 :Properties=species:S:1:pos:R:3 iupac_name=chloroform pbc="F F F"(           5  atoms)
  Maximum number of GENCAN loops for all molecule packing:          600
  Distance tolerance:    2.0000000000000000     
  Number of molecules of type            1 :            1
  Number of molecules of type            2 :            1
  Number of molecules of type            3 :           28
  Total number of restrictions:            3
  Total number of atoms:          147
  Total number of molecules:           30
  Number of fixed molecules:            0
  Number of free molecules:           30
  Number of variables:          180
  Total number of fixed atoms:            0
  PBC on: Constraint automatically added to non-fixed atoms:
  -> inside box     0.00    0.00    0.00   15.88   15.88   15.88
  Updated total number of restrictions:            4
  Maximum internal distance of type            1 :    1.6376059019190179     
  Maximum internal distance of type            2 :    2.1268392388236590     
  Maximum internal distance of type            3 :    2.9128739262110201     
  All atoms must be within these coordinates: 
   x: [   -999.36173535791761      ,    1000.6382646420824       ] 
   y: [   -999.20000000000005      ,    1000.8000000000000       ] 
   z: [   -999.38416485900223      ,    1000.6158351409978       ] 
  If the system is larger than this, increase the sidemax parameter. 

################################################################################

  Building initial approximation ... 

################################################################################

  Adjusting initial point to fit the constraints 

--------------------------------------------------------------------------------

--------------------------------------------------------------------------------

  Molecules of type:            1

  Packing:|0                                                        100%|
          |***************

  Restraint-only function value:    9.0704046485627553E-005
  Maximum violation of the restraints:    9.0704046485627553E-005

--------------------------------------------------------------------------------

  Molecules of type:            2

  Packing:|0                                                        100%|
          |************

  Restraint-only function value:    1.0101423758525581E-002
  Maximum violation of the restraints:    6.1978488834959723E-003

--------------------------------------------------------------------------------

  Molecules of type:            3

  Packing:|0                                                        100%|
          |************************

  Restraint-only function value:    3.0439884902670016E-003
  Maximum violation of the restraints:    1.6137352363690576E-003

--------------------------------------------------------------------------------

  Rescaling maximum and minimum coordinates... 
  Mininum and maximum coordinates after constraint fitting: 
   x: [    6.7247187078922513E-004 ,    15.938764442931937       ] 
   y: [   -2.6741772872930281E-002 ,    15.927673383595838       ] 
   z: [   -6.6438493005665745E-003 ,    15.850363722034839       ] 
  Computing size of patches... 
  Number of cells in each direction and cell sides: 
   x:            7  cells of size    2.2690706207364970     
   y:            7  cells of size    2.2690706207364970     
   z:            7  cells of size    2.2690706207364970     
  Cell-system length:   15.88349  15.88349  15.88349
  Reseting center of mass... 

--------------------------------------------------------------------------------

  Setting initial trial coordinates ... 

--------------------------------------------------------------------------------

--------------------------------------------------------------------------------

  Molecules of type:            1
  Adjusting random positions to fit the constraints. 
  Packing:|0                                                        100%|
          |***
  Restraint-only function value:    1.7992284334727724E-007
  Maximum violation of the restraints:    1.7992284334727724E-007

--------------------------------------------------------------------------------

  Molecules of type:            2
  Adjusting random positions to fit the constraints. 
  Packing:|0                                                        100%|
          |******
  Restraint-only function value:    2.0874122956068409E-003
  Maximum violation of the restraints:    2.0874122956068409E-003

--------------------------------------------------------------------------------

  Molecules of type:            3
  Adjusting random positions to fit the constraints. 
  Packing:|0                                                        100%|
          |***
  Restraint-only function value:    0.0000000000000000     
  Maximum violation of the restraints:    0.0000000000000000     

################################################################################

  Objective function at initial point:    481.19773764814789     

################################################################################

  Packing molecules of type:            1

################################################################################


  Initial approximation is a solution. Nothing to do. 

  Current point written to file: solvated_150/1oxidanium_1chlorite_chloroform.xyz
--------------------------------------------------------------------------------
  Packing solved for molecules of type           1
  Objective function value:    1.7992284334727724E-007
  Maximum violation of target distance:    0.0000000000000000     
  Max. constraint violation:    1.7992284334727724E-007
--------------------------------------------------------------------------------

################################################################################

  Packing molecules of type:            2

################################################################################


  Initial approximation is a solution. Nothing to do. 

  Current point written to file: solvated_150/1oxidanium_1chlorite_chloroform.xyz
--------------------------------------------------------------------------------
  Packing solved for molecules of type           2
  Objective function value:    2.0874122956068409E-003
  Maximum violation of target distance:    0.0000000000000000     
  Max. constraint violation:    2.0874122956068409E-003
--------------------------------------------------------------------------------

################################################################################

  Packing molecules of type:            3

################################################################################


--------------------------------------------------------------------------------

  Starting GENCAN loop:            0
  Scaling radii by:    1.1000000000000001     

  Packing:|0                                                        100%|
          |***************************************

  Function value from last GENCAN loop: f = .27095E-03
  Best function value before: f = .40396E+03
  Improvement from best function value:    99.99 %
  Improvement from last loop:    99.99 %
  Maximum violation of target distance:     0.000000
  Maximum violation of the constraints: .23789E-03
  Current structure written to file: solvated_150/1oxidanium_1chlorite_chloroform.xyz
--------------------------------------------------------------------------------
  Packing solved for molecules of type           3
  Objective function value:    2.7094598451125651E-004
  Maximum violation of target distance:    0.0000000000000000     
  Max. constraint violation:    2.3789421702319404E-004
--------------------------------------------------------------------------------

################################################################################

  Packing all molecules together 

################################################################################


--------------------------------------------------------------------------------

  Starting GENCAN loop:            0
  Scaling radii by:    1.1000000000000001     

  Packing:|0                                                        100%|
          |*********************************************

  Function value from last GENCAN loop: f = .16819E-02
  Best function value before: f = .10269E+03
  Improvement from best function value:    99.99 %
  Improvement from last loop:    99.99 %
  Maximum violation of target distance:     0.000000
  Maximum violation of the constraints: .16819E-02

################################################################################

                                 Success! 
              Final objective function value: .16819E-02
              Maximum violation of target distance:   0.000000
              Maximum violation of the constraints: .16819E-02

--------------------------------------------------------------------------------

              Please cite this work if Packmol was useful: 

           L. Martinez, R. Andrade, E. G. Birgin, J. M. Martinez, 
         PACKMOL: A package for building initial configurations for
                   molecular dynamics simulations. 
        Journal of Computational Chemistry, 30(13) pp. 2157-2164, 2009.
                  https://doi.org/10.1002/jcc.21224

################################################################################

  Solution written to file: solvated_150/1oxidanium_1chlorite_chloroform.xyz

--------------------------------------------------------------------------------

   Running time:    1.67919993E-02  seconds. 

--------------------------------------------------------------------------------


