
################################################################################

 PACKMOL - Packing optimization for the automated generation of
 starting configurations for molecular dynamics simulations.
 
                                                             Version 21.1.2 

################################################################################

  Packmol must be run with: packmol < inputfile.inp 

  Userguide at: http://m3g.iqm.unicamp.br/packmol 

  Reading input file... (Control-C aborts)
  Types of coordinate files specified: xyz
  Periodic boundary condition activated: 
    Minimum coordinates:     0.00    0.00    0.00
    Maximum coordinates:    11.84   11.84   11.84
  Seed for random number generator:      1234567
  Output file: solvated_150/1oxidanium_1dihydrogen-phosphate_1,3-dioxolan-2-one.xyz
  Reading coordinate file: ../structures/oxidanium.xyz
  Reading coordinate file: ../structures/dihydrogen-phosphate.xyz
  Reading coordinate file: ../structures/1,3-dioxolan-2-one.xyz
  Number of independent structures:            3
  The structures are: 
  Structure            1 :Properties=species:S:1:pos:R:3 iupac_name=oxidanium pbc="F F F"(           4  atoms)
  Structure            2 :Properties=species:S:1:pos:R:3 iupac_name=dihydrogen-phosphate pbc="F F F"(           7  atoms)
  Structure            3 :Properties=species:S:1:pos:R:3 iupac_name=1,3-dioxolan-2-one pbc="F F F"(          10  atoms)
  Maximum number of GENCAN loops for all molecule packing:          600
  Distance tolerance:    2.0000000000000000     
  Number of molecules of type            1 :            1
  Number of molecules of type            2 :            1
  Number of molecules of type            3 :           13
  Total number of restrictions:            3
  Total number of atoms:          141
  Total number of molecules:           15
  Number of fixed molecules:            0
  Number of free molecules:           15
  Number of variables:           90
  Total number of fixed atoms:            0
  PBC on: Constraint automatically added to non-fixed atoms:
  -> inside box     0.00    0.00    0.00   11.84   11.84   11.84
  Updated total number of restrictions:            4
  Maximum internal distance of type            1 :    1.6376059019190179     
  Maximum internal distance of type            2 :    3.4498690960672698     
  Maximum internal distance of type            3 :    4.2728366537933553     
  All atoms must be within these coordinates: 
   x: [   -999.36173535791761      ,    1000.6382646420824       ] 
   y: [   -999.20000000000005      ,    1000.8000000000000       ] 
   z: [   -999.38416485900223      ,    1000.6158351409978       ] 
  If the system is larger than this, increase the sidemax parameter. 

################################################################################

  Building initial approximation ... 

################################################################################

  Adjusting initial point to fit the constraints 

--------------------------------------------------------------------------------

--------------------------------------------------------------------------------

  Molecules of type:            1

  Packing:|0                                                        100%|
          |***************

  Restraint-only function value:    1.2897780191319284E-004
  Maximum violation of the restraints:    1.2897780191319284E-004

--------------------------------------------------------------------------------

  Molecules of type:            2

  Packing:|0                                                        100%|
          |***************

  Restraint-only function value:    0.0000000000000000     
  Maximum violation of the restraints:    0.0000000000000000     

--------------------------------------------------------------------------------

  Molecules of type:            3

  Packing:|0                                                        100%|
          |******************

  Restraint-only function value:    4.0738680438294901E-004
  Maximum violation of the restraints:    1.2376039647346506E-004

--------------------------------------------------------------------------------

  Rescaling maximum and minimum coordinates... 
  Mininum and maximum coordinates after constraint fitting: 
   x: [   -6.3774780327865571E-003 ,    11.844895337282976       ] 
   y: [    5.4969884149911684E-002 ,    11.838932674144319       ] 
   z: [   -8.0304981761156278E-003 ,    11.847254816647116       ] 
  Computing size of patches... 
  Number of cells in each direction and cell sides: 
   x:            5  cells of size    2.3680902279752840     
   y:            5  cells of size    2.3680902279752840     
   z:            5  cells of size    2.3680902279752840     
  Cell-system length:   11.84045  11.84045  11.84045
  Reseting center of mass... 

--------------------------------------------------------------------------------

  Setting initial trial coordinates ... 

--------------------------------------------------------------------------------

--------------------------------------------------------------------------------

  Molecules of type:            1
  Adjusting random positions to fit the constraints. 
  Packing:|0                                                        100%|
          |***
  Restraint-only function value:    1.5938916652050704E-005
  Maximum violation of the restraints:    1.5938916652050704E-005

--------------------------------------------------------------------------------

  Molecules of type:            2
  Adjusting random positions to fit the constraints. 
  Restraint-only function value:    8.1398391875755986E-003
  Maximum violation of the restraints:    8.1398391875755986E-003

--------------------------------------------------------------------------------

  Molecules of type:            3
  Adjusting random positions to fit the constraints. 
  Packing:|0                                                        100%|
          |******
  Restraint-only function value:    6.9846814383649178E-008
  Maximum violation of the restraints:    6.9846814383649178E-008

################################################################################

  Objective function at initial point:    1005.0186376110888     

################################################################################

  Packing molecules of type:            1

################################################################################


  Initial approximation is a solution. Nothing to do. 

  Current point written to file: solvated_150/1oxidanium_1dihydrogen-phosphate_1,3-dioxolan-2-one.xyz
--------------------------------------------------------------------------------
  Packing solved for molecules of type           1
  Objective function value:    1.5938916652050704E-005
  Maximum violation of target distance:    0.0000000000000000     
  Max. constraint violation:    1.5938916652050704E-005
--------------------------------------------------------------------------------

################################################################################

  Packing molecules of type:            2

################################################################################


  Initial approximation is a solution. Nothing to do. 

  Current point written to file: solvated_150/1oxidanium_1dihydrogen-phosphate_1,3-dioxolan-2-one.xyz
--------------------------------------------------------------------------------
  Packing solved for molecules of type           2
  Objective function value:    8.1398391875755986E-003
  Maximum violation of target distance:    0.0000000000000000     
  Max. constraint violation:    8.1398391875755986E-003
--------------------------------------------------------------------------------

################################################################################

  Packing molecules of type:            3

################################################################################


--------------------------------------------------------------------------------

  Starting GENCAN loop:            0
  Scaling radii by:    1.1000000000000001     

  Packing:|0                                                        100%|
          |*************************************************************|


  Function value from last GENCAN loop: f = .10182E-01
  Best function value before: f = .85525E+03
  Improvement from best function value:    99.99 %
  Improvement from last loop:    99.99 %
  Maximum violation of target distance:     0.000000
  Maximum violation of the constraints: .84554E-02
  Current structure written to file: solvated_150/1oxidanium_1dihydrogen-phosphate_1,3-dioxolan-2-one.xyz
--------------------------------------------------------------------------------
  Packing solved for molecules of type           3
  Objective function value:    1.0181516254958898E-002
  Maximum violation of target distance:    0.0000000000000000     
  Max. constraint violation:    8.4554222568494070E-003
--------------------------------------------------------------------------------

################################################################################

  Packing all molecules together 

################################################################################


--------------------------------------------------------------------------------

  Starting GENCAN loop:            0
  Scaling radii by:    1.1000000000000001     

  Packing:|0                                                        100%|
          |************************************

  Function value from last GENCAN loop: f = .19812E-01
  Best function value before: f = .11071E+03
  Improvement from best function value:    99.98 %
  Improvement from last loop:    99.98 %
  Maximum violation of target distance:     0.000000
  Maximum violation of the constraints: .66493E-02

################################################################################

                                 Success! 
              Final objective function value: .19812E-01
              Maximum violation of target distance:   0.000000
              Maximum violation of the constraints: .66493E-02

--------------------------------------------------------------------------------

              Please cite this work if Packmol was useful: 

           L. Martinez, R. Andrade, E. G. Birgin, J. M. Martinez, 
         PACKMOL: A package for building initial configurations for
                   molecular dynamics simulations. 
        Journal of Computational Chemistry, 30(13) pp. 2157-2164, 2009.
                  https://doi.org/10.1002/jcc.21224

################################################################################

  Solution written to file: solvated_150/1oxidanium_1dihydrogen-phosphate_1,3-dioxolan-2-one.xyz

--------------------------------------------------------------------------------

   Running time:    2.92840004E-02  seconds. 

--------------------------------------------------------------------------------


