
################################################################################

 PACKMOL - Packing optimization for the automated generation of
 starting configurations for molecular dynamics simulations.
 
                                                             Version 21.1.2 

################################################################################

  Packmol must be run with: packmol < inputfile.inp 

  Userguide at: http://m3g.iqm.unicamp.br/packmol 

  Reading input file... (Control-C aborts)
  Types of coordinate files specified: xyz
  Periodic boundary condition activated: 
    Minimum coordinates:     0.00    0.00    0.00
    Maximum coordinates:    16.88   16.88   16.88
  Seed for random number generator:      1234567
  Output file: solvated_150/1oxidanium_1iodate_tetrachloromethane.xyz
  Reading coordinate file: ../structures/oxidanium.xyz
  Reading coordinate file: ../structures/iodate.xyz
  Reading coordinate file: ../structures/tetrachloromethane.xyz
  Number of independent structures:            3
  The structures are: 
  Structure            1 :Properties=species:S:1:pos:R:3 iupac_name=oxidanium pbc="F F F"(           4  atoms)
  Structure            2 :Properties=species:S:1:pos:R:3 iupac_name=iodate pbc="F F F"(           5  atoms)
  Structure            3 :Properties=species:S:1:pos:R:3 iupac_name=tetrachloromethane pbc="F F F"(           5  atoms)
  Maximum number of GENCAN loops for all molecule packing:          600
  Distance tolerance:    2.0000000000000000     
  Number of molecules of type            1 :            1
  Number of molecules of type            2 :            1
  Number of molecules of type            3 :           28
  Total number of restrictions:            3
  Total number of atoms:          149
  Total number of molecules:           30
  Number of fixed molecules:            0
  Number of free molecules:           30
  Number of variables:          180
  Total number of fixed atoms:            0
  PBC on: Constraint automatically added to non-fixed atoms:
  -> inside box     0.00    0.00    0.00   16.88   16.88   16.88
  Updated total number of restrictions:            4
  Maximum internal distance of type            1 :    1.6376059019190179     
  Maximum internal distance of type            2 :    3.2333368451029041     
  Maximum internal distance of type            3 :    2.9101379795466742     
  All atoms must be within these coordinates: 
   x: [   -999.36173535791761      ,    1000.6382646420824       ] 
   y: [   -999.20000000000005      ,    1000.8000000000000       ] 
   z: [   -999.38416485900223      ,    1000.6158351409978       ] 
  If the system is larger than this, increase the sidemax parameter. 

################################################################################

  Building initial approximation ... 

################################################################################

  Adjusting initial point to fit the constraints 

--------------------------------------------------------------------------------

--------------------------------------------------------------------------------

  Molecules of type:            1

  Packing:|0                                                        100%|
          |***************

  Restraint-only function value:    0.0000000000000000     
  Maximum violation of the restraints:    0.0000000000000000     

--------------------------------------------------------------------------------

  Molecules of type:            2

  Packing:|0                                                        100%|
          |************

  Restraint-only function value:    0.0000000000000000     
  Maximum violation of the restraints:    0.0000000000000000     

--------------------------------------------------------------------------------

  Molecules of type:            3

  Packing:|0                                                        100%|
          |*********************

  Restraint-only function value:    7.3323034566637830E-004
  Maximum violation of the restraints:    3.3133467886679489E-004

--------------------------------------------------------------------------------

  Rescaling maximum and minimum coordinates... 
  Mininum and maximum coordinates after constraint fitting: 
   x: [    8.2576337204805055E-004 ,    16.880625638522620       ] 
   y: [   -1.2871182518844081E-002 ,    16.886639348765957       ] 
   z: [    3.4276939879829844E-003 ,    16.874402987086611       ] 
  Computing size of patches... 
  Number of cells in each direction and cell sides: 
   x:            7  cells of size    2.4109885842924541     
   y:            7  cells of size    2.4109885842924541     
   z:            7  cells of size    2.4109885842924541     
  Cell-system length:   16.87692  16.87692  16.87692
  Reseting center of mass... 

--------------------------------------------------------------------------------

  Setting initial trial coordinates ... 

--------------------------------------------------------------------------------

--------------------------------------------------------------------------------

  Molecules of type:            1
  Adjusting random positions to fit the constraints. 
  Packing:|0                                                        100%|
          |***
  Restraint-only function value:    0.0000000000000000     
  Maximum violation of the restraints:    0.0000000000000000     

--------------------------------------------------------------------------------

  Molecules of type:            2
  Adjusting random positions to fit the constraints. 
  Packing:|0                                                        100%|
          |***
  Restraint-only function value:    0.0000000000000000     
  Maximum violation of the restraints:    0.0000000000000000     

--------------------------------------------------------------------------------

  Molecules of type:            3
  Adjusting random positions to fit the constraints. 
  Packing:|0                                                        100%|
          |******
  Restraint-only function value:    0.0000000000000000     
  Maximum violation of the restraints:    0.0000000000000000     

################################################################################

  Objective function at initial point:    290.11116394198456     

################################################################################

  Packing molecules of type:            1

################################################################################


  Initial approximation is a solution. Nothing to do. 

  Current point written to file: solvated_150/1oxidanium_1iodate_tetrachloromethane.xyz
--------------------------------------------------------------------------------
  Packing solved for molecules of type           1
  Objective function value:    0.0000000000000000     
  Maximum violation of target distance:    0.0000000000000000     
  Max. constraint violation:    0.0000000000000000     
--------------------------------------------------------------------------------

################################################################################

  Packing molecules of type:            2

################################################################################


  Initial approximation is a solution. Nothing to do. 

  Current point written to file: solvated_150/1oxidanium_1iodate_tetrachloromethane.xyz
--------------------------------------------------------------------------------
  Packing solved for molecules of type           2
  Objective function value:    0.0000000000000000     
  Maximum violation of target distance:    0.0000000000000000     
  Max. constraint violation:    0.0000000000000000     
--------------------------------------------------------------------------------

################################################################################

  Packing molecules of type:            3

################################################################################


--------------------------------------------------------------------------------

  Starting GENCAN loop:            0
  Scaling radii by:    1.1000000000000001     

  Packing:|0                                                        100%|
          |***************************************

  Function value from last GENCAN loop: f = .44045E-02
  Best function value before: f = .22791E+03
  Improvement from best function value:    99.99 %
  Improvement from last loop:    99.99 %
  Maximum violation of target distance:     0.000000
  Maximum violation of the constraints: .44045E-02
  Current structure written to file: solvated_150/1oxidanium_1iodate_tetrachloromethane.xyz
--------------------------------------------------------------------------------
  Packing solved for molecules of type           3
  Objective function value:    4.4045053069837765E-003
  Maximum violation of target distance:    0.0000000000000000     
  Max. constraint violation:    4.4045053069837765E-003
--------------------------------------------------------------------------------

################################################################################

  Packing all molecules together 

################################################################################


--------------------------------------------------------------------------------

  Starting GENCAN loop:            0
  Scaling radii by:    1.1000000000000001     

  Packing:|0                                                        100%|
          |******************************

  Function value from last GENCAN loop: f = .86732E-02
  Best function value before: f = .65218E+02
  Improvement from best function value:    99.99 %
  Improvement from last loop:    99.99 %
  Maximum violation of target distance:     0.000000
  Maximum violation of the constraints: .84068E-02

################################################################################

                                 Success! 
              Final objective function value: .86732E-02
              Maximum violation of target distance:   0.000000
              Maximum violation of the constraints: .84068E-02

--------------------------------------------------------------------------------

              Please cite this work if Packmol was useful: 

           L. Martinez, R. Andrade, E. G. Birgin, J. M. Martinez, 
         PACKMOL: A package for building initial configurations for
                   molecular dynamics simulations. 
        Journal of Computational Chemistry, 30(13) pp. 2157-2164, 2009.
                  https://doi.org/10.1002/jcc.21224

################################################################################

  Solution written to file: solvated_150/1oxidanium_1iodate_tetrachloromethane.xyz

--------------------------------------------------------------------------------

   Running time:    1.56999975E-02  seconds. 

--------------------------------------------------------------------------------


