
################################################################################

 PACKMOL - Packing optimization for the automated generation of
 starting configurations for molecular dynamics simulations.
 
                                                             Version 21.1.2 

################################################################################

  Packmol must be run with: packmol < inputfile.inp 

  Userguide at: http://m3g.iqm.unicamp.br/packmol 

  Reading input file... (Control-C aborts)
  Types of coordinate files specified: xyz
  Periodic boundary condition activated: 
    Minimum coordinates:     0.00    0.00    0.00
    Maximum coordinates:    12.69   12.69   12.69
  Seed for random number generator:      1234567
  Output file: solvated_150/1Pa_5permanganate_N,N-dimethylformamide.xyz
  Reading coordinate file: ../structures/Pa.xyz
  Reading coordinate file: ../structures/permanganate.xyz
  Reading coordinate file: ../structures/N,N-dimethylformamide.xyz
  Number of independent structures:            3
  The structures are: 
  Structure            1 :Properties=species:S:1:pos:R:3 iupac_name=Pa pbc="F F F"(           1  atoms)
  Structure            2 :Properties=species:S:1:pos:R:3 iupac_name=permanganate pbc="F F F"(           5  atoms)
  Structure            3 :Properties=species:S:1:pos:R:3 iupac_name=N,N-dimethylformamide pbc="F F F"(          12  atoms)
  Maximum number of GENCAN loops for all molecule packing:          600
  Distance tolerance:    2.0000000000000000     
  Number of molecules of type            1 :            1
  Number of molecules of type            2 :            5
  Number of molecules of type            3 :           10
  Total number of restrictions:            3
  Total number of atoms:          146
  Total number of molecules:           16
  Number of fixed molecules:            0
  Number of free molecules:           16
  Number of variables:           96
  Total number of fixed atoms:            0
  PBC on: Constraint automatically added to non-fixed atoms:
  -> inside box     0.00    0.00    0.00   12.69   12.69   12.69
  Updated total number of restrictions:            4
  Maximum internal distance of type            1 :    0.0000000000000000     
  Maximum internal distance of type            2 :    3.1470440495963827     
  Maximum internal distance of type            3 :    4.2658499117995232     
  All atoms must be within these coordinates: 
   x: [   -1000.0000000000000      ,    1000.0000000000000       ] 
   y: [   -1000.0000000000000      ,    1000.0000000000000       ] 
   z: [   -1000.0000000000000      ,    1000.0000000000000       ] 
  If the system is larger than this, increase the sidemax parameter. 

################################################################################

  Building initial approximation ... 

################################################################################

  Adjusting initial point to fit the constraints 

--------------------------------------------------------------------------------

--------------------------------------------------------------------------------

  Molecules of type:            1

  Packing:|0                                                        100%|
          |******

  Restraint-only function value:    1.8963726941137219E-014
  Maximum violation of the restraints:    1.8963726941137219E-014

--------------------------------------------------------------------------------

  Molecules of type:            2

  Packing:|0                                                        100%|
          |*********************

  Restraint-only function value:    2.4718171621792288E-004
  Maximum violation of the restraints:    2.4283012861375366E-004

--------------------------------------------------------------------------------

  Molecules of type:            3

  Packing:|0                                                        100%|
          |************************

  Restraint-only function value:    1.9407427009478951E-003
  Maximum violation of the restraints:    1.4704479263513307E-003

--------------------------------------------------------------------------------

  Rescaling maximum and minimum coordinates... 
  Mininum and maximum coordinates after constraint fitting: 
   x: [   -2.7115013611939517E-002 ,    12.691543131364853       ] 
   y: [    5.1925680976047127E-002 ,    12.691543288443555       ] 
   z: [   -2.7592996332259645E-008 ,    12.692700485592514       ] 
  Computing size of patches... 
  Number of cells in each direction and cell sides: 
   x:            5  cells of size    2.5383086390119982     
   y:            5  cells of size    2.5383086390119982     
   z:            5  cells of size    2.5383086390119982     
  Cell-system length:   12.69154  12.69154  12.69154
  Reseting center of mass... 

--------------------------------------------------------------------------------

  Setting initial trial coordinates ... 

--------------------------------------------------------------------------------

--------------------------------------------------------------------------------

  Molecules of type:            1
  Adjusting random positions to fit the constraints. 
  Restraint-only function value:    1.8963726941137219E-014
  Maximum violation of the restraints:    1.8963726941137219E-014

--------------------------------------------------------------------------------

  Molecules of type:            2
  Adjusting random positions to fit the constraints. 
  Packing:|0                                                        100%|
          |***
  Restraint-only function value:    0.0000000000000000     
  Maximum violation of the restraints:    0.0000000000000000     

--------------------------------------------------------------------------------

  Molecules of type:            3
  Adjusting random positions to fit the constraints. 
  Restraint-only function value:    0.0000000000000000     
  Maximum violation of the restraints:    0.0000000000000000     

################################################################################

  Objective function at initial point:    600.26817230705774     

################################################################################

  Packing molecules of type:            1

################################################################################


  Initial approximation is a solution. Nothing to do. 

  Current point written to file: solvated_150/1Pa_5permanganate_N,N-dimethylformamide.xyz
--------------------------------------------------------------------------------
  Packing solved for molecules of type           1
  Objective function value:    1.8963726941137219E-014
  Maximum violation of target distance:    0.0000000000000000     
  Max. constraint violation:    1.8963726941137219E-014
--------------------------------------------------------------------------------

################################################################################

  Packing molecules of type:            2

################################################################################


--------------------------------------------------------------------------------

  Starting GENCAN loop:            0
  Scaling radii by:    1.1000000000000001     

  Packing:|0                                                        100%|
          |******************

  Function value from last GENCAN loop: f = .43444E-02
  Best function value before: f = .45165E+02
  Improvement from best function value:    99.99 %
  Improvement from last loop:    99.99 %
  Maximum violation of target distance:     0.000000
  Maximum violation of the constraints: .43444E-02
  Current structure written to file: solvated_150/1Pa_5permanganate_N,N-dimethylformamide.xyz
--------------------------------------------------------------------------------
  Packing solved for molecules of type           2
  Objective function value:    4.3443658809118602E-003
  Maximum violation of target distance:    0.0000000000000000     
  Max. constraint violation:    4.3443658809118602E-003
--------------------------------------------------------------------------------

################################################################################

  Packing molecules of type:            3

################################################################################


--------------------------------------------------------------------------------

  Starting GENCAN loop:            0
  Scaling radii by:    1.1000000000000001     

  Packing:|0                                                        100%|
          |***************************

  Function value from last GENCAN loop: f = .82075E-03
  Best function value before: f = .40422E+03
  Improvement from best function value:    99.99 %
  Improvement from last loop:    99.99 %
  Maximum violation of target distance:     0.000000
  Maximum violation of the constraints: .82069E-03
  Current structure written to file: solvated_150/1Pa_5permanganate_N,N-dimethylformamide.xyz
--------------------------------------------------------------------------------
  Packing solved for molecules of type           3
  Objective function value:    8.2074959926606685E-004
  Maximum violation of target distance:    0.0000000000000000     
  Max. constraint violation:    8.2069033939341203E-004
--------------------------------------------------------------------------------

################################################################################

  Packing all molecules together 

################################################################################


--------------------------------------------------------------------------------

  Starting GENCAN loop:            0
  Scaling radii by:    1.1000000000000001     

  Packing:|0                                                        100%|
          |************************************************

  Function value from last GENCAN loop: f = .00000E+00
  Best function value before: f = .14853E+03
  Improvement from best function value:    99.99 %
  Improvement from last loop:    99.99 %
  Maximum violation of target distance:     0.000000
  Maximum violation of the constraints: .00000E+00

################################################################################

                                 Success! 
              Final objective function value: .00000E+00
              Maximum violation of target distance:   0.000000
              Maximum violation of the constraints: .00000E+00

--------------------------------------------------------------------------------

              Please cite this work if Packmol was useful: 

           L. Martinez, R. Andrade, E. G. Birgin, J. M. Martinez, 
         PACKMOL: A package for building initial configurations for
                   molecular dynamics simulations. 
        Journal of Computational Chemistry, 30(13) pp. 2157-2164, 2009.
                  https://doi.org/10.1002/jcc.21224

################################################################################

  Solution written to file: solvated_150/1Pa_5permanganate_N,N-dimethylformamide.xyz

--------------------------------------------------------------------------------

   Running time:    2.11429968E-02  seconds. 

--------------------------------------------------------------------------------


