
################################################################################

 PACKMOL - Packing optimization for the automated generation of
 starting configurations for molecular dynamics simulations.
 
                                                             Version 21.1.2 

################################################################################

  Packmol must be run with: packmol < inputfile.inp 

  Userguide at: http://m3g.iqm.unicamp.br/packmol 

  Reading input file... (Control-C aborts)
  Types of coordinate files specified: xyz
  Periodic boundary condition activated: 
    Minimum coordinates:     0.00    0.00    0.00
    Maximum coordinates:    13.22   13.22   13.22
  Seed for random number generator:      1234567
  Output file: solvated_150/1Pa_5hexafluorophosphate_toluene.xyz
  Reading coordinate file: ../structures/Pa.xyz
  Reading coordinate file: ../structures/hexafluorophosphate.xyz
  Reading coordinate file: ../structures/toluene.xyz
  Number of independent structures:            3
  The structures are: 
  Structure            1 :Properties=species:S:1:pos:R:3 iupac_name=Pa pbc="F F F"(           1  atoms)
  Structure            2 :Properties=species:S:1:pos:R:3 iupac_name=hexafluorophosphate pbc="F F F"(           7  atoms)
  Structure            3 :Properties=species:S:1:pos:R:3 iupac_name=toluene pbc="F F F"(          15  atoms)
  Maximum number of GENCAN loops for all molecule packing:          600
  Distance tolerance:    2.0000000000000000     
  Number of molecules of type            1 :            1
  Number of molecules of type            2 :            5
  Number of molecules of type            3 :            7
  Total number of restrictions:            3
  Total number of atoms:          141
  Total number of molecules:           13
  Number of fixed molecules:            0
  Number of free molecules:           13
  Number of variables:           78
  Total number of fixed atoms:            0
  PBC on: Constraint automatically added to non-fixed atoms:
  -> inside box     0.00    0.00    0.00   13.22   13.22   13.22
  Updated total number of restrictions:            4
  Maximum internal distance of type            1 :    0.0000000000000000     
  Maximum internal distance of type            2 :    2.7542579841038859     
  Maximum internal distance of type            3 :    5.8525991243207498     
  All atoms must be within these coordinates: 
   x: [   -1000.0000000000000      ,    1000.0000000000000       ] 
   y: [   -1000.0000000000000      ,    1000.0000000000000       ] 
   z: [   -1000.0000000000000      ,    1000.0000000000000       ] 
  If the system is larger than this, increase the sidemax parameter. 

################################################################################

  Building initial approximation ... 

################################################################################

  Adjusting initial point to fit the constraints 

--------------------------------------------------------------------------------

--------------------------------------------------------------------------------

  Molecules of type:            1

  Packing:|0                                                        100%|
          |******

  Restraint-only function value:    1.7288461496472697E-014
  Maximum violation of the restraints:    1.7288461496472697E-014

--------------------------------------------------------------------------------

  Molecules of type:            2

  Packing:|0                                                        100%|
          |*********************

  Restraint-only function value:    0.0000000000000000     
  Maximum violation of the restraints:    0.0000000000000000     

--------------------------------------------------------------------------------

  Molecules of type:            3

  Packing:|0                                                        100%|
          |***************************

  Restraint-only function value:    1.1865839358798379E-002
  Maximum violation of the restraints:    7.4392725977099677E-003

--------------------------------------------------------------------------------

  Rescaling maximum and minimum coordinates... 
  Mininum and maximum coordinates after constraint fitting: 
   x: [   -5.3957019406106655E-004 ,    13.285684602851051       ] 
   y: [    2.9397416451825663E-003 ,    13.224695874727971       ] 
   z: [   -4.5607487263811780E-002 ,    13.224599549267907       ] 
  Computing size of patches... 
  Number of cells in each direction and cell sides: 
   x:            5  cells of size    2.6449391563507230     
   y:            5  cells of size    2.6449391563507230     
   z:            5  cells of size    2.6449391563507230     
  Cell-system length:   13.22470  13.22470  13.22470
  Reseting center of mass... 

--------------------------------------------------------------------------------

  Setting initial trial coordinates ... 

--------------------------------------------------------------------------------

--------------------------------------------------------------------------------

  Molecules of type:            1
  Adjusting random positions to fit the constraints. 
  Restraint-only function value:    1.7288461496472697E-014
  Maximum violation of the restraints:    1.7288461496472697E-014

--------------------------------------------------------------------------------

  Molecules of type:            2
  Adjusting random positions to fit the constraints. 
  Restraint-only function value:    0.0000000000000000     
  Maximum violation of the restraints:    0.0000000000000000     

--------------------------------------------------------------------------------

  Molecules of type:            3
  Adjusting random positions to fit the constraints. 
  Packing:|0                                                        100%|
          |******
  Restraint-only function value:    4.3599538686854245E-005
  Maximum violation of the restraints:    4.3599538686854245E-005

################################################################################

  Objective function at initial point:    608.04202109348319     

################################################################################

  Packing molecules of type:            1

################################################################################


  Initial approximation is a solution. Nothing to do. 

  Current point written to file: solvated_150/1Pa_5hexafluorophosphate_toluene.xyz
--------------------------------------------------------------------------------
  Packing solved for molecules of type           1
  Objective function value:    1.7288461496472697E-014
  Maximum violation of target distance:    0.0000000000000000     
  Max. constraint violation:    1.7288461496472697E-014
--------------------------------------------------------------------------------

################################################################################

  Packing molecules of type:            2

################################################################################


--------------------------------------------------------------------------------

  Starting GENCAN loop:            0
  Scaling radii by:    1.1000000000000001     

  Packing:|0                                                        100%|
          |************

  Function value from last GENCAN loop: f = .25389E-02
  Best function value before: f = .67901E+02
  Improvement from best function value:    99.99 %
  Improvement from last loop:    99.99 %
  Maximum violation of target distance:     0.000000
  Maximum violation of the constraints: .13932E-02
  Current structure written to file: solvated_150/1Pa_5hexafluorophosphate_toluene.xyz
--------------------------------------------------------------------------------
  Packing solved for molecules of type           2
  Objective function value:    2.5388906233421533E-003
  Maximum violation of target distance:    0.0000000000000000     
  Max. constraint violation:    1.3931845688614480E-003
--------------------------------------------------------------------------------

################################################################################

  Packing molecules of type:            3

################################################################################


--------------------------------------------------------------------------------

  Starting GENCAN loop:            0
  Scaling radii by:    1.1000000000000001     

  Packing:|0                                                        100%|
          |***************************************************

  Function value from last GENCAN loop: f = .90528E-02
  Best function value before: f = .52381E+03
  Improvement from best function value:    99.99 %
  Improvement from last loop:    99.99 %
  Maximum violation of target distance:     0.000000
  Maximum violation of the constraints: .64480E-02
  Current structure written to file: solvated_150/1Pa_5hexafluorophosphate_toluene.xyz
--------------------------------------------------------------------------------
  Packing solved for molecules of type           3
  Objective function value:    9.0527847259457561E-003
  Maximum violation of target distance:    0.0000000000000000     
  Max. constraint violation:    6.4479675114798157E-003
--------------------------------------------------------------------------------

################################################################################

  Packing all molecules together 

################################################################################


--------------------------------------------------------------------------------

  Starting GENCAN loop:            0
  Scaling radii by:    1.1000000000000001     

  Packing:|0                                                        100%|
          |******************************************************

  Function value from last GENCAN loop: f = .16449E-01
  Best function value before: f = .15888E+03
  Improvement from best function value:    99.99 %
  Improvement from last loop:    99.99 %
  Maximum violation of target distance:     0.000000
  Maximum violation of the constraints: .85159E-02

################################################################################

                                 Success! 
              Final objective function value: .16449E-01
              Maximum violation of target distance:   0.000000
              Maximum violation of the constraints: .85159E-02

--------------------------------------------------------------------------------

              Please cite this work if Packmol was useful: 

           L. Martinez, R. Andrade, E. G. Birgin, J. M. Martinez, 
         PACKMOL: A package for building initial configurations for
                   molecular dynamics simulations. 
        Journal of Computational Chemistry, 30(13) pp. 2157-2164, 2009.
                  https://doi.org/10.1002/jcc.21224

################################################################################

  Solution written to file: solvated_150/1Pa_5hexafluorophosphate_toluene.xyz

--------------------------------------------------------------------------------

   Running time:    2.46709995E-02  seconds. 

--------------------------------------------------------------------------------


