
################################################################################

 PACKMOL - Packing optimization for the automated generation of
 starting configurations for molecular dynamics simulations.
 
                                                             Version 21.1.2 

################################################################################

  Packmol must be run with: packmol < inputfile.inp 

  Userguide at: http://m3g.iqm.unicamp.br/packmol 

  Reading input file... (Control-C aborts)
  Types of coordinate files specified: xyz
  Periodic boundary condition activated: 
    Minimum coordinates:     0.00    0.00    0.00
    Maximum coordinates:    13.09   13.09   13.09
  Seed for random number generator:      1234567
  Output file: solvated_150/1Pa_5chlorite_methylsulfinylmethane.xyz
  Reading coordinate file: ../structures/Pa.xyz
  Reading coordinate file: ../structures/chlorite.xyz
  Reading coordinate file: ../structures/methylsulfinylmethane.xyz
  Number of independent structures:            3
  The structures are: 
  Structure            1 :Properties=species:S:1:pos:R:3 iupac_name=Pa pbc="F F F"(           1  atoms)
  Structure            2 :Properties=species:S:1:pos:R:3 iupac_name=chlorite pbc="F F F"(           3  atoms)
  Structure            3 :Properties=species:S:1:pos:R:3 iupac_name=methylsulfinylmethane pbc="F F F"(          10  atoms)
  Maximum number of GENCAN loops for all molecule packing:          600
  Distance tolerance:    2.0000000000000000     
  Number of molecules of type            1 :            1
  Number of molecules of type            2 :            5
  Number of molecules of type            3 :           13
  Total number of restrictions:            3
  Total number of atoms:          146
  Total number of molecules:           19
  Number of fixed molecules:            0
  Number of free molecules:           19
  Number of variables:          114
  Total number of fixed atoms:            0
  PBC on: Constraint automatically added to non-fixed atoms:
  -> inside box     0.00    0.00    0.00   13.09   13.09   13.09
  Updated total number of restrictions:            4
  Maximum internal distance of type            1 :    0.0000000000000000     
  Maximum internal distance of type            2 :    2.1268392388236590     
  Maximum internal distance of type            3 :    4.5884748326649891     
  All atoms must be within these coordinates: 
   x: [   -1000.0000000000000      ,    1000.0000000000000       ] 
   y: [   -1000.0000000000000      ,    1000.0000000000000       ] 
   z: [   -1000.0000000000000      ,    1000.0000000000000       ] 
  If the system is larger than this, increase the sidemax parameter. 

################################################################################

  Building initial approximation ... 

################################################################################

  Adjusting initial point to fit the constraints 

--------------------------------------------------------------------------------

--------------------------------------------------------------------------------

  Molecules of type:            1

  Packing:|0                                                        100%|
          |******

  Restraint-only function value:    1.8789455381282999E-014
  Maximum violation of the restraints:    1.8789455381282999E-014

--------------------------------------------------------------------------------

  Molecules of type:            2

  Packing:|0                                                        100%|
          |***************

  Restraint-only function value:    3.7261811688297933E-003
  Maximum violation of the restraints:    3.7260433777357230E-003

--------------------------------------------------------------------------------

  Molecules of type:            3

  Packing:|0                                                        100%|
          |*********************

  Restraint-only function value:    5.3744917779288259E-004
  Maximum violation of the restraints:    2.1511627793554614E-004

--------------------------------------------------------------------------------

  Rescaling maximum and minimum coordinates... 
  Mininum and maximum coordinates after constraint fitting: 
   x: [   -1.2729896028707689E-003 ,    13.095239134838790       ] 
   y: [    7.9741715084523136E-003 ,    13.129261295879493       ] 
   z: [   -5.2522727672033866E-004 ,    13.096488361024555       ] 
  Computing size of patches... 
  Number of cells in each direction and cell sides: 
   x:            5  cells of size    2.6172234674033761     
   y:            5  cells of size    2.6172234674033761     
   z:            5  cells of size    2.6172234674033761     
  Cell-system length:   13.08612  13.08612  13.08612
  Reseting center of mass... 

--------------------------------------------------------------------------------

  Setting initial trial coordinates ... 

--------------------------------------------------------------------------------

--------------------------------------------------------------------------------

  Molecules of type:            1
  Adjusting random positions to fit the constraints. 
  Restraint-only function value:    1.8789455381282999E-014
  Maximum violation of the restraints:    1.8789455381282999E-014

--------------------------------------------------------------------------------

  Molecules of type:            2
  Adjusting random positions to fit the constraints. 
  Packing:|0                                                        100%|
          |***
  Restraint-only function value:    7.0593521358127860E-005
  Maximum violation of the restraints:    7.0593521358127860E-005

--------------------------------------------------------------------------------

  Molecules of type:            3
  Adjusting random positions to fit the constraints. 
  Packing:|0                                                        100%|
          |***
  Restraint-only function value:    6.3549861556741844E-003
  Maximum violation of the restraints:    6.1173751644048886E-003

################################################################################

  Objective function at initial point:    427.90027368517599     

################################################################################

  Packing molecules of type:            1

################################################################################


  Initial approximation is a solution. Nothing to do. 

  Current point written to file: solvated_150/1Pa_5chlorite_methylsulfinylmethane.xyz
--------------------------------------------------------------------------------
  Packing solved for molecules of type           1
  Objective function value:    1.8789455381282999E-014
  Maximum violation of target distance:    0.0000000000000000     
  Max. constraint violation:    1.8789455381282999E-014
--------------------------------------------------------------------------------

################################################################################

  Packing molecules of type:            2

################################################################################


  Initial approximation is a solution. Nothing to do. 

  Current point written to file: solvated_150/1Pa_5chlorite_methylsulfinylmethane.xyz
--------------------------------------------------------------------------------
  Packing solved for molecules of type           2
  Objective function value:   0.60182967574633950     
  Maximum violation of target distance:    0.0000000000000000     
  Max. constraint violation:    7.0593521358127860E-005
--------------------------------------------------------------------------------

################################################################################

  Packing molecules of type:            3

################################################################################


--------------------------------------------------------------------------------

  Starting GENCAN loop:            0
  Scaling radii by:    1.1000000000000001     

  Packing:|0                                                        100%|
          |*************************************************************|


  Function value from last GENCAN loop: f = .94187E-03
  Best function value before: f = .39177E+03
  Improvement from best function value:    99.99 %
  Improvement from last loop:    99.99 %
  Maximum violation of target distance:     0.000000
  Maximum violation of the constraints: .82389E-03
  Current structure written to file: solvated_150/1Pa_5chlorite_methylsulfinylmethane.xyz
--------------------------------------------------------------------------------
  Packing solved for molecules of type           3
  Objective function value:    9.4186820324190681E-004
  Maximum violation of target distance:    0.0000000000000000     
  Max. constraint violation:    8.2388777628808170E-004
--------------------------------------------------------------------------------

################################################################################

  Packing all molecules together 

################################################################################


--------------------------------------------------------------------------------

  Starting GENCAN loop:            0
  Scaling radii by:    1.1000000000000001     

  Packing:|0                                                        100%|
          |******************************

  Function value from last GENCAN loop: f = .58789E-02
  Best function value before: f = .10226E+03
  Improvement from best function value:    99.99 %
  Improvement from last loop:    99.99 %
  Maximum violation of target distance:     0.000000
  Maximum violation of the constraints: .39126E-02

################################################################################

                                 Success! 
              Final objective function value: .58789E-02
              Maximum violation of target distance:   0.000000
              Maximum violation of the constraints: .39126E-02

--------------------------------------------------------------------------------

              Please cite this work if Packmol was useful: 

           L. Martinez, R. Andrade, E. G. Birgin, J. M. Martinez, 
         PACKMOL: A package for building initial configurations for
                   molecular dynamics simulations. 
        Journal of Computational Chemistry, 30(13) pp. 2157-2164, 2009.
                  https://doi.org/10.1002/jcc.21224

################################################################################

  Solution written to file: solvated_150/1Pa_5chlorite_methylsulfinylmethane.xyz

--------------------------------------------------------------------------------

   Running time:    2.91280001E-02  seconds. 

--------------------------------------------------------------------------------


