
################################################################################

 PACKMOL - Packing optimization for the automated generation of
 starting configurations for molecular dynamics simulations.
 
                                                             Version 21.1.2 

################################################################################

  Packmol must be run with: packmol < inputfile.inp 

  Userguide at: http://m3g.iqm.unicamp.br/packmol 

  Reading input file... (Control-C aborts)
  Types of coordinate files specified: xyz
  Periodic boundary condition activated: 
    Minimum coordinates:     0.00    0.00    0.00
    Maximum coordinates:    12.66   12.66   12.66
  Seed for random number generator:      1234567
  Output file: solvated_150/1Pa_5Br_methanol.xyz
  Reading coordinate file: ../structures/Pa.xyz
  Reading coordinate file: ../structures/Br.xyz
  Reading coordinate file: ../structures/methanol.xyz
  Number of independent structures:            3
  The structures are: 
  Structure            1 :Properties=species:S:1:pos:R:3 iupac_name=Pa pbc="F F F"(           1  atoms)
  Structure            2 :Properties=species:S:1:pos:R:3 iupac_name=Br pbc="F F F"(           1  atoms)
  Structure            3 :Properties=species:S:1:pos:R:3 iupac_name=methanol pbc="F F F"(           6  atoms)
  Maximum number of GENCAN loops for all molecule packing:          600
  Distance tolerance:    2.0000000000000000     
  Number of molecules of type            1 :            1
  Number of molecules of type            2 :            5
  Number of molecules of type            3 :           24
  Total number of restrictions:            3
  Total number of atoms:          150
  Total number of molecules:           30
  Number of fixed molecules:            0
  Number of free molecules:           30
  Number of variables:          180
  Total number of fixed atoms:            0
  PBC on: Constraint automatically added to non-fixed atoms:
  -> inside box     0.00    0.00    0.00   12.66   12.66   12.66
  Updated total number of restrictions:            4
  Maximum internal distance of type            1 :    0.0000000000000000     
  Maximum internal distance of type            2 :    0.0000000000000000     
  Maximum internal distance of type            3 :    2.8429210119171442     
  All atoms must be within these coordinates: 
   x: [   -1000.0000000000000      ,    1000.0000000000000       ] 
   y: [   -1000.0000000000000      ,    1000.0000000000000       ] 
   z: [   -1000.0000000000000      ,    1000.0000000000000       ] 
  If the system is larger than this, increase the sidemax parameter. 

################################################################################

  Building initial approximation ... 

################################################################################

  Adjusting initial point to fit the constraints 

--------------------------------------------------------------------------------

--------------------------------------------------------------------------------

  Molecules of type:            1

  Packing:|0                                                        100%|
          |******

  Restraint-only function value:    2.2382335238308055E-014
  Maximum violation of the restraints:    2.2382335238308055E-014

--------------------------------------------------------------------------------

  Molecules of type:            2

  Packing:|0                                                        100%|
          |******

  Restraint-only function value:    3.1129198316031406E-015
  Maximum violation of the restraints:    8.8959268921283577E-016

--------------------------------------------------------------------------------

  Molecules of type:            3

  Packing:|0                                                        100%|
          |*********************

  Restraint-only function value:    8.2252676738211431E-004
  Maximum violation of the restraints:    4.1832847561569481E-004

--------------------------------------------------------------------------------

  Rescaling maximum and minimum coordinates... 
  Mininum and maximum coordinates after constraint fitting: 
   x: [   -1.3099880113095194E-002 ,    12.660437896191311       ] 
   y: [   -5.0291175815590193E-003 ,    12.674900367909034       ] 
   z: [   -2.9775073073778913E-008 ,    12.660437850858045       ] 
  Computing size of patches... 
  Number of cells in each direction and cell sides: 
   x:            5  cells of size    2.5320875712892730     
   y:            5  cells of size    2.5320875712892730     
   z:            5  cells of size    2.5320875712892730     
  Cell-system length:   12.66044  12.66044  12.66044
  Reseting center of mass... 

--------------------------------------------------------------------------------

  Setting initial trial coordinates ... 

--------------------------------------------------------------------------------

--------------------------------------------------------------------------------

  Molecules of type:            1
  Adjusting random positions to fit the constraints. 
  Restraint-only function value:    2.2382335238308055E-014
  Maximum violation of the restraints:    2.2382335238308055E-014

--------------------------------------------------------------------------------

  Molecules of type:            2
  Adjusting random positions to fit the constraints. 
  Restraint-only function value:    3.0998982693635865E-016
  Maximum violation of the restraints:    2.8980725465882276E-016

--------------------------------------------------------------------------------

  Molecules of type:            3
  Adjusting random positions to fit the constraints. 
  Packing:|0                                                        100%|
          |***
  Restraint-only function value:    0.0000000000000000     
  Maximum violation of the restraints:    0.0000000000000000     

################################################################################

  Objective function at initial point:    649.81234408121134     

################################################################################

  Packing molecules of type:            1

################################################################################


  Initial approximation is a solution. Nothing to do. 

  Current point written to file: solvated_150/1Pa_5Br_methanol.xyz
--------------------------------------------------------------------------------
  Packing solved for molecules of type           1
  Objective function value:    2.2382335238308055E-014
  Maximum violation of target distance:    0.0000000000000000     
  Max. constraint violation:    2.2382335238308055E-014
--------------------------------------------------------------------------------

################################################################################

  Packing molecules of type:            2

################################################################################


  Initial approximation is a solution. Nothing to do. 

  Current point written to file: solvated_150/1Pa_5Br_methanol.xyz
--------------------------------------------------------------------------------
  Packing solved for molecules of type           2
  Objective function value:    3.0998982693635865E-016
  Maximum violation of target distance:    0.0000000000000000     
  Max. constraint violation:    2.8980725465882276E-016
--------------------------------------------------------------------------------

################################################################################

  Packing molecules of type:            3

################################################################################


--------------------------------------------------------------------------------

  Starting GENCAN loop:            0
  Scaling radii by:    1.1000000000000001     

  Packing:|0                                                        100%|
          |***************************************

  Function value from last GENCAN loop: f = .34758E-02
  Best function value before: f = .62764E+03
  Improvement from best function value:    99.99 %
  Improvement from last loop:    99.99 %
  Maximum violation of target distance:     0.000000
  Maximum violation of the constraints: .17913E-02
  Current structure written to file: solvated_150/1Pa_5Br_methanol.xyz
--------------------------------------------------------------------------------
  Packing solved for molecules of type           3
  Objective function value:    3.4757970143391315E-003
  Maximum violation of target distance:    0.0000000000000000     
  Max. constraint violation:    1.7913039701559967E-003
--------------------------------------------------------------------------------

################################################################################

  Packing all molecules together 

################################################################################


--------------------------------------------------------------------------------

  Starting GENCAN loop:            0
  Scaling radii by:    1.1000000000000001     

  Packing:|0                                                        100%|
          |******************

  Function value from last GENCAN loop: f = .18981E-02
  Best function value before: f = .29438E+02
  Improvement from best function value:    99.99 %
  Improvement from last loop:    99.99 %
  Maximum violation of target distance:     0.000000
  Maximum violation of the constraints: .86727E-03

################################################################################

                                 Success! 
              Final objective function value: .18981E-02
              Maximum violation of target distance:   0.000000
              Maximum violation of the constraints: .86727E-03

--------------------------------------------------------------------------------

              Please cite this work if Packmol was useful: 

           L. Martinez, R. Andrade, E. G. Birgin, J. M. Martinez, 
         PACKMOL: A package for building initial configurations for
                   molecular dynamics simulations. 
        Journal of Computational Chemistry, 30(13) pp. 2157-2164, 2009.
                  https://doi.org/10.1002/jcc.21224

################################################################################

  Solution written to file: solvated_150/1Pa_5Br_methanol.xyz

--------------------------------------------------------------------------------

   Running time:    1.93590000E-02  seconds. 

--------------------------------------------------------------------------------


