
################################################################################

 PACKMOL - Packing optimization for the automated generation of
 starting configurations for molecular dynamics simulations.
 
                                                             Version 21.1.2 

################################################################################

  Packmol must be run with: packmol < inputfile.inp 

  Userguide at: http://m3g.iqm.unicamp.br/packmol 

  Reading input file... (Control-C aborts)
  Types of coordinate files specified: xyz
  Periodic boundary condition activated: 
    Minimum coordinates:     0.00    0.00    0.00
    Maximum coordinates:    12.81   12.81   12.81
  Seed for random number generator:      1234567
  Output file: solvated_150/1Pa_5isocyanate_1,3-dioxolan-2-one.xyz
  Reading coordinate file: ../structures/Pa.xyz
  Reading coordinate file: ../structures/isocyanate.xyz
  Reading coordinate file: ../structures/1,3-dioxolan-2-one.xyz
  Number of independent structures:            3
  The structures are: 
  Structure            1 :Properties=species:S:1:pos:R:3 iupac_name=Pa pbc="F F F"(           1  atoms)
  Structure            2 :Properties=species:S:1:pos:R:3 iupac_name=isocyanate pbc="F F F"(           3  atoms)
  Structure            3 :Properties=species:S:1:pos:R:3 iupac_name=1,3-dioxolan-2-one pbc="F F F"(          10  atoms)
  Maximum number of GENCAN loops for all molecule packing:          600
  Distance tolerance:    2.0000000000000000     
  Number of molecules of type            1 :            1
  Number of molecules of type            2 :            5
  Number of molecules of type            3 :           13
  Total number of restrictions:            3
  Total number of atoms:          146
  Total number of molecules:           19
  Number of fixed molecules:            0
  Number of free molecules:           19
  Number of variables:          114
  Total number of fixed atoms:            0
  PBC on: Constraint automatically added to non-fixed atoms:
  -> inside box     0.00    0.00    0.00   12.81   12.81   12.81
  Updated total number of restrictions:            4
  Maximum internal distance of type            1 :    0.0000000000000000     
  Maximum internal distance of type            2 :    2.5570000000000004     
  Maximum internal distance of type            3 :    4.2728366537933553     
  All atoms must be within these coordinates: 
   x: [   -1000.0000000000000      ,    1000.0000000000000       ] 
   y: [   -1000.0000000000000      ,    1000.0000000000000       ] 
   z: [   -1000.0000000000000      ,    1000.0000000000000       ] 
  If the system is larger than this, increase the sidemax parameter. 

################################################################################

  Building initial approximation ... 

################################################################################

  Adjusting initial point to fit the constraints 

--------------------------------------------------------------------------------

--------------------------------------------------------------------------------

  Molecules of type:            1

  Packing:|0                                                        100%|
          |******

  Restraint-only function value:    2.3979874154974527E-014
  Maximum violation of the restraints:    2.3979874154974527E-014

--------------------------------------------------------------------------------

  Molecules of type:            2

  Packing:|0                                                        100%|
          |************

  Restraint-only function value:    7.9237099648754496E-004
  Maximum violation of the restraints:    6.3467554960192768E-004

--------------------------------------------------------------------------------

  Molecules of type:            3

  Packing:|0                                                        100%|
          |*********************

  Restraint-only function value:    1.1968168722094602E-005
  Maximum violation of the restraints:    1.1968168722094602E-005

--------------------------------------------------------------------------------

  Rescaling maximum and minimum coordinates... 
  Mininum and maximum coordinates after constraint fitting: 
   x: [    2.7950941473975534E-004 ,    12.812626923377920       ] 
   y: [    9.1750986054541517E-003 ,    12.828990952408251       ] 
   z: [   -8.2001993161447684E-003 ,    12.813623214276825       ] 
  Computing size of patches... 
  Number of cells in each direction and cell sides: 
   x:            5  cells of size    2.5622353950915051     
   y:            5  cells of size    2.5622353950915051     
   z:            5  cells of size    2.5622353950915051     
  Cell-system length:   12.81118  12.81118  12.81118
  Reseting center of mass... 

--------------------------------------------------------------------------------

  Setting initial trial coordinates ... 

--------------------------------------------------------------------------------

--------------------------------------------------------------------------------

  Molecules of type:            1
  Adjusting random positions to fit the constraints. 
  Restraint-only function value:    2.3979874154974527E-014
  Maximum violation of the restraints:    2.3979874154974527E-014

--------------------------------------------------------------------------------

  Molecules of type:            2
  Adjusting random positions to fit the constraints. 
  Packing:|0                                                        100%|
          |***
  Restraint-only function value:    0.0000000000000000     
  Maximum violation of the restraints:    0.0000000000000000     

--------------------------------------------------------------------------------

  Molecules of type:            3
  Adjusting random positions to fit the constraints. 
  Packing:|0                                                        100%|
          |***
  Restraint-only function value:    0.0000000000000000     
  Maximum violation of the restraints:    0.0000000000000000     

################################################################################

  Objective function at initial point:    895.62758742889173     

################################################################################

  Packing molecules of type:            1

################################################################################


  Initial approximation is a solution. Nothing to do. 

  Current point written to file: solvated_150/1Pa_5isocyanate_1,3-dioxolan-2-one.xyz
--------------------------------------------------------------------------------
  Packing solved for molecules of type           1
  Objective function value:    2.3979874154974527E-014
  Maximum violation of target distance:    0.0000000000000000     
  Max. constraint violation:    2.3979874154974527E-014
--------------------------------------------------------------------------------

################################################################################

  Packing molecules of type:            2

################################################################################


--------------------------------------------------------------------------------

  Starting GENCAN loop:            0
  Scaling radii by:    1.1000000000000001     

  Packing:|0                                                        100%|
          |***

  Function value from last GENCAN loop: f = .33863E-02
  Best function value before: f = .93719E+01
  Improvement from best function value:    99.96 %
  Improvement from last loop:    99.96 %
  Maximum violation of target distance:     0.000000
  Maximum violation of the constraints: .33863E-02
  Current structure written to file: solvated_150/1Pa_5isocyanate_1,3-dioxolan-2-one.xyz
--------------------------------------------------------------------------------
  Packing solved for molecules of type           2
  Objective function value:    3.3862656973122152E-003
  Maximum violation of target distance:    0.0000000000000000     
  Max. constraint violation:    3.3862656973122152E-003
--------------------------------------------------------------------------------

################################################################################

  Packing molecules of type:            3

################################################################################


--------------------------------------------------------------------------------

  Starting GENCAN loop:            0
  Scaling radii by:    1.1000000000000001     

  Packing:|0                                                        100%|
          |***************************

  Function value from last GENCAN loop: f = .20860E-04
  Best function value before: f = .86391E+03
  Improvement from best function value:    99.99 %
  Improvement from last loop:    99.99 %
  Maximum violation of target distance:     0.000000
  Maximum violation of the constraints: .20860E-04
  Current structure written to file: solvated_150/1Pa_5isocyanate_1,3-dioxolan-2-one.xyz
--------------------------------------------------------------------------------
  Packing solved for molecules of type           3
  Objective function value:    2.0859766890457687E-005
  Maximum violation of target distance:    0.0000000000000000     
  Max. constraint violation:    2.0859766890457687E-005
--------------------------------------------------------------------------------

################################################################################

  Packing all molecules together 

################################################################################


--------------------------------------------------------------------------------

  Starting GENCAN loop:            0
  Scaling radii by:    1.1000000000000001     

  Packing:|0                                                        100%|
          |************************************

  Function value from last GENCAN loop: f = .38463E-02
  Best function value before: f = .10843E+03
  Improvement from best function value:    99.99 %
  Improvement from last loop:    99.99 %
  Maximum violation of target distance:     0.000000
  Maximum violation of the constraints: .38463E-02

################################################################################

                                 Success! 
              Final objective function value: .38463E-02
              Maximum violation of target distance:   0.000000
              Maximum violation of the constraints: .38463E-02

--------------------------------------------------------------------------------

              Please cite this work if Packmol was useful: 

           L. Martinez, R. Andrade, E. G. Birgin, J. M. Martinez, 
         PACKMOL: A package for building initial configurations for
                   molecular dynamics simulations. 
        Journal of Computational Chemistry, 30(13) pp. 2157-2164, 2009.
                  https://doi.org/10.1002/jcc.21224

################################################################################

  Solution written to file: solvated_150/1Pa_5isocyanate_1,3-dioxolan-2-one.xyz

--------------------------------------------------------------------------------

   Running time:    1.69649981E-02  seconds. 

--------------------------------------------------------------------------------


