
################################################################################

 PACKMOL - Packing optimization for the automated generation of
 starting configurations for molecular dynamics simulations.
 
                                                             Version 21.1.2 

################################################################################

  Packmol must be run with: packmol < inputfile.inp 

  Userguide at: http://m3g.iqm.unicamp.br/packmol 

  Reading input file... (Control-C aborts)
  Types of coordinate files specified: xyz
  Periodic boundary condition activated: 
    Minimum coordinates:     0.00    0.00    0.00
    Maximum coordinates:    14.12   14.12   14.12
  Seed for random number generator:      1234567
  Output file: solvated_150/1Pa_5Cl_hexane.xyz
  Reading coordinate file: ../structures/Pa.xyz
  Reading coordinate file: ../structures/Cl.xyz
  Reading coordinate file: ../structures/hexane.xyz
  Number of independent structures:            3
  The structures are: 
  Structure            1 :Properties=species:S:1:pos:R:3 iupac_name=Pa pbc="F F F"(           1  atoms)
  Structure            2 :Properties=species:S:1:pos:R:3 iupac_name=Cl pbc="F F F"(           1  atoms)
  Structure            3 :Properties=species:S:1:pos:R:3 iupac_name=hexane pbc="F F F"(          20  atoms)
  Maximum number of GENCAN loops for all molecule packing:          600
  Distance tolerance:    2.0000000000000000     
  Number of molecules of type            1 :            1
  Number of molecules of type            2 :            5
  Number of molecules of type            3 :            7
  Total number of restrictions:            3
  Total number of atoms:          146
  Total number of molecules:           13
  Number of fixed molecules:            0
  Number of free molecules:           13
  Number of variables:           78
  Total number of fixed atoms:            0
  PBC on: Constraint automatically added to non-fixed atoms:
  -> inside box     0.00    0.00    0.00   14.12   14.12   14.12
  Updated total number of restrictions:            4
  Maximum internal distance of type            1 :    0.0000000000000000     
  Maximum internal distance of type            2 :    0.0000000000000000     
  Maximum internal distance of type            3 :    8.0946737815677299     
  All atoms must be within these coordinates: 
   x: [   -1000.0000000000000      ,    1000.0000000000000       ] 
   y: [   -1000.0000000000000      ,    1000.0000000000000       ] 
   z: [   -1000.0000000000000      ,    1000.0000000000000       ] 
  If the system is larger than this, increase the sidemax parameter. 

################################################################################

  Building initial approximation ... 

################################################################################

  Adjusting initial point to fit the constraints 

--------------------------------------------------------------------------------

--------------------------------------------------------------------------------

  Molecules of type:            1

  Packing:|0                                                        100%|
          |******

  Restraint-only function value:    1.7033375919283029E-014
  Maximum violation of the restraints:    1.7033375919283029E-014

--------------------------------------------------------------------------------

  Molecules of type:            2

  Packing:|0                                                        100%|
          |******

  Restraint-only function value:    9.5439518409942405E-015
  Maximum violation of the restraints:    6.3263002393478458E-015

--------------------------------------------------------------------------------

  Molecules of type:            3

  Packing:|0                                                        100%|
          |*********************************************

  Restraint-only function value:    2.5640571098719514E-004
  Maximum violation of the restraints:    1.2025196672577664E-004

--------------------------------------------------------------------------------

  Rescaling maximum and minimum coordinates... 
  Mininum and maximum coordinates after constraint fitting: 
   x: [   -3.8066900742705911E-009 ,    14.122849338283988       ] 
   y: [    3.3523147955531829E-006 ,    14.125976658623333       ] 
   z: [   -7.7540946191601455E-003 ,    14.128652094314480       ] 
  Computing size of patches... 
  Number of cells in each direction and cell sides: 
   x:            6  cells of size    2.3536157619707270     
   y:            6  cells of size    2.3536157619707270     
   z:            6  cells of size    2.3536157619707270     
  Cell-system length:   14.12169  14.12169  14.12169
  Reseting center of mass... 

--------------------------------------------------------------------------------

  Setting initial trial coordinates ... 

--------------------------------------------------------------------------------

--------------------------------------------------------------------------------

  Molecules of type:            1
  Adjusting random positions to fit the constraints. 
  Restraint-only function value:    1.7033375919283029E-014
  Maximum violation of the restraints:    1.7033375919283029E-014

--------------------------------------------------------------------------------

  Molecules of type:            2
  Adjusting random positions to fit the constraints. 
  Restraint-only function value:    1.5151881998615245E-015
  Maximum violation of the restraints:    1.2039496902091407E-015

--------------------------------------------------------------------------------

  Molecules of type:            3
  Adjusting random positions to fit the constraints. 
  Packing:|0                                                        100%|
          |************
  Restraint-only function value:    0.0000000000000000     
  Maximum violation of the restraints:    0.0000000000000000     

################################################################################

  Objective function at initial point:    218.58182624948952     

################################################################################

  Packing molecules of type:            1

################################################################################


  Initial approximation is a solution. Nothing to do. 

  Current point written to file: solvated_150/1Pa_5Cl_hexane.xyz
--------------------------------------------------------------------------------
  Packing solved for molecules of type           1
  Objective function value:    1.7033375919283029E-014
  Maximum violation of target distance:    0.0000000000000000     
  Max. constraint violation:    1.7033375919283029E-014
--------------------------------------------------------------------------------

################################################################################

  Packing molecules of type:            2

################################################################################


  Initial approximation is a solution. Nothing to do. 

  Current point written to file: solvated_150/1Pa_5Cl_hexane.xyz
--------------------------------------------------------------------------------
  Packing solved for molecules of type           2
  Objective function value:    1.5151881998615245E-015
  Maximum violation of target distance:    0.0000000000000000     
  Max. constraint violation:    1.2039496902091407E-015
--------------------------------------------------------------------------------

################################################################################

  Packing molecules of type:            3

################################################################################


--------------------------------------------------------------------------------

  Starting GENCAN loop:            0
  Scaling radii by:    1.1000000000000001     

  Packing:|0                                                        100%|
          |*********************************************

  Function value from last GENCAN loop: f = .97330E-02
  Best function value before: f = .20901E+03
  Improvement from best function value:    99.99 %
  Improvement from last loop:    99.99 %
  Maximum violation of target distance:     0.000000
  Maximum violation of the constraints: .97330E-02
  Current structure written to file: solvated_150/1Pa_5Cl_hexane.xyz
--------------------------------------------------------------------------------
  Packing solved for molecules of type           3
  Objective function value:    9.7330179008868704E-003
  Maximum violation of target distance:    0.0000000000000000     
  Max. constraint violation:    9.7330179008868704E-003
--------------------------------------------------------------------------------

################################################################################

  Packing all molecules together 

################################################################################


--------------------------------------------------------------------------------

  Starting GENCAN loop:            0
  Scaling radii by:    1.1000000000000001     

  Packing:|0                                                        100%|
          |******

  Function value from last GENCAN loop: f = .70154E-02
  Best function value before: f = .35856E+00
  Improvement from best function value:    98.04 %
  Improvement from last loop:    98.04 %
  Maximum violation of target distance:     0.000000
  Maximum violation of the constraints: .55779E-02

################################################################################

                                 Success! 
              Final objective function value: .70154E-02
              Maximum violation of target distance:   0.000000
              Maximum violation of the constraints: .55779E-02

--------------------------------------------------------------------------------

              Please cite this work if Packmol was useful: 

           L. Martinez, R. Andrade, E. G. Birgin, J. M. Martinez, 
         PACKMOL: A package for building initial configurations for
                   molecular dynamics simulations. 
        Journal of Computational Chemistry, 30(13) pp. 2157-2164, 2009.
                  https://doi.org/10.1002/jcc.21224

################################################################################

  Solution written to file: solvated_150/1Pa_5Cl_hexane.xyz

--------------------------------------------------------------------------------

   Running time:    1.66419968E-02  seconds. 

--------------------------------------------------------------------------------


