
################################################################################

 PACKMOL - Packing optimization for the automated generation of
 starting configurations for molecular dynamics simulations.
 
                                                             Version 21.1.2 

################################################################################

  Packmol must be run with: packmol < inputfile.inp 

  Userguide at: http://m3g.iqm.unicamp.br/packmol 

  Reading input file... (Control-C aborts)
  Types of coordinate files specified: xyz
  Periodic boundary condition activated: 
    Minimum coordinates:     0.00    0.00    0.00
    Maximum coordinates:    12.07   12.07   12.07
  Seed for random number generator:      1234567
  Output file: solvated_150/1Pa_5tetrafluoroborate_methanol.xyz
  Reading coordinate file: ../structures/Pa.xyz
  Reading coordinate file: ../structures/tetrafluoroborate.xyz
  Reading coordinate file: ../structures/methanol.xyz
  Number of independent structures:            3
  The structures are: 
  Structure            1 :Properties=species:S:1:pos:R:3 iupac_name=Pa pbc="F F F"(           1  atoms)
  Structure            2 :Properties=species:S:1:pos:R:3 iupac_name=tetrafluoroborate pbc="F F F"(           5  atoms)
  Structure            3 :Properties=species:S:1:pos:R:3 iupac_name=methanol pbc="F F F"(           6  atoms)
  Maximum number of GENCAN loops for all molecule packing:          600
  Distance tolerance:    2.0000000000000000     
  Number of molecules of type            1 :            1
  Number of molecules of type            2 :            5
  Number of molecules of type            3 :           20
  Total number of restrictions:            3
  Total number of atoms:          146
  Total number of molecules:           26
  Number of fixed molecules:            0
  Number of free molecules:           26
  Number of variables:          156
  Total number of fixed atoms:            0
  PBC on: Constraint automatically added to non-fixed atoms:
  -> inside box     0.00    0.00    0.00   12.07   12.07   12.07
  Updated total number of restrictions:            4
  Maximum internal distance of type            1 :    0.0000000000000000     
  Maximum internal distance of type            2 :    2.3741501496324950     
  Maximum internal distance of type            3 :    2.8429210119171442     
  All atoms must be within these coordinates: 
   x: [   -1000.0000000000000      ,    1000.0000000000000       ] 
   y: [   -1000.0000000000000      ,    1000.0000000000000       ] 
   z: [   -1000.0000000000000      ,    1000.0000000000000       ] 
  If the system is larger than this, increase the sidemax parameter. 

################################################################################

  Building initial approximation ... 

################################################################################

  Adjusting initial point to fit the constraints 

--------------------------------------------------------------------------------

--------------------------------------------------------------------------------

  Molecules of type:            1

  Packing:|0                                                        100%|
          |******

  Restraint-only function value:    1.7943043886376228E-014
  Maximum violation of the restraints:    1.7943043886376228E-014

--------------------------------------------------------------------------------

  Molecules of type:            2

  Packing:|0                                                        100%|
          |***************

  Restraint-only function value:    1.2238094763019863E-004
  Maximum violation of the restraints:    1.1384111563915425E-004

--------------------------------------------------------------------------------

  Molecules of type:            3

  Packing:|0                                                        100%|
          |*********************

  Restraint-only function value:    7.4564895852230343E-005
  Maximum violation of the restraints:    5.7018469140860432E-005

--------------------------------------------------------------------------------

  Rescaling maximum and minimum coordinates... 
  Mininum and maximum coordinates after constraint fitting: 
   x: [   -7.5445714139092835E-003 ,    12.073670317190132       ] 
   y: [    1.4611760453773102E-002 ,    12.072774733629839       ] 
   z: [   -5.6116604696399008E-009 ,    12.076047760077000       ] 
  Computing size of patches... 
  Number of cells in each direction and cell sides: 
   x:            5  cells of size    2.4141416712248538     
   y:            5  cells of size    2.4141416712248538     
   z:            5  cells of size    2.4141416712248538     
  Cell-system length:   12.07071  12.07071  12.07071
  Reseting center of mass... 

--------------------------------------------------------------------------------

  Setting initial trial coordinates ... 

--------------------------------------------------------------------------------

--------------------------------------------------------------------------------

  Molecules of type:            1
  Adjusting random positions to fit the constraints. 
  Restraint-only function value:    1.7943043886376228E-014
  Maximum violation of the restraints:    1.7943043886376228E-014

--------------------------------------------------------------------------------

  Molecules of type:            2
  Adjusting random positions to fit the constraints. 
  Packing:|0                                                        100%|
          |***
  Restraint-only function value:    0.0000000000000000     
  Maximum violation of the restraints:    0.0000000000000000     

--------------------------------------------------------------------------------

  Molecules of type:            3
  Adjusting random positions to fit the constraints. 
  Packing:|0                                                        100%|
          |******
  Restraint-only function value:    0.0000000000000000     
  Maximum violation of the restraints:    0.0000000000000000     

################################################################################

  Objective function at initial point:    386.32416836360386     

################################################################################

  Packing molecules of type:            1

################################################################################


  Initial approximation is a solution. Nothing to do. 

  Current point written to file: solvated_150/1Pa_5tetrafluoroborate_methanol.xyz
--------------------------------------------------------------------------------
  Packing solved for molecules of type           1
  Objective function value:    1.7943043886376228E-014
  Maximum violation of target distance:    0.0000000000000000     
  Max. constraint violation:    1.7943043886376228E-014
--------------------------------------------------------------------------------

################################################################################

  Packing molecules of type:            2

################################################################################


--------------------------------------------------------------------------------

  Starting GENCAN loop:            0
  Scaling radii by:    1.1000000000000001     

  Packing:|0                                                        100%|
          |***************

  Function value from last GENCAN loop: f = .38261E-02
  Best function value before: f = .93148E+02
  Improvement from best function value:    99.99 %
  Improvement from last loop:    99.99 %
  Maximum violation of target distance:     0.000000
  Maximum violation of the constraints: .38261E-02
  Current structure written to file: solvated_150/1Pa_5tetrafluoroborate_methanol.xyz
--------------------------------------------------------------------------------
  Packing solved for molecules of type           2
  Objective function value:    3.8260601360933571E-003
  Maximum violation of target distance:    0.0000000000000000     
  Max. constraint violation:    3.8260601360933571E-003
--------------------------------------------------------------------------------

################################################################################

  Packing molecules of type:            3

################################################################################


--------------------------------------------------------------------------------

  Starting GENCAN loop:            0
  Scaling radii by:    1.1000000000000001     

  Packing:|0                                                        100%|
          |******************************

  Function value from last GENCAN loop: f = .11586E-01
  Best function value before: f = .23528E+03
  Improvement from best function value:    99.99 %
  Improvement from last loop:    99.99 %
  Maximum violation of target distance:     0.000000
  Maximum violation of the constraints: .74653E-02
  Current structure written to file: solvated_150/1Pa_5tetrafluoroborate_methanol.xyz
--------------------------------------------------------------------------------
  Packing solved for molecules of type           3
  Objective function value:    1.1586052140372028E-002
  Maximum violation of target distance:    0.0000000000000000     
  Max. constraint violation:    7.4652709309350664E-003
--------------------------------------------------------------------------------

################################################################################

  Packing all molecules together 

################################################################################


--------------------------------------------------------------------------------

  Starting GENCAN loop:            0
  Scaling radii by:    1.1000000000000001     

  Packing:|0                                                        100%|
          |***************************************

  Function value from last GENCAN loop: f = .16168E-01
  Best function value before: f = .27559E+03
  Improvement from best function value:    99.99 %
  Improvement from last loop:    99.99 %
  Maximum violation of target distance:     0.000000
  Maximum violation of the constraints: .77877E-02

################################################################################

                                 Success! 
              Final objective function value: .16168E-01
              Maximum violation of target distance:   0.000000
              Maximum violation of the constraints: .77877E-02

--------------------------------------------------------------------------------

              Please cite this work if Packmol was useful: 

           L. Martinez, R. Andrade, E. G. Birgin, J. M. Martinez, 
         PACKMOL: A package for building initial configurations for
                   molecular dynamics simulations. 
        Journal of Computational Chemistry, 30(13) pp. 2157-2164, 2009.
                  https://doi.org/10.1002/jcc.21224

################################################################################

  Solution written to file: solvated_150/1Pa_5tetrafluoroborate_methanol.xyz

--------------------------------------------------------------------------------

   Running time:    2.22169980E-02  seconds. 

--------------------------------------------------------------------------------


