
################################################################################

 PACKMOL - Packing optimization for the automated generation of
 starting configurations for molecular dynamics simulations.
 
                                                             Version 21.1.2 

################################################################################

  Packmol must be run with: packmol < inputfile.inp 

  Userguide at: http://m3g.iqm.unicamp.br/packmol 

  Reading input file... (Control-C aborts)
  Types of coordinate files specified: xyz
  Periodic boundary condition activated: 
    Minimum coordinates:     0.00    0.00    0.00
    Maximum coordinates:    12.36   12.36   12.36
  Seed for random number generator:      1234567
  Output file: solvated_150/1Pa_5trifluoromethanesulfonate_methylsulfinylmethane.xyz
  Reading coordinate file: ../structures/Pa.xyz
  Reading coordinate file: ../structures/trifluoromethanesulfonate.xyz
  Reading coordinate file: ../structures/methylsulfinylmethane.xyz
  Number of independent structures:            3
  The structures are: 
  Structure            1 :Properties=species:S:1:pos:R:3 iupac_name=Pa pbc="F F F"(           1  atoms)
  Structure            2 :Properties=species:S:1:pos:R:3 iupac_name=trifluoromethanesulfonate pbc="F F F"(           8  atoms)
  Structure            3 :Properties=species:S:1:pos:R:3 iupac_name=methylsulfinylmethane pbc="F F F"(          10  atoms)
  Maximum number of GENCAN loops for all molecule packing:          600
  Distance tolerance:    2.0000000000000000     
  Number of molecules of type            1 :            1
  Number of molecules of type            2 :            5
  Number of molecules of type            3 :           10
  Total number of restrictions:            3
  Total number of atoms:          141
  Total number of molecules:           16
  Number of fixed molecules:            0
  Number of free molecules:           16
  Number of variables:           96
  Total number of fixed atoms:            0
  PBC on: Constraint automatically added to non-fixed atoms:
  -> inside box     0.00    0.00    0.00   12.36   12.36   12.36
  Updated total number of restrictions:            4
  Maximum internal distance of type            1 :    0.0000000000000000     
  Maximum internal distance of type            2 :    3.7274277538270275     
  Maximum internal distance of type            3 :    4.5884748326649891     
  All atoms must be within these coordinates: 
   x: [   -1000.0000000000000      ,    1000.0000000000000       ] 
   y: [   -1000.0000000000000      ,    1000.0000000000000       ] 
   z: [   -1000.0000000000000      ,    1000.0000000000000       ] 
  If the system is larger than this, increase the sidemax parameter. 

################################################################################

  Building initial approximation ... 

################################################################################

  Adjusting initial point to fit the constraints 

--------------------------------------------------------------------------------

--------------------------------------------------------------------------------

  Molecules of type:            1

  Packing:|0                                                        100%|
          |******

  Restraint-only function value:    1.7536862180905562E-014
  Maximum violation of the restraints:    1.7536862180905562E-014

--------------------------------------------------------------------------------

  Molecules of type:            2

  Packing:|0                                                        100%|
          |***************

  Restraint-only function value:    0.0000000000000000     
  Maximum violation of the restraints:    0.0000000000000000     

--------------------------------------------------------------------------------

  Molecules of type:            3

  Packing:|0                                                        100%|
          |************************

  Restraint-only function value:    2.7432072711244072E-004
  Maximum violation of the restraints:    2.6661076050607481E-004

--------------------------------------------------------------------------------

  Rescaling maximum and minimum coordinates... 
  Mininum and maximum coordinates after constraint fitting: 
   x: [    2.2117615119477147E-003 ,    12.357565907311127       ] 
   y: [   -1.1545794916463631E-002 ,    12.357566056169290       ] 
   z: [    7.7131474540692579E-009 ,    12.353253481990158       ] 
  Computing size of patches... 
  Number of cells in each direction and cell sides: 
   x:            5  cells of size    2.4715131925058778     
   y:            5  cells of size    2.4715131925058778     
   z:            5  cells of size    2.4715131925058778     
  Cell-system length:   12.35757  12.35757  12.35757
  Reseting center of mass... 

--------------------------------------------------------------------------------

  Setting initial trial coordinates ... 

--------------------------------------------------------------------------------

--------------------------------------------------------------------------------

  Molecules of type:            1
  Adjusting random positions to fit the constraints. 
  Restraint-only function value:    1.7536862180905562E-014
  Maximum violation of the restraints:    1.7536862180905562E-014

--------------------------------------------------------------------------------

  Molecules of type:            2
  Adjusting random positions to fit the constraints. 
  Packing:|0                                                        100%|
          |******
  Restraint-only function value:    1.4637671808200050E-006
  Maximum violation of the restraints:    1.4637671808200050E-006

--------------------------------------------------------------------------------

  Molecules of type:            3
  Adjusting random positions to fit the constraints. 
  Packing:|0                                                        100%|
          |***
  Restraint-only function value:    6.8774611944217104E-005
  Maximum violation of the restraints:    6.8774611944217104E-005

################################################################################

  Objective function at initial point:    423.02054591352879     

################################################################################

  Packing molecules of type:            1

################################################################################


  Initial approximation is a solution. Nothing to do. 

  Current point written to file: solvated_150/1Pa_5trifluoromethanesulfonate_methylsulfinylmethane.xyz
--------------------------------------------------------------------------------
  Packing solved for molecules of type           1
  Objective function value:    1.7536862180905562E-014
  Maximum violation of target distance:    0.0000000000000000     
  Max. constraint violation:    1.7536862180905562E-014
--------------------------------------------------------------------------------

################################################################################

  Packing molecules of type:            2

################################################################################


--------------------------------------------------------------------------------

  Starting GENCAN loop:            0
  Scaling radii by:    1.1000000000000001     

  Packing:|0                                                        100%|
          |******************

  Function value from last GENCAN loop: f = .18015E-02
  Best function value before: f = .31885E+02
  Improvement from best function value:    99.99 %
  Improvement from last loop:    99.99 %
  Maximum violation of target distance:     0.000000
  Maximum violation of the constraints: .90379E-03
  Current structure written to file: solvated_150/1Pa_5trifluoromethanesulfonate_methylsulfinylmethane.xyz
--------------------------------------------------------------------------------
  Packing solved for molecules of type           2
  Objective function value:    1.8014700175691164E-003
  Maximum violation of target distance:    0.0000000000000000     
  Max. constraint violation:    9.0378560209470357E-004
--------------------------------------------------------------------------------

################################################################################

  Packing molecules of type:            3

################################################################################


--------------------------------------------------------------------------------

  Starting GENCAN loop:            0
  Scaling radii by:    1.1000000000000001     

  Packing:|0                                                        100%|
          |******************************

  Function value from last GENCAN loop: f = .17147E-03
  Best function value before: f = .28088E+03
  Improvement from best function value:    99.99 %
  Improvement from last loop:    99.99 %
  Maximum violation of target distance:     0.000000
  Maximum violation of the constraints: .17147E-03
  Current structure written to file: solvated_150/1Pa_5trifluoromethanesulfonate_methylsulfinylmethane.xyz
--------------------------------------------------------------------------------
  Packing solved for molecules of type           3
  Objective function value:    1.7147017089038849E-004
  Maximum violation of target distance:    0.0000000000000000     
  Max. constraint violation:    1.7147017089038849E-004
--------------------------------------------------------------------------------

################################################################################

  Packing all molecules together 

################################################################################


--------------------------------------------------------------------------------

  Starting GENCAN loop:            0
  Scaling radii by:    1.1000000000000001     

  Packing:|0                                                        100%|
          |******************************************

  Function value from last GENCAN loop: f = .22897E-02
  Best function value before: f = .24712E+03
  Improvement from best function value:    99.99 %
  Improvement from last loop:    99.99 %
  Maximum violation of target distance:     0.000000
  Maximum violation of the constraints: .22896E-02

################################################################################

                                 Success! 
              Final objective function value: .22897E-02
              Maximum violation of target distance:   0.000000
              Maximum violation of the constraints: .22896E-02

--------------------------------------------------------------------------------

              Please cite this work if Packmol was useful: 

           L. Martinez, R. Andrade, E. G. Birgin, J. M. Martinez, 
         PACKMOL: A package for building initial configurations for
                   molecular dynamics simulations. 
        Journal of Computational Chemistry, 30(13) pp. 2157-2164, 2009.
                  https://doi.org/10.1002/jcc.21224

################################################################################

  Solution written to file: solvated_150/1Pa_5trifluoromethanesulfonate_methylsulfinylmethane.xyz

--------------------------------------------------------------------------------

   Running time:    1.84249990E-02  seconds. 

--------------------------------------------------------------------------------


