
################################################################################

 PACKMOL - Packing optimization for the automated generation of
 starting configurations for molecular dynamics simulations.
 
                                                             Version 21.1.2 

################################################################################

  Packmol must be run with: packmol < inputfile.inp 

  Userguide at: http://m3g.iqm.unicamp.br/packmol 

  Reading input file... (Control-C aborts)
  Types of coordinate files specified: xyz
  Periodic boundary condition activated: 
    Minimum coordinates:     0.00    0.00    0.00
    Maximum coordinates:    13.00   13.00   13.00
  Seed for random number generator:      1234567
  Output file: solvated_150/1Pa_5cyanide_acetic-acid.xyz
  Reading coordinate file: ../structures/Pa.xyz
  Reading coordinate file: ../structures/cyanide.xyz
  Reading coordinate file: ../structures/acetic-acid.xyz
  Number of independent structures:            3
  The structures are: 
  Structure            1 :Properties=species:S:1:pos:R:3 iupac_name=Pa pbc="F F F"(           1  atoms)
  Structure            2 :Properties=species:S:1:pos:R:3 iupac_name=cyanide pbc="F F F"(           2  atoms)
  Structure            3 :Properties=species:S:1:pos:R:3 iupac_name=acetic-acid pbc="F F F"(           8  atoms)
  Maximum number of GENCAN loops for all molecule packing:          600
  Distance tolerance:    2.0000000000000000     
  Number of molecules of type            1 :            1
  Number of molecules of type            2 :            5
  Number of molecules of type            3 :           17
  Total number of restrictions:            3
  Total number of atoms:          147
  Total number of molecules:           23
  Number of fixed molecules:            0
  Number of free molecules:           23
  Number of variables:          138
  Total number of fixed atoms:            0
  PBC on: Constraint automatically added to non-fixed atoms:
  -> inside box     0.00    0.00    0.00   13.00   13.00   13.00
  Updated total number of restrictions:            4
  Maximum internal distance of type            1 :    0.0000000000000000     
  Maximum internal distance of type            2 :    1.1133999999999999     
  Maximum internal distance of type            3 :    4.0492717592179464     
  All atoms must be within these coordinates: 
   x: [   -1000.0000000000000      ,    1000.0000000000000       ] 
   y: [   -1000.0000000000000      ,    1000.0000000000000       ] 
   z: [   -1000.0000000000000      ,    1000.0000000000000       ] 
  If the system is larger than this, increase the sidemax parameter. 

################################################################################

  Building initial approximation ... 

################################################################################

  Adjusting initial point to fit the constraints 

--------------------------------------------------------------------------------

--------------------------------------------------------------------------------

  Molecules of type:            1

  Packing:|0                                                        100%|
          |******

  Restraint-only function value:    2.4846884025809189E-014
  Maximum violation of the restraints:    2.4846884025809189E-014

--------------------------------------------------------------------------------

  Molecules of type:            2

  Packing:|0                                                        100%|
          |*********

  Restraint-only function value:    2.8655220763030094E-015
  Maximum violation of the restraints:    1.2063029296478461E-015

--------------------------------------------------------------------------------

  Molecules of type:            3

  Packing:|0                                                        100%|
          |***************************

  Restraint-only function value:    5.6157949562767552E-003
  Maximum violation of the restraints:    4.1258133963847895E-003

--------------------------------------------------------------------------------

  Rescaling maximum and minimum coordinates... 
  Mininum and maximum coordinates after constraint fitting: 
   x: [   -2.4559142184203485E-008 ,    12.997351030727046       ] 
   y: [   -4.5419232690484708E-002 ,    12.997351062789903       ] 
   z: [   -2.6859105397299049E-002 ,    12.997350980476677       ] 
  Computing size of patches... 
  Number of cells in each direction and cell sides: 
   x:            5  cells of size    2.5994701939282083     
   y:            5  cells of size    2.5994701939282083     
   z:            5  cells of size    2.5994701939282083     
  Cell-system length:   12.99735  12.99735  12.99735
  Reseting center of mass... 

--------------------------------------------------------------------------------

  Setting initial trial coordinates ... 

--------------------------------------------------------------------------------

--------------------------------------------------------------------------------

  Molecules of type:            1
  Adjusting random positions to fit the constraints. 
  Restraint-only function value:    2.4846884025809189E-014
  Maximum violation of the restraints:    2.4846884025809189E-014

--------------------------------------------------------------------------------

  Molecules of type:            2
  Adjusting random positions to fit the constraints. 
  Packing:|0                                                        100%|
          |***
  Restraint-only function value:    0.0000000000000000     
  Maximum violation of the restraints:    0.0000000000000000     

--------------------------------------------------------------------------------

  Molecules of type:            3
  Adjusting random positions to fit the constraints. 
  Packing:|0                                                        100%|
          |******
  Restraint-only function value:    6.6220153931523465E-005
  Maximum violation of the restraints:    6.6220153931523465E-005

################################################################################

  Objective function at initial point:    621.79361949754002     

################################################################################

  Packing molecules of type:            1

################################################################################


  Initial approximation is a solution. Nothing to do. 

  Current point written to file: solvated_150/1Pa_5cyanide_acetic-acid.xyz
--------------------------------------------------------------------------------
  Packing solved for molecules of type           1
  Objective function value:    2.4846884025809189E-014
  Maximum violation of target distance:    0.0000000000000000     
  Max. constraint violation:    2.4846884025809189E-014
--------------------------------------------------------------------------------

################################################################################

  Packing molecules of type:            2

################################################################################


--------------------------------------------------------------------------------

  Starting GENCAN loop:            0
  Scaling radii by:    1.1000000000000001     

  Packing:|0                                                        100%|
          |*********

  Function value from last GENCAN loop: f = .23330E-04
  Best function value before: f = .13803E+02
  Improvement from best function value:    99.99 %
  Improvement from last loop:    99.99 %
  Maximum violation of target distance:     0.000000
  Maximum violation of the constraints: .23330E-04
  Current structure written to file: solvated_150/1Pa_5cyanide_acetic-acid.xyz
--------------------------------------------------------------------------------
  Packing solved for molecules of type           2
  Objective function value:    2.3329607436378750E-005
  Maximum violation of target distance:    0.0000000000000000     
  Max. constraint violation:    2.3329607436378750E-005
--------------------------------------------------------------------------------

################################################################################

  Packing molecules of type:            3

################################################################################


--------------------------------------------------------------------------------

  Starting GENCAN loop:            0
  Scaling radii by:    1.1000000000000001     

  Packing:|0                                                        100%|
          |*********************************************************

  Function value from last GENCAN loop: f = .10102E-01
  Best function value before: f = .60350E+03
  Improvement from best function value:    99.99 %
  Improvement from last loop:    99.99 %
  Maximum violation of target distance:     0.000000
  Maximum violation of the constraints: .92608E-02
  Current structure written to file: solvated_150/1Pa_5cyanide_acetic-acid.xyz
--------------------------------------------------------------------------------
  Packing solved for molecules of type           3
  Objective function value:    1.0101931363371695E-002
  Maximum violation of target distance:    0.0000000000000000     
  Max. constraint violation:    9.2607600711885080E-003
--------------------------------------------------------------------------------

################################################################################

  Packing all molecules together 

################################################################################


--------------------------------------------------------------------------------

  Starting GENCAN loop:            0
  Scaling radii by:    1.1000000000000001     

  Packing:|0                                                        100%|
          |*********************************

  Function value from last GENCAN loop: f = .70779E-02
  Best function value before: f = .88346E+02
  Improvement from best function value:    99.99 %
  Improvement from last loop:    99.99 %
  Maximum violation of target distance:     0.000000
  Maximum violation of the constraints: .39215E-02

################################################################################

                                 Success! 
              Final objective function value: .70779E-02
              Maximum violation of target distance:   0.000000
              Maximum violation of the constraints: .39215E-02

--------------------------------------------------------------------------------

              Please cite this work if Packmol was useful: 

           L. Martinez, R. Andrade, E. G. Birgin, J. M. Martinez, 
         PACKMOL: A package for building initial configurations for
                   molecular dynamics simulations. 
        Journal of Computational Chemistry, 30(13) pp. 2157-2164, 2009.
                  https://doi.org/10.1002/jcc.21224

################################################################################

  Solution written to file: solvated_150/1Pa_5cyanide_acetic-acid.xyz

--------------------------------------------------------------------------------

   Running time:    3.65559980E-02  seconds. 

--------------------------------------------------------------------------------


