
################################################################################

 PACKMOL - Packing optimization for the automated generation of
 starting configurations for molecular dynamics simulations.
 
                                                             Version 21.1.2 

################################################################################

  Packmol must be run with: packmol < inputfile.inp 

  Userguide at: http://m3g.iqm.unicamp.br/packmol 

  Reading input file... (Control-C aborts)
  Types of coordinate files specified: xyz
  Periodic boundary condition activated: 
    Minimum coordinates:     0.00    0.00    0.00
    Maximum coordinates:    13.22   13.22   13.22
  Seed for random number generator:      1234567
  Output file: solvated_150/1Pr_3F_toluene.xyz
  Reading coordinate file: ../structures/Pr.xyz
  Reading coordinate file: ../structures/F.xyz
  Reading coordinate file: ../structures/toluene.xyz
  Number of independent structures:            3
  The structures are: 
  Structure            1 :Properties=species:S:1:pos:R:3 iupac_name=Pr pbc="F F F"(           1  atoms)
  Structure            2 :Properties=species:S:1:pos:R:3 iupac_name=F pbc="F F F"(           1  atoms)
  Structure            3 :Properties=species:S:1:pos:R:3 iupac_name=toluene pbc="F F F"(          15  atoms)
  Maximum number of GENCAN loops for all molecule packing:          600
  Distance tolerance:    2.0000000000000000     
  Number of molecules of type            1 :            1
  Number of molecules of type            2 :            3
  Number of molecules of type            3 :            9
  Total number of restrictions:            3
  Total number of atoms:          139
  Total number of molecules:           13
  Number of fixed molecules:            0
  Number of free molecules:           13
  Number of variables:           78
  Total number of fixed atoms:            0
  PBC on: Constraint automatically added to non-fixed atoms:
  -> inside box     0.00    0.00    0.00   13.22   13.22   13.22
  Updated total number of restrictions:            4
  Maximum internal distance of type            1 :    0.0000000000000000     
  Maximum internal distance of type            2 :    0.0000000000000000     
  Maximum internal distance of type            3 :    5.8525991243207498     
  All atoms must be within these coordinates: 
   x: [   -1000.0000000000000      ,    1000.0000000000000       ] 
   y: [   -1000.0000000000000      ,    1000.0000000000000       ] 
   z: [   -1000.0000000000000      ,    1000.0000000000000       ] 
  If the system is larger than this, increase the sidemax parameter. 

################################################################################

  Building initial approximation ... 

################################################################################

  Adjusting initial point to fit the constraints 

--------------------------------------------------------------------------------

--------------------------------------------------------------------------------

  Molecules of type:            1

  Packing:|0                                                        100%|
          |******

  Restraint-only function value:    1.7288461496472697E-014
  Maximum violation of the restraints:    1.7288461496472697E-014

--------------------------------------------------------------------------------

  Molecules of type:            2

  Packing:|0                                                        100%|
          |******

  Restraint-only function value:    2.6331092375510828E-014
  Maximum violation of the restraints:    2.5408910773163157E-014

--------------------------------------------------------------------------------

  Molecules of type:            3

  Packing:|0                                                        100%|
          |************************

  Restraint-only function value:    7.4213338624868766E-003
  Maximum violation of the restraints:    7.4212120088958692E-003

--------------------------------------------------------------------------------

  Rescaling maximum and minimum coordinates... 
  Mininum and maximum coordinates after constraint fitting: 
   x: [   -6.0914743736208352E-002 ,    13.224695755641548       ] 
   y: [    3.1310889587651564E-003 ,    13.224695894467658       ] 
   z: [   -1.7263261042899103E-008 ,    13.224942615291660       ] 
  Computing size of patches... 
  Number of cells in each direction and cell sides: 
   x:            5  cells of size    2.6449391563507230     
   y:            5  cells of size    2.6449391563507230     
   z:            5  cells of size    2.6449391563507230     
  Cell-system length:   13.22470  13.22470  13.22470
  Reseting center of mass... 

--------------------------------------------------------------------------------

  Setting initial trial coordinates ... 

--------------------------------------------------------------------------------

--------------------------------------------------------------------------------

  Molecules of type:            1
  Adjusting random positions to fit the constraints. 
  Restraint-only function value:    1.7288461496472697E-014
  Maximum violation of the restraints:    1.7288461496472697E-014

--------------------------------------------------------------------------------

  Molecules of type:            2
  Adjusting random positions to fit the constraints. 
  Restraint-only function value:    2.1298502273169613E-014
  Maximum violation of the restraints:    2.0948198871799984E-014

--------------------------------------------------------------------------------

  Molecules of type:            3
  Adjusting random positions to fit the constraints. 
  Packing:|0                                                        100%|
          |*********
  Restraint-only function value:    0.0000000000000000     
  Maximum violation of the restraints:    0.0000000000000000     

################################################################################

  Objective function at initial point:    1126.3345710078283     

################################################################################

  Packing molecules of type:            1

################################################################################


  Initial approximation is a solution. Nothing to do. 

  Current point written to file: solvated_150/1Pr_3F_toluene.xyz
--------------------------------------------------------------------------------
  Packing solved for molecules of type           1
  Objective function value:    1.7288461496472697E-014
  Maximum violation of target distance:    0.0000000000000000     
  Max. constraint violation:    1.7288461496472697E-014
--------------------------------------------------------------------------------

################################################################################

  Packing molecules of type:            2

################################################################################


  Initial approximation is a solution. Nothing to do. 

  Current point written to file: solvated_150/1Pr_3F_toluene.xyz
--------------------------------------------------------------------------------
  Packing solved for molecules of type           2
  Objective function value:    2.1298502273169613E-014
  Maximum violation of target distance:    0.0000000000000000     
  Max. constraint violation:    2.0948198871799984E-014
--------------------------------------------------------------------------------

################################################################################

  Packing molecules of type:            3

################################################################################


--------------------------------------------------------------------------------

  Starting GENCAN loop:            0
  Scaling radii by:    1.1000000000000001     

  Packing:|0                                                        100%|
          |*************************************************************|

  Function value from last GENCAN loop: f = .20605E+01
  Best function value before: f = .11263E+04
  Improvement from best function value:    99.82 %
  Improvement from last loop:    99.82 %
  Maximum violation of target distance:     0.000000
  Maximum violation of the constraints: .10892E+01
  All-type function value: .12703E+02

--------------------------------------------------------------------------------


--------------------------------------------------------------------------------

  Starting GENCAN loop:            1
  Scaling radii by:    1.1000000000000001     

  Packing:|0                                                        100%|
          |*********************************************************

  Function value from last GENCAN loop: f = .11920E-01
  Best function value before: f = .20605E+01
  Improvement from best function value:    99.42 %
  Improvement from last loop:    99.42 %
  Maximum violation of target distance:     0.000000
  Maximum violation of the constraints: .68986E-02
  Current structure written to file: solvated_150/1Pr_3F_toluene.xyz
--------------------------------------------------------------------------------
  Packing solved for molecules of type           3
  Objective function value:    1.1919779683950710E-002
  Maximum violation of target distance:    0.0000000000000000     
  Max. constraint violation:    6.8986399248277177E-003
--------------------------------------------------------------------------------

################################################################################

  Packing all molecules together 

################################################################################


--------------------------------------------------------------------------------

  Starting GENCAN loop:            0
  Scaling radii by:    1.1000000000000001     

  Packing:|0                                                        100%|
          |***************************

  Function value from last GENCAN loop: f = .12767E-01
  Best function value before: f = .18792E+02
  Improvement from best function value:    99.93 %
  Improvement from last loop:    99.93 %
  Maximum violation of target distance:     0.000000
  Maximum violation of the constraints: .72941E-02

################################################################################

                                 Success! 
              Final objective function value: .12767E-01
              Maximum violation of target distance:   0.000000
              Maximum violation of the constraints: .72941E-02

--------------------------------------------------------------------------------

              Please cite this work if Packmol was useful: 

           L. Martinez, R. Andrade, E. G. Birgin, J. M. Martinez, 
         PACKMOL: A package for building initial configurations for
                   molecular dynamics simulations. 
        Journal of Computational Chemistry, 30(13) pp. 2157-2164, 2009.
                  https://doi.org/10.1002/jcc.21224

################################################################################

  Solution written to file: solvated_150/1Pr_3F_toluene.xyz

--------------------------------------------------------------------------------

   Running time:    6.53870031E-02  seconds. 

--------------------------------------------------------------------------------


