
################################################################################

 PACKMOL - Packing optimization for the automated generation of
 starting configurations for molecular dynamics simulations.
 
                                                             Version 21.1.2 

################################################################################

  Packmol must be run with: packmol < inputfile.inp 

  Userguide at: http://m3g.iqm.unicamp.br/packmol 

  Reading input file... (Control-C aborts)
  Types of coordinate files specified: xyz
  Periodic boundary condition activated: 
    Minimum coordinates:     0.00    0.00    0.00
    Maximum coordinates:    12.44   12.44   12.44
  Seed for random number generator:      1234567
  Output file: solvated_150/1pyridin-1-ium_1chlorite_benzene.xyz
  Reading coordinate file: ../structures/pyridin-1-ium.xyz
  Reading coordinate file: ../structures/chlorite.xyz
  Reading coordinate file: ../structures/benzene.xyz
  Number of independent structures:            3
  The structures are: 
  Structure            1 :Properties=species:S:1:pos:R:3 iupac_name=pyridin-1-ium pbc="F F F"(          12  atoms)
  Structure            2 :Properties=species:S:1:pos:R:3 iupac_name=chlorite pbc="F F F"(           3  atoms)
  Structure            3 :Properties=species:S:1:pos:R:3 iupac_name=benzene pbc="F F F"(          12  atoms)
  Maximum number of GENCAN loops for all molecule packing:          600
  Distance tolerance:    2.0000000000000000     
  Number of molecules of type            1 :            1
  Number of molecules of type            2 :            1
  Number of molecules of type            3 :           11
  Total number of restrictions:            3
  Total number of atoms:          147
  Total number of molecules:           13
  Number of fixed molecules:            0
  Number of free molecules:           13
  Number of variables:           78
  Total number of fixed atoms:            0
  PBC on: Constraint automatically added to non-fixed atoms:
  -> inside box     0.00    0.00    0.00   12.44   12.44   12.44
  Updated total number of restrictions:            4
  Maximum internal distance of type            1 :    4.9160269913823704     
  Maximum internal distance of type            2 :    2.1268392388236590     
  Maximum internal distance of type            3 :    4.9619487079170828     
  All atoms must be within these coordinates: 
   x: [   -997.22184526164881      ,    1002.7781547383512       ] 
   y: [   -996.79999999999995      ,    1003.2000000000000       ] 
   z: [   -999.99988583067909      ,    1000.0001141693209       ] 
  If the system is larger than this, increase the sidemax parameter. 

################################################################################

  Building initial approximation ... 

################################################################################

  Adjusting initial point to fit the constraints 

--------------------------------------------------------------------------------

--------------------------------------------------------------------------------

  Molecules of type:            1

  Packing:|0                                                        100%|
          |***************

  Restraint-only function value:    1.0303377065204414E-003
  Maximum violation of the restraints:    1.0303377065204414E-003

--------------------------------------------------------------------------------

  Molecules of type:            2

  Packing:|0                                                        100%|
          |************

  Restraint-only function value:    0.0000000000000000     
  Maximum violation of the restraints:    0.0000000000000000     

--------------------------------------------------------------------------------

  Molecules of type:            3

  Packing:|0                                                        100%|
          |*********************

  Restraint-only function value:    5.4859213977274772E-003
  Maximum violation of the restraints:    3.7220509387970863E-003

--------------------------------------------------------------------------------

  Rescaling maximum and minimum coordinates... 
  Mininum and maximum coordinates after constraint fitting: 
   x: [   -4.3139604418660854E-002 ,    12.429988974326973       ] 
   y: [   -2.7557378930422656E-002 ,    12.434490350522752       ] 
   z: [   -2.2697331412750283E-002 ,    12.442077508704868       ] 
  Computing size of patches... 
  Number of cells in each direction and cell sides: 
   x:            5  cells of size    2.4883143122553752     
   y:            5  cells of size    2.4883143122553752     
   z:            5  cells of size    2.4883143122553752     
  Cell-system length:   12.44157  12.44157  12.44157
  Reseting center of mass... 

--------------------------------------------------------------------------------

  Setting initial trial coordinates ... 

--------------------------------------------------------------------------------

--------------------------------------------------------------------------------

  Molecules of type:            1
  Adjusting random positions to fit the constraints. 
  Packing:|0                                                        100%|
          |******
  Restraint-only function value:    0.0000000000000000     
  Maximum violation of the restraints:    0.0000000000000000     

--------------------------------------------------------------------------------

  Molecules of type:            2
  Adjusting random positions to fit the constraints. 
  Packing:|0                                                        100%|
          |***
  Restraint-only function value:    5.9034112058625621E-005
  Maximum violation of the restraints:    5.9034112058625621E-005

--------------------------------------------------------------------------------

  Molecules of type:            3
  Adjusting random positions to fit the constraints. 
  Packing:|0                                                        100%|
          |*********
  Restraint-only function value:    2.3112325884696722E-002
  Maximum violation of the restraints:    6.3713286262518194E-003

################################################################################

  Objective function at initial point:    854.56393378490861     

################################################################################

  Packing molecules of type:            1

################################################################################


  Initial approximation is a solution. Nothing to do. 

  Current point written to file: solvated_150/1pyridin-1-ium_1chlorite_benzene.xyz
--------------------------------------------------------------------------------
  Packing solved for molecules of type           1
  Objective function value:    0.0000000000000000     
  Maximum violation of target distance:    0.0000000000000000     
  Max. constraint violation:    0.0000000000000000     
--------------------------------------------------------------------------------

################################################################################

  Packing molecules of type:            2

################################################################################


  Initial approximation is a solution. Nothing to do. 

  Current point written to file: solvated_150/1pyridin-1-ium_1chlorite_benzene.xyz
--------------------------------------------------------------------------------
  Packing solved for molecules of type           2
  Objective function value:    5.9034112058625621E-005
  Maximum violation of target distance:    0.0000000000000000     
  Max. constraint violation:    5.9034112058625621E-005
--------------------------------------------------------------------------------

################################################################################

  Packing molecules of type:            3

################################################################################


--------------------------------------------------------------------------------

  Starting GENCAN loop:            0
  Scaling radii by:    1.1000000000000001     

  Packing:|0                                                        100%|
          |*********************************************************

  Function value from last GENCAN loop: f = .20718E-01
  Best function value before: f = .85252E+03
  Improvement from best function value:    99.99 %
  Improvement from last loop:    99.99 %
  Maximum violation of target distance:     0.000000
  Maximum violation of the constraints: .92223E-02
  Current structure written to file: solvated_150/1pyridin-1-ium_1chlorite_benzene.xyz
--------------------------------------------------------------------------------
  Packing solved for molecules of type           3
  Objective function value:    2.0718090100046424E-002
  Maximum violation of target distance:    0.0000000000000000     
  Max. constraint violation:    9.2222908581037107E-003
--------------------------------------------------------------------------------

################################################################################

  Packing all molecules together 

################################################################################


--------------------------------------------------------------------------------

  Starting GENCAN loop:            0
  Scaling radii by:    1.1000000000000001     

  Packing:|0                                                        100%|
          |***************************************

  Function value from last GENCAN loop: f = .88452E-02
  Best function value before: f = .21383E+02
  Improvement from best function value:    99.96 %
  Improvement from last loop:    99.96 %
  Maximum violation of target distance:     0.000000
  Maximum violation of the constraints: .37871E-02

################################################################################

                                 Success! 
              Final objective function value: .88452E-02
              Maximum violation of target distance:   0.000000
              Maximum violation of the constraints: .37871E-02

--------------------------------------------------------------------------------

              Please cite this work if Packmol was useful: 

           L. Martinez, R. Andrade, E. G. Birgin, J. M. Martinez, 
         PACKMOL: A package for building initial configurations for
                   molecular dynamics simulations. 
        Journal of Computational Chemistry, 30(13) pp. 2157-2164, 2009.
                  https://doi.org/10.1002/jcc.21224

################################################################################

  Solution written to file: solvated_150/1pyridin-1-ium_1chlorite_benzene.xyz

--------------------------------------------------------------------------------

   Running time:    3.07920054E-02  seconds. 

--------------------------------------------------------------------------------


