
################################################################################

 PACKMOL - Packing optimization for the automated generation of
 starting configurations for molecular dynamics simulations.
 
                                                             Version 21.1.2 

################################################################################

  Packmol must be run with: packmol < inputfile.inp 

  Userguide at: http://m3g.iqm.unicamp.br/packmol 

  Reading input file... (Control-C aborts)
  Types of coordinate files specified: xyz
  Periodic boundary condition activated: 
    Minimum coordinates:     0.00    0.00    0.00
    Maximum coordinates:    11.21   11.21   11.21
  Seed for random number generator:      1234567
  Output file: solvated_150/1pyridin-1-ium_1hexafluorophosphate_azane.xyz
  Reading coordinate file: ../structures/pyridin-1-ium.xyz
  Reading coordinate file: ../structures/hexafluorophosphate.xyz
  Reading coordinate file: ../structures/azane.xyz
  Number of independent structures:            3
  The structures are: 
  Structure            1 :Properties=species:S:1:pos:R:3 iupac_name=pyridin-1-ium pbc="F F F"(          12  atoms)
  Structure            2 :Properties=species:S:1:pos:R:3 iupac_name=hexafluorophosphate pbc="F F F"(           7  atoms)
  Structure            3 :Properties=species:S:1:pos:R:3 iupac_name=azane pbc="F F F"(           4  atoms)
  Maximum number of GENCAN loops for all molecule packing:          600
  Distance tolerance:    2.0000000000000000     
  Number of molecules of type            1 :            1
  Number of molecules of type            2 :            1
  Number of molecules of type            3 :           32
  Total number of restrictions:            3
  Total number of atoms:          147
  Total number of molecules:           34
  Number of fixed molecules:            0
  Number of free molecules:           34
  Number of variables:          204
  Total number of fixed atoms:            0
  PBC on: Constraint automatically added to non-fixed atoms:
  -> inside box     0.00    0.00    0.00   11.21   11.21   11.21
  Updated total number of restrictions:            4
  Maximum internal distance of type            1 :    4.9160269913823704     
  Maximum internal distance of type            2 :    2.7542579841038859     
  Maximum internal distance of type            3 :    1.6276392505712067     
  All atoms must be within these coordinates: 
   x: [   -997.22184526164881      ,    1002.7781547383512       ] 
   y: [   -996.79999999999995      ,    1003.2000000000000       ] 
   z: [   -999.99988583067909      ,    1000.0001141693209       ] 
  If the system is larger than this, increase the sidemax parameter. 

################################################################################

  Building initial approximation ... 

################################################################################

  Adjusting initial point to fit the constraints 

--------------------------------------------------------------------------------

--------------------------------------------------------------------------------

  Molecules of type:            1

  Packing:|0                                                        100%|
          |***************

  Restraint-only function value:    1.0304021674428961E-003
  Maximum violation of the restraints:    1.0304021674428961E-003

--------------------------------------------------------------------------------

  Molecules of type:            2

  Packing:|0                                                        100%|
          |***************

  Restraint-only function value:    0.0000000000000000     
  Maximum violation of the restraints:    0.0000000000000000     

--------------------------------------------------------------------------------

  Molecules of type:            3

  Packing:|0                                                        100%|
          |*********************

  Restraint-only function value:    4.3730362420407046E-003
  Maximum violation of the restraints:    4.0555215859503033E-003

--------------------------------------------------------------------------------

  Rescaling maximum and minimum coordinates... 
  Mininum and maximum coordinates after constraint fitting: 
   x: [   -4.5030665029234820E-002 ,    11.215346476751145       ] 
   y: [    1.1207259695478701E-004 ,    11.222823976007222       ] 
   z: [   -2.2698041407166566E-002 ,    11.213775962071452       ] 
  Computing size of patches... 
  Number of cells in each direction and cell sides: 
   x:            5  cells of size    2.2427586332501117     
   y:            5  cells of size    2.2427586332501117     
   z:            5  cells of size    2.2427586332501117     
  Cell-system length:   11.21379  11.21379  11.21379
  Reseting center of mass... 

--------------------------------------------------------------------------------

  Setting initial trial coordinates ... 

--------------------------------------------------------------------------------

--------------------------------------------------------------------------------

  Molecules of type:            1
  Adjusting random positions to fit the constraints. 
  Packing:|0                                                        100%|
          |***
  Restraint-only function value:    0.0000000000000000     
  Maximum violation of the restraints:    0.0000000000000000     

--------------------------------------------------------------------------------

  Molecules of type:            2
  Adjusting random positions to fit the constraints. 
  Packing:|0                                                        100%|
          |***
  Restraint-only function value:    0.0000000000000000     
  Maximum violation of the restraints:    0.0000000000000000     

--------------------------------------------------------------------------------

  Molecules of type:            3
  Adjusting random positions to fit the constraints. 
  Packing:|0                                                        100%|
          |***
  Restraint-only function value:    0.0000000000000000     
  Maximum violation of the restraints:    0.0000000000000000     

################################################################################

  Objective function at initial point:    1115.7246525501353     

################################################################################

  Packing molecules of type:            1

################################################################################


  Initial approximation is a solution. Nothing to do. 

  Current point written to file: solvated_150/1pyridin-1-ium_1hexafluorophosphate_azane.xyz
--------------------------------------------------------------------------------
  Packing solved for molecules of type           1
  Objective function value:    0.0000000000000000     
  Maximum violation of target distance:    0.0000000000000000     
  Max. constraint violation:    0.0000000000000000     
--------------------------------------------------------------------------------

################################################################################

  Packing molecules of type:            2

################################################################################


  Initial approximation is a solution. Nothing to do. 

  Current point written to file: solvated_150/1pyridin-1-ium_1hexafluorophosphate_azane.xyz
--------------------------------------------------------------------------------
  Packing solved for molecules of type           2
  Objective function value:    0.0000000000000000     
  Maximum violation of target distance:    0.0000000000000000     
  Max. constraint violation:    0.0000000000000000     
--------------------------------------------------------------------------------

################################################################################

  Packing molecules of type:            3

################################################################################


--------------------------------------------------------------------------------

  Starting GENCAN loop:            0
  Scaling radii by:    1.1000000000000001     

  Packing:|0                                                        100%|
          |******************************

  Function value from last GENCAN loop: f = .10514E-01
  Best function value before: f = .67989E+03
  Improvement from best function value:    99.99 %
  Improvement from last loop:    99.99 %
  Maximum violation of target distance:     0.000000
  Maximum violation of the constraints: .88710E-02
  Current structure written to file: solvated_150/1pyridin-1-ium_1hexafluorophosphate_azane.xyz
--------------------------------------------------------------------------------
  Packing solved for molecules of type           3
  Objective function value:    1.0513581282680703E-002
  Maximum violation of target distance:    0.0000000000000000     
  Max. constraint violation:    8.8709802148616308E-003
--------------------------------------------------------------------------------

################################################################################

  Packing all molecules together 

################################################################################


--------------------------------------------------------------------------------

  Starting GENCAN loop:            0
  Scaling radii by:    1.1000000000000001     

  Packing:|0                                                        100%|
          |******************************************************

  Function value from last GENCAN loop: f = .15699E-01
  Best function value before: f = .35182E+03
  Improvement from best function value:    99.99 %
  Improvement from last loop:    99.99 %
  Maximum violation of target distance:     0.000000
  Maximum violation of the constraints: .58867E-02

################################################################################

                                 Success! 
              Final objective function value: .15699E-01
              Maximum violation of target distance:   0.000000
              Maximum violation of the constraints: .58867E-02

--------------------------------------------------------------------------------

              Please cite this work if Packmol was useful: 

           L. Martinez, R. Andrade, E. G. Birgin, J. M. Martinez, 
         PACKMOL: A package for building initial configurations for
                   molecular dynamics simulations. 
        Journal of Computational Chemistry, 30(13) pp. 2157-2164, 2009.
                  https://doi.org/10.1002/jcc.21224

################################################################################

  Solution written to file: solvated_150/1pyridin-1-ium_1hexafluorophosphate_azane.xyz

--------------------------------------------------------------------------------

   Running time:    3.40430066E-02  seconds. 

--------------------------------------------------------------------------------


