
################################################################################

 PACKMOL - Packing optimization for the automated generation of
 starting configurations for molecular dynamics simulations.
 
                                                             Version 21.1.2 

################################################################################

  Packmol must be run with: packmol < inputfile.inp 

  Userguide at: http://m3g.iqm.unicamp.br/packmol 

  Reading input file... (Control-C aborts)
  Types of coordinate files specified: xyz
  Periodic boundary condition activated: 
    Minimum coordinates:     0.00    0.00    0.00
    Maximum coordinates:    11.84   11.84   11.84
  Seed for random number generator:      1234567
  Output file: solvated_150/1pyridin-1-ium_1permanganate_1,3-dioxolan-2-one.xyz
  Reading coordinate file: ../structures/pyridin-1-ium.xyz
  Reading coordinate file: ../structures/permanganate.xyz
  Reading coordinate file: ../structures/1,3-dioxolan-2-one.xyz
  Number of independent structures:            3
  The structures are: 
  Structure            1 :Properties=species:S:1:pos:R:3 iupac_name=pyridin-1-ium pbc="F F F"(          12  atoms)
  Structure            2 :Properties=species:S:1:pos:R:3 iupac_name=permanganate pbc="F F F"(           5  atoms)
  Structure            3 :Properties=species:S:1:pos:R:3 iupac_name=1,3-dioxolan-2-one pbc="F F F"(          10  atoms)
  Maximum number of GENCAN loops for all molecule packing:          600
  Distance tolerance:    2.0000000000000000     
  Number of molecules of type            1 :            1
  Number of molecules of type            2 :            1
  Number of molecules of type            3 :           13
  Total number of restrictions:            3
  Total number of atoms:          147
  Total number of molecules:           15
  Number of fixed molecules:            0
  Number of free molecules:           15
  Number of variables:           90
  Total number of fixed atoms:            0
  PBC on: Constraint automatically added to non-fixed atoms:
  -> inside box     0.00    0.00    0.00   11.84   11.84   11.84
  Updated total number of restrictions:            4
  Maximum internal distance of type            1 :    4.9160269913823704     
  Maximum internal distance of type            2 :    3.1470440495963827     
  Maximum internal distance of type            3 :    4.2728366537933553     
  All atoms must be within these coordinates: 
   x: [   -997.22184526164881      ,    1002.7781547383512       ] 
   y: [   -996.79999999999995      ,    1003.2000000000000       ] 
   z: [   -999.99988583067909      ,    1000.0001141693209       ] 
  If the system is larger than this, increase the sidemax parameter. 

################################################################################

  Building initial approximation ... 

################################################################################

  Adjusting initial point to fit the constraints 

--------------------------------------------------------------------------------

--------------------------------------------------------------------------------

  Molecules of type:            1

  Packing:|0                                                        100%|
          |***************

  Restraint-only function value:    4.0634989210374086E-005
  Maximum violation of the restraints:    3.9634311258936553E-005

--------------------------------------------------------------------------------

  Molecules of type:            2

  Packing:|0                                                        100%|
          |***************

  Restraint-only function value:    5.1227986433743033E-004
  Maximum violation of the restraints:    5.1227986433743033E-004

--------------------------------------------------------------------------------

  Molecules of type:            3

  Packing:|0                                                        100%|
          |******************

  Restraint-only function value:    4.0733659986319834E-004
  Maximum violation of the restraints:    1.2371237311031475E-004

--------------------------------------------------------------------------------

  Rescaling maximum and minimum coordinates... 
  Mininum and maximum coordinates after constraint fitting: 
   x: [   -6.3769367729476891E-003 ,    11.844894718711060       ] 
   y: [    5.4973185388042939E-002 ,    11.838942738405127       ] 
   z: [   -1.6004372282870553E-002 ,    11.847253481532807       ] 
  Computing size of patches... 
  Number of cells in each direction and cell sides: 
   x:            5  cells of size    2.3680902279752840     
   y:            5  cells of size    2.3680902279752840     
   z:            5  cells of size    2.3680902279752840     
  Cell-system length:   11.84045  11.84045  11.84045
  Reseting center of mass... 

--------------------------------------------------------------------------------

  Setting initial trial coordinates ... 

--------------------------------------------------------------------------------

--------------------------------------------------------------------------------

  Molecules of type:            1
  Adjusting random positions to fit the constraints. 
  Packing:|0                                                        100%|
          |*********
  Restraint-only function value:    2.3060584494467007E-007
  Maximum violation of the restraints:    7.8927951246486003E-008

--------------------------------------------------------------------------------

  Molecules of type:            2
  Adjusting random positions to fit the constraints. 
  Packing:|0                                                        100%|
          |***
  Restraint-only function value:    0.0000000000000000     
  Maximum violation of the restraints:    0.0000000000000000     

--------------------------------------------------------------------------------

  Molecules of type:            3
  Adjusting random positions to fit the constraints. 
  Packing:|0                                                        100%|
          |******
  Restraint-only function value:    6.9957328177144164E-008
  Maximum violation of the restraints:    6.9957328177144164E-008

################################################################################

  Objective function at initial point:    1197.9206727951675     

################################################################################

  Packing molecules of type:            1

################################################################################


  Initial approximation is a solution. Nothing to do. 

  Current point written to file: solvated_150/1pyridin-1-ium_1permanganate_1,3-dioxolan-2-one.xyz
--------------------------------------------------------------------------------
  Packing solved for molecules of type           1
  Objective function value:    2.3060584494467007E-007
  Maximum violation of target distance:    0.0000000000000000     
  Max. constraint violation:    7.8927951246486003E-008
--------------------------------------------------------------------------------

################################################################################

  Packing molecules of type:            2

################################################################################


  Initial approximation is a solution. Nothing to do. 

  Current point written to file: solvated_150/1pyridin-1-ium_1permanganate_1,3-dioxolan-2-one.xyz
--------------------------------------------------------------------------------
  Packing solved for molecules of type           2
  Objective function value:    0.0000000000000000     
  Maximum violation of target distance:    0.0000000000000000     
  Max. constraint violation:    0.0000000000000000     
--------------------------------------------------------------------------------

################################################################################

  Packing molecules of type:            3

################################################################################


--------------------------------------------------------------------------------

  Starting GENCAN loop:            0
  Scaling radii by:    1.1000000000000001     

  Packing:|0                                                        100%|
          |*************************************************************|


  Function value from last GENCAN loop: f = .89716E-02
  Best function value before: f = .85525E+03
  Improvement from best function value:    99.99 %
  Improvement from last loop:    99.99 %
  Maximum violation of target distance:     0.000000
  Maximum violation of the constraints: .39730E-02
  Current structure written to file: solvated_150/1pyridin-1-ium_1permanganate_1,3-dioxolan-2-one.xyz
--------------------------------------------------------------------------------
  Packing solved for molecules of type           3
  Objective function value:    8.9715775014192756E-003
  Maximum violation of target distance:    0.0000000000000000     
  Max. constraint violation:    3.9730332302882693E-003
--------------------------------------------------------------------------------

################################################################################

  Packing all molecules together 

################################################################################


--------------------------------------------------------------------------------

  Starting GENCAN loop:            0
  Scaling radii by:    1.1000000000000001     

  Packing:|0                                                        100%|
          |*************************************************************|


  Function value from last GENCAN loop: f = .15195E-01
  Best function value before: f = .25228E+03
  Improvement from best function value:    99.99 %
  Improvement from last loop:    99.99 %
  Maximum violation of target distance:     0.000000
  Maximum violation of the constraints: .86198E-02

################################################################################

                                 Success! 
              Final objective function value: .15195E-01
              Maximum violation of target distance:   0.000000
              Maximum violation of the constraints: .86198E-02

--------------------------------------------------------------------------------

              Please cite this work if Packmol was useful: 

           L. Martinez, R. Andrade, E. G. Birgin, J. M. Martinez, 
         PACKMOL: A package for building initial configurations for
                   molecular dynamics simulations. 
        Journal of Computational Chemistry, 30(13) pp. 2157-2164, 2009.
                  https://doi.org/10.1002/jcc.21224

################################################################################

  Solution written to file: solvated_150/1pyridin-1-ium_1permanganate_1,3-dioxolan-2-one.xyz

--------------------------------------------------------------------------------

   Running time:    4.48449999E-02  seconds. 

--------------------------------------------------------------------------------


