
################################################################################

 PACKMOL - Packing optimization for the automated generation of
 starting configurations for molecular dynamics simulations.
 
                                                             Version 21.1.2 

################################################################################

  Packmol must be run with: packmol < inputfile.inp 

  Userguide at: http://m3g.iqm.unicamp.br/packmol 

  Reading input file... (Control-C aborts)
  Types of coordinate files specified: xyz
  Periodic boundary condition activated: 
    Minimum coordinates:     0.00    0.00    0.00
    Maximum coordinates:    11.81   11.81   11.81
  Seed for random number generator:      1234567
  Output file: solvated_150/1Tb_3methanesulfonate_ethanol.xyz
  Reading coordinate file: ../structures/Tb.xyz
  Reading coordinate file: ../structures/methanesulfonate.xyz
  Reading coordinate file: ../structures/ethanol.xyz
  Number of independent structures:            3
  The structures are: 
  Structure            1 :Properties=species:S:1:pos:R:3 iupac_name=Tb pbc="F F F"(           1  atoms)
  Structure            2 :Properties=species:S:1:pos:R:3 iupac_name=methanesulfonate pbc="F F F"(           8  atoms)
  Structure            3 :Properties=species:S:1:pos:R:3 iupac_name=ethanol pbc="F F F"(           9  atoms)
  Maximum number of GENCAN loops for all molecule packing:          600
  Distance tolerance:    2.0000000000000000     
  Number of molecules of type            1 :            1
  Number of molecules of type            2 :            3
  Number of molecules of type            3 :           13
  Total number of restrictions:            3
  Total number of atoms:          142
  Total number of molecules:           17
  Number of fixed molecules:            0
  Number of free molecules:           17
  Number of variables:          102
  Total number of fixed atoms:            0
  PBC on: Constraint automatically added to non-fixed atoms:
  -> inside box     0.00    0.00    0.00   11.81   11.81   11.81
  Updated total number of restrictions:            4
  Maximum internal distance of type            1 :    0.0000000000000000     
  Maximum internal distance of type            2 :    3.4723013766088910     
  Maximum internal distance of type            3 :    3.5502894431299539     
  All atoms must be within these coordinates: 
   x: [   -1000.0000000000000      ,    1000.0000000000000       ] 
   y: [   -1000.0000000000000      ,    1000.0000000000000       ] 
   z: [   -1000.0000000000000      ,    1000.0000000000000       ] 
  If the system is larger than this, increase the sidemax parameter. 

################################################################################

  Building initial approximation ... 

################################################################################

  Adjusting initial point to fit the constraints 

--------------------------------------------------------------------------------

--------------------------------------------------------------------------------

  Molecules of type:            1

  Packing:|0                                                        100%|
          |******

  Restraint-only function value:    1.9031954526440668E-014
  Maximum violation of the restraints:    1.9031954526440668E-014

--------------------------------------------------------------------------------

  Molecules of type:            2

  Packing:|0                                                        100%|
          |******************

  Restraint-only function value:    0.0000000000000000     
  Maximum violation of the restraints:    0.0000000000000000     

--------------------------------------------------------------------------------

  Molecules of type:            3

  Packing:|0                                                        100%|
          |******************

  Restraint-only function value:    1.8909976643869089E-003
  Maximum violation of the restraints:    1.8909976643869089E-003

--------------------------------------------------------------------------------

  Rescaling maximum and minimum coordinates... 
  Mininum and maximum coordinates after constraint fitting: 
   x: [    1.6706281054525020E-002 ,    11.811134556143344       ] 
   y: [    3.7062878623565004E-003 ,    11.811134661415821       ] 
   z: [   -2.5861609742605651E-008 ,    11.841883532090193       ] 
  Computing size of patches... 
  Number of cells in each direction and cell sides: 
   x:            5  cells of size    2.3622269134713014     
   y:            5  cells of size    2.3622269134713014     
   z:            5  cells of size    2.3622269134713014     
  Cell-system length:   11.81113  11.81113  11.81113
  Reseting center of mass... 

--------------------------------------------------------------------------------

  Setting initial trial coordinates ... 

--------------------------------------------------------------------------------

--------------------------------------------------------------------------------

  Molecules of type:            1
  Adjusting random positions to fit the constraints. 
  Restraint-only function value:    1.9031954526440668E-014
  Maximum violation of the restraints:    1.9031954526440668E-014

--------------------------------------------------------------------------------

  Molecules of type:            2
  Adjusting random positions to fit the constraints. 
  Restraint-only function value:    0.0000000000000000     
  Maximum violation of the restraints:    0.0000000000000000     

--------------------------------------------------------------------------------

  Molecules of type:            3
  Adjusting random positions to fit the constraints. 
  Restraint-only function value:    1.4942176196577213E-003
  Maximum violation of the restraints:    1.4942176196577213E-003

################################################################################

  Objective function at initial point:    986.28688256196460     

################################################################################

  Packing molecules of type:            1

################################################################################


  Initial approximation is a solution. Nothing to do. 

  Current point written to file: solvated_150/1Tb_3methanesulfonate_ethanol.xyz
--------------------------------------------------------------------------------
  Packing solved for molecules of type           1
  Objective function value:    1.9031954526440668E-014
  Maximum violation of target distance:    0.0000000000000000     
  Max. constraint violation:    1.9031954526440668E-014
--------------------------------------------------------------------------------

################################################################################

  Packing molecules of type:            2

################################################################################


--------------------------------------------------------------------------------

  Starting GENCAN loop:            0
  Scaling radii by:    1.1000000000000001     

  Packing:|0                                                        100%|
          |******************

  Function value from last GENCAN loop: f = .00000E+00
  Best function value before: f = .11222E+03
  Improvement from best function value:    99.99 %
  Improvement from last loop:    99.99 %
  Maximum violation of target distance:     0.000000
  Maximum violation of the constraints: .00000E+00
  Current structure written to file: solvated_150/1Tb_3methanesulfonate_ethanol.xyz
--------------------------------------------------------------------------------
  Packing solved for molecules of type           2
  Objective function value:    0.0000000000000000     
  Maximum violation of target distance:    0.0000000000000000     
  Max. constraint violation:    0.0000000000000000     
--------------------------------------------------------------------------------

################################################################################

  Packing molecules of type:            3

################################################################################


--------------------------------------------------------------------------------

  Starting GENCAN loop:            0
  Scaling radii by:    1.1000000000000001     

  Packing:|0                                                        100%|
          |*********************************************************

  Function value from last GENCAN loop: f = .25457E-01
  Best function value before: f = .66620E+03
  Improvement from best function value:    99.99 %
  Improvement from last loop:    99.99 %
  Maximum violation of target distance:     0.000000
  Maximum violation of the constraints: .64408E-02
  Current structure written to file: solvated_150/1Tb_3methanesulfonate_ethanol.xyz
--------------------------------------------------------------------------------
  Packing solved for molecules of type           3
  Objective function value:    2.5457167050848120E-002
  Maximum violation of target distance:    0.0000000000000000     
  Max. constraint violation:    6.4407649454266032E-003
--------------------------------------------------------------------------------

################################################################################

  Packing all molecules together 

################################################################################


--------------------------------------------------------------------------------

  Starting GENCAN loop:            0
  Scaling radii by:    1.1000000000000001     

  Packing:|0                                                        100%|
          |*********************************************************

  Function value from last GENCAN loop: f = .83709E-02
  Best function value before: f = .23842E+03
  Improvement from best function value:    99.99 %
  Improvement from last loop:    99.99 %
  Maximum violation of target distance:     0.000000
  Maximum violation of the constraints: .50176E-02

################################################################################

                                 Success! 
              Final objective function value: .83709E-02
              Maximum violation of target distance:   0.000000
              Maximum violation of the constraints: .50176E-02

--------------------------------------------------------------------------------

              Please cite this work if Packmol was useful: 

           L. Martinez, R. Andrade, E. G. Birgin, J. M. Martinez, 
         PACKMOL: A package for building initial configurations for
                   molecular dynamics simulations. 
        Journal of Computational Chemistry, 30(13) pp. 2157-2164, 2009.
                  https://doi.org/10.1002/jcc.21224

################################################################################

  Solution written to file: solvated_150/1Tb_3methanesulfonate_ethanol.xyz

--------------------------------------------------------------------------------

   Running time:    3.40989977E-02  seconds. 

--------------------------------------------------------------------------------


