
################################################################################

 PACKMOL - Packing optimization for the automated generation of
 starting configurations for molecular dynamics simulations.
 
                                                             Version 21.1.2 

################################################################################

  Packmol must be run with: packmol < inputfile.inp 

  Userguide at: http://m3g.iqm.unicamp.br/packmol 

  Reading input file... (Control-C aborts)
  Types of coordinate files specified: xyz
  Periodic boundary condition activated: 
    Minimum coordinates:     0.00    0.00    0.00
    Maximum coordinates:    11.84   11.84   11.84
  Seed for random number generator:      1234567
  Output file: solvated_150/1tetramethylazanium_1F_N,N-dimethylformamide.xyz
  Reading coordinate file: ../structures/tetramethylazanium.xyz
  Reading coordinate file: ../structures/F.xyz
  Reading coordinate file: ../structures/N,N-dimethylformamide.xyz
  Number of independent structures:            3
  The structures are: 
  Structure            1 :Properties=species:S:1:pos:R:3 iupac_name=tetramethylazanium pbc="F F F"(          17  atoms)
  Structure            2 :Properties=species:S:1:pos:R:3 iupac_name=F pbc="F F F"(           1  atoms)
  Structure            3 :Properties=species:S:1:pos:R:3 iupac_name=N,N-dimethylformamide pbc="F F F"(          12  atoms)
  Maximum number of GENCAN loops for all molecule packing:          600
  Distance tolerance:    2.0000000000000000     
  Number of molecules of type            1 :            1
  Number of molecules of type            2 :            1
  Number of molecules of type            3 :           11
  Total number of restrictions:            3
  Total number of atoms:          150
  Total number of molecules:           13
  Number of fixed molecules:            0
  Number of free molecules:           13
  Number of variables:           78
  Total number of fixed atoms:            0
  PBC on: Constraint automatically added to non-fixed atoms:
  -> inside box     0.00    0.00    0.00   11.84   11.84   11.84
  Updated total number of restrictions:            4
  Maximum internal distance of type            1 :    4.2493752776143463     
  Maximum internal distance of type            2 :    0.0000000000000000     
  Maximum internal distance of type            3 :    4.2658499117995232     
  All atoms must be within these coordinates: 
   x: [   -996.84205636524950      ,    1003.1579436347505       ] 
   y: [   -996.79999999999995      ,    1003.2000000000000       ] 
   z: [   -996.84376303312183      ,    1003.1562369668782       ] 
  If the system is larger than this, increase the sidemax parameter. 

################################################################################

  Building initial approximation ... 

################################################################################

  Adjusting initial point to fit the constraints 

--------------------------------------------------------------------------------

--------------------------------------------------------------------------------

  Molecules of type:            1

  Packing:|0                                                        100%|
          |*********************

  Restraint-only function value:    0.0000000000000000     
  Maximum violation of the restraints:    0.0000000000000000     

--------------------------------------------------------------------------------

  Molecules of type:            2

  Packing:|0                                                        100%|
          |******

  Restraint-only function value:    8.5355875080435634E-018
  Maximum violation of the restraints:    8.5355875080435634E-018

--------------------------------------------------------------------------------

  Molecules of type:            3

  Packing:|0                                                        100%|
          |*********************

  Restraint-only function value:    9.2182697407920434E-003
  Maximum violation of the restraints:    4.2368506549131024E-003

--------------------------------------------------------------------------------

  Rescaling maximum and minimum coordinates... 
  Mininum and maximum coordinates after constraint fitting: 
   x: [   -4.0291635469793190E-002 ,    11.842831623900466       ] 
   y: [   -5.5135041541332962E-003 ,    11.842831645263223       ] 
   z: [    2.6674893405242983E-009 ,    11.888857997902642       ] 
  Computing size of patches... 
  Number of cells in each direction and cell sides: 
   x:            5  cells of size    2.3685663286394716     
   y:            5  cells of size    2.3685663286394716     
   z:            5  cells of size    2.3685663286394716     
  Cell-system length:   11.84283  11.84283  11.84283
  Reseting center of mass... 

--------------------------------------------------------------------------------

  Setting initial trial coordinates ... 

--------------------------------------------------------------------------------

--------------------------------------------------------------------------------

  Molecules of type:            1
  Adjusting random positions to fit the constraints. 
  Restraint-only function value:    5.4633079272844250E-004
  Maximum violation of the restraints:    5.4633079272844250E-004

--------------------------------------------------------------------------------

  Molecules of type:            2
  Adjusting random positions to fit the constraints. 
  Restraint-only function value:    8.5355875080435634E-018
  Maximum violation of the restraints:    8.5355875080435634E-018

--------------------------------------------------------------------------------

  Molecules of type:            3
  Adjusting random positions to fit the constraints. 
  Restraint-only function value:    6.0523344438910207E-004
  Maximum violation of the restraints:    6.0523344438910207E-004

################################################################################

  Objective function at initial point:    1228.3207872913208     

################################################################################

  Packing molecules of type:            1

################################################################################


  Initial approximation is a solution. Nothing to do. 

  Current point written to file: solvated_150/1tetramethylazanium_1F_N,N-dimethylformamide.xyz
--------------------------------------------------------------------------------
  Packing solved for molecules of type           1
  Objective function value:    5.4633079272844250E-004
  Maximum violation of target distance:    0.0000000000000000     
  Max. constraint violation:    5.4633079272844250E-004
--------------------------------------------------------------------------------

################################################################################

  Packing molecules of type:            2

################################################################################


  Initial approximation is a solution. Nothing to do. 

  Current point written to file: solvated_150/1tetramethylazanium_1F_N,N-dimethylformamide.xyz
--------------------------------------------------------------------------------
  Packing solved for molecules of type           2
  Objective function value:    8.5355875080435634E-018
  Maximum violation of target distance:    0.0000000000000000     
  Max. constraint violation:    8.5355875080435634E-018
--------------------------------------------------------------------------------

################################################################################

  Packing molecules of type:            3

################################################################################


--------------------------------------------------------------------------------

  Starting GENCAN loop:            0
  Scaling radii by:    1.1000000000000001     

  Packing:|0                                                        100%|
          |*************************************************************|

  Function value from last GENCAN loop: f = .47513E-01
  Best function value before: f = .11760E+04
  Improvement from best function value:    99.99 %
  Improvement from last loop:    99.99 %
  Maximum violation of target distance:     0.000000
  Maximum violation of the constraints: .22826E-01
  All-type function value: .96589E+02

--------------------------------------------------------------------------------


--------------------------------------------------------------------------------

  Starting GENCAN loop:            1
  Scaling radii by:    1.1000000000000001     

  Packing:|0                                                        100%|
          |***

  Function value from last GENCAN loop: f = .13082E-01
  Best function value before: f = .47513E-01
  Improvement from best function value:    72.47 %
  Improvement from last loop:    72.47 %
  Maximum violation of target distance:     0.000000
  Maximum violation of the constraints: .62130E-02
  Current structure written to file: solvated_150/1tetramethylazanium_1F_N,N-dimethylformamide.xyz
--------------------------------------------------------------------------------
  Packing solved for molecules of type           3
  Objective function value:    1.3081503722170850E-002
  Maximum violation of target distance:    0.0000000000000000     
  Max. constraint violation:    6.2130081635473526E-003
--------------------------------------------------------------------------------

################################################################################

  Packing all molecules together 

################################################################################


--------------------------------------------------------------------------------

  Starting GENCAN loop:            0
  Scaling radii by:    1.1000000000000001     

  Packing:|0                                                        100%|
          |*********************************************

  Function value from last GENCAN loop: f = .32818E-02
  Best function value before: f = .95411E+02
  Improvement from best function value:    99.99 %
  Improvement from last loop:    99.99 %
  Maximum violation of target distance:     0.000000
  Maximum violation of the constraints: .24849E-02

################################################################################

                                 Success! 
              Final objective function value: .32818E-02
              Maximum violation of target distance:   0.000000
              Maximum violation of the constraints: .24849E-02

--------------------------------------------------------------------------------

              Please cite this work if Packmol was useful: 

           L. Martinez, R. Andrade, E. G. Birgin, J. M. Martinez, 
         PACKMOL: A package for building initial configurations for
                   molecular dynamics simulations. 
        Journal of Computational Chemistry, 30(13) pp. 2157-2164, 2009.
                  https://doi.org/10.1002/jcc.21224

################################################################################

  Solution written to file: solvated_150/1tetramethylazanium_1F_N,N-dimethylformamide.xyz

--------------------------------------------------------------------------------

   Running time:    3.84020023E-02  seconds. 

--------------------------------------------------------------------------------


