
################################################################################

 PACKMOL - Packing optimization for the automated generation of
 starting configurations for molecular dynamics simulations.
 
                                                             Version 21.1.2 

################################################################################

  Packmol must be run with: packmol < inputfile.inp 

  Userguide at: http://m3g.iqm.unicamp.br/packmol 

  Reading input file... (Control-C aborts)
  Types of coordinate files specified: xyz
  Periodic boundary condition activated: 
    Minimum coordinates:     0.00    0.00    0.00
    Maximum coordinates:    11.52   11.52   11.52
  Seed for random number generator:      1234567
  Output file: solvated_150/1tetraethylazanium_1chlorite_acetic-acid.xyz
  Reading coordinate file: ../structures/tetraethylazanium.xyz
  Reading coordinate file: ../structures/chlorite.xyz
  Reading coordinate file: ../structures/acetic-acid.xyz
  Number of independent structures:            3
  The structures are: 
  Structure            1 :Properties=species:S:1:pos:R:3 iupac_name=tetraethylazanium pbc="F F F"(          29  atoms)
  Structure            2 :Properties=species:S:1:pos:R:3 iupac_name=chlorite pbc="F F F"(           3  atoms)
  Structure            3 :Properties=species:S:1:pos:R:3 iupac_name=acetic-acid pbc="F F F"(           8  atoms)
  Maximum number of GENCAN loops for all molecule packing:          600
  Distance tolerance:    2.0000000000000000     
  Number of molecules of type            1 :            1
  Number of molecules of type            2 :            1
  Number of molecules of type            3 :           14
  Total number of restrictions:            3
  Total number of atoms:          144
  Total number of molecules:           16
  Number of fixed molecules:            0
  Number of free molecules:           16
  Number of variables:           96
  Total number of fixed atoms:            0
  PBC on: Constraint automatically added to non-fixed atoms:
  -> inside box     0.00    0.00    0.00   11.52   11.52   11.52
  Updated total number of restrictions:            4
  Maximum internal distance of type            1 :    5.9772380795815723     
  Maximum internal distance of type            2 :    2.1268392388236590     
  Maximum internal distance of type            3 :    4.0492717592179464     
  All atoms must be within these coordinates: 
   x: [   -993.60000000000002      ,    1006.4000000000000       ] 
   y: [   -994.79447170094159      ,    1005.2055282990584       ] 
   z: [   -994.79498074333060      ,    1005.2050192566694       ] 
  If the system is larger than this, increase the sidemax parameter. 

################################################################################

  Building initial approximation ... 

################################################################################

  Adjusting initial point to fit the constraints 

--------------------------------------------------------------------------------

--------------------------------------------------------------------------------

  Molecules of type:            1

  Packing:|0                                                        100%|
          |******************

  Restraint-only function value:    0.0000000000000000     
  Maximum violation of the restraints:    0.0000000000000000     

--------------------------------------------------------------------------------

  Molecules of type:            2

  Packing:|0                                                        100%|
          |************

  Restraint-only function value:    0.0000000000000000     
  Maximum violation of the restraints:    0.0000000000000000     

--------------------------------------------------------------------------------

  Molecules of type:            3

  Packing:|0                                                        100%|
          |************************

  Restraint-only function value:    5.4806739780956685E-010
  Maximum violation of the restraints:    5.4806739780956685E-010

--------------------------------------------------------------------------------

  Rescaling maximum and minimum coordinates... 
  Mininum and maximum coordinates after constraint fitting: 
   x: [   -1.6553963238595869E-005 ,    11.504874534854112       ] 
   y: [    1.5712242875515606E-002 ,    11.509375909919518       ] 
   z: [    9.5576201805759389E-003 ,    11.516380709598527       ] 
  Computing size of patches... 
  Number of cells in each direction and cell sides: 
   x:            5  cells of size    2.3032914261520085     
   y:            5  cells of size    2.3032914261520085     
   z:            5  cells of size    2.3032914261520085     
  Cell-system length:   11.51646  11.51646  11.51646
  Reseting center of mass... 

--------------------------------------------------------------------------------

  Setting initial trial coordinates ... 

--------------------------------------------------------------------------------

--------------------------------------------------------------------------------

  Molecules of type:            1
  Adjusting random positions to fit the constraints. 
  Restraint-only function value:    0.0000000000000000     
  Maximum violation of the restraints:    0.0000000000000000     

--------------------------------------------------------------------------------

  Molecules of type:            2
  Adjusting random positions to fit the constraints. 
  Packing:|0                                                        100%|
          |******
  Restraint-only function value:    0.0000000000000000     
  Maximum violation of the restraints:    0.0000000000000000     

--------------------------------------------------------------------------------

  Molecules of type:            3
  Adjusting random positions to fit the constraints. 
  Packing:|0                                                        100%|
          |***
  Restraint-only function value:    1.4520763873705758E-002
  Maximum violation of the restraints:    9.2290088224051756E-003

################################################################################

  Objective function at initial point:    1140.3778158596406     

################################################################################

  Packing molecules of type:            1

################################################################################


  Initial approximation is a solution. Nothing to do. 

  Current point written to file: solvated_150/1tetraethylazanium_1chlorite_acetic-acid.xyz
--------------------------------------------------------------------------------
  Packing solved for molecules of type           1
  Objective function value:    0.0000000000000000     
  Maximum violation of target distance:    0.0000000000000000     
  Max. constraint violation:    0.0000000000000000     
--------------------------------------------------------------------------------

################################################################################

  Packing molecules of type:            2

################################################################################


  Initial approximation is a solution. Nothing to do. 

  Current point written to file: solvated_150/1tetraethylazanium_1chlorite_acetic-acid.xyz
--------------------------------------------------------------------------------
  Packing solved for molecules of type           2
  Objective function value:    0.0000000000000000     
  Maximum violation of target distance:    0.0000000000000000     
  Max. constraint violation:    0.0000000000000000     
--------------------------------------------------------------------------------

################################################################################

  Packing molecules of type:            3

################################################################################


--------------------------------------------------------------------------------

  Starting GENCAN loop:            0
  Scaling radii by:    1.1000000000000001     

  Packing:|0                                                        100%|
          |******************************************************

  Function value from last GENCAN loop: f = .10240E-01
  Best function value before: f = .59993E+03
  Improvement from best function value:    99.99 %
  Improvement from last loop:    99.99 %
  Maximum violation of target distance:     0.000000
  Maximum violation of the constraints: .61809E-02
  Current structure written to file: solvated_150/1tetraethylazanium_1chlorite_acetic-acid.xyz
--------------------------------------------------------------------------------
  Packing solved for molecules of type           3
  Objective function value:    1.0239880179602508E-002
  Maximum violation of target distance:    0.0000000000000000     
  Max. constraint violation:    6.1809488761727788E-003
--------------------------------------------------------------------------------

################################################################################

  Packing all molecules together 

################################################################################


--------------------------------------------------------------------------------

  Starting GENCAN loop:            0
  Scaling radii by:    1.1000000000000001     

  Packing:|0                                                        100%|
          |******************************************

  Function value from last GENCAN loop: f = .23590E-01
  Best function value before: f = .37168E+03
  Improvement from best function value:    99.99 %
  Improvement from last loop:    99.99 %
  Maximum violation of target distance:     0.000000
  Maximum violation of the constraints: .74917E-02

################################################################################

                                 Success! 
              Final objective function value: .23590E-01
              Maximum violation of target distance:   0.000000
              Maximum violation of the constraints: .74917E-02

--------------------------------------------------------------------------------

              Please cite this work if Packmol was useful: 

           L. Martinez, R. Andrade, E. G. Birgin, J. M. Martinez, 
         PACKMOL: A package for building initial configurations for
                   molecular dynamics simulations. 
        Journal of Computational Chemistry, 30(13) pp. 2157-2164, 2009.
                  https://doi.org/10.1002/jcc.21224

################################################################################

  Solution written to file: solvated_150/1tetraethylazanium_1chlorite_acetic-acid.xyz

--------------------------------------------------------------------------------

   Running time:    3.03220078E-02  seconds. 

--------------------------------------------------------------------------------


