
################################################################################

 PACKMOL - Packing optimization for the automated generation of
 starting configurations for molecular dynamics simulations.
 
                                                             Version 21.1.2 

################################################################################

  Packmol must be run with: packmol < inputfile.inp 

  Userguide at: http://m3g.iqm.unicamp.br/packmol 

  Reading input file... (Control-C aborts)
  Types of coordinate files specified: xyz
  Periodic boundary condition activated: 
    Minimum coordinates:     0.00    0.00    0.00
    Maximum coordinates:    11.57   11.57   11.57
  Seed for random number generator:      1234567
  Output file: solvated_150/1tetramethylazanium_1formate_ethanol.xyz
  Reading coordinate file: ../structures/tetramethylazanium.xyz
  Reading coordinate file: ../structures/formate.xyz
  Reading coordinate file: ../structures/ethanol.xyz
  Number of independent structures:            3
  The structures are: 
  Structure            1 :Properties=species:S:1:pos:R:3 iupac_name=tetramethylazanium pbc="F F F"(          17  atoms)
  Structure            2 :Properties=species:S:1:pos:R:3 iupac_name=formate pbc="F F F"(           4  atoms)
  Structure            3 :Properties=species:S:1:pos:R:3 iupac_name=ethanol pbc="F F F"(           9  atoms)
  Maximum number of GENCAN loops for all molecule packing:          600
  Distance tolerance:    2.0000000000000000     
  Number of molecules of type            1 :            1
  Number of molecules of type            2 :            1
  Number of molecules of type            3 :           14
  Total number of restrictions:            3
  Total number of atoms:          147
  Total number of molecules:           16
  Number of fixed molecules:            0
  Number of free molecules:           16
  Number of variables:           96
  Total number of fixed atoms:            0
  PBC on: Constraint automatically added to non-fixed atoms:
  -> inside box     0.00    0.00    0.00   11.57   11.57   11.57
  Updated total number of restrictions:            4
  Maximum internal distance of type            1 :    4.2493752776143463     
  Maximum internal distance of type            2 :    2.2928000000000002     
  Maximum internal distance of type            3 :    3.5502894431299539     
  All atoms must be within these coordinates: 
   x: [   -996.84205636524950      ,    1003.1579436347505       ] 
   y: [   -996.79999999999995      ,    1003.2000000000000       ] 
   z: [   -996.84376303312183      ,    1003.1562369668782       ] 
  If the system is larger than this, increase the sidemax parameter. 

################################################################################

  Building initial approximation ... 

################################################################################

  Adjusting initial point to fit the constraints 

--------------------------------------------------------------------------------

--------------------------------------------------------------------------------

  Molecules of type:            1

  Packing:|0                                                        100%|
          |******************

  Restraint-only function value:    0.0000000000000000     
  Maximum violation of the restraints:    0.0000000000000000     

--------------------------------------------------------------------------------

  Molecules of type:            2

  Packing:|0                                                        100%|
          |***************

  Restraint-only function value:    0.0000000000000000     
  Maximum violation of the restraints:    0.0000000000000000     

--------------------------------------------------------------------------------

  Molecules of type:            3

  Packing:|0                                                        100%|
          |*********************

  Restraint-only function value:    4.3305346199912130E-006
  Maximum violation of the restraints:    4.3305346199912130E-006

--------------------------------------------------------------------------------

  Rescaling maximum and minimum coordinates... 
  Mininum and maximum coordinates after constraint fitting: 
   x: [    5.3409525214543332E-003 ,    11.565561589060316       ] 
   y: [    5.8346209261250642E-002 ,    11.570101283955546       ] 
   z: [   -1.4714847297867574E-003 ,    11.573593112227769       ] 
  Computing size of patches... 
  Number of cells in each direction and cell sides: 
   x:            5  cells of size    2.3149696429388666     
   y:            5  cells of size    2.3149696429388666     
   z:            5  cells of size    2.3149696429388666     
  Cell-system length:   11.57485  11.57485  11.57485
  Reseting center of mass... 

--------------------------------------------------------------------------------

  Setting initial trial coordinates ... 

--------------------------------------------------------------------------------

--------------------------------------------------------------------------------

  Molecules of type:            1
  Adjusting random positions to fit the constraints. 
  Packing:|0                                                        100%|
          |***
  Restraint-only function value:    0.0000000000000000     
  Maximum violation of the restraints:    0.0000000000000000     

--------------------------------------------------------------------------------

  Molecules of type:            2
  Adjusting random positions to fit the constraints. 
  Packing:|0                                                        100%|
          |***
  Restraint-only function value:    3.1528345368474675E-006
  Maximum violation of the restraints:    3.1528345368474675E-006

--------------------------------------------------------------------------------

  Molecules of type:            3
  Adjusting random positions to fit the constraints. 
  Restraint-only function value:    1.1988576336139131E-002
  Maximum violation of the restraints:    7.1497273164638211E-003

################################################################################

  Objective function at initial point:    899.68855624569585     

################################################################################

  Packing molecules of type:            1

################################################################################


  Initial approximation is a solution. Nothing to do. 

  Current point written to file: solvated_150/1tetramethylazanium_1formate_ethanol.xyz
--------------------------------------------------------------------------------
  Packing solved for molecules of type           1
  Objective function value:    0.0000000000000000     
  Maximum violation of target distance:    0.0000000000000000     
  Max. constraint violation:    0.0000000000000000     
--------------------------------------------------------------------------------

################################################################################

  Packing molecules of type:            2

################################################################################


  Initial approximation is a solution. Nothing to do. 

  Current point written to file: solvated_150/1tetramethylazanium_1formate_ethanol.xyz
--------------------------------------------------------------------------------
  Packing solved for molecules of type           2
  Objective function value:    3.1528345368474675E-006
  Maximum violation of target distance:    0.0000000000000000     
  Max. constraint violation:    3.1528345368474675E-006
--------------------------------------------------------------------------------

################################################################################

  Packing molecules of type:            3

################################################################################


--------------------------------------------------------------------------------

  Starting GENCAN loop:            0
  Scaling radii by:    1.1000000000000001     

  Packing:|0                                                        100%|
          |*********************************************

  Function value from last GENCAN loop: f = .10723E-01
  Best function value before: f = .56393E+03
  Improvement from best function value:    99.99 %
  Improvement from last loop:    99.99 %
  Maximum violation of target distance:     0.000000
  Maximum violation of the constraints: .65298E-02
  Current structure written to file: solvated_150/1tetramethylazanium_1formate_ethanol.xyz
--------------------------------------------------------------------------------
  Packing solved for molecules of type           3
  Objective function value:    1.0722894540535315E-002
  Maximum violation of target distance:    0.0000000000000000     
  Max. constraint violation:    6.5297649999572754E-003
--------------------------------------------------------------------------------

################################################################################

  Packing all molecules together 

################################################################################


--------------------------------------------------------------------------------

  Starting GENCAN loop:            0
  Scaling radii by:    1.1000000000000001     

  Packing:|0                                                        100%|
          |*********************************************************

  Function value from last GENCAN loop: f = .19101E-01
  Best function value before: f = .27803E+03
  Improvement from best function value:    99.99 %
  Improvement from last loop:    99.99 %
  Maximum violation of target distance:     0.000000
  Maximum violation of the constraints: .83753E-02

################################################################################

                                 Success! 
              Final objective function value: .19101E-01
              Maximum violation of target distance:   0.000000
              Maximum violation of the constraints: .83753E-02

--------------------------------------------------------------------------------

              Please cite this work if Packmol was useful: 

           L. Martinez, R. Andrade, E. G. Birgin, J. M. Martinez, 
         PACKMOL: A package for building initial configurations for
                   molecular dynamics simulations. 
        Journal of Computational Chemistry, 30(13) pp. 2157-2164, 2009.
                  https://doi.org/10.1002/jcc.21224

################################################################################

  Solution written to file: solvated_150/1tetramethylazanium_1formate_ethanol.xyz

--------------------------------------------------------------------------------

   Running time:    3.59420031E-02  seconds. 

--------------------------------------------------------------------------------


