
################################################################################

 PACKMOL - Packing optimization for the automated generation of
 starting configurations for molecular dynamics simulations.
 
                                                             Version 21.1.2 

################################################################################

  Packmol must be run with: packmol < inputfile.inp 

  Userguide at: http://m3g.iqm.unicamp.br/packmol 

  Reading input file... (Control-C aborts)
  Types of coordinate files specified: xyz
  Periodic boundary condition activated: 
    Minimum coordinates:     0.00    0.00    0.00
    Maximum coordinates:    10.72   10.72   10.72
  Seed for random number generator:      1234567
  Output file: solvated_150/1tetraethylazanium_1cyanide_oxidane.xyz
  Reading coordinate file: ../structures/tetraethylazanium.xyz
  Reading coordinate file: ../structures/cyanide.xyz
  Reading coordinate file: ../structures/oxidane.xyz
  Number of independent structures:            3
  The structures are: 
  Structure            1 :Properties=species:S:1:pos:R:3 iupac_name=tetraethylazanium pbc="F F F"(          29  atoms)
  Structure            2 :Properties=species:S:1:pos:R:3 iupac_name=cyanide pbc="F F F"(           2  atoms)
  Structure            3 :Properties=species:S:1:pos:R:3 iupac_name=oxidane pbc="F F F"(           3  atoms)
  Maximum number of GENCAN loops for all molecule packing:          600
  Distance tolerance:    2.0000000000000000     
  Number of molecules of type            1 :            1
  Number of molecules of type            2 :            1
  Number of molecules of type            3 :           39
  Total number of restrictions:            3
  Total number of atoms:          148
  Total number of molecules:           41
  Number of fixed molecules:            0
  Number of free molecules:           41
  Number of variables:          246
  Total number of fixed atoms:            0
  PBC on: Constraint automatically added to non-fixed atoms:
  -> inside box     0.00    0.00    0.00   10.72   10.72   10.72
  Updated total number of restrictions:            4
  Maximum internal distance of type            1 :    5.9772380795815723     
  Maximum internal distance of type            2 :    1.1133999999999999     
  Maximum internal distance of type            3 :    1.5269386005992513     
  All atoms must be within these coordinates: 
   x: [   -993.60000000000002      ,    1006.4000000000000       ] 
   y: [   -994.79447170094159      ,    1005.2055282990584       ] 
   z: [   -994.79498074333060      ,    1005.2050192566694       ] 
  If the system is larger than this, increase the sidemax parameter. 

################################################################################

  Building initial approximation ... 

################################################################################

  Adjusting initial point to fit the constraints 

--------------------------------------------------------------------------------

--------------------------------------------------------------------------------

  Molecules of type:            1

  Packing:|0                                                        100%|
          |******************

  Restraint-only function value:    0.0000000000000000     
  Maximum violation of the restraints:    0.0000000000000000     

--------------------------------------------------------------------------------

  Molecules of type:            2

  Packing:|0                                                        100%|
          |*********

  Restraint-only function value:    8.5469112952437957E-016
  Maximum violation of the restraints:    8.2116784120101971E-016

--------------------------------------------------------------------------------

  Molecules of type:            3

  Packing:|0                                                        100%|
          |***************

  Restraint-only function value:    6.3951470410338214E-004
  Maximum violation of the restraints:    2.5975200693628914E-004

--------------------------------------------------------------------------------

  Rescaling maximum and minimum coordinates... 
  Mininum and maximum coordinates after constraint fitting: 
   x: [   -4.6440303717510116E-004 ,    10.724106312360139       ] 
   y: [   -1.1396315346117120E-002 ,    10.727070082561767       ] 
   z: [   -7.8552350791519544E-003 ,    10.725524080547897       ] 
  Computing size of patches... 
  Number of cells in each direction and cell sides: 
   x:            4  cells of size    2.6805553077259194     
   y:            4  cells of size    2.6805553077259194     
   z:            4  cells of size    2.6805553077259194     
  Cell-system length:   10.72222  10.72222  10.72222
  Reseting center of mass... 

--------------------------------------------------------------------------------

  Setting initial trial coordinates ... 

--------------------------------------------------------------------------------

--------------------------------------------------------------------------------

  Molecules of type:            1
  Adjusting random positions to fit the constraints. 
  Restraint-only function value:    0.0000000000000000     
  Maximum violation of the restraints:    0.0000000000000000     

--------------------------------------------------------------------------------

  Molecules of type:            2
  Adjusting random positions to fit the constraints. 
  Packing:|0                                                        100%|
          |***
  Restraint-only function value:    0.0000000000000000     
  Maximum violation of the restraints:    0.0000000000000000     

--------------------------------------------------------------------------------

  Molecules of type:            3
  Adjusting random positions to fit the constraints. 
  Packing:|0                                                        100%|
          |***
  Restraint-only function value:    0.0000000000000000     
  Maximum violation of the restraints:    0.0000000000000000     

################################################################################

  Objective function at initial point:    1053.7453135516960     

################################################################################

  Packing molecules of type:            1

################################################################################


  Initial approximation is a solution. Nothing to do. 

  Current point written to file: solvated_150/1tetraethylazanium_1cyanide_oxidane.xyz
--------------------------------------------------------------------------------
  Packing solved for molecules of type           1
  Objective function value:    0.0000000000000000     
  Maximum violation of target distance:    0.0000000000000000     
  Max. constraint violation:    0.0000000000000000     
--------------------------------------------------------------------------------

################################################################################

  Packing molecules of type:            2

################################################################################


  Initial approximation is a solution. Nothing to do. 

  Current point written to file: solvated_150/1tetraethylazanium_1cyanide_oxidane.xyz
--------------------------------------------------------------------------------
  Packing solved for molecules of type           2
  Objective function value:    0.0000000000000000     
  Maximum violation of target distance:    0.0000000000000000     
  Max. constraint violation:    0.0000000000000000     
--------------------------------------------------------------------------------

################################################################################

  Packing molecules of type:            3

################################################################################


--------------------------------------------------------------------------------

  Starting GENCAN loop:            0
  Scaling radii by:    1.1000000000000001     

  Packing:|0                                                        100%|
          |***************************************

  Function value from last GENCAN loop: f = .11735E-01
  Best function value before: f = .69270E+03
  Improvement from best function value:    99.99 %
  Improvement from last loop:    99.99 %
  Maximum violation of target distance:     0.000000
  Maximum violation of the constraints: .80131E-02
  Current structure written to file: solvated_150/1tetraethylazanium_1cyanide_oxidane.xyz
--------------------------------------------------------------------------------
  Packing solved for molecules of type           3
  Objective function value:    1.1734970964788470E-002
  Maximum violation of target distance:    0.0000000000000000     
  Max. constraint violation:    8.0131323457723440E-003
--------------------------------------------------------------------------------

################################################################################

  Packing all molecules together 

################################################################################


--------------------------------------------------------------------------------

  Starting GENCAN loop:            0
  Scaling radii by:    1.1000000000000001     

  Packing:|0                                                        100%|
          |***************************************

  Function value from last GENCAN loop: f = .31379E-01
  Best function value before: f = .41586E+03
  Improvement from best function value:    99.99 %
  Improvement from last loop:    99.99 %
  Maximum violation of target distance:     0.000000
  Maximum violation of the constraints: .67364E-02

################################################################################

                                 Success! 
              Final objective function value: .31379E-01
              Maximum violation of target distance:   0.000000
              Maximum violation of the constraints: .67364E-02

--------------------------------------------------------------------------------

              Please cite this work if Packmol was useful: 

           L. Martinez, R. Andrade, E. G. Birgin, J. M. Martinez, 
         PACKMOL: A package for building initial configurations for
                   molecular dynamics simulations. 
        Journal of Computational Chemistry, 30(13) pp. 2157-2164, 2009.
                  https://doi.org/10.1002/jcc.21224

################################################################################

  Solution written to file: solvated_150/1tetraethylazanium_1cyanide_oxidane.xyz

--------------------------------------------------------------------------------

   Running time:    3.60180028E-02  seconds. 

--------------------------------------------------------------------------------


