
################################################################################

 PACKMOL - Packing optimization for the automated generation of
 starting configurations for molecular dynamics simulations.
 
                                                             Version 21.1.2 

################################################################################

  Packmol must be run with: packmol < inputfile.inp 

  Userguide at: http://m3g.iqm.unicamp.br/packmol 

  Reading input file... (Control-C aborts)
  Types of coordinate files specified: xyz
  Periodic boundary condition activated: 
    Minimum coordinates:     0.00    0.00    0.00
    Maximum coordinates:    12.58   12.58   12.58
  Seed for random number generator:      1234567
  Output file: solvated_150/1Th_4chlorate_1,3-dioxolan-2-one.xyz
  Reading coordinate file: ../structures/Th.xyz
  Reading coordinate file: ../structures/chlorate.xyz
  Reading coordinate file: ../structures/1,3-dioxolan-2-one.xyz
  Number of independent structures:            3
  The structures are: 
  Structure            1 :Properties=species:S:1:pos:R:3 iupac_name=Th pbc="F F F"(           1  atoms)
  Structure            2 :Properties=species:S:1:pos:R:3 iupac_name=chlorate pbc="F F F"(           4  atoms)
  Structure            3 :Properties=species:S:1:pos:R:3 iupac_name=1,3-dioxolan-2-one pbc="F F F"(          10  atoms)
  Maximum number of GENCAN loops for all molecule packing:          600
  Distance tolerance:    2.0000000000000000     
  Number of molecules of type            1 :            1
  Number of molecules of type            2 :            4
  Number of molecules of type            3 :           13
  Total number of restrictions:            3
  Total number of atoms:          147
  Total number of molecules:           18
  Number of fixed molecules:            0
  Number of free molecules:           18
  Number of variables:          108
  Total number of fixed atoms:            0
  PBC on: Constraint automatically added to non-fixed atoms:
  -> inside box     0.00    0.00    0.00   12.58   12.58   12.58
  Updated total number of restrictions:            4
  Maximum internal distance of type            1 :    0.0000000000000000     
  Maximum internal distance of type            2 :    2.7625205161410111     
  Maximum internal distance of type            3 :    4.2728366537933553     
  All atoms must be within these coordinates: 
   x: [   -1000.0000000000000      ,    1000.0000000000000       ] 
   y: [   -1000.0000000000000      ,    1000.0000000000000       ] 
   z: [   -1000.0000000000000      ,    1000.0000000000000       ] 
  If the system is larger than this, increase the sidemax parameter. 

################################################################################

  Building initial approximation ... 

################################################################################

  Adjusting initial point to fit the constraints 

--------------------------------------------------------------------------------

--------------------------------------------------------------------------------

  Molecules of type:            1

  Packing:|0                                                        100%|
          |******

  Restraint-only function value:    2.0136906221950779E-014
  Maximum violation of the restraints:    2.0136906221950779E-014

--------------------------------------------------------------------------------

  Molecules of type:            2

  Packing:|0                                                        100%|
          |***************

  Restraint-only function value:    2.4188042356721624E-003
  Maximum violation of the restraints:    2.4069058701714800E-003

--------------------------------------------------------------------------------

  Molecules of type:            3

  Packing:|0                                                        100%|
          |******************

  Restraint-only function value:    3.0084020539818839E-003
  Maximum violation of the restraints:    1.8134792619045712E-003

--------------------------------------------------------------------------------

  Rescaling maximum and minimum coordinates... 
  Mininum and maximum coordinates after constraint fitting: 
   x: [    2.0810877319349472E-003 ,    12.584791131487961       ] 
   y: [    2.5475237748969207E-002 ,    12.617047685953459       ] 
   z: [   -1.5342121978670071E-004 ,    12.612468984454008       ] 
  Computing size of patches... 
  Number of cells in each direction and cell sides: 
   x:            5  cells of size    2.5164713733555386     
   y:            5  cells of size    2.5164713733555386     
   z:            5  cells of size    2.5164713733555386     
  Cell-system length:   12.58236  12.58236  12.58236
  Reseting center of mass... 

--------------------------------------------------------------------------------

  Setting initial trial coordinates ... 

--------------------------------------------------------------------------------

--------------------------------------------------------------------------------

  Molecules of type:            1
  Adjusting random positions to fit the constraints. 
  Restraint-only function value:    2.0136906221950779E-014
  Maximum violation of the restraints:    2.0136906221950779E-014

--------------------------------------------------------------------------------

  Molecules of type:            2
  Adjusting random positions to fit the constraints. 
  Packing:|0                                                        100%|
          |***
  Restraint-only function value:    0.0000000000000000     
  Maximum violation of the restraints:    0.0000000000000000     

--------------------------------------------------------------------------------

  Molecules of type:            3
  Adjusting random positions to fit the constraints. 
  Restraint-only function value:    0.0000000000000000     
  Maximum violation of the restraints:    0.0000000000000000     

################################################################################

  Objective function at initial point:    763.83841545742257     

################################################################################

  Packing molecules of type:            1

################################################################################


  Initial approximation is a solution. Nothing to do. 

  Current point written to file: solvated_150/1Th_4chlorate_1,3-dioxolan-2-one.xyz
--------------------------------------------------------------------------------
  Packing solved for molecules of type           1
  Objective function value:    2.0136906221950779E-014
  Maximum violation of target distance:    0.0000000000000000     
  Max. constraint violation:    2.0136906221950779E-014
--------------------------------------------------------------------------------

################################################################################

  Packing molecules of type:            2

################################################################################


--------------------------------------------------------------------------------

  Starting GENCAN loop:            0
  Scaling radii by:    1.1000000000000001     

  Packing:|0                                                        100%|
          |***************

  Function value from last GENCAN loop: f = .00000E+00
  Best function value before: f = .25799E+02
  Improvement from best function value:    99.99 %
  Improvement from last loop:    99.99 %
  Maximum violation of target distance:     0.000000
  Maximum violation of the constraints: .00000E+00
  Current structure written to file: solvated_150/1Th_4chlorate_1,3-dioxolan-2-one.xyz
--------------------------------------------------------------------------------
  Packing solved for molecules of type           2
  Objective function value:    0.0000000000000000     
  Maximum violation of target distance:    0.0000000000000000     
  Max. constraint violation:    0.0000000000000000     
--------------------------------------------------------------------------------

################################################################################

  Packing molecules of type:            3

################################################################################


--------------------------------------------------------------------------------

  Starting GENCAN loop:            0
  Scaling radii by:    1.1000000000000001     

  Packing:|0                                                        100%|
          |*************************************************************|


  Function value from last GENCAN loop: f = .64249E-03
  Best function value before: f = .73263E+03
  Improvement from best function value:    99.99 %
  Improvement from last loop:    99.99 %
  Maximum violation of target distance:     0.000000
  Maximum violation of the constraints: .64249E-03
  Current structure written to file: solvated_150/1Th_4chlorate_1,3-dioxolan-2-one.xyz
--------------------------------------------------------------------------------
  Packing solved for molecules of type           3
  Objective function value:    6.4248855143620755E-004
  Maximum violation of target distance:    0.0000000000000000     
  Max. constraint violation:    6.4248855143620755E-004
--------------------------------------------------------------------------------

################################################################################

  Packing all molecules together 

################################################################################


--------------------------------------------------------------------------------

  Starting GENCAN loop:            0
  Scaling radii by:    1.1000000000000001     

  Packing:|0                                                        100%|
          |*********************************

  Function value from last GENCAN loop: f = .35458E-02
  Best function value before: f = .12464E+03
  Improvement from best function value:    99.99 %
  Improvement from last loop:    99.99 %
  Maximum violation of target distance:     0.000000
  Maximum violation of the constraints: .20399E-02

################################################################################

                                 Success! 
              Final objective function value: .35458E-02
              Maximum violation of target distance:   0.000000
              Maximum violation of the constraints: .20399E-02

--------------------------------------------------------------------------------

              Please cite this work if Packmol was useful: 

           L. Martinez, R. Andrade, E. G. Birgin, J. M. Martinez, 
         PACKMOL: A package for building initial configurations for
                   molecular dynamics simulations. 
        Journal of Computational Chemistry, 30(13) pp. 2157-2164, 2009.
                  https://doi.org/10.1002/jcc.21224

################################################################################

  Solution written to file: solvated_150/1Th_4chlorate_1,3-dioxolan-2-one.xyz

--------------------------------------------------------------------------------

   Running time:    2.50619948E-02  seconds. 

--------------------------------------------------------------------------------


