
################################################################################

 PACKMOL - Packing optimization for the automated generation of
 starting configurations for molecular dynamics simulations.
 
                                                             Version 21.1.2 

################################################################################

  Packmol must be run with: packmol < inputfile.inp 

  Userguide at: http://m3g.iqm.unicamp.br/packmol 

  Reading input file... (Control-C aborts)
  Types of coordinate files specified: xyz
  Periodic boundary condition activated: 
    Minimum coordinates:     0.00    0.00    0.00
    Maximum coordinates:    12.04   12.04   12.04
  Seed for random number generator:      1234567
  Output file: solvated_150/1Th_4acetate_ethanol.xyz
  Reading coordinate file: ../structures/Th.xyz
  Reading coordinate file: ../structures/acetate.xyz
  Reading coordinate file: ../structures/ethanol.xyz
  Number of independent structures:            3
  The structures are: 
  Structure            1 :Properties=species:S:1:pos:R:3 iupac_name=Th pbc="F F F"(           1  atoms)
  Structure            2 :Properties=species:S:1:pos:R:3 iupac_name=acetate pbc="F F F"(           7  atoms)
  Structure            3 :Properties=species:S:1:pos:R:3 iupac_name=ethanol pbc="F F F"(           9  atoms)
  Maximum number of GENCAN loops for all molecule packing:          600
  Distance tolerance:    2.0000000000000000     
  Number of molecules of type            1 :            1
  Number of molecules of type            2 :            4
  Number of molecules of type            3 :           13
  Total number of restrictions:            3
  Total number of atoms:          146
  Total number of molecules:           18
  Number of fixed molecules:            0
  Number of free molecules:           18
  Number of variables:          108
  Total number of fixed atoms:            0
  PBC on: Constraint automatically added to non-fixed atoms:
  -> inside box     0.00    0.00    0.00   12.04   12.04   12.04
  Updated total number of restrictions:            4
  Maximum internal distance of type            1 :    0.0000000000000000     
  Maximum internal distance of type            2 :    3.2679070993527342     
  Maximum internal distance of type            3 :    3.5502894431299539     
  All atoms must be within these coordinates: 
   x: [   -1000.0000000000000      ,    1000.0000000000000       ] 
   y: [   -1000.0000000000000      ,    1000.0000000000000       ] 
   z: [   -1000.0000000000000      ,    1000.0000000000000       ] 
  If the system is larger than this, increase the sidemax parameter. 

################################################################################

  Building initial approximation ... 

################################################################################

  Adjusting initial point to fit the constraints 

--------------------------------------------------------------------------------

--------------------------------------------------------------------------------

  Molecules of type:            1

  Packing:|0                                                        100%|
          |******

  Restraint-only function value:    1.7628758847728545E-014
  Maximum violation of the restraints:    1.7628758847728545E-014

--------------------------------------------------------------------------------

  Molecules of type:            2

  Packing:|0                                                        100%|
          |***************

  Restraint-only function value:    0.0000000000000000     
  Maximum violation of the restraints:    0.0000000000000000     

--------------------------------------------------------------------------------

  Molecules of type:            3

  Packing:|0                                                        100%|
          |*********************

  Restraint-only function value:    3.7107483632198893E-003
  Maximum violation of the restraints:    3.7098505481263193E-003

--------------------------------------------------------------------------------

  Rescaling maximum and minimum coordinates... 
  Mininum and maximum coordinates after constraint fitting: 
   x: [   0.11016732027088362      ,    12.038327248035884       ] 
   y: [   0.25923201752350555      ,    12.038327356718369       ] 
   z: [   -4.3068843426114424E-002 ,    11.976085656962274       ] 
  Computing size of patches... 
  Number of cells in each direction and cell sides: 
   x:            5  cells of size    2.4076654525666887     
   y:            5  cells of size    2.4076654525666887     
   z:            5  cells of size    2.4076654525666887     
  Cell-system length:   12.03833  12.03833  12.03833
  Reseting center of mass... 

--------------------------------------------------------------------------------

  Setting initial trial coordinates ... 

--------------------------------------------------------------------------------

--------------------------------------------------------------------------------

  Molecules of type:            1
  Adjusting random positions to fit the constraints. 
  Restraint-only function value:    1.7628758847728545E-014
  Maximum violation of the restraints:    1.7628758847728545E-014

--------------------------------------------------------------------------------

  Molecules of type:            2
  Adjusting random positions to fit the constraints. 
  Packing:|0                                                        100%|
          |***
  Restraint-only function value:    0.0000000000000000     
  Maximum violation of the restraints:    0.0000000000000000     

--------------------------------------------------------------------------------

  Molecules of type:            3
  Adjusting random positions to fit the constraints. 
  Restraint-only function value:    0.0000000000000000     
  Maximum violation of the restraints:    0.0000000000000000     

################################################################################

  Objective function at initial point:    772.94859284626284     

################################################################################

  Packing molecules of type:            1

################################################################################


  Initial approximation is a solution. Nothing to do. 

  Current point written to file: solvated_150/1Th_4acetate_ethanol.xyz
--------------------------------------------------------------------------------
  Packing solved for molecules of type           1
  Objective function value:    1.7628758847728545E-014
  Maximum violation of target distance:    0.0000000000000000     
  Max. constraint violation:    1.7628758847728545E-014
--------------------------------------------------------------------------------

################################################################################

  Packing molecules of type:            2

################################################################################


--------------------------------------------------------------------------------

  Starting GENCAN loop:            0
  Scaling radii by:    1.1000000000000001     

  Packing:|0                                                        100%|
          |***

  Function value from last GENCAN loop: f = .00000E+00
  Best function value before: f = .42250E-02
  Improvement from best function value:    99.99 %
  Improvement from last loop:    99.99 %
  Maximum violation of target distance:     0.000000
  Maximum violation of the constraints: .00000E+00
  Current structure written to file: solvated_150/1Th_4acetate_ethanol.xyz
--------------------------------------------------------------------------------
  Packing solved for molecules of type           2
  Objective function value:    0.0000000000000000     
  Maximum violation of target distance:    0.0000000000000000     
  Max. constraint violation:    0.0000000000000000     
--------------------------------------------------------------------------------

################################################################################

  Packing molecules of type:            3

################################################################################


--------------------------------------------------------------------------------

  Starting GENCAN loop:            0
  Scaling radii by:    1.1000000000000001     

  Packing:|0                                                        100%|
          |************************************

  Function value from last GENCAN loop: f = .18745E-01
  Best function value before: f = .70580E+03
  Improvement from best function value:    99.99 %
  Improvement from last loop:    99.99 %
  Maximum violation of target distance:     0.000000
  Maximum violation of the constraints: .72708E-02
  Current structure written to file: solvated_150/1Th_4acetate_ethanol.xyz
--------------------------------------------------------------------------------
  Packing solved for molecules of type           3
  Objective function value:    1.8744589813563455E-002
  Maximum violation of target distance:    0.0000000000000000     
  Max. constraint violation:    7.2708497245629160E-003
--------------------------------------------------------------------------------

################################################################################

  Packing all molecules together 

################################################################################


--------------------------------------------------------------------------------

  Starting GENCAN loop:            0
  Scaling radii by:    1.1000000000000001     

  Packing:|0                                                        100%|
          |***************************

  Function value from last GENCAN loop: f = .39505E-03
  Best function value before: f = .10314E+03
  Improvement from best function value:    99.99 %
  Improvement from last loop:    99.99 %
  Maximum violation of target distance:     0.000000
  Maximum violation of the constraints: .18821E-03

################################################################################

                                 Success! 
              Final objective function value: .39505E-03
              Maximum violation of target distance:   0.000000
              Maximum violation of the constraints: .18821E-03

--------------------------------------------------------------------------------

              Please cite this work if Packmol was useful: 

           L. Martinez, R. Andrade, E. G. Birgin, J. M. Martinez, 
         PACKMOL: A package for building initial configurations for
                   molecular dynamics simulations. 
        Journal of Computational Chemistry, 30(13) pp. 2157-2164, 2009.
                  https://doi.org/10.1002/jcc.21224

################################################################################

  Solution written to file: solvated_150/1Th_4acetate_ethanol.xyz

--------------------------------------------------------------------------------

   Running time:    1.98879987E-02  seconds. 

--------------------------------------------------------------------------------


