
################################################################################

 PACKMOL - Packing optimization for the automated generation of
 starting configurations for molecular dynamics simulations.
 
                                                             Version 21.1.2 

################################################################################

  Packmol must be run with: packmol < inputfile.inp 

  Userguide at: http://m3g.iqm.unicamp.br/packmol 

  Reading input file... (Control-C aborts)
  Types of coordinate files specified: xyz
  Periodic boundary condition activated: 
    Minimum coordinates:     0.00    0.00    0.00
    Maximum coordinates:    16.49   16.49   16.49
  Seed for random number generator:      1234567
  Output file: solvated_150/1Th_4trifluoromethanesulfonate_tetrachloromethane.xyz
  Reading coordinate file: ../structures/Th.xyz
  Reading coordinate file: ../structures/trifluoromethanesulfonate.xyz
  Reading coordinate file: ../structures/tetrachloromethane.xyz
  Number of independent structures:            3
  The structures are: 
  Structure            1 :Properties=species:S:1:pos:R:3 iupac_name=Th pbc="F F F"(           1  atoms)
  Structure            2 :Properties=species:S:1:pos:R:3 iupac_name=trifluoromethanesulfonate pbc="F F F"(           8  atoms)
  Structure            3 :Properties=species:S:1:pos:R:3 iupac_name=tetrachloromethane pbc="F F F"(           5  atoms)
  Maximum number of GENCAN loops for all molecule packing:          600
  Distance tolerance:    2.0000000000000000     
  Number of molecules of type            1 :            1
  Number of molecules of type            2 :            4
  Number of molecules of type            3 :           23
  Total number of restrictions:            3
  Total number of atoms:          148
  Total number of molecules:           28
  Number of fixed molecules:            0
  Number of free molecules:           28
  Number of variables:          168
  Total number of fixed atoms:            0
  PBC on: Constraint automatically added to non-fixed atoms:
  -> inside box     0.00    0.00    0.00   16.49   16.49   16.49
  Updated total number of restrictions:            4
  Maximum internal distance of type            1 :    0.0000000000000000     
  Maximum internal distance of type            2 :    3.7274277538270275     
  Maximum internal distance of type            3 :    2.9101379795466742     
  All atoms must be within these coordinates: 
   x: [   -1000.0000000000000      ,    1000.0000000000000       ] 
   y: [   -1000.0000000000000      ,    1000.0000000000000       ] 
   z: [   -1000.0000000000000      ,    1000.0000000000000       ] 
  If the system is larger than this, increase the sidemax parameter. 

################################################################################

  Building initial approximation ... 

################################################################################

  Adjusting initial point to fit the constraints 

--------------------------------------------------------------------------------

--------------------------------------------------------------------------------

  Molecules of type:            1

  Packing:|0                                                        100%|
          |******

  Restraint-only function value:    2.0841266414331812E-014
  Maximum violation of the restraints:    2.0841266414331812E-014

--------------------------------------------------------------------------------

  Molecules of type:            2

  Packing:|0                                                        100%|
          |***************

  Restraint-only function value:    0.0000000000000000     
  Maximum violation of the restraints:    0.0000000000000000     

--------------------------------------------------------------------------------

  Molecules of type:            3

  Packing:|0                                                        100%|
          |******************

  Restraint-only function value:    1.9328537634681103E-003
  Maximum violation of the restraints:    1.6980863861133803E-003

--------------------------------------------------------------------------------

  Rescaling maximum and minimum coordinates... 
  Mininum and maximum coordinates after constraint fitting: 
   x: [   -1.0834375324741385E-002 ,    16.493220083507339       ] 
   y: [   -2.9138345750174120E-002 ,    16.493220126773167       ] 
   z: [   -2.9606042062368942E-009 ,    16.475859289568525       ] 
  Computing size of patches... 
  Number of cells in each direction and cell sides: 
   x:            7  cells of size    2.3561742909010683     
   y:            7  cells of size    2.3561742909010683     
   z:            7  cells of size    2.3561742909010683     
  Cell-system length:   16.49322  16.49322  16.49322
  Reseting center of mass... 

--------------------------------------------------------------------------------

  Setting initial trial coordinates ... 

--------------------------------------------------------------------------------

--------------------------------------------------------------------------------

  Molecules of type:            1
  Adjusting random positions to fit the constraints. 
  Restraint-only function value:    2.0841266414331812E-014
  Maximum violation of the restraints:    2.0841266414331812E-014

--------------------------------------------------------------------------------

  Molecules of type:            2
  Adjusting random positions to fit the constraints. 
  Restraint-only function value:    1.4082145245504417E-004
  Maximum violation of the restraints:    1.4082145245504417E-004

--------------------------------------------------------------------------------

  Molecules of type:            3
  Adjusting random positions to fit the constraints. 
  Restraint-only function value:    7.3956510928822857E-003
  Maximum violation of the restraints:    7.3956510928822857E-003

################################################################################

  Objective function at initial point:    185.56817855544151     

################################################################################

  Packing molecules of type:            1

################################################################################


  Initial approximation is a solution. Nothing to do. 

  Current point written to file: solvated_150/1Th_4trifluoromethanesulfonate_tetrachloromethane.xyz
--------------------------------------------------------------------------------
  Packing solved for molecules of type           1
  Objective function value:    2.0841266414331812E-014
  Maximum violation of target distance:    0.0000000000000000     
  Max. constraint violation:    2.0841266414331812E-014
--------------------------------------------------------------------------------

################################################################################

  Packing molecules of type:            2

################################################################################


  Initial approximation is a solution. Nothing to do. 

  Current point written to file: solvated_150/1Th_4trifluoromethanesulfonate_tetrachloromethane.xyz
--------------------------------------------------------------------------------
  Packing solved for molecules of type           2
  Objective function value:    1.4082145245504417E-004
  Maximum violation of target distance:    0.0000000000000000     
  Max. constraint violation:    1.4082145245504417E-004
--------------------------------------------------------------------------------

################################################################################

  Packing molecules of type:            3

################################################################################


--------------------------------------------------------------------------------

  Starting GENCAN loop:            0
  Scaling radii by:    1.1000000000000001     

  Packing:|0                                                        100%|
          |***************************

  Function value from last GENCAN loop: f = .15549E-02
  Best function value before: f = .14305E+03
  Improvement from best function value:    99.99 %
  Improvement from last loop:    99.99 %
  Maximum violation of target distance:     0.000000
  Maximum violation of the constraints: .99966E-03
  Current structure written to file: solvated_150/1Th_4trifluoromethanesulfonate_tetrachloromethane.xyz
--------------------------------------------------------------------------------
  Packing solved for molecules of type           3
  Objective function value:    1.5548822029883666E-003
  Maximum violation of target distance:    0.0000000000000000     
  Max. constraint violation:    9.9966225431238659E-004
--------------------------------------------------------------------------------

################################################################################

  Packing all molecules together 

################################################################################


--------------------------------------------------------------------------------

  Starting GENCAN loop:            0
  Scaling radii by:    1.1000000000000001     

  Packing:|0                                                        100%|
          |************

  Function value from last GENCAN loop: f = .21434E-03
  Best function value before: f = .48139E+02
  Improvement from best function value:    99.99 %
  Improvement from last loop:    99.99 %
  Maximum violation of target distance:     0.000000
  Maximum violation of the constraints: .17727E-03

################################################################################

                                 Success! 
              Final objective function value: .21434E-03
              Maximum violation of target distance:   0.000000
              Maximum violation of the constraints: .17727E-03

--------------------------------------------------------------------------------

              Please cite this work if Packmol was useful: 

           L. Martinez, R. Andrade, E. G. Birgin, J. M. Martinez, 
         PACKMOL: A package for building initial configurations for
                   molecular dynamics simulations. 
        Journal of Computational Chemistry, 30(13) pp. 2157-2164, 2009.
                  https://doi.org/10.1002/jcc.21224

################################################################################

  Solution written to file: solvated_150/1Th_4trifluoromethanesulfonate_tetrachloromethane.xyz

--------------------------------------------------------------------------------

   Running time:    8.63900036E-03  seconds. 

--------------------------------------------------------------------------------


