
################################################################################

 PACKMOL - Packing optimization for the automated generation of
 starting configurations for molecular dynamics simulations.
 
                                                             Version 21.1.2 

################################################################################

  Packmol must be run with: packmol < inputfile.inp 

  Userguide at: http://m3g.iqm.unicamp.br/packmol 

  Reading input file... (Control-C aborts)
  Types of coordinate files specified: xyz
  Periodic boundary condition activated: 
    Minimum coordinates:     0.00    0.00    0.00
    Maximum coordinates:    12.61   12.61   12.61
  Seed for random number generator:      1234567
  Output file: solvated_150/1Th_4perchlorate_methylsulfinylmethane.xyz
  Reading coordinate file: ../structures/Th.xyz
  Reading coordinate file: ../structures/perchlorate.xyz
  Reading coordinate file: ../structures/methylsulfinylmethane.xyz
  Number of independent structures:            3
  The structures are: 
  Structure            1 :Properties=species:S:1:pos:R:3 iupac_name=Th pbc="F F F"(           1  atoms)
  Structure            2 :Properties=species:S:1:pos:R:3 iupac_name=perchlorate pbc="F F F"(           5  atoms)
  Structure            3 :Properties=species:S:1:pos:R:3 iupac_name=methylsulfinylmethane pbc="F F F"(          10  atoms)
  Maximum number of GENCAN loops for all molecule packing:          600
  Distance tolerance:    2.0000000000000000     
  Number of molecules of type            1 :            1
  Number of molecules of type            2 :            4
  Number of molecules of type            3 :           12
  Total number of restrictions:            3
  Total number of atoms:          141
  Total number of molecules:           17
  Number of fixed molecules:            0
  Number of free molecules:           17
  Number of variables:          102
  Total number of fixed atoms:            0
  PBC on: Constraint automatically added to non-fixed atoms:
  -> inside box     0.00    0.00    0.00   12.61   12.61   12.61
  Updated total number of restrictions:            4
  Maximum internal distance of type            1 :    0.0000000000000000     
  Maximum internal distance of type            2 :    2.4217290788608046     
  Maximum internal distance of type            3 :    4.5884748326649891     
  All atoms must be within these coordinates: 
   x: [   -1000.0000000000000      ,    1000.0000000000000       ] 
   y: [   -1000.0000000000000      ,    1000.0000000000000       ] 
   z: [   -1000.0000000000000      ,    1000.0000000000000       ] 
  If the system is larger than this, increase the sidemax parameter. 

################################################################################

  Building initial approximation ... 

################################################################################

  Adjusting initial point to fit the constraints 

--------------------------------------------------------------------------------

--------------------------------------------------------------------------------

  Molecules of type:            1

  Packing:|0                                                        100%|
          |******

  Restraint-only function value:    1.7464419157172547E-014
  Maximum violation of the restraints:    1.7464419157172547E-014

--------------------------------------------------------------------------------

  Molecules of type:            2

  Packing:|0                                                        100%|
          |******************

  Restraint-only function value:    5.5286028806846256E-003
  Maximum violation of the restraints:    5.5285532704629188E-003

--------------------------------------------------------------------------------

  Molecules of type:            3

  Packing:|0                                                        100%|
          |*********************

  Restraint-only function value:    6.3038092998113877E-005
  Maximum violation of the restraints:    4.6450020518124259E-005

--------------------------------------------------------------------------------

  Rescaling maximum and minimum coordinates... 
  Mininum and maximum coordinates after constraint fitting: 
   x: [   -5.2576388571596085E-002 ,    12.614649772927960       ] 
   y: [    5.2711312396815828E-003 ,    12.609988035943184       ] 
   z: [    2.7177549100088072E-008 ,    12.600483155066120       ] 
  Computing size of patches... 
  Number of cells in each direction and cell sides: 
   x:            5  cells of size    2.5219661079119127     
   y:            5  cells of size    2.5219661079119127     
   z:            5  cells of size    2.5219661079119127     
  Cell-system length:   12.60983  12.60983  12.60983
  Reseting center of mass... 

--------------------------------------------------------------------------------

  Setting initial trial coordinates ... 

--------------------------------------------------------------------------------

--------------------------------------------------------------------------------

  Molecules of type:            1
  Adjusting random positions to fit the constraints. 
  Restraint-only function value:    1.7464419157172547E-014
  Maximum violation of the restraints:    1.7464419157172547E-014

--------------------------------------------------------------------------------

  Molecules of type:            2
  Adjusting random positions to fit the constraints. 
  Packing:|0                                                        100%|
          |******
  Restraint-only function value:    5.7221593089423371E-003
  Maximum violation of the restraints:    5.7221593089423371E-003

--------------------------------------------------------------------------------

  Molecules of type:            3
  Adjusting random positions to fit the constraints. 
  Packing:|0                                                        100%|
          |***
  Restraint-only function value:    0.0000000000000000     
  Maximum violation of the restraints:    0.0000000000000000     

################################################################################

  Objective function at initial point:    741.08066512688686     

################################################################################

  Packing molecules of type:            1

################################################################################


  Initial approximation is a solution. Nothing to do. 

  Current point written to file: solvated_150/1Th_4perchlorate_methylsulfinylmethane.xyz
--------------------------------------------------------------------------------
  Packing solved for molecules of type           1
  Objective function value:    1.7464419157172547E-014
  Maximum violation of target distance:    0.0000000000000000     
  Max. constraint violation:    1.7464419157172547E-014
--------------------------------------------------------------------------------

################################################################################

  Packing molecules of type:            2

################################################################################


--------------------------------------------------------------------------------

  Starting GENCAN loop:            0
  Scaling radii by:    1.1000000000000001     

  Packing:|0                                                        100%|
          |***************

  Function value from last GENCAN loop: f = .15659E-04
  Best function value before: f = .96563E+02
  Improvement from best function value:    99.99 %
  Improvement from last loop:    99.99 %
  Maximum violation of target distance:     0.000000
  Maximum violation of the constraints: .15659E-04
  Current structure written to file: solvated_150/1Th_4perchlorate_methylsulfinylmethane.xyz
--------------------------------------------------------------------------------
  Packing solved for molecules of type           2
  Objective function value:    1.5659171188360298E-005
  Maximum violation of target distance:    0.0000000000000000     
  Max. constraint violation:    1.5659171188360298E-005
--------------------------------------------------------------------------------

################################################################################

  Packing molecules of type:            3

################################################################################


--------------------------------------------------------------------------------

  Starting GENCAN loop:            0
  Scaling radii by:    1.1000000000000001     

  Packing:|0                                                        100%|
          |*************************************************************|


  Function value from last GENCAN loop: f = .20752E-02
  Best function value before: f = .57442E+03
  Improvement from best function value:    99.99 %
  Improvement from last loop:    99.99 %
  Maximum violation of target distance:     0.000000
  Maximum violation of the constraints: .17572E-02
  Current structure written to file: solvated_150/1Th_4perchlorate_methylsulfinylmethane.xyz
--------------------------------------------------------------------------------
  Packing solved for molecules of type           3
  Objective function value:    2.0751640236592343E-003
  Maximum violation of target distance:    0.0000000000000000     
  Max. constraint violation:    1.7571806981983131E-003
--------------------------------------------------------------------------------

################################################################################

  Packing all molecules together 

################################################################################


--------------------------------------------------------------------------------

  Starting GENCAN loop:            0
  Scaling radii by:    1.1000000000000001     

  Packing:|0                                                        100%|
          |******************************************

  Function value from last GENCAN loop: f = .25418E-03
  Best function value before: f = .10107E+03
  Improvement from best function value:    99.99 %
  Improvement from last loop:    99.99 %
  Maximum violation of target distance:     0.000000
  Maximum violation of the constraints: .20606E-03

################################################################################

                                 Success! 
              Final objective function value: .25418E-03
              Maximum violation of target distance:   0.000000
              Maximum violation of the constraints: .20606E-03

--------------------------------------------------------------------------------

              Please cite this work if Packmol was useful: 

           L. Martinez, R. Andrade, E. G. Birgin, J. M. Martinez, 
         PACKMOL: A package for building initial configurations for
                   molecular dynamics simulations. 
        Journal of Computational Chemistry, 30(13) pp. 2157-2164, 2009.
                  https://doi.org/10.1002/jcc.21224

################################################################################

  Solution written to file: solvated_150/1Th_4perchlorate_methylsulfinylmethane.xyz

--------------------------------------------------------------------------------

   Running time:    3.25319991E-02  seconds. 

--------------------------------------------------------------------------------


