
################################################################################

 PACKMOL - Packing optimization for the automated generation of
 starting configurations for molecular dynamics simulations.
 
                                                             Version 21.1.2 

################################################################################

  Packmol must be run with: packmol < inputfile.inp 

  Userguide at: http://m3g.iqm.unicamp.br/packmol 

  Reading input file... (Control-C aborts)
  Types of coordinate files specified: xyz
  Periodic boundary condition activated: 
    Minimum coordinates:     0.00    0.00    0.00
    Maximum coordinates:    11.74   11.74   11.74
  Seed for random number generator:      1234567
  Output file: solvated_150/1Yb_3hydroxide_azane.xyz
  Reading coordinate file: ../structures/Yb.xyz
  Reading coordinate file: ../structures/hydroxide.xyz
  Reading coordinate file: ../structures/azane.xyz
  Number of independent structures:            3
  The structures are: 
  Structure            1 :Properties=species:S:1:pos:R:3 iupac_name=Yb pbc="F F F"(           1  atoms)
  Structure            2 :Properties=species:S:1:pos:R:3 iupac_name=hydroxide pbc="F F F"(           2  atoms)
  Structure            3 :Properties=species:S:1:pos:R:3 iupac_name=azane pbc="F F F"(           4  atoms)
  Maximum number of GENCAN loops for all molecule packing:          600
  Distance tolerance:    2.0000000000000000     
  Number of molecules of type            1 :            1
  Number of molecules of type            2 :            3
  Number of molecules of type            3 :           35
  Total number of restrictions:            3
  Total number of atoms:          147
  Total number of molecules:           39
  Number of fixed molecules:            0
  Number of free molecules:           39
  Number of variables:          234
  Total number of fixed atoms:            0
  PBC on: Constraint automatically added to non-fixed atoms:
  -> inside box     0.00    0.00    0.00   11.74   11.74   11.74
  Updated total number of restrictions:            4
  Maximum internal distance of type            1 :    0.0000000000000000     
  Maximum internal distance of type            2 :   0.96977183398983080     
  Maximum internal distance of type            3 :    1.6276392505712067     
  All atoms must be within these coordinates: 
   x: [   -1000.0000000000000      ,    1000.0000000000000       ] 
   y: [   -1000.0000000000000      ,    1000.0000000000000       ] 
   z: [   -1000.0000000000000      ,    1000.0000000000000       ] 
  If the system is larger than this, increase the sidemax parameter. 

################################################################################

  Building initial approximation ... 

################################################################################

  Adjusting initial point to fit the constraints 

--------------------------------------------------------------------------------

--------------------------------------------------------------------------------

  Molecules of type:            1

  Packing:|0                                                        100%|
          |******

  Restraint-only function value:    2.0403695634882505E-014
  Maximum violation of the restraints:    2.0403695634882505E-014

--------------------------------------------------------------------------------

  Molecules of type:            2

  Packing:|0                                                        100%|
          |*********

  Restraint-only function value:    1.7074224689476413E-009
  Maximum violation of the restraints:    1.1530463297407097E-009

--------------------------------------------------------------------------------

  Molecules of type:            3

  Packing:|0                                                        100%|
          |******************

  Restraint-only function value:    4.8905007170950325E-003
  Maximum violation of the restraints:    2.4328728878654769E-003

--------------------------------------------------------------------------------

  Rescaling maximum and minimum coordinates... 
  Mininum and maximum coordinates after constraint fitting: 
   x: [   -9.7072365748422152E-004 ,    11.738574239764477       ] 
   y: [   -1.2673153829748950E-004 ,    11.738658287102464       ] 
   z: [   -3.4877448930974560E-002 ,    11.738573577232847       ] 
  Computing size of patches... 
  Number of cells in each direction and cell sides: 
   x:            5  cells of size    2.3477099132672103     
   y:            5  cells of size    2.3477099132672103     
   z:            5  cells of size    2.3477099132672103     
  Cell-system length:   11.73855  11.73855  11.73855
  Reseting center of mass... 

--------------------------------------------------------------------------------

  Setting initial trial coordinates ... 

--------------------------------------------------------------------------------

--------------------------------------------------------------------------------

  Molecules of type:            1
  Adjusting random positions to fit the constraints. 
  Restraint-only function value:    2.0403695634882505E-014
  Maximum violation of the restraints:    2.0403695634882505E-014

--------------------------------------------------------------------------------

  Molecules of type:            2
  Adjusting random positions to fit the constraints. 
  Restraint-only function value:    3.7364309638179662E-003
  Maximum violation of the restraints:    3.7364309638179662E-003

--------------------------------------------------------------------------------

  Molecules of type:            3
  Adjusting random positions to fit the constraints. 
  Packing:|0                                                        100%|
          |***
  Restraint-only function value:    3.2791201807272193E-006
  Maximum violation of the restraints:    3.2791201807272193E-006

################################################################################

  Objective function at initial point:    965.24073833211628     

################################################################################

  Packing molecules of type:            1

################################################################################


  Initial approximation is a solution. Nothing to do. 

  Current point written to file: solvated_150/1Yb_3hydroxide_azane.xyz
--------------------------------------------------------------------------------
  Packing solved for molecules of type           1
  Objective function value:    2.0403695634882505E-014
  Maximum violation of target distance:    0.0000000000000000     
  Max. constraint violation:    2.0403695634882505E-014
--------------------------------------------------------------------------------

################################################################################

  Packing molecules of type:            2

################################################################################


--------------------------------------------------------------------------------

  Starting GENCAN loop:            0
  Scaling radii by:    1.1000000000000001     

  Packing:|0                                                        100%|
          |*********

  Function value from last GENCAN loop: f = .12010E-03
  Best function value before: f = .28470E+02
  Improvement from best function value:    99.99 %
  Improvement from last loop:    99.99 %
  Maximum violation of target distance:     0.000000
  Maximum violation of the constraints: .12010E-03
  Current structure written to file: solvated_150/1Yb_3hydroxide_azane.xyz
--------------------------------------------------------------------------------
  Packing solved for molecules of type           2
  Objective function value:    1.2009836330430353E-004
  Maximum violation of target distance:    0.0000000000000000     
  Max. constraint violation:    1.2009836330430353E-004
--------------------------------------------------------------------------------

################################################################################

  Packing molecules of type:            3

################################################################################


--------------------------------------------------------------------------------

  Starting GENCAN loop:            0
  Scaling radii by:    1.1000000000000001     

  Packing:|0                                                        100%|
          |*********************

  Function value from last GENCAN loop: f = .26151E-02
  Best function value before: f = .80764E+03
  Improvement from best function value:    99.99 %
  Improvement from last loop:    99.99 %
  Maximum violation of target distance:     0.000000
  Maximum violation of the constraints: .26151E-02
  Current structure written to file: solvated_150/1Yb_3hydroxide_azane.xyz
--------------------------------------------------------------------------------
  Packing solved for molecules of type           3
  Objective function value:    2.6150528090234187E-003
  Maximum violation of target distance:    0.0000000000000000     
  Max. constraint violation:    2.6150528090234187E-003
--------------------------------------------------------------------------------

################################################################################

  Packing all molecules together 

################################################################################


--------------------------------------------------------------------------------

  Starting GENCAN loop:            0
  Scaling radii by:    1.1000000000000001     

  Packing:|0                                                        100%|
          |******************************

  Function value from last GENCAN loop: f = .93639E-02
  Best function value before: f = .67071E+02
  Improvement from best function value:    99.99 %
  Improvement from last loop:    99.99 %
  Maximum violation of target distance:     0.000000
  Maximum violation of the constraints: .58984E-02

################################################################################

                                 Success! 
              Final objective function value: .93639E-02
              Maximum violation of target distance:   0.000000
              Maximum violation of the constraints: .58984E-02

--------------------------------------------------------------------------------

              Please cite this work if Packmol was useful: 

           L. Martinez, R. Andrade, E. G. Birgin, J. M. Martinez, 
         PACKMOL: A package for building initial configurations for
                   molecular dynamics simulations. 
        Journal of Computational Chemistry, 30(13) pp. 2157-2164, 2009.
                  https://doi.org/10.1002/jcc.21224

################################################################################

  Solution written to file: solvated_150/1Yb_3hydroxide_azane.xyz

--------------------------------------------------------------------------------

   Running time:    1.86860040E-02  seconds. 

--------------------------------------------------------------------------------


