
################################################################################

 PACKMOL - Packing optimization for the automated generation of
 starting configurations for molecular dynamics simulations.
 
                                                             Version 21.1.2 

################################################################################

  Packmol must be run with: packmol < inputfile.inp 

  Userguide at: http://m3g.iqm.unicamp.br/packmol 

  Reading input file... (Control-C aborts)
  Types of coordinate files specified: xyz
  Periodic boundary condition activated: 
    Minimum coordinates:     0.00    0.00    0.00
    Maximum coordinates:    15.88   15.88   15.88
  Seed for random number generator:      1234567
  Output file: solvated_150/21-ethyl-3-methylimidazol-3-ium_1disulfide_tetrachloromethane.xyz
  Reading coordinate file: ../structures/1-ethyl-3-methylimidazol-3-ium.xyz
  Reading coordinate file: ../structures/disulfide.xyz
  Reading coordinate file: ../structures/tetrachloromethane.xyz
  Number of independent structures:            3
  The structures are: 
  Structure            1 :Properties=species:S:1:pos:R:3 iupac_name=1-ethyl-3-methylimidazol-3-ium pbc="F F F"(          19  atoms)
  Structure            2 :Properties=species:S:1:pos:R:3 iupac_name=disulfide pbc="F F F"(           2  atoms)
  Structure            3 :Properties=species:S:1:pos:R:3 iupac_name=tetrachloromethane pbc="F F F"(           5  atoms)
  Maximum number of GENCAN loops for all molecule packing:          600
  Distance tolerance:    2.0000000000000000     
  Number of molecules of type            1 :            2
  Number of molecules of type            2 :            1
  Number of molecules of type            3 :           22
  Total number of restrictions:            3
  Total number of atoms:          150
  Total number of molecules:           25
  Number of fixed molecules:            0
  Number of free molecules:           25
  Number of variables:          150
  Total number of fixed atoms:            0
  PBC on: Constraint automatically added to non-fixed atoms:
  -> inside box     0.00    0.00    0.00   15.88   15.88   15.88
  Updated total number of restrictions:            4
  Maximum internal distance of type            1 :    7.3997103713591379     
  Maximum internal distance of type            2 :    2.0299991086204940     
  Maximum internal distance of type            3 :    2.9101379795466742     
  All atoms must be within these coordinates: 
   x: [   -987.20000000000005      ,    1012.8000000000000       ] 
   y: [   -994.03941433566683      ,    1005.9605856643332       ] 
   z: [   -996.44583594196718      ,    1003.5541640580328       ] 
  If the system is larger than this, increase the sidemax parameter. 

################################################################################

  Building initial approximation ... 

################################################################################

  Adjusting initial point to fit the constraints 

--------------------------------------------------------------------------------

--------------------------------------------------------------------------------

  Molecules of type:            1

  Packing:|0                                                        100%|
          |***************************

  Restraint-only function value:    1.5200825578371934E-003
  Maximum violation of the restraints:    1.5200825578371934E-003

--------------------------------------------------------------------------------

  Molecules of type:            2

  Packing:|0                                                        100%|
          |*********

  Restraint-only function value:    1.5096269429263163E-019
  Maximum violation of the restraints:    1.5096269429263163E-019

--------------------------------------------------------------------------------

  Molecules of type:            3

  Packing:|0                                                        100%|
          |******************

  Restraint-only function value:    5.9382448711998176E-006
  Maximum violation of the restraints:    5.9382448711998176E-006

--------------------------------------------------------------------------------

  Rescaling maximum and minimum coordinates... 
  Mininum and maximum coordinates after constraint fitting: 
   x: [    1.5398441492068834E-002 ,    15.883512975448340       ] 
   y: [   -2.7473868884144404E-010 ,    15.909358707446337       ] 
   z: [    2.0122984264622396E-010 ,    15.856348655175038       ] 
  Computing size of patches... 
  Number of cells in each direction and cell sides: 
   x:            7  cells of size    2.2688271230400638     
   y:            7  cells of size    2.2688271230400638     
   z:            7  cells of size    2.2688271230400638     
  Cell-system length:   15.88179  15.88179  15.88179
  Reseting center of mass... 

--------------------------------------------------------------------------------

  Setting initial trial coordinates ... 

--------------------------------------------------------------------------------

--------------------------------------------------------------------------------

  Molecules of type:            1
  Adjusting random positions to fit the constraints. 
  Packing:|0                                                        100%|
          |*********
  Restraint-only function value:    0.0000000000000000     
  Maximum violation of the restraints:    0.0000000000000000     

--------------------------------------------------------------------------------

  Molecules of type:            2
  Adjusting random positions to fit the constraints. 
  Packing:|0                                                        100%|
          |***
  Restraint-only function value:    1.0884035293344089E-004
  Maximum violation of the restraints:    1.0884035293344089E-004

--------------------------------------------------------------------------------

  Molecules of type:            3
  Adjusting random positions to fit the constraints. 
  Packing:|0                                                        100%|
          |***
  Restraint-only function value:    1.8944160734092919E-004
  Maximum violation of the restraints:    1.8944160734092919E-004

################################################################################

  Objective function at initial point:    231.69184673682068     

################################################################################

  Packing molecules of type:            1

################################################################################


  Initial approximation is a solution. Nothing to do. 

  Current point written to file: solvated_150/21-ethyl-3-methylimidazol-3-ium_1disulfide_tetrachloromethane.xyz
--------------------------------------------------------------------------------
  Packing solved for molecules of type           1
  Objective function value:   0.21022706856537249     
  Maximum violation of target distance:    0.0000000000000000     
  Max. constraint violation:    0.0000000000000000     
--------------------------------------------------------------------------------

################################################################################

  Packing molecules of type:            2

################################################################################


  Initial approximation is a solution. Nothing to do. 

  Current point written to file: solvated_150/21-ethyl-3-methylimidazol-3-ium_1disulfide_tetrachloromethane.xyz
--------------------------------------------------------------------------------
  Packing solved for molecules of type           2
  Objective function value:    1.0884035293344089E-004
  Maximum violation of target distance:    0.0000000000000000     
  Max. constraint violation:    1.0884035293344089E-004
--------------------------------------------------------------------------------

################################################################################

  Packing molecules of type:            3

################################################################################


--------------------------------------------------------------------------------

  Starting GENCAN loop:            0
  Scaling radii by:    1.1000000000000001     

  Packing:|0                                                        100%|
          |******************************

  Function value from last GENCAN loop: f = .47322E-05
  Best function value before: f = .15623E+03
  Improvement from best function value:    99.99 %
  Improvement from last loop:    99.99 %
  Maximum violation of target distance:     0.000000
  Maximum violation of the constraints: .43474E-05
  Current structure written to file: solvated_150/21-ethyl-3-methylimidazol-3-ium_1disulfide_tetrachloromethane.xyz
--------------------------------------------------------------------------------
  Packing solved for molecules of type           3
  Objective function value:    4.7322256709970174E-006
  Maximum violation of target distance:    0.0000000000000000     
  Max. constraint violation:    4.3473766507814809E-006
--------------------------------------------------------------------------------

################################################################################

  Packing all molecules together 

################################################################################


--------------------------------------------------------------------------------

  Starting GENCAN loop:            0
  Scaling radii by:    1.1000000000000001     

  Packing:|0                                                        100%|
          |***************************

  Function value from last GENCAN loop: f = .56584E-02
  Best function value before: f = .88840E+02
  Improvement from best function value:    99.99 %
  Improvement from last loop:    99.99 %
  Maximum violation of target distance:     0.000000
  Maximum violation of the constraints: .56556E-02

################################################################################

                                 Success! 
              Final objective function value: .56584E-02
              Maximum violation of target distance:   0.000000
              Maximum violation of the constraints: .56556E-02

--------------------------------------------------------------------------------

              Please cite this work if Packmol was useful: 

           L. Martinez, R. Andrade, E. G. Birgin, J. M. Martinez, 
         PACKMOL: A package for building initial configurations for
                   molecular dynamics simulations. 
        Journal of Computational Chemistry, 30(13) pp. 2157-2164, 2009.
                  https://doi.org/10.1002/jcc.21224

################################################################################

  Solution written to file: solvated_150/21-ethyl-3-methylimidazol-3-ium_1disulfide_tetrachloromethane.xyz

--------------------------------------------------------------------------------

   Running time:    1.19099990E-02  seconds. 

--------------------------------------------------------------------------------


