
################################################################################

 PACKMOL - Packing optimization for the automated generation of
 starting configurations for molecular dynamics simulations.
 
                                                             Version 21.1.2 

################################################################################

  Packmol must be run with: packmol < inputfile.inp 

  Userguide at: http://m3g.iqm.unicamp.br/packmol 

  Reading input file... (Control-C aborts)
  Types of coordinate files specified: xyz
  Periodic boundary condition activated: 
    Minimum coordinates:     0.00    0.00    0.00
    Maximum coordinates:    15.88   15.88   15.88
  Seed for random number generator:      1234567
  Output file: solvated_150/2azanium_1sulfate_chloroform.xyz
  Reading coordinate file: ../structures/azanium.xyz
  Reading coordinate file: ../structures/sulfate.xyz
  Reading coordinate file: ../structures/chloroform.xyz
  Number of independent structures:            3
  The structures are: 
  Structure            1 :Properties=species:S:1:pos:R:3 iupac_name=ammonium pbc="F F F"(           5  atoms)
  Structure            2 :Properties=species:S:1:pos:R:3 iupac_name=sulfate pbc="F F F"(           5  atoms)
  Structure            3 :Properties=species:S:1:pos:R:3 iupac_name=chloroform pbc="F F F"(           5  atoms)
  Maximum number of GENCAN loops for all molecule packing:          600
  Distance tolerance:    2.0000000000000000     
  Number of molecules of type            1 :            2
  Number of molecules of type            2 :            1
  Number of molecules of type            3 :           27
  Total number of restrictions:            3
  Total number of atoms:          150
  Total number of molecules:           30
  Number of fixed molecules:            0
  Number of free molecules:           30
  Number of variables:          180
  Total number of fixed atoms:            0
  PBC on: Constraint automatically added to non-fixed atoms:
  -> inside box     0.00    0.00    0.00   15.88   15.88   15.88
  Updated total number of restrictions:            4
  Maximum internal distance of type            1 :    1.6868875125804925     
  Maximum internal distance of type            2 :    2.4074826707579851     
  Maximum internal distance of type            3 :    2.9128739262110201     
  All atoms must be within these coordinates: 
   x: [   -998.39999999999998      ,    1001.6000000000000       ] 
   y: [   -998.70640540811314      ,    1001.2935945918869       ] 
   z: [   -998.68884568164333      ,    1001.3111543183567       ] 
  If the system is larger than this, increase the sidemax parameter. 

################################################################################

  Building initial approximation ... 

################################################################################

  Adjusting initial point to fit the constraints 

--------------------------------------------------------------------------------

--------------------------------------------------------------------------------

  Molecules of type:            1

  Packing:|0                                                        100%|
          |************

  Restraint-only function value:    8.2297779328914316E-004
  Maximum violation of the restraints:    8.2297779328914316E-004

--------------------------------------------------------------------------------

  Molecules of type:            2

  Packing:|0                                                        100%|
          |************

  Restraint-only function value:    0.0000000000000000     
  Maximum violation of the restraints:    0.0000000000000000     

--------------------------------------------------------------------------------

  Molecules of type:            3

  Packing:|0                                                        100%|
          |***************************

  Restraint-only function value:    8.3851623744657863E-003
  Maximum violation of the restraints:    8.3506664571322518E-003

--------------------------------------------------------------------------------

  Rescaling maximum and minimum coordinates... 
  Mininum and maximum coordinates after constraint fitting: 
   x: [    3.4024649971267765E-002 ,    15.948087273783552       ] 
   y: [   -1.7569290864328920E-003 ,    15.903779534251086       ] 
   z: [    4.4671592041055239E-004 ,    15.832311779936743       ] 
  Computing size of patches... 
  Number of cells in each direction and cell sides: 
   x:            7  cells of size    2.2690706207364970     
   y:            7  cells of size    2.2690706207364970     
   z:            7  cells of size    2.2690706207364970     
  Cell-system length:   15.88349  15.88349  15.88349
  Reseting center of mass... 

--------------------------------------------------------------------------------

  Setting initial trial coordinates ... 

--------------------------------------------------------------------------------

--------------------------------------------------------------------------------

  Molecules of type:            1
  Adjusting random positions to fit the constraints. 
  Restraint-only function value:    2.4782797131952855E-004
  Maximum violation of the restraints:    2.4782797131952855E-004

--------------------------------------------------------------------------------

  Molecules of type:            2
  Adjusting random positions to fit the constraints. 
  Packing:|0                                                        100%|
          |***
  Restraint-only function value:    6.5275808455849309E-003
  Maximum violation of the restraints:    4.7833061128076410E-003

--------------------------------------------------------------------------------

  Molecules of type:            3
  Adjusting random positions to fit the constraints. 
  Packing:|0                                                        100%|
          |***
  Restraint-only function value:    0.0000000000000000     
  Maximum violation of the restraints:    0.0000000000000000     

################################################################################

  Objective function at initial point:    238.02232375984343     

################################################################################

  Packing molecules of type:            1

################################################################################


  Initial approximation is a solution. Nothing to do. 

  Current point written to file: solvated_150/2azanium_1sulfate_chloroform.xyz
--------------------------------------------------------------------------------
  Packing solved for molecules of type           1
  Objective function value:    2.4782797131952855E-004
  Maximum violation of target distance:    0.0000000000000000     
  Max. constraint violation:    2.4782797131952855E-004
--------------------------------------------------------------------------------

################################################################################

  Packing molecules of type:            2

################################################################################


  Initial approximation is a solution. Nothing to do. 

  Current point written to file: solvated_150/2azanium_1sulfate_chloroform.xyz
--------------------------------------------------------------------------------
  Packing solved for molecules of type           2
  Objective function value:    6.5275808455849309E-003
  Maximum violation of target distance:    0.0000000000000000     
  Max. constraint violation:    4.7833061128076410E-003
--------------------------------------------------------------------------------

################################################################################

  Packing molecules of type:            3

################################################################################


--------------------------------------------------------------------------------

  Starting GENCAN loop:            0
  Scaling radii by:    1.1000000000000001     

  Packing:|0                                                        100%|
          |******************************

  Function value from last GENCAN loop: f = .15034E-02
  Best function value before: f = .19360E+03
  Improvement from best function value:    99.99 %
  Improvement from last loop:    99.99 %
  Maximum violation of target distance:     0.000000
  Maximum violation of the constraints: .86296E-03
  Current structure written to file: solvated_150/2azanium_1sulfate_chloroform.xyz
--------------------------------------------------------------------------------
  Packing solved for molecules of type           3
  Objective function value:    1.5033775217939342E-003
  Maximum violation of target distance:    0.0000000000000000     
  Max. constraint violation:    8.6295909778447740E-004
--------------------------------------------------------------------------------

################################################################################

  Packing all molecules together 

################################################################################


--------------------------------------------------------------------------------

  Starting GENCAN loop:            0
  Scaling radii by:    1.1000000000000001     

  Packing:|0                                                        100%|
          |************************

  Function value from last GENCAN loop: f = .18961E-03
  Best function value before: f = .57204E+02
  Improvement from best function value:    99.99 %
  Improvement from last loop:    99.99 %
  Maximum violation of target distance:     0.000000
  Maximum violation of the constraints: .18662E-03

################################################################################

                                 Success! 
              Final objective function value: .18961E-03
              Maximum violation of target distance:   0.000000
              Maximum violation of the constraints: .18662E-03

--------------------------------------------------------------------------------

              Please cite this work if Packmol was useful: 

           L. Martinez, R. Andrade, E. G. Birgin, J. M. Martinez, 
         PACKMOL: A package for building initial configurations for
                   molecular dynamics simulations. 
        Journal of Computational Chemistry, 30(13) pp. 2157-2164, 2009.
                  https://doi.org/10.1002/jcc.21224

################################################################################

  Solution written to file: solvated_150/2azanium_1sulfate_chloroform.xyz

--------------------------------------------------------------------------------

   Running time:    1.28719993E-02  seconds. 

--------------------------------------------------------------------------------


