
################################################################################

 PACKMOL - Packing optimization for the automated generation of
 starting configurations for molecular dynamics simulations.
 
                                                             Version 21.1.2 

################################################################################

  Packmol must be run with: packmol < inputfile.inp 

  Userguide at: http://m3g.iqm.unicamp.br/packmol 

  Reading input file... (Control-C aborts)
  Types of coordinate files specified: xyz
  Periodic boundary condition activated: 
    Minimum coordinates:     0.00    0.00    0.00
    Maximum coordinates:    12.44   12.44   12.44
  Seed for random number generator:      1234567
  Output file: solvated_150/2azanium_12-dithioperoxy-disulfate_benzene.xyz
  Reading coordinate file: ../structures/azanium.xyz
  Reading coordinate file: ../structures/2-dithioperoxy-disulfate.xyz
  Reading coordinate file: ../structures/benzene.xyz
  Number of independent structures:            3
  The structures are: 
  Structure            1 :Properties=species:S:1:pos:R:3 iupac_name=ammonium pbc="F F F"(           5  atoms)
  Structure            2 :Properties=species:S:1:pos:R:3 iupac_name=2-dithioperoxy-disulfate pbc="F F F"(          10  atoms)
  Structure            3 :Properties=species:S:1:pos:R:3 iupac_name=benzene pbc="F F F"(          12  atoms)
  Maximum number of GENCAN loops for all molecule packing:          600
  Distance tolerance:    2.0000000000000000     
  Number of molecules of type            1 :            2
  Number of molecules of type            2 :            1
  Number of molecules of type            3 :           10
  Total number of restrictions:            3
  Total number of atoms:          140
  Total number of molecules:           13
  Number of fixed molecules:            0
  Number of free molecules:           13
  Number of variables:           78
  Total number of fixed atoms:            0
  PBC on: Constraint automatically added to non-fixed atoms:
  -> inside box     0.00    0.00    0.00   12.44   12.44   12.44
  Updated total number of restrictions:            4
  Maximum internal distance of type            1 :    1.6868875125804925     
  Maximum internal distance of type            2 :    6.6701975607923334     
  Maximum internal distance of type            3 :    4.9619487079170828     
  All atoms must be within these coordinates: 
   x: [   -998.39999999999998      ,    1001.6000000000000       ] 
   y: [   -998.70640540811314      ,    1001.2935945918869       ] 
   z: [   -998.68884568164333      ,    1001.3111543183567       ] 
  If the system is larger than this, increase the sidemax parameter. 

################################################################################

  Building initial approximation ... 

################################################################################

  Adjusting initial point to fit the constraints 

--------------------------------------------------------------------------------

--------------------------------------------------------------------------------

  Molecules of type:            1

  Packing:|0                                                        100%|
          |***************

  Restraint-only function value:    1.2741823318897090E-006
  Maximum violation of the restraints:    1.2741823318897090E-006

--------------------------------------------------------------------------------

  Molecules of type:            2

  Packing:|0                                                        100%|
          |***************

  Restraint-only function value:    0.0000000000000000     
  Maximum violation of the restraints:    0.0000000000000000     

--------------------------------------------------------------------------------

  Molecules of type:            3

  Packing:|0                                                        100%|
          |************************************

  Restraint-only function value:    1.5566694230239441E-006
  Maximum violation of the restraints:    1.3652118197792138E-006

--------------------------------------------------------------------------------

  Rescaling maximum and minimum coordinates... 
  Mininum and maximum coordinates after constraint fitting: 
   x: [   -8.2619967918754779E-004 ,    12.423306609815844       ] 
   y: [   -1.4877832092950716E-004 ,    12.442369741185134       ] 
   z: [    3.4336896904088506E-004 ,    12.441754486833171       ] 
  Computing size of patches... 
  Number of cells in each direction and cell sides: 
   x:            5  cells of size    2.4883143122553752     
   y:            5  cells of size    2.4883143122553752     
   z:            5  cells of size    2.4883143122553752     
  Cell-system length:   12.44157  12.44157  12.44157
  Reseting center of mass... 

--------------------------------------------------------------------------------

  Setting initial trial coordinates ... 

--------------------------------------------------------------------------------

--------------------------------------------------------------------------------

  Molecules of type:            1
  Adjusting random positions to fit the constraints. 
  Restraint-only function value:    6.1754974551175993E-003
  Maximum violation of the restraints:    3.5434200160457245E-003

--------------------------------------------------------------------------------

  Molecules of type:            2
  Adjusting random positions to fit the constraints. 
  Packing:|0                                                        100%|
          |***
  Restraint-only function value:    0.0000000000000000     
  Maximum violation of the restraints:    0.0000000000000000     

--------------------------------------------------------------------------------

  Molecules of type:            3
  Adjusting random positions to fit the constraints. 
  Packing:|0                                                        100%|
          |*********
  Restraint-only function value:    3.2564623876335569E-007
  Maximum violation of the restraints:    1.7687610687339853E-007

################################################################################

  Objective function at initial point:    704.08564884493239     

################################################################################

  Packing molecules of type:            1

################################################################################


  Initial approximation is a solution. Nothing to do. 

  Current point written to file: solvated_150/2azanium_12-dithioperoxy-disulfate_benzene.xyz
--------------------------------------------------------------------------------
  Packing solved for molecules of type           1
  Objective function value:    6.1754974551175993E-003
  Maximum violation of target distance:    0.0000000000000000     
  Max. constraint violation:    3.5434200160457245E-003
--------------------------------------------------------------------------------

################################################################################

  Packing molecules of type:            2

################################################################################


  Initial approximation is a solution. Nothing to do. 

  Current point written to file: solvated_150/2azanium_12-dithioperoxy-disulfate_benzene.xyz
--------------------------------------------------------------------------------
  Packing solved for molecules of type           2
  Objective function value:    0.0000000000000000     
  Maximum violation of target distance:    0.0000000000000000     
  Max. constraint violation:    0.0000000000000000     
--------------------------------------------------------------------------------

################################################################################

  Packing molecules of type:            3

################################################################################


--------------------------------------------------------------------------------

  Starting GENCAN loop:            0
  Scaling radii by:    1.1000000000000001     

  Packing:|0                                                        100%|
          |************************************************

  Function value from last GENCAN loop: f = .40342E-02
  Best function value before: f = .56555E+03
  Improvement from best function value:    99.99 %
  Improvement from last loop:    99.99 %
  Maximum violation of target distance:     0.000000
  Maximum violation of the constraints: .24687E-02
  Current structure written to file: solvated_150/2azanium_12-dithioperoxy-disulfate_benzene.xyz
--------------------------------------------------------------------------------
  Packing solved for molecules of type           3
  Objective function value:    4.0341959599081737E-003
  Maximum violation of target distance:    0.0000000000000000     
  Max. constraint violation:    2.4686927375624488E-003
--------------------------------------------------------------------------------

################################################################################

  Packing all molecules together 

################################################################################


--------------------------------------------------------------------------------

  Starting GENCAN loop:            0
  Scaling radii by:    1.1000000000000001     

  Packing:|0                                                        100%|
          |*********************************************************

  Function value from last GENCAN loop: f = .14007E-01
  Best function value before: f = .15690E+03
  Improvement from best function value:    99.99 %
  Improvement from last loop:    99.99 %
  Maximum violation of target distance:     0.000000
  Maximum violation of the constraints: .51255E-02

################################################################################

                                 Success! 
              Final objective function value: .14007E-01
              Maximum violation of target distance:   0.000000
              Maximum violation of the constraints: .51255E-02

--------------------------------------------------------------------------------

              Please cite this work if Packmol was useful: 

           L. Martinez, R. Andrade, E. G. Birgin, J. M. Martinez, 
         PACKMOL: A package for building initial configurations for
                   molecular dynamics simulations. 
        Journal of Computational Chemistry, 30(13) pp. 2157-2164, 2009.
                  https://doi.org/10.1002/jcc.21224

################################################################################

  Solution written to file: solvated_150/2azanium_12-dithioperoxy-disulfate_benzene.xyz

--------------------------------------------------------------------------------

   Running time:    3.45420018E-02  seconds. 

--------------------------------------------------------------------------------


