
################################################################################

 PACKMOL - Packing optimization for the automated generation of
 starting configurations for molecular dynamics simulations.
 
                                                             Version 21.1.2 

################################################################################

  Packmol must be run with: packmol < inputfile.inp 

  Userguide at: http://m3g.iqm.unicamp.br/packmol 

  Reading input file... (Control-C aborts)
  Types of coordinate files specified: xyz
  Periodic boundary condition activated: 
    Minimum coordinates:     0.00    0.00    0.00
    Maximum coordinates:    12.69   12.69   12.69
  Seed for random number generator:      1234567
  Output file: solvated_150/2Bk_3carbonate_N,N-dimethylformamide.xyz
  Reading coordinate file: ../structures/Bk.xyz
  Reading coordinate file: ../structures/carbonate.xyz
  Reading coordinate file: ../structures/N,N-dimethylformamide.xyz
  Number of independent structures:            3
  The structures are: 
  Structure            1 :Properties=species:S:1:pos:R:3 iupac_name=Bk pbc="F F F"(           1  atoms)
  Structure            2 :Properties=species:S:1:pos:R:3 iupac_name=carbonate pbc="F F F"(           4  atoms)
  Structure            3 :Properties=species:S:1:pos:R:3 iupac_name=N,N-dimethylformamide pbc="F F F"(          12  atoms)
  Maximum number of GENCAN loops for all molecule packing:          600
  Distance tolerance:    2.0000000000000000     
  Number of molecules of type            1 :            2
  Number of molecules of type            2 :            3
  Number of molecules of type            3 :           11
  Total number of restrictions:            3
  Total number of atoms:          146
  Total number of molecules:           16
  Number of fixed molecules:            0
  Number of free molecules:           16
  Number of variables:           96
  Total number of fixed atoms:            0
  PBC on: Constraint automatically added to non-fixed atoms:
  -> inside box     0.00    0.00    0.00   12.69   12.69   12.69
  Updated total number of restrictions:            4
  Maximum internal distance of type            1 :    0.0000000000000000     
  Maximum internal distance of type            2 :    2.2307843037819683     
  Maximum internal distance of type            3 :    4.2658499117995232     
  All atoms must be within these coordinates: 
   x: [   -1000.0000000000000      ,    1000.0000000000000       ] 
   y: [   -1000.0000000000000      ,    1000.0000000000000       ] 
   z: [   -1000.0000000000000      ,    1000.0000000000000       ] 
  If the system is larger than this, increase the sidemax parameter. 

################################################################################

  Building initial approximation ... 

################################################################################

  Adjusting initial point to fit the constraints 

--------------------------------------------------------------------------------

--------------------------------------------------------------------------------

  Molecules of type:            1

  Packing:|0                                                        100%|
          |******

  Restraint-only function value:    2.6765189864452010E-014
  Maximum violation of the restraints:    2.6765189864452010E-014

--------------------------------------------------------------------------------

  Molecules of type:            2

  Packing:|0                                                        100%|
          |************

  Restraint-only function value:    3.6327893476605669E-005
  Maximum violation of the restraints:    3.5913309348001899E-005

--------------------------------------------------------------------------------

  Molecules of type:            3

  Packing:|0                                                        100%|
          |************************

  Restraint-only function value:    7.5638730567140371E-006
  Maximum violation of the restraints:    7.5638730567140371E-006

--------------------------------------------------------------------------------

  Rescaling maximum and minimum coordinates... 
  Mininum and maximum coordinates after constraint fitting: 
   x: [   -4.5529338266867372E-004 ,    12.693487915227099       ] 
   y: [    6.3682835451120011E-004 ,    12.691543071039746       ] 
   z: [   -4.2375293124651010E-003 ,    12.685107902027198       ] 
  Computing size of patches... 
  Number of cells in each direction and cell sides: 
   x:            5  cells of size    2.5383086390119982     
   y:            5  cells of size    2.5383086390119982     
   z:            5  cells of size    2.5383086390119982     
  Cell-system length:   12.69154  12.69154  12.69154
  Reseting center of mass... 

--------------------------------------------------------------------------------

  Setting initial trial coordinates ... 

--------------------------------------------------------------------------------

--------------------------------------------------------------------------------

  Molecules of type:            1
  Adjusting random positions to fit the constraints. 
  Restraint-only function value:    0.0000000000000000     
  Maximum violation of the restraints:    0.0000000000000000     

--------------------------------------------------------------------------------

  Molecules of type:            2
  Adjusting random positions to fit the constraints. 
  Packing:|0                                                        100%|
          |***
  Restraint-only function value:    0.0000000000000000     
  Maximum violation of the restraints:    0.0000000000000000     

--------------------------------------------------------------------------------

  Molecules of type:            3
  Adjusting random positions to fit the constraints. 
  Packing:|0                                                        100%|
          |******
  Restraint-only function value:    0.0000000000000000     
  Maximum violation of the restraints:    0.0000000000000000     

################################################################################

  Objective function at initial point:    769.23889282367429     

################################################################################

  Packing molecules of type:            1

################################################################################


  Initial approximation is a solution. Nothing to do. 

  Current point written to file: solvated_150/2Bk_3carbonate_N,N-dimethylformamide.xyz
--------------------------------------------------------------------------------
  Packing solved for molecules of type           1
  Objective function value:    0.0000000000000000     
  Maximum violation of target distance:    0.0000000000000000     
  Max. constraint violation:    0.0000000000000000     
--------------------------------------------------------------------------------

################################################################################

  Packing molecules of type:            2

################################################################################


--------------------------------------------------------------------------------

  Starting GENCAN loop:            0
  Scaling radii by:    1.1000000000000001     

  Packing:|0                                                        100%|
          |*********

  Function value from last GENCAN loop: f = .48718E-05
  Best function value before: f = .70482E+02
  Improvement from best function value:    99.99 %
  Improvement from last loop:    99.99 %
  Maximum violation of target distance:     0.000000
  Maximum violation of the constraints: .45189E-05
  Current structure written to file: solvated_150/2Bk_3carbonate_N,N-dimethylformamide.xyz
--------------------------------------------------------------------------------
  Packing solved for molecules of type           2
  Objective function value:    4.8718153785899798E-006
  Maximum violation of target distance:    0.0000000000000000     
  Max. constraint violation:    4.5188548377571861E-006
--------------------------------------------------------------------------------

################################################################################

  Packing molecules of type:            3

################################################################################


--------------------------------------------------------------------------------

  Starting GENCAN loop:            0
  Scaling radii by:    1.1000000000000001     

  Packing:|0                                                        100%|
          |***************************************************

  Function value from last GENCAN loop: f = .86997E-02
  Best function value before: f = .64574E+03
  Improvement from best function value:    99.99 %
  Improvement from last loop:    99.99 %
  Maximum violation of target distance:     0.000000
  Maximum violation of the constraints: .39662E-02
  Current structure written to file: solvated_150/2Bk_3carbonate_N,N-dimethylformamide.xyz
--------------------------------------------------------------------------------
  Packing solved for molecules of type           3
  Objective function value:    8.6997375414469506E-003
  Maximum violation of target distance:    0.0000000000000000     
  Max. constraint violation:    3.9662254424207904E-003
--------------------------------------------------------------------------------

################################################################################

  Packing all molecules together 

################################################################################


--------------------------------------------------------------------------------

  Starting GENCAN loop:            0
  Scaling radii by:    1.1000000000000001     

  Packing:|0                                                        100%|
          |******************************************

  Function value from last GENCAN loop: f = .65583E-02
  Best function value before: f = .56574E+02
  Improvement from best function value:    99.99 %
  Improvement from last loop:    99.99 %
  Maximum violation of target distance:     0.000000
  Maximum violation of the constraints: .48719E-02

################################################################################

                                 Success! 
              Final objective function value: .65583E-02
              Maximum violation of target distance:   0.000000
              Maximum violation of the constraints: .48719E-02

--------------------------------------------------------------------------------

              Please cite this work if Packmol was useful: 

           L. Martinez, R. Andrade, E. G. Birgin, J. M. Martinez, 
         PACKMOL: A package for building initial configurations for
                   molecular dynamics simulations. 
        Journal of Computational Chemistry, 30(13) pp. 2157-2164, 2009.
                  https://doi.org/10.1002/jcc.21224

################################################################################

  Solution written to file: solvated_150/2Bk_3carbonate_N,N-dimethylformamide.xyz

--------------------------------------------------------------------------------

   Running time:    2.91660018E-02  seconds. 

--------------------------------------------------------------------------------


