
################################################################################

 PACKMOL - Packing optimization for the automated generation of
 starting configurations for molecular dynamics simulations.
 
                                                             Version 21.1.2 

################################################################################

  Packmol must be run with: packmol < inputfile.inp 

  Userguide at: http://m3g.iqm.unicamp.br/packmol 

  Reading input file... (Control-C aborts)
  Types of coordinate files specified: xyz
  Periodic boundary condition activated: 
    Minimum coordinates:     0.00    0.00    0.00
    Maximum coordinates:    12.34   12.34   12.34
  Seed for random number generator:      1234567
  Output file: solvated_150/2Cs_1carbonate_1,3-dioxolan-2-one.xyz
  Reading coordinate file: ../structures/Cs.xyz
  Reading coordinate file: ../structures/carbonate.xyz
  Reading coordinate file: ../structures/1,3-dioxolan-2-one.xyz
  Number of independent structures:            3
  The structures are: 
  Structure            1 :Properties=species:S:1:pos:R:3 iupac_name=Cs pbc="F F F"(           1  atoms)
  Structure            2 :Properties=species:S:1:pos:R:3 iupac_name=carbonate pbc="F F F"(           4  atoms)
  Structure            3 :Properties=species:S:1:pos:R:3 iupac_name=1,3-dioxolan-2-one pbc="F F F"(          10  atoms)
  Maximum number of GENCAN loops for all molecule packing:          600
  Distance tolerance:    2.0000000000000000     
  Number of molecules of type            1 :            2
  Number of molecules of type            2 :            1
  Number of molecules of type            3 :           14
  Total number of restrictions:            3
  Total number of atoms:          146
  Total number of molecules:           17
  Number of fixed molecules:            0
  Number of free molecules:           17
  Number of variables:          102
  Total number of fixed atoms:            0
  PBC on: Constraint automatically added to non-fixed atoms:
  -> inside box     0.00    0.00    0.00   12.34   12.34   12.34
  Updated total number of restrictions:            4
  Maximum internal distance of type            1 :    0.0000000000000000     
  Maximum internal distance of type            2 :    2.2307843037819683     
  Maximum internal distance of type            3 :    4.2728366537933553     
  All atoms must be within these coordinates: 
   x: [   -1000.0000000000000      ,    1000.0000000000000       ] 
   y: [   -1000.0000000000000      ,    1000.0000000000000       ] 
   z: [   -1000.0000000000000      ,    1000.0000000000000       ] 
  If the system is larger than this, increase the sidemax parameter. 

################################################################################

  Building initial approximation ... 

################################################################################

  Adjusting initial point to fit the constraints 

--------------------------------------------------------------------------------

--------------------------------------------------------------------------------

  Molecules of type:            1

  Packing:|0                                                        100%|
          |******

  Restraint-only function value:    2.8010383121811293E-014
  Maximum violation of the restraints:    2.6525001411434203E-014

--------------------------------------------------------------------------------

  Molecules of type:            2

  Packing:|0                                                        100%|
          |***************

  Restraint-only function value:    6.2564688671319287E-006
  Maximum violation of the restraints:    6.2564688671319287E-006

--------------------------------------------------------------------------------

  Molecules of type:            3

  Packing:|0                                                        100%|
          |******************

  Restraint-only function value:    9.4989833550628618E-003
  Maximum violation of the restraints:    9.1087528160966810E-003

--------------------------------------------------------------------------------

  Rescaling maximum and minimum coordinates... 
  Mininum and maximum coordinates after constraint fitting: 
   x: [   -8.2374594942417694E-004 ,    12.344897115951738       ] 
   y: [   0.10836655289113438      ,    12.344896877036007       ] 
   z: [   -1.3944056515013750E-002 ,    12.412383121446686       ] 
  Computing size of patches... 
  Number of cells in each direction and cell sides: 
   x:            5  cells of size    2.4689794002665266     
   y:            5  cells of size    2.4689794002665266     
   z:            5  cells of size    2.4689794002665266     
  Cell-system length:   12.34490  12.34490  12.34490
  Reseting center of mass... 

--------------------------------------------------------------------------------

  Setting initial trial coordinates ... 

--------------------------------------------------------------------------------

--------------------------------------------------------------------------------

  Molecules of type:            1
  Adjusting random positions to fit the constraints. 
  Restraint-only function value:    0.0000000000000000     
  Maximum violation of the restraints:    0.0000000000000000     

--------------------------------------------------------------------------------

  Molecules of type:            2
  Adjusting random positions to fit the constraints. 
  Packing:|0                                                        100%|
          |***
  Restraint-only function value:    0.0000000000000000     
  Maximum violation of the restraints:    0.0000000000000000     

--------------------------------------------------------------------------------

  Molecules of type:            3
  Adjusting random positions to fit the constraints. 
  Packing:|0                                                        100%|
          |*********
  Restraint-only function value:    0.0000000000000000     
  Maximum violation of the restraints:    0.0000000000000000     

################################################################################

  Objective function at initial point:    1033.5251516943251     

################################################################################

  Packing molecules of type:            1

################################################################################


  Initial approximation is a solution. Nothing to do. 

  Current point written to file: solvated_150/2Cs_1carbonate_1,3-dioxolan-2-one.xyz
--------------------------------------------------------------------------------
  Packing solved for molecules of type           1
  Objective function value:    0.0000000000000000     
  Maximum violation of target distance:    0.0000000000000000     
  Max. constraint violation:    0.0000000000000000     
--------------------------------------------------------------------------------

################################################################################

  Packing molecules of type:            2

################################################################################


  Initial approximation is a solution. Nothing to do. 

  Current point written to file: solvated_150/2Cs_1carbonate_1,3-dioxolan-2-one.xyz
--------------------------------------------------------------------------------
  Packing solved for molecules of type           2
  Objective function value:    0.0000000000000000     
  Maximum violation of target distance:    0.0000000000000000     
  Max. constraint violation:    0.0000000000000000     
--------------------------------------------------------------------------------

################################################################################

  Packing molecules of type:            3

################################################################################


--------------------------------------------------------------------------------

  Starting GENCAN loop:            0
  Scaling radii by:    1.1000000000000001     

  Packing:|0                                                        100%|
          |******************************************************

  Function value from last GENCAN loop: f = .92297E-02
  Best function value before: f = .10276E+04
  Improvement from best function value:    99.99 %
  Improvement from last loop:    99.99 %
  Maximum violation of target distance:     0.000000
  Maximum violation of the constraints: .30728E-02
  Current structure written to file: solvated_150/2Cs_1carbonate_1,3-dioxolan-2-one.xyz
--------------------------------------------------------------------------------
  Packing solved for molecules of type           3
  Objective function value:    9.2297346029599440E-003
  Maximum violation of target distance:    0.0000000000000000     
  Max. constraint violation:    3.0727984607452881E-003
--------------------------------------------------------------------------------

################################################################################

  Packing all molecules together 

################################################################################


--------------------------------------------------------------------------------

  Starting GENCAN loop:            0
  Scaling radii by:    1.1000000000000001     

  Packing:|0                                                        100%|
          |******************************************

  Function value from last GENCAN loop: f = .17078E-01
  Best function value before: f = .80492E+02
  Improvement from best function value:    99.98 %
  Improvement from last loop:    99.98 %
  Maximum violation of target distance:     0.000000
  Maximum violation of the constraints: .84222E-02

################################################################################

                                 Success! 
              Final objective function value: .17078E-01
              Maximum violation of target distance:   0.000000
              Maximum violation of the constraints: .84222E-02

--------------------------------------------------------------------------------

              Please cite this work if Packmol was useful: 

           L. Martinez, R. Andrade, E. G. Birgin, J. M. Martinez, 
         PACKMOL: A package for building initial configurations for
                   molecular dynamics simulations. 
        Journal of Computational Chemistry, 30(13) pp. 2157-2164, 2009.
                  https://doi.org/10.1002/jcc.21224

################################################################################

  Solution written to file: solvated_150/2Cs_1carbonate_1,3-dioxolan-2-one.xyz

--------------------------------------------------------------------------------

   Running time:    2.94400007E-02  seconds. 

--------------------------------------------------------------------------------


