
################################################################################

 PACKMOL - Packing optimization for the automated generation of
 starting configurations for molecular dynamics simulations.
 
                                                             Version 21.1.2 

################################################################################

  Packmol must be run with: packmol < inputfile.inp 

  Userguide at: http://m3g.iqm.unicamp.br/packmol 

  Reading input file... (Control-C aborts)
  Types of coordinate files specified: xyz
  Periodic boundary condition activated: 
    Minimum coordinates:     0.00    0.00    0.00
    Maximum coordinates:    12.44   12.44   12.44
  Seed for random number generator:      1234567
  Output file: solvated_150/2diaminomethylideneazanium_12-dithioperoxy-disulfate_benzene.xyz
  Reading coordinate file: ../structures/diaminomethylideneazanium.xyz
  Reading coordinate file: ../structures/2-dithioperoxy-disulfate.xyz
  Reading coordinate file: ../structures/benzene.xyz
  Number of independent structures:            3
  The structures are: 
  Structure            1 :Properties=species:S:1:pos:R:3 iupac_name=diaminomethylideneazanium pbc="F F F"(          10  atoms)
  Structure            2 :Properties=species:S:1:pos:R:3 iupac_name=2-dithioperoxy-disulfate pbc="F F F"(          10  atoms)
  Structure            3 :Properties=species:S:1:pos:R:3 iupac_name=benzene pbc="F F F"(          12  atoms)
  Maximum number of GENCAN loops for all molecule packing:          600
  Distance tolerance:    2.0000000000000000     
  Number of molecules of type            1 :            2
  Number of molecules of type            2 :            1
  Number of molecules of type            3 :           10
  Total number of restrictions:            3
  Total number of atoms:          150
  Total number of molecules:           13
  Number of fixed molecules:            0
  Number of free molecules:           13
  Number of variables:           78
  Total number of fixed atoms:            0
  PBC on: Constraint automatically added to non-fixed atoms:
  -> inside box     0.00    0.00    0.00   12.44   12.44   12.44
  Updated total number of restrictions:            4
  Maximum internal distance of type            1 :    4.1851607316804458     
  Maximum internal distance of type            2 :    6.6701975607923334     
  Maximum internal distance of type            3 :    4.9619487079170828     
  All atoms must be within these coordinates: 
   x: [   -996.79999999999995      ,    1003.2000000000000       ] 
   y: [   -996.91106050338635      ,    1003.0889394966136       ] 
   z: [   -999.99985780463692      ,    1000.0001421953631       ] 
  If the system is larger than this, increase the sidemax parameter. 

################################################################################

  Building initial approximation ... 

################################################################################

  Adjusting initial point to fit the constraints 

--------------------------------------------------------------------------------

--------------------------------------------------------------------------------

  Molecules of type:            1

  Packing:|0                                                        100%|
          |******************

  Restraint-only function value:    0.0000000000000000     
  Maximum violation of the restraints:    0.0000000000000000     

--------------------------------------------------------------------------------

  Molecules of type:            2

  Packing:|0                                                        100%|
          |******************************

  Restraint-only function value:    1.3815673269962690E-003
  Maximum violation of the restraints:    1.0927554404667446E-003

--------------------------------------------------------------------------------

  Molecules of type:            3

  Packing:|0                                                        100%|
          |************************

  Restraint-only function value:    5.9980190130390842E-004
  Maximum violation of the restraints:    5.9567923786239309E-004

--------------------------------------------------------------------------------

  Rescaling maximum and minimum coordinates... 
  Mininum and maximum coordinates after constraint fitting: 
   x: [    1.6995697111621084E-002 ,    12.464935945604667       ] 
   y: [   -1.2016902398903065E-002 ,    12.437464697238600       ] 
   z: [    3.9476376310834926E-004 ,    12.458829591840392       ] 
  Computing size of patches... 
  Number of cells in each direction and cell sides: 
   x:            5  cells of size    2.4883143122553752     
   y:            5  cells of size    2.4883143122553752     
   z:            5  cells of size    2.4883143122553752     
  Cell-system length:   12.44157  12.44157  12.44157
  Reseting center of mass... 

--------------------------------------------------------------------------------

  Setting initial trial coordinates ... 

--------------------------------------------------------------------------------

--------------------------------------------------------------------------------

  Molecules of type:            1
  Adjusting random positions to fit the constraints. 
  Restraint-only function value:    0.0000000000000000     
  Maximum violation of the restraints:    0.0000000000000000     

--------------------------------------------------------------------------------

  Molecules of type:            2
  Adjusting random positions to fit the constraints. 
  Packing:|0                                                        100%|
          |***
  Restraint-only function value:    8.8106121846031195E-004
  Maximum violation of the restraints:    8.8106121846031195E-004

--------------------------------------------------------------------------------

  Molecules of type:            3
  Adjusting random positions to fit the constraints. 
  Packing:|0                                                        100%|
          |******
  Restraint-only function value:    0.0000000000000000     
  Maximum violation of the restraints:    0.0000000000000000     

################################################################################

  Objective function at initial point:    524.34268184697419     

################################################################################

  Packing molecules of type:            1

################################################################################


  Initial approximation is a solution. Nothing to do. 

  Current point written to file: solvated_150/2diaminomethylideneazanium_12-dithioperoxy-disulfate_benzene.xyz
--------------------------------------------------------------------------------
  Packing solved for molecules of type           1
  Objective function value:    0.0000000000000000     
  Maximum violation of target distance:    0.0000000000000000     
  Max. constraint violation:    0.0000000000000000     
--------------------------------------------------------------------------------

################################################################################

  Packing molecules of type:            2

################################################################################


  Initial approximation is a solution. Nothing to do. 

  Current point written to file: solvated_150/2diaminomethylideneazanium_12-dithioperoxy-disulfate_benzene.xyz
--------------------------------------------------------------------------------
  Packing solved for molecules of type           2
  Objective function value:    8.8106121846031195E-004
  Maximum violation of target distance:    0.0000000000000000     
  Max. constraint violation:    8.8106121846031195E-004
--------------------------------------------------------------------------------

################################################################################

  Packing molecules of type:            3

################################################################################


--------------------------------------------------------------------------------

  Starting GENCAN loop:            0
  Scaling radii by:    1.1000000000000001     

  Packing:|0                                                        100%|
          |*********************************

  Function value from last GENCAN loop: f = .10387E-01
  Best function value before: f = .21580E+03
  Improvement from best function value:    99.99 %
  Improvement from last loop:    99.99 %
  Maximum violation of target distance:     0.000000
  Maximum violation of the constraints: .48290E-02
  Current structure written to file: solvated_150/2diaminomethylideneazanium_12-dithioperoxy-disulfate_benzene.xyz
--------------------------------------------------------------------------------
  Packing solved for molecules of type           3
  Objective function value:    1.0386606753206507E-002
  Maximum violation of target distance:    0.0000000000000000     
  Max. constraint violation:    4.8290316494690030E-003
--------------------------------------------------------------------------------

################################################################################

  Packing all molecules together 

################################################################################


--------------------------------------------------------------------------------

  Starting GENCAN loop:            0
  Scaling radii by:    1.1000000000000001     

  Packing:|0                                                        100%|
          |*********************************************************

  Function value from last GENCAN loop: f = .33923E-02
  Best function value before: f = .25009E+03
  Improvement from best function value:    99.99 %
  Improvement from last loop:    99.99 %
  Maximum violation of target distance:     0.000000
  Maximum violation of the constraints: .27322E-02

################################################################################

                                 Success! 
              Final objective function value: .33923E-02
              Maximum violation of target distance:   0.000000
              Maximum violation of the constraints: .27322E-02

--------------------------------------------------------------------------------

              Please cite this work if Packmol was useful: 

           L. Martinez, R. Andrade, E. G. Birgin, J. M. Martinez, 
         PACKMOL: A package for building initial configurations for
                   molecular dynamics simulations. 
        Journal of Computational Chemistry, 30(13) pp. 2157-2164, 2009.
                  https://doi.org/10.1002/jcc.21224

################################################################################

  Solution written to file: solvated_150/2diaminomethylideneazanium_12-dithioperoxy-disulfate_benzene.xyz

--------------------------------------------------------------------------------

   Running time:    2.50639990E-02  seconds. 

--------------------------------------------------------------------------------


