
################################################################################

 PACKMOL - Packing optimization for the automated generation of
 starting configurations for molecular dynamics simulations.
 
                                                             Version 21.1.2 

################################################################################

  Packmol must be run with: packmol < inputfile.inp 

  Userguide at: http://m3g.iqm.unicamp.br/packmol 

  Reading input file... (Control-C aborts)
  Types of coordinate files specified: xyz
  Periodic boundary condition activated: 
    Minimum coordinates:     0.00    0.00    0.00
    Maximum coordinates:    12.20   12.20   12.20
  Seed for random number generator:      1234567
  Output file: solvated_150/2diaminomethylideneazanium_1disulfide_acetic-acid.xyz
  Reading coordinate file: ../structures/diaminomethylideneazanium.xyz
  Reading coordinate file: ../structures/disulfide.xyz
  Reading coordinate file: ../structures/acetic-acid.xyz
  Number of independent structures:            3
  The structures are: 
  Structure            1 :Properties=species:S:1:pos:R:3 iupac_name=diaminomethylideneazanium pbc="F F F"(          10  atoms)
  Structure            2 :Properties=species:S:1:pos:R:3 iupac_name=disulfide pbc="F F F"(           2  atoms)
  Structure            3 :Properties=species:S:1:pos:R:3 iupac_name=acetic-acid pbc="F F F"(           8  atoms)
  Maximum number of GENCAN loops for all molecule packing:          600
  Distance tolerance:    2.0000000000000000     
  Number of molecules of type            1 :            2
  Number of molecules of type            2 :            1
  Number of molecules of type            3 :           16
  Total number of restrictions:            3
  Total number of atoms:          150
  Total number of molecules:           19
  Number of fixed molecules:            0
  Number of free molecules:           19
  Number of variables:          114
  Total number of fixed atoms:            0
  PBC on: Constraint automatically added to non-fixed atoms:
  -> inside box     0.00    0.00    0.00   12.20   12.20   12.20
  Updated total number of restrictions:            4
  Maximum internal distance of type            1 :    4.1851607316804458     
  Maximum internal distance of type            2 :    2.0299991086204940     
  Maximum internal distance of type            3 :    4.0492717592179464     
  All atoms must be within these coordinates: 
   x: [   -996.79999999999995      ,    1003.2000000000000       ] 
   y: [   -996.91106050338635      ,    1003.0889394966136       ] 
   z: [   -999.99985780463692      ,    1000.0001421953631       ] 
  If the system is larger than this, increase the sidemax parameter. 

################################################################################

  Building initial approximation ... 

################################################################################

  Adjusting initial point to fit the constraints 

--------------------------------------------------------------------------------

--------------------------------------------------------------------------------

  Molecules of type:            1

  Packing:|0                                                        100%|
          |******************

  Restraint-only function value:    1.4060551294704908E-003
  Maximum violation of the restraints:    1.2523306540849137E-003

--------------------------------------------------------------------------------

  Molecules of type:            2

  Packing:|0                                                        100%|
          |*********

  Restraint-only function value:    9.9035796858059405E-019
  Maximum violation of the restraints:    9.9035796858059405E-019

--------------------------------------------------------------------------------

  Molecules of type:            3

  Packing:|0                                                        100%|
          |************************

  Restraint-only function value:    5.6134476945486544E-003
  Maximum violation of the restraints:    3.9743938606387214E-003

--------------------------------------------------------------------------------

  Rescaling maximum and minimum coordinates... 
  Mininum and maximum coordinates after constraint fitting: 
   x: [   -2.3742623402696456E-003 ,    12.195420181087142       ] 
   y: [    2.8276492466530161E-010 ,    12.205121431187351       ] 
   z: [   -4.4577987059975697E-002 ,    12.194735628307729       ] 
  Computing size of patches... 
  Number of cells in each direction and cell sides: 
   x:            5  cells of size    2.4390840360766903     
   y:            5  cells of size    2.4390840360766903     
   z:            5  cells of size    2.4390840360766903     
  Cell-system length:   12.19542  12.19542  12.19542
  Reseting center of mass... 

--------------------------------------------------------------------------------

  Setting initial trial coordinates ... 

--------------------------------------------------------------------------------

--------------------------------------------------------------------------------

  Molecules of type:            1
  Adjusting random positions to fit the constraints. 
  Restraint-only function value:    0.0000000000000000     
  Maximum violation of the restraints:    0.0000000000000000     

--------------------------------------------------------------------------------

  Molecules of type:            2
  Adjusting random positions to fit the constraints. 
  Restraint-only function value:    7.3194365951110181E-003
  Maximum violation of the restraints:    7.3194365951110181E-003

--------------------------------------------------------------------------------

  Molecules of type:            3
  Adjusting random positions to fit the constraints. 
  Packing:|0                                                        100%|
          |***
  Restraint-only function value:    0.0000000000000000     
  Maximum violation of the restraints:    0.0000000000000000     

################################################################################

  Objective function at initial point:    1133.7494515299500     

################################################################################

  Packing molecules of type:            1

################################################################################


  Initial approximation is a solution. Nothing to do. 

  Current point written to file: solvated_150/2diaminomethylideneazanium_1disulfide_acetic-acid.xyz
--------------------------------------------------------------------------------
  Packing solved for molecules of type           1
  Objective function value:    0.0000000000000000     
  Maximum violation of target distance:    0.0000000000000000     
  Max. constraint violation:    0.0000000000000000     
--------------------------------------------------------------------------------

################################################################################

  Packing molecules of type:            2

################################################################################


  Initial approximation is a solution. Nothing to do. 

  Current point written to file: solvated_150/2diaminomethylideneazanium_1disulfide_acetic-acid.xyz
--------------------------------------------------------------------------------
  Packing solved for molecules of type           2
  Objective function value:    7.3194365951110181E-003
  Maximum violation of target distance:    0.0000000000000000     
  Max. constraint violation:    7.3194365951110181E-003
--------------------------------------------------------------------------------

################################################################################

  Packing molecules of type:            3

################################################################################


--------------------------------------------------------------------------------

  Starting GENCAN loop:            0
  Scaling radii by:    1.1000000000000001     

  Packing:|0                                                        100%|
          |*********************************************************

  Function value from last GENCAN loop: f = .13403E-01
  Best function value before: f = .82452E+03
  Improvement from best function value:    99.99 %
  Improvement from last loop:    99.99 %
  Maximum violation of target distance:     0.000000
  Maximum violation of the constraints: .98840E-02
  Current structure written to file: solvated_150/2diaminomethylideneazanium_1disulfide_acetic-acid.xyz
--------------------------------------------------------------------------------
  Packing solved for molecules of type           3
  Objective function value:    1.3403031811592209E-002
  Maximum violation of target distance:    0.0000000000000000     
  Max. constraint violation:    9.8840338304279785E-003
--------------------------------------------------------------------------------

################################################################################

  Packing all molecules together 

################################################################################


--------------------------------------------------------------------------------

  Starting GENCAN loop:            0
  Scaling radii by:    1.1000000000000001     

  Packing:|0                                                        100%|
          |************************************************

  Function value from last GENCAN loop: f = .17907E-01
  Best function value before: f = .43687E+03
  Improvement from best function value:    99.99 %
  Improvement from last loop:    99.99 %
  Maximum violation of target distance:     0.000000
  Maximum violation of the constraints: .68540E-02

################################################################################

                                 Success! 
              Final objective function value: .17907E-01
              Maximum violation of target distance:   0.000000
              Maximum violation of the constraints: .68540E-02

--------------------------------------------------------------------------------

              Please cite this work if Packmol was useful: 

           L. Martinez, R. Andrade, E. G. Birgin, J. M. Martinez, 
         PACKMOL: A package for building initial configurations for
                   molecular dynamics simulations. 
        Journal of Computational Chemistry, 30(13) pp. 2157-2164, 2009.
                  https://doi.org/10.1002/jcc.21224

################################################################################

  Solution written to file: solvated_150/2diaminomethylideneazanium_1disulfide_acetic-acid.xyz

--------------------------------------------------------------------------------

   Running time:    3.59660015E-02  seconds. 

--------------------------------------------------------------------------------


