
################################################################################

 PACKMOL - Packing optimization for the automated generation of
 starting configurations for molecular dynamics simulations.
 
                                                             Version 21.1.2 

################################################################################

  Packmol must be run with: packmol < inputfile.inp 

  Userguide at: http://m3g.iqm.unicamp.br/packmol 

  Reading input file... (Control-C aborts)
  Types of coordinate files specified: xyz
  Periodic boundary condition activated: 
    Minimum coordinates:     0.00    0.00    0.00
    Maximum coordinates:    16.56   16.56   16.56
  Seed for random number generator:      1234567
  Output file: solvated_150/2Pa_5disulfide_chloroform.xyz
  Reading coordinate file: ../structures/Pa.xyz
  Reading coordinate file: ../structures/disulfide.xyz
  Reading coordinate file: ../structures/chloroform.xyz
  Number of independent structures:            3
  The structures are: 
  Structure            1 :Properties=species:S:1:pos:R:3 iupac_name=Pa pbc="F F F"(           1  atoms)
  Structure            2 :Properties=species:S:1:pos:R:3 iupac_name=disulfide pbc="F F F"(           2  atoms)
  Structure            3 :Properties=species:S:1:pos:R:3 iupac_name=chloroform pbc="F F F"(           5  atoms)
  Maximum number of GENCAN loops for all molecule packing:          600
  Distance tolerance:    2.0000000000000000     
  Number of molecules of type            1 :            2
  Number of molecules of type            2 :            5
  Number of molecules of type            3 :           27
  Total number of restrictions:            3
  Total number of atoms:          147
  Total number of molecules:           34
  Number of fixed molecules:            0
  Number of free molecules:           34
  Number of variables:          204
  Total number of fixed atoms:            0
  PBC on: Constraint automatically added to non-fixed atoms:
  -> inside box     0.00    0.00    0.00   16.56   16.56   16.56
  Updated total number of restrictions:            4
  Maximum internal distance of type            1 :    0.0000000000000000     
  Maximum internal distance of type            2 :    2.0299991086204940     
  Maximum internal distance of type            3 :    2.9128739262110201     
  All atoms must be within these coordinates: 
   x: [   -1000.0000000000000      ,    1000.0000000000000       ] 
   y: [   -1000.0000000000000      ,    1000.0000000000000       ] 
   z: [   -1000.0000000000000      ,    1000.0000000000000       ] 
  If the system is larger than this, increase the sidemax parameter. 

################################################################################

  Building initial approximation ... 

################################################################################

  Adjusting initial point to fit the constraints 

--------------------------------------------------------------------------------

--------------------------------------------------------------------------------

  Molecules of type:            1

  Packing:|0                                                        100%|
          |******

  Restraint-only function value:    6.1808776037640539E-014
  Maximum violation of the restraints:    6.0914378608695876E-014

--------------------------------------------------------------------------------

  Molecules of type:            2

  Packing:|0                                                        100%|
          |*********

  Restraint-only function value:    1.5802893960820328E-016
  Maximum violation of the restraints:    5.6666946129741051E-017

--------------------------------------------------------------------------------

  Molecules of type:            3

  Packing:|0                                                        100%|
          |***************************

  Restraint-only function value:    1.0752932002218622E-007
  Maximum violation of the restraints:    1.0752932002218622E-007

--------------------------------------------------------------------------------

  Rescaling maximum and minimum coordinates... 
  Mininum and maximum coordinates after constraint fitting: 
   x: [   -2.1147073425709095E-008 ,    16.560188508479058       ] 
   y: [   -6.6426575843564234E-011 ,    16.560188543315093       ] 
   z: [   -2.3187207682490168E-004 ,    16.560188409165541       ] 
  Computing size of patches... 
  Number of cells in each direction and cell sides: 
   x:            7  cells of size    2.3657412011443273     
   y:            7  cells of size    2.3657412011443273     
   z:            7  cells of size    2.3657412011443273     
  Cell-system length:   16.56019  16.56019  16.56019
  Reseting center of mass... 

--------------------------------------------------------------------------------

  Setting initial trial coordinates ... 

--------------------------------------------------------------------------------

--------------------------------------------------------------------------------

  Molecules of type:            1
  Adjusting random positions to fit the constraints. 
  Restraint-only function value:    0.0000000000000000     
  Maximum violation of the restraints:    0.0000000000000000     

--------------------------------------------------------------------------------

  Molecules of type:            2
  Adjusting random positions to fit the constraints. 
  Restraint-only function value:    0.0000000000000000     
  Maximum violation of the restraints:    0.0000000000000000     

--------------------------------------------------------------------------------

  Molecules of type:            3
  Adjusting random positions to fit the constraints. 
  Restraint-only function value:    1.4403638125398367E-003
  Maximum violation of the restraints:    1.2436030533237287E-003

################################################################################

  Objective function at initial point:    328.99557656486070     

################################################################################

  Packing molecules of type:            1

################################################################################


  Initial approximation is a solution. Nothing to do. 

  Current point written to file: solvated_150/2Pa_5disulfide_chloroform.xyz
--------------------------------------------------------------------------------
  Packing solved for molecules of type           1
  Objective function value:    0.0000000000000000     
  Maximum violation of target distance:    0.0000000000000000     
  Max. constraint violation:    0.0000000000000000     
--------------------------------------------------------------------------------

################################################################################

  Packing molecules of type:            2

################################################################################


  Initial approximation is a solution. Nothing to do. 

  Current point written to file: solvated_150/2Pa_5disulfide_chloroform.xyz
--------------------------------------------------------------------------------
  Packing solved for molecules of type           2
  Objective function value:    0.0000000000000000     
  Maximum violation of target distance:    0.0000000000000000     
  Max. constraint violation:    0.0000000000000000     
--------------------------------------------------------------------------------

################################################################################

  Packing molecules of type:            3

################################################################################


--------------------------------------------------------------------------------

  Starting GENCAN loop:            0
  Scaling radii by:    1.1000000000000001     

  Packing:|0                                                        100%|
          |************************************

  Function value from last GENCAN loop: f = .17865E-02
  Best function value before: f = .32575E+03
  Improvement from best function value:    99.99 %
  Improvement from last loop:    99.99 %
  Maximum violation of target distance:     0.000000
  Maximum violation of the constraints: .78678E-03
  Current structure written to file: solvated_150/2Pa_5disulfide_chloroform.xyz
--------------------------------------------------------------------------------
  Packing solved for molecules of type           3
  Objective function value:    1.7865285026099011E-003
  Maximum violation of target distance:    0.0000000000000000     
  Max. constraint violation:    7.8678399538389390E-004
--------------------------------------------------------------------------------

################################################################################

  Packing all molecules together 

################################################################################


--------------------------------------------------------------------------------

  Starting GENCAN loop:            0
  Scaling radii by:    1.1000000000000001     

  Packing:|0                                                        100%|
          |******************

  Function value from last GENCAN loop: f = .49989E-03
  Best function value before: f = .98700E+01
  Improvement from best function value:    99.99 %
  Improvement from last loop:    99.99 %
  Maximum violation of target distance:     0.000000
  Maximum violation of the constraints: .49729E-03

################################################################################

                                 Success! 
              Final objective function value: .49989E-03
              Maximum violation of target distance:   0.000000
              Maximum violation of the constraints: .49729E-03

--------------------------------------------------------------------------------

              Please cite this work if Packmol was useful: 

           L. Martinez, R. Andrade, E. G. Birgin, J. M. Martinez, 
         PACKMOL: A package for building initial configurations for
                   molecular dynamics simulations. 
        Journal of Computational Chemistry, 30(13) pp. 2157-2164, 2009.
                  https://doi.org/10.1002/jcc.21224

################################################################################

  Solution written to file: solvated_150/2Pa_5disulfide_chloroform.xyz

--------------------------------------------------------------------------------

   Running time:    1.49169937E-02  seconds. 

--------------------------------------------------------------------------------


