
################################################################################

 PACKMOL - Packing optimization for the automated generation of
 starting configurations for molecular dynamics simulations.
 
                                                             Version 21.1.2 

################################################################################

  Packmol must be run with: packmol < inputfile.inp 

  Userguide at: http://m3g.iqm.unicamp.br/packmol 

  Reading input file... (Control-C aborts)
  Types of coordinate files specified: xyz
  Periodic boundary condition activated: 
    Minimum coordinates:     0.00    0.00    0.00
    Maximum coordinates:    11.76   11.76   11.76
  Seed for random number generator:      1234567
  Output file: solvated_150/2pyridin-1-ium_1sulfate_oxolane.xyz
  Reading coordinate file: ../structures/pyridin-1-ium.xyz
  Reading coordinate file: ../structures/sulfate.xyz
  Reading coordinate file: ../structures/oxolane.xyz
  Number of independent structures:            3
  The structures are: 
  Structure            1 :Properties=species:S:1:pos:R:3 iupac_name=pyridin-1-ium pbc="F F F"(          12  atoms)
  Structure            2 :Properties=species:S:1:pos:R:3 iupac_name=sulfate pbc="F F F"(           5  atoms)
  Structure            3 :Properties=species:S:1:pos:R:3 iupac_name=oxolane pbc="F F F"(          13  atoms)
  Maximum number of GENCAN loops for all molecule packing:          600
  Distance tolerance:    2.0000000000000000     
  Number of molecules of type            1 :            2
  Number of molecules of type            2 :            1
  Number of molecules of type            3 :            9
  Total number of restrictions:            3
  Total number of atoms:          146
  Total number of molecules:           12
  Number of fixed molecules:            0
  Number of free molecules:           12
  Number of variables:           72
  Total number of fixed atoms:            0
  PBC on: Constraint automatically added to non-fixed atoms:
  -> inside box     0.00    0.00    0.00   11.76   11.76   11.76
  Updated total number of restrictions:            4
  Maximum internal distance of type            1 :    4.9160269913823704     
  Maximum internal distance of type            2 :    2.4074826707579851     
  Maximum internal distance of type            3 :    4.1645648236040227     
  All atoms must be within these coordinates: 
   x: [   -997.22184526164881      ,    1002.7781547383512       ] 
   y: [   -996.79999999999995      ,    1003.2000000000000       ] 
   z: [   -999.99988583067909      ,    1000.0001141693209       ] 
  If the system is larger than this, increase the sidemax parameter. 

################################################################################

  Building initial approximation ... 

################################################################################

  Adjusting initial point to fit the constraints 

--------------------------------------------------------------------------------

--------------------------------------------------------------------------------

  Molecules of type:            1

  Packing:|0                                                        100%|
          |************************

  Restraint-only function value:    1.4384465516199872E-002
  Maximum violation of the restraints:    4.5159283683399920E-003

--------------------------------------------------------------------------------

  Molecules of type:            2

  Packing:|0                                                        100%|
          |************

  Restraint-only function value:    5.7757893598773532E-005
  Maximum violation of the restraints:    5.7757893598773532E-005

--------------------------------------------------------------------------------

  Molecules of type:            3

  Packing:|0                                                        100%|
          |*********************

  Restraint-only function value:    0.0000000000000000     
  Maximum violation of the restraints:    0.0000000000000000     

--------------------------------------------------------------------------------

  Rescaling maximum and minimum coordinates... 
  Mininum and maximum coordinates after constraint fitting: 
   x: [    4.1303936710138850E-002 ,    11.759033750202912       ] 
   y: [   -5.3739135459538951E-003 ,    11.808309897472514       ] 
   z: [   -1.2345377707557922E-004 ,    11.722444272329508       ] 
  Computing size of patches... 
  Number of cells in each direction and cell sides: 
   x:            5  cells of size    2.3521583713709111     
   y:            5  cells of size    2.3521583713709111     
   z:            5  cells of size    2.3521583713709111     
  Cell-system length:   11.76079  11.76079  11.76079
  Reseting center of mass... 

--------------------------------------------------------------------------------

  Setting initial trial coordinates ... 

--------------------------------------------------------------------------------

--------------------------------------------------------------------------------

  Molecules of type:            1
  Adjusting random positions to fit the constraints. 
  Packing:|0                                                        100%|
          |***
  Restraint-only function value:    1.8924686124321530E-005
  Maximum violation of the restraints:    1.8762229290603845E-005

--------------------------------------------------------------------------------

  Molecules of type:            2
  Adjusting random positions to fit the constraints. 
  Packing:|0                                                        100%|
          |***
  Restraint-only function value:    4.1171963744686792E-004
  Maximum violation of the restraints:    3.1897579552098154E-004

--------------------------------------------------------------------------------

  Molecules of type:            3
  Adjusting random positions to fit the constraints. 
  Restraint-only function value:    0.0000000000000000     
  Maximum violation of the restraints:    0.0000000000000000     

################################################################################

  Objective function at initial point:    1143.5324841867423     

################################################################################

  Packing molecules of type:            1

################################################################################


  Initial approximation is a solution. Nothing to do. 

  Current point written to file: solvated_150/2pyridin-1-ium_1sulfate_oxolane.xyz
--------------------------------------------------------------------------------
  Packing solved for molecules of type           1
  Objective function value:    1.8924686124321530E-005
  Maximum violation of target distance:    0.0000000000000000     
  Max. constraint violation:    1.8762229290603845E-005
--------------------------------------------------------------------------------

################################################################################

  Packing molecules of type:            2

################################################################################


  Initial approximation is a solution. Nothing to do. 

  Current point written to file: solvated_150/2pyridin-1-ium_1sulfate_oxolane.xyz
--------------------------------------------------------------------------------
  Packing solved for molecules of type           2
  Objective function value:    4.1171963744686792E-004
  Maximum violation of target distance:    0.0000000000000000     
  Max. constraint violation:    3.1897579552098154E-004
--------------------------------------------------------------------------------

################################################################################

  Packing molecules of type:            3

################################################################################


--------------------------------------------------------------------------------

  Starting GENCAN loop:            0
  Scaling radii by:    1.1000000000000001     

  Packing:|0                                                        100%|
          |******************************************

  Function value from last GENCAN loop: f = .38159E-01
  Best function value before: f = .93636E+03
  Improvement from best function value:    99.99 %
  Improvement from last loop:    99.99 %
  Maximum violation of target distance:     0.000000
  Maximum violation of the constraints: .98469E-02
  Current structure written to file: solvated_150/2pyridin-1-ium_1sulfate_oxolane.xyz
--------------------------------------------------------------------------------
  Packing solved for molecules of type           3
  Objective function value:    3.8159434370812977E-002
  Maximum violation of target distance:    0.0000000000000000     
  Max. constraint violation:    9.8469435174318339E-003
--------------------------------------------------------------------------------

################################################################################

  Packing all molecules together 

################################################################################


--------------------------------------------------------------------------------

  Starting GENCAN loop:            0
  Scaling radii by:    1.1000000000000001     

  Packing:|0                                                        100%|
          |************************************************

  Function value from last GENCAN loop: f = .65994E-02
  Best function value before: f = .23583E+03
  Improvement from best function value:    99.99 %
  Improvement from last loop:    99.99 %
  Maximum violation of target distance:     0.000000
  Maximum violation of the constraints: .59817E-02

################################################################################

                                 Success! 
              Final objective function value: .65994E-02
              Maximum violation of target distance:   0.000000
              Maximum violation of the constraints: .59817E-02

--------------------------------------------------------------------------------

              Please cite this work if Packmol was useful: 

           L. Martinez, R. Andrade, E. G. Birgin, J. M. Martinez, 
         PACKMOL: A package for building initial configurations for
                   molecular dynamics simulations. 
        Journal of Computational Chemistry, 30(13) pp. 2157-2164, 2009.
                  https://doi.org/10.1002/jcc.21224

################################################################################

  Solution written to file: solvated_150/2pyridin-1-ium_1sulfate_oxolane.xyz

--------------------------------------------------------------------------------

   Running time:    2.52680071E-02  seconds. 

--------------------------------------------------------------------------------


