
################################################################################

 PACKMOL - Packing optimization for the automated generation of
 starting configurations for molecular dynamics simulations.
 
                                                             Version 21.1.2 

################################################################################

  Packmol must be run with: packmol < inputfile.inp 

  Userguide at: http://m3g.iqm.unicamp.br/packmol 

  Reading input file... (Control-C aborts)
  Types of coordinate files specified: xyz
  Periodic boundary condition activated: 
    Minimum coordinates:     0.00    0.00    0.00
    Maximum coordinates:    13.04   13.04   13.04
  Seed for random number generator:      1234567
  Output file: solvated_150/2Sm_3chromate_ethyl-methyl-carbonate.xyz
  Reading coordinate file: ../structures/Sm.xyz
  Reading coordinate file: ../structures/chromate.xyz
  Reading coordinate file: ../structures/ethyl-methyl-carbonate.xyz
  Number of independent structures:            3
  The structures are: 
  Structure            1 :Properties=species:S:1:pos:R:3 iupac_name=Sm pbc="F F F"(           1  atoms)
  Structure            2 :Properties=species:S:1:pos:R:3 iupac_name=chromate pbc="F F F"(           5  atoms)
  Structure            3 :Properties=species:S:1:pos:R:3 iupac_name=ethyl-methyl-carbonate pbc="F F F"(          15  atoms)
  Maximum number of GENCAN loops for all molecule packing:          600
  Distance tolerance:    2.0000000000000000     
  Number of molecules of type            1 :            2
  Number of molecules of type            2 :            3
  Number of molecules of type            3 :            8
  Total number of restrictions:            3
  Total number of atoms:          137
  Total number of molecules:           13
  Number of fixed molecules:            0
  Number of free molecules:           13
  Number of variables:           78
  Total number of fixed atoms:            0
  PBC on: Constraint automatically added to non-fixed atoms:
  -> inside box     0.00    0.00    0.00   13.04   13.04   13.04
  Updated total number of restrictions:            4
  Maximum internal distance of type            1 :    0.0000000000000000     
  Maximum internal distance of type            2 :    3.0992197000858139     
  Maximum internal distance of type            3 :    7.6125855147906218     
  All atoms must be within these coordinates: 
   x: [   -1000.0000000000000      ,    1000.0000000000000       ] 
   y: [   -1000.0000000000000      ,    1000.0000000000000       ] 
   z: [   -1000.0000000000000      ,    1000.0000000000000       ] 
  If the system is larger than this, increase the sidemax parameter. 

################################################################################

  Building initial approximation ... 

################################################################################

  Adjusting initial point to fit the constraints 

--------------------------------------------------------------------------------

--------------------------------------------------------------------------------

  Molecules of type:            1

  Packing:|0                                                        100%|
          |******

  Restraint-only function value:    6.5717727532755289E-015
  Maximum violation of the restraints:    6.5717727532755289E-015

--------------------------------------------------------------------------------

  Molecules of type:            2

  Packing:|0                                                        100%|
          |***************

  Restraint-only function value:    0.0000000000000000     
  Maximum violation of the restraints:    0.0000000000000000     

--------------------------------------------------------------------------------

  Molecules of type:            3

  Packing:|0                                                        100%|
          |************************************

  Restraint-only function value:    5.5322677363492069E-003
  Maximum violation of the restraints:    2.9592493728147523E-003

--------------------------------------------------------------------------------

  Rescaling maximum and minimum coordinates... 
  Mininum and maximum coordinates after constraint fitting: 
   x: [   -3.8465889907909008E-002 ,    13.042321766550401       ] 
   y: [   -5.3513539204034259E-003 ,    13.042321771675404       ] 
   z: [   -5.7322651514368772E-008 ,    13.048389878904672       ] 
  Computing size of patches... 
  Number of cells in each direction and cell sides: 
   x:            5  cells of size    2.6084643790831943     
   y:            5  cells of size    2.6084643790831943     
   z:            5  cells of size    2.6084643790831943     
  Cell-system length:   13.04232  13.04232  13.04232
  Reseting center of mass... 

--------------------------------------------------------------------------------

  Setting initial trial coordinates ... 

--------------------------------------------------------------------------------

--------------------------------------------------------------------------------

  Molecules of type:            1
  Adjusting random positions to fit the constraints. 
  Restraint-only function value:    0.0000000000000000     
  Maximum violation of the restraints:    0.0000000000000000     

--------------------------------------------------------------------------------

  Molecules of type:            2
  Adjusting random positions to fit the constraints. 
  Packing:|0                                                        100%|
          |***
  Restraint-only function value:    0.0000000000000000     
  Maximum violation of the restraints:    0.0000000000000000     

--------------------------------------------------------------------------------

  Molecules of type:            3
  Adjusting random positions to fit the constraints. 
  Packing:|0                                                        100%|
          |*********************************
  Restraint-only function value:    1.5700923739608057E-002
  Maximum violation of the restraints:    7.8605421751914775E-003

################################################################################

  Objective function at initial point:    519.34303710789834     

################################################################################

  Packing molecules of type:            1

################################################################################


  Initial approximation is a solution. Nothing to do. 

  Current point written to file: solvated_150/2Sm_3chromate_ethyl-methyl-carbonate.xyz
--------------------------------------------------------------------------------
  Packing solved for molecules of type           1
  Objective function value:    0.0000000000000000     
  Maximum violation of target distance:    0.0000000000000000     
  Max. constraint violation:    0.0000000000000000     
--------------------------------------------------------------------------------

################################################################################

  Packing molecules of type:            2

################################################################################


--------------------------------------------------------------------------------

  Starting GENCAN loop:            0
  Scaling radii by:    1.1000000000000001     

  Packing:|0                                                        100%|
          |************

  Function value from last GENCAN loop: f = .95728E-02
  Best function value before: f = .14159E+02
  Improvement from best function value:    99.93 %
  Improvement from last loop:    99.93 %
  Maximum violation of target distance:     0.000000
  Maximum violation of the constraints: .55866E-02
  Current structure written to file: solvated_150/2Sm_3chromate_ethyl-methyl-carbonate.xyz
--------------------------------------------------------------------------------
  Packing solved for molecules of type           2
  Objective function value:    9.5728464369532890E-003
  Maximum violation of target distance:    0.0000000000000000     
  Max. constraint violation:    5.5865525513372986E-003
--------------------------------------------------------------------------------

################################################################################

  Packing molecules of type:            3

################################################################################


--------------------------------------------------------------------------------

  Starting GENCAN loop:            0
  Scaling radii by:    1.1000000000000001     

  Packing:|0                                                        100%|
          |***************************************

  Function value from last GENCAN loop: f = .37882E-02
  Best function value before: f = .46987E+03
  Improvement from best function value:    99.99 %
  Improvement from last loop:    99.99 %
  Maximum violation of target distance:     0.000000
  Maximum violation of the constraints: .23322E-02
  Current structure written to file: solvated_150/2Sm_3chromate_ethyl-methyl-carbonate.xyz
--------------------------------------------------------------------------------
  Packing solved for molecules of type           3
  Objective function value:    3.7882260251832830E-003
  Maximum violation of target distance:    0.0000000000000000     
  Max. constraint violation:    2.3322130624453810E-003
--------------------------------------------------------------------------------

################################################################################

  Packing all molecules together 

################################################################################


--------------------------------------------------------------------------------

  Starting GENCAN loop:            0
  Scaling radii by:    1.1000000000000001     

  Packing:|0                                                        100%|
          |******************************************

  Function value from last GENCAN loop: f = .74972E-03
  Best function value before: f = .11987E+03
  Improvement from best function value:    99.99 %
  Improvement from last loop:    99.99 %
  Maximum violation of target distance:     0.000000
  Maximum violation of the constraints: .52678E-03

################################################################################

                                 Success! 
              Final objective function value: .74972E-03
              Maximum violation of target distance:   0.000000
              Maximum violation of the constraints: .52678E-03

--------------------------------------------------------------------------------

              Please cite this work if Packmol was useful: 

           L. Martinez, R. Andrade, E. G. Birgin, J. M. Martinez, 
         PACKMOL: A package for building initial configurations for
                   molecular dynamics simulations. 
        Journal of Computational Chemistry, 30(13) pp. 2157-2164, 2009.
                  https://doi.org/10.1002/jcc.21224

################################################################################

  Solution written to file: solvated_150/2Sm_3chromate_ethyl-methyl-carbonate.xyz

--------------------------------------------------------------------------------

   Running time:    2.24409997E-02  seconds. 

--------------------------------------------------------------------------------


