
################################################################################

 PACKMOL - Packing optimization for the automated generation of
 starting configurations for molecular dynamics simulations.
 
                                                             Version 21.1.2 

################################################################################

  Packmol must be run with: packmol < inputfile.inp 

  Userguide at: http://m3g.iqm.unicamp.br/packmol 

  Reading input file... (Control-C aborts)
  Types of coordinate files specified: xyz
  Periodic boundary condition activated: 
    Minimum coordinates:     0.00    0.00    0.00
    Maximum coordinates:    11.64   11.64   11.64
  Seed for random number generator:      1234567
  Output file: solvated_150/3Pa_5phosphate_azane.xyz
  Reading coordinate file: ../structures/Pa.xyz
  Reading coordinate file: ../structures/phosphate.xyz
  Reading coordinate file: ../structures/azane.xyz
  Number of independent structures:            3
  The structures are: 
  Structure            1 :Properties=species:S:1:pos:R:3 iupac_name=Pa pbc="F F F"(           1  atoms)
  Structure            2 :Properties=species:S:1:pos:R:3 iupac_name=phosphate pbc="F F F"(           5  atoms)
  Structure            3 :Properties=species:S:1:pos:R:3 iupac_name=azane pbc="F F F"(           4  atoms)
  Maximum number of GENCAN loops for all molecule packing:          600
  Distance tolerance:    2.0000000000000000     
  Number of molecules of type            1 :            3
  Number of molecules of type            2 :            5
  Number of molecules of type            3 :           30
  Total number of restrictions:            3
  Total number of atoms:          148
  Total number of molecules:           38
  Number of fixed molecules:            0
  Number of free molecules:           38
  Number of variables:          228
  Total number of fixed atoms:            0
  PBC on: Constraint automatically added to non-fixed atoms:
  -> inside box     0.00    0.00    0.00   11.64   11.64   11.64
  Updated total number of restrictions:            4
  Maximum internal distance of type            1 :    0.0000000000000000     
  Maximum internal distance of type            2 :    2.5110349838263901     
  Maximum internal distance of type            3 :    1.6276392505712067     
  All atoms must be within these coordinates: 
   x: [   -1000.0000000000000      ,    1000.0000000000000       ] 
   y: [   -1000.0000000000000      ,    1000.0000000000000       ] 
   z: [   -1000.0000000000000      ,    1000.0000000000000       ] 
  If the system is larger than this, increase the sidemax parameter. 

################################################################################

  Building initial approximation ... 

################################################################################

  Adjusting initial point to fit the constraints 

--------------------------------------------------------------------------------

--------------------------------------------------------------------------------

  Molecules of type:            1

  Packing:|0                                                        100%|
          |******

  Restraint-only function value:    3.2592334593963812E-014
  Maximum violation of the restraints:    2.8593867766546869E-014

--------------------------------------------------------------------------------

  Molecules of type:            2

  Packing:|0                                                        100%|
          |***************

  Restraint-only function value:    5.5177404745067945E-004
  Maximum violation of the restraints:    3.4334633453377803E-004

--------------------------------------------------------------------------------

  Molecules of type:            3

  Packing:|0                                                        100%|
          |******************************

  Restraint-only function value:    2.5286115397373225E-006
  Maximum violation of the restraints:    8.4681800091295970E-007

--------------------------------------------------------------------------------

  Rescaling maximum and minimum coordinates... 
  Mininum and maximum coordinates after constraint fitting: 
   x: [   -2.5598102153839673E-004 ,    11.650452548496151       ] 
   y: [   -2.0251606395057058E-004 ,    11.647558656571634       ] 
   z: [   -3.8260540349950410E-004 ,    11.638000836609015       ] 
  Computing size of patches... 
  Number of cells in each direction and cell sides: 
   x:            5  cells of size    2.3274700275507172     
   y:            5  cells of size    2.3274700275507172     
   z:            5  cells of size    2.3274700275507172     
  Cell-system length:   11.63735  11.63735  11.63735
  Reseting center of mass... 

--------------------------------------------------------------------------------

  Setting initial trial coordinates ... 

--------------------------------------------------------------------------------

--------------------------------------------------------------------------------

  Molecules of type:            1
  Adjusting random positions to fit the constraints. 
  Restraint-only function value:    0.0000000000000000     
  Maximum violation of the restraints:    0.0000000000000000     

--------------------------------------------------------------------------------

  Molecules of type:            2
  Adjusting random positions to fit the constraints. 
  Restraint-only function value:    0.0000000000000000     
  Maximum violation of the restraints:    0.0000000000000000     

--------------------------------------------------------------------------------

  Molecules of type:            3
  Adjusting random positions to fit the constraints. 
  Packing:|0                                                        100%|
          |***
  Restraint-only function value:    4.7086951848979039E-006
  Maximum violation of the restraints:    4.7086951848979039E-006

################################################################################

  Objective function at initial point:    964.29050369005552     

################################################################################

  Packing molecules of type:            1

################################################################################


  Initial approximation is a solution. Nothing to do. 

  Current point written to file: solvated_150/3Pa_5phosphate_azane.xyz
--------------------------------------------------------------------------------
  Packing solved for molecules of type           1
  Objective function value:    0.0000000000000000     
  Maximum violation of target distance:    0.0000000000000000     
  Max. constraint violation:    0.0000000000000000     
--------------------------------------------------------------------------------

################################################################################

  Packing molecules of type:            2

################################################################################


--------------------------------------------------------------------------------

  Starting GENCAN loop:            0
  Scaling radii by:    1.1000000000000001     

  Packing:|0                                                        100%|
          |*********

  Function value from last GENCAN loop: f = .81705E-05
  Best function value before: f = .47797E+02
  Improvement from best function value:    99.99 %
  Improvement from last loop:    99.99 %
  Maximum violation of target distance:     0.000000
  Maximum violation of the constraints: .81705E-05
  Current structure written to file: solvated_150/3Pa_5phosphate_azane.xyz
--------------------------------------------------------------------------------
  Packing solved for molecules of type           2
  Objective function value:    8.1705481627018836E-006
  Maximum violation of target distance:    0.0000000000000000     
  Max. constraint violation:    8.1705481627018836E-006
--------------------------------------------------------------------------------

################################################################################

  Packing molecules of type:            3

################################################################################


--------------------------------------------------------------------------------

  Starting GENCAN loop:            0
  Scaling radii by:    1.1000000000000001     

  Packing:|0                                                        100%|
          |******************************************

  Function value from last GENCAN loop: f = .17637E-02
  Best function value before: f = .66448E+03
  Improvement from best function value:    99.99 %
  Improvement from last loop:    99.99 %
  Maximum violation of target distance:     0.000000
  Maximum violation of the constraints: .10394E-02
  Current structure written to file: solvated_150/3Pa_5phosphate_azane.xyz
--------------------------------------------------------------------------------
  Packing solved for molecules of type           3
  Objective function value:    1.7636974852184607E-003
  Maximum violation of target distance:    0.0000000000000000     
  Max. constraint violation:    1.0394452698956791E-003
--------------------------------------------------------------------------------

################################################################################

  Packing all molecules together 

################################################################################


--------------------------------------------------------------------------------

  Starting GENCAN loop:            0
  Scaling radii by:    1.1000000000000001     

  Packing:|0                                                        100%|
          |*********************************

  Function value from last GENCAN loop: f = .36474E-02
  Best function value before: f = .22339E+03
  Improvement from best function value:    99.99 %
  Improvement from last loop:    99.99 %
  Maximum violation of target distance:     0.000000
  Maximum violation of the constraints: .20781E-02

################################################################################

                                 Success! 
              Final objective function value: .36474E-02
              Maximum violation of target distance:   0.000000
              Maximum violation of the constraints: .20781E-02

--------------------------------------------------------------------------------

              Please cite this work if Packmol was useful: 

           L. Martinez, R. Andrade, E. G. Birgin, J. M. Martinez, 
         PACKMOL: A package for building initial configurations for
                   molecular dynamics simulations. 
        Journal of Computational Chemistry, 30(13) pp. 2157-2164, 2009.
                  https://doi.org/10.1002/jcc.21224

################################################################################

  Solution written to file: solvated_150/3Pa_5phosphate_azane.xyz

--------------------------------------------------------------------------------

   Running time:    2.33499967E-02  seconds. 

--------------------------------------------------------------------------------


